tcpdump: verbose output suppressed, use -v or -vv for full protocol decode
listening on eth0, link-type EN10MB (Ethernet), capture size 65535 bytes
01:36:16.677589 IP 10.0.98.12.56118 > 132.245.241.50.587: Flags [S], seq 2363031439, win 8192, options [mss 1360,nop,wscale 8,nop,nop,sackOK], length 0
01:36:16.677619 IP 107.154.96.50.56118 > 132.245.241.50.587: Flags [S], seq 2363031439, win 8192, options [mss 1360,nop,wscale 8,nop,nop,sackOK], length 0
01:36:16.704522 IP 10.0.98.12.56119 > 132.245.241.50.587: Flags [S], seq 1624890574, win 8192, options [mss 1360,nop,wscale 8,nop,nop,sackOK], length 0
01:36:16.704554 IP 107.154.96.50.56119 > 132.245.241.50.587: Flags [S], seq 1624890574, win 8192, options [mss 1360,nop,wscale 8,nop,nop,sackOK], length 0
01:36:16.998548 IP 10.0.98.12.56120 > 132.245.241.50.587: Flags [S], seq 4142238529, win 8192, options [mss 1360,nop,wscale 8,nop,nop,sackOK], length 0
01:36:16.998580 IP 107.154.96.50.56120 > 132.245.241.50.587: Flags [S], seq 4142238529, win 8192, options [mss 1360,nop,wscale 8,nop,nop,sackOK], length 0
01:36:18.253306 IP 183.206.23.219.6250 > 10.0.98.12.6124: Flags [S], seq 394919392, win 8192, options [mss 1400,nop,nop,sackOK], length 0
01:36:19.682385 IP 10.0.98.12.56118 > 132.245.241.50.587: Flags [S], seq 2363031439, win 8192, options [mss 1360,nop,wscale 8,nop,nop,sackOK], length 0
01:36:19.682405 IP 107.154.96.50.56118 > 132.245.241.50.587: Flags [S], seq 2363031439, win 8192, options [mss 1360,nop,wscale 8,nop,nop,sackOK], length 0
01:36:19.696381 IP 10.0.98.12.56119 > 132.245.241.50.587: Flags [S], seq 1624890574, win 8192, options [mss 1360,nop,wscale 8,nop,nop,sackOK], length 0
01:36:19.696395 IP 107.154.96.50.56119 > 132.245.241.50.587: Flags [S], seq 1624890574, win 8192, options [mss 1360,nop,wscale 8,nop,nop,sackOK], length 0
01:36:20.004386 IP 10.0.98.12.56120 > 132.245.241.50.587: Flags [S], seq 4142238529, win 8192, options [mss 1360,nop,wscale 8,nop,nop,sackOK], length 0
01:36:20.004407 IP 107.154.96.50.56120 > 132.245.241.50.587: Flags [S], seq 4142238529, win 8192, options [mss 1360,nop,wscale 8,nop,nop,sackOK], length 0
01:36:20.081896 IP 106.241.31.236.53527 > 10.0.98.12.6124: Flags [S], seq 173625311, win 8192, options [mss 1400,nop,wscale 8,nop,nop,sackOK], length 0
01:36:20.082191 IP 10.0.98.12.6124 > 106.241.31.236.53527: Flags [S.], seq 3464145475, ack 173625312, win 32767, options [mss 1360,nop,wscale 0,nop,nop,sackOK], length 0
01:36:20.082203 IP 107.154.96.50.6124 > 106.241.31.236.53527: Flags [S.], seq 3464145475, ack 173625312, win 32767, options [mss 1360,nop,wscale 0,nop,nop,sackOK], length 0
01:36:23.080363 IP 10.0.98.12.6124 > 106.241.31.236.53527: Flags [S.], seq 3464145475, ack 173625312, win 32767, options [mss 1360,nop,wscale 0,nop,nop,sackOK], length 0
01:36:23.080389 IP 107.154.96.50.6124 > 106.241.31.236.53527: Flags [S.], seq 3464145475, ack 173625312, win 32767, options [mss 1360,nop,wscale 0,nop,nop,sackOK], length 0
01:36:23.081129 IP 106.241.31.236.53527 > 10.0.98.12.6124: Flags [S], seq 173625311, win 8192, options [mss 1400,nop,wscale 8,nop,nop,sackOK], length 0
01:36:24.846513 IP 211.247.14.67.62373 > 10.0.98.29.6124: Flags [S], seq 2270446007, win 8192, options [mss 1400,nop,wscale 8,nop,nop,sackOK], length 0
01:36:25.554020 IP 190.165.175.86.35499 > 10.0.98.29.23: Flags [S], seq 1805279283, win 28926, options [mss 536], length 0
01:36:25.676349 IP 10.0.98.12.56118 > 132.245.241.50.587: Flags [S], seq 2363031439, win 8192, options [mss 1360,nop,nop,sackOK], length 0
01:36:25.676371 IP 107.154.96.50.56118 > 132.245.241.50.587: Flags [S], seq 2363031439, win 8192, options [mss 1360,nop,nop,sackOK], length 0
01:36:25.701301 IP 10.0.98.12.56119 > 132.245.241.50.587: Flags [S], seq 1624890574, win 8192, options [mss 1360,nop,nop,sackOK], length 0
01:36:25.701318 IP 107.154.96.50.56119 > 132.245.241.50.587: Flags [S], seq 1624890574, win 8192, options [mss 1360,nop,nop,sackOK], length 0
01:36:26.002325 IP 10.0.98.12.56120 > 132.245.241.50.587: Flags [S], seq 4142238529, win 8192, options [mss 1360,nop,nop,sackOK], length 0
01:36:26.002349 IP 107.154.96.50.56120 > 132.245.241.50.587: Flags [S], seq 4142238529, win 8192, options [mss 1360,nop,nop,sackOK], length 0
01:36:27.521922 IP 104.184.141.164.57815 > 10.0.98.29.3389: Flags [S], seq 1282699908, win 8192, options [mss 1400,nop,wscale 2,nop,nop,sackOK], length 0
01:36:27.847053 IP 211.247.14.67.62373 > 10.0.98.29.6124: Flags [S], seq 2270446007, win 8192, options [mss 1400,nop,wscale 8,nop,nop,sackOK], length 0
01:36:29.079315 IP 10.0.98.12.6124 > 106.241.31.236.53527: Flags [S.], seq 3464145475, ack 173625312, win 32767, options [mss 1360,nop,nop,sackOK], length 0
01:36:29.079336 IP 107.154.96.50.6124 > 106.241.31.236.53527: Flags [S.], seq 3464145475, ack 173625312, win 32767, options [mss 1360,nop,nop,sackOK], length 0
01:36:29.081795 IP 106.241.31.236.53527 > 10.0.98.12.6124: Flags [S], seq 173625311, win 8192, options [mss 1400,nop,nop,sackOK], length 0
01:36:33.848444 IP 211.247.14.67.62373 > 10.0.98.29.6124: Flags [S], seq 2270446007, win 8192, options [mss 1400,nop,nop,sackOK], length 0
01:36:36.317628 IP 190.165.175.86.35499 > 10.0.98.29.23: Flags [S], seq 1805279283, win 28926, options [mss 536], length 0
01:36:36.565118 IP 104.184.141.164.57815 > 10.0.98.29.3389: Flags [S], seq 1282699908, win 8192, options [mss 1400,nop,nop,sackOK], length 0
01:36:37.428018 IP 104.184.141.164.58323 > 10.0.98.29.3389: Flags [S], seq 1663509267, win 8192, options [mss 1400,nop,wscale 2,nop,nop,sackOK], length 0
01:36:37.680324 IP 10.0.98.12.56118 > 40.100.152.114.587: Flags [S], seq 2119389986, win 8192, options [mss 1360,nop,wscale 8,nop,nop,sackOK], length 0
01:36:37.680363 IP 107.154.96.50.56118 > 40.100.152.114.587: Flags [S], seq 2119389986, win 8192, options [mss 1360,nop,wscale 8,nop,nop,sackOK], length 0
01:36:37.699263 IP 10.0.98.12.56119 > 40.100.152.114.587: Flags [S], seq 3086494455, win 8192, options [mss 1360,nop,wscale 8,nop,nop,sackOK], length 0
01:36:37.699289 IP 107.154.96.50.56119 > 40.100.152.114.587: Flags [S], seq 3086494455, win 8192, options [mss 1360,nop,wscale 8,nop,nop,sackOK], length 0
01:36:38.004289 IP 10.0.98.12.56120 > 40.100.152.114.587: Flags [S], seq 1125135583, win 8192, options [mss 1360,nop,wscale 8,nop,nop,sackOK], length 0
01:36:38.004320 IP 107.154.96.50.56120 > 40.100.152.114.587: Flags [S], seq 1125135583, win 8192, options [mss 1360,nop,wscale 8,nop,nop,sackOK], length 0
01:36:38.590899 IP 59.60.68.106.50413 > 10.0.98.29.6124: Flags [S], seq 3788855168, win 8192, options [mss 1400,nop,wscale 2,nop,nop,sackOK], length 0
01:36:38.813797 IP 58.187.45.134.23838 > 10.0.98.29.23: Flags [S], seq 1805279283, win 6883, options [mss 536], length 0
01:36:40.425903 IP 104.184.141.164.58323 > 10.0.98.29.3389: Flags [S], seq 1663509267, win 8192, options [mss 1400,nop,wscale 2,nop,nop,sackOK], length 0
01:36:40.682128 IP 10.0.98.12.56118 > 40.100.152.114.587: Flags [S], seq 2119389986, win 8192, options [mss 1360,nop,wscale 8,nop,nop,sackOK], length 0
01:36:40.682152 IP 107.154.96.50.56118 > 40.100.152.114.587: Flags [S], seq 2119389986, win 8192, options [mss 1360,nop,wscale 8,nop,nop,sackOK], length 0
01:36:40.699105 IP 10.0.98.12.56119 > 40.100.152.114.587: Flags [S], seq 3086494455, win 8192, options [mss 1360,nop,wscale 8,nop,nop,sackOK], length 0
01:36:40.699120 IP 107.154.96.50.56119 > 40.100.152.114.587: Flags [S], seq 3086494455, win 8192, options [mss 1360,nop,wscale 8,nop,nop,sackOK], length 0
01:36:41.004130 IP 10.0.98.12.56120 > 40.100.152.114.587: Flags [S], seq 1125135583, win 8192, options [mss 1360,nop,wscale 8,nop,nop,sackOK], length 0
01:36:41.004155 IP 107.154.96.50.56120 > 40.100.152.114.587: Flags [S], seq 1125135583, win 8192, options [mss 1360,nop,wscale 8,nop,nop,sackOK], length 0
01:36:41.085140 IP 10.0.98.12.6124 > 106.241.31.236.53527: Flags [R], seq 3464145476, win 0, length 0
01:36:41.085158 IP 107.154.96.50.6124 > 106.241.31.236.53527: Flags [R], seq 3464145476, win 0, length 0
01:36:41.595683 IP 59.60.68.106.50413 > 10.0.98.29.6124: Flags [S], seq 3788855168, win 8192, options [mss 1400,nop,wscale 2,nop,nop,sackOK], length 0
01:36:44.853216 IP 39.159.20.49.2694 > 10.0.98.12.6124: Flags [S], seq 1580928215, win 8192, options [mss 1400,nop,wscale 8,nop,nop,sackOK], length 0
01:36:45.284693 IP 42.119.41.9.23072 > 10.0.98.29.23: Flags [S], seq 1805279283, win 20991, options [mss 536], length 0
01:36:46.436322 IP 104.184.141.164.58323 > 10.0.98.29.3389: Flags [S], seq 1663509267, win 8192, options [mss 1400,nop,nop,sackOK], length 0
01:36:46.679094 IP 10.0.98.12.56118 > 40.100.152.114.587: Flags [S], seq 2119389986, win 8192, options [mss 1360,nop,nop,sackOK], length 0
01:36:46.679143 IP 107.154.96.50.56118 > 40.100.152.114.587: Flags [S], seq 2119389986, win 8192, options [mss 1360,nop,nop,sackOK], length 0
01:36:46.704050 IP 10.0.98.12.56119 > 40.100.152.114.587: Flags [S], seq 3086494455, win 8192, options [mss 1360,nop,nop,sackOK], length 0
01:36:46.704079 IP 107.154.96.50.56119 > 40.100.152.114.587: Flags [S], seq 3086494455, win 8192, options [mss 1360,nop,nop,sackOK], length 0
01:36:46.999103 IP 10.0.98.12.56120 > 40.100.152.114.587: Flags [S], seq 1125135583, win 8192, options [mss 1360,nop,nop,sackOK], length 0
01:36:46.999122 IP 107.154.96.50.56120 > 40.100.152.114.587: Flags [S], seq 1125135583, win 8192, options [mss 1360,nop,nop,sackOK], length 0
01:36:47.163720 IP 42.233.2.147.8574 > 10.0.98.12.6124: Flags [S], seq 1260898094, win 8192, options [mss 1400,nop,wscale 2,nop,nop,sackOK], length 0
01:36:47.590346 IP 59.60.68.106.50413 > 10.0.98.29.6124: Flags [S], seq 3788855168, win 8192, options [mss 1400,nop,nop,sackOK], length 0
01:36:47.850925 IP 39.159.20.49.2694 > 10.0.98.12.6124: Flags [S], seq 1580928215, win 8192, options [mss 1400,nop,wscale 8,nop,nop,sackOK], length 0
01:36:50.163785 IP 42.233.2.147.8574 > 10.0.98.12.6124: Flags [S], seq 1260898094, win 8192, options [mss 1400,nop,wscale 2,nop,nop,sackOK], length 0
01:36:52.374104 IP 190.165.175.86.35499 > 10.0.98.29.23: Flags [S], seq 1805279283, win 28926, options [mss 536], length 0
01:36:53.843297 IP 39.159.20.49.2704 > 10.0.98.12.6124: Flags [S], seq 1580928215, win 8192, options [mss 1400,nop,nop,sackOK], length 0
01:36:56.163998 IP 42.233.2.147.8579 > 10.0.98.12.6124: Flags [S], seq 1260898094, win 8192, options [mss 1400,nop,nop,sackOK], length 0
01:36:58.331180 IP 60.13.119.112.26608 > 10.0.98.29.6124: Flags [S], seq 2748618953, win 8192, options [mss 1400,nop,wscale 8,nop,nop,sackOK], length 0
01:36:59.075303 IP 106.241.31.236.65048 > 10.0.98.29.6124: Flags [S], seq 3552752411, win 8192, options [mss 1400,nop,wscale 8,nop,nop,sackOK], length 0
01:37:00.057146 IP 104.184.141.164.59442 > 10.0.98.29.3389: Flags [S], seq 2498621925, win 8192, options [mss 1400,nop,wscale 2,nop,nop,sackOK], length 0
01:37:01.330476 IP 60.13.119.112.26608 > 10.0.98.29.6124: Flags [S], seq 2748618953, win 8192, options [mss 1400,nop,wscale 8,nop,nop,sackOK], length 0
01:37:01.875503 IP 113.66.20.140.19883 > 10.0.98.29.6124: Flags [S], seq 1652231810, win 8192, options [mss 1400,nop,wscale 2,nop,nop,sackOK], length 0
01:37:02.075354 IP 106.241.31.236.65048 > 10.0.98.29.6124: Flags [S], seq 3552752411, win 8192, options [mss 1400,nop,wscale 8,nop,nop,sackOK], length 0
01:37:04.875537 IP 113.66.20.140.19883 > 10.0.98.29.6124: Flags [S], seq 1652231810, win 8192, options [mss 1400,nop,wscale 2,nop,nop,sackOK], length 0
01:37:06.475489 IP 221.233.104.78.49314 > 10.0.98.12.6124: Flags [S], seq 2885483517, win 8192, options [mss 1400,nop,wscale 2,nop,nop,sackOK], length 0
01:37:07.330680 IP 60.13.119.112.26608 > 10.0.98.29.6124: Flags [S], seq 2748618953, win 8192, options [mss 1400,nop,nop,sackOK], length 0
01:37:08.076588 IP 106.241.31.236.65048 > 10.0.98.29.6124: Flags [S], seq 3552752411, win 8192, options [mss 1400,nop,nop,sackOK], length 0
01:37:08.085184 IP 222.109.197.153.50302 > 10.0.98.29.6124: Flags [S], seq 3855329015, win 8192, options [mss 1400,nop,wscale 8,nop,nop,sackOK], length 0
01:37:09.163503 IP 104.184.141.164.59442 > 10.0.98.29.3389: Flags [S], seq 2498621925, win 8192, options [mss 1400,nop,nop,sackOK], length 0
01:37:09.482742 IP 221.233.104.78.49314 > 10.0.98.12.6124: Flags [S], seq 2885483517, win 8192, options [mss 1400,nop,wscale 2,nop,nop,sackOK], length 0
01:37:10.871919 IP 113.66.20.140.19908 > 10.0.98.29.6124: Flags [S], seq 1652231810, win 8192, options [mss 1400,nop,nop,sackOK], length 0
01:37:11.085503 IP 222.109.197.153.50302 > 10.0.98.29.6124: Flags [S], seq 3855329015, win 8192, options [mss 1400,nop,wscale 8,nop,nop,sackOK], length 0
01:37:11.334665 IP 188.37.235.231.52122 > 10.0.98.29.6124: Flags [S], seq 680726947, win 8192, options [mss 1400,nop,wscale 2,nop,nop,sackOK], length 0
01:37:12.133390 IP 118.100.72.155.59485 > 10.0.98.12.6124: Flags [S], seq 1392332290, win 8192, options [mss 1400,nop,wscale 8,nop,nop,sackOK], length 0
01:37:12.717410 IP 222.92.145.18.64890 > 10.0.98.12.6124: Flags [S], seq 2262063563, win 8192, options [mss 1400,nop,wscale 2,nop,nop,sackOK], length 0
01:37:14.379171 IP 188.37.235.231.52122 > 10.0.98.29.6124: Flags [S], seq 680726947, win 8192, options [mss 1400,nop,wscale 2,nop,nop,sackOK], length 0
01:37:15.133823 IP 118.100.72.155.59485 > 10.0.98.12.6124: Flags [S], seq 1392332290, win 8192, options [mss 1400,nop,wscale 8,nop,nop,sackOK], length 0
01:37:15.484692 IP 221.233.104.78.49314 > 10.0.98.12.6124: Flags [S], seq 2885483517, win 8192, options [mss 1400,nop,nop,sackOK], length 0
01:37:15.717469 IP 222.92.145.18.64890 > 10.0.98.12.6124: Flags [S], seq 2262063563, win 8192, options [mss 1400,nop,wscale 2,nop,nop,sackOK], length 0
01:37:17.086714 IP 222.109.197.153.50302 > 10.0.98.29.6124: Flags [S], seq 3855329015, win 8192, options [mss 1400,nop,nop,sackOK], length 0
01:37:20.381815 IP 188.37.235.231.52122 > 10.0.98.29.6124: Flags [S], seq 680726947, win 8192, options [mss 1400,nop,nop,sackOK], length 0
01:37:21.134703 IP 118.100.72.155.59485 > 10.0.98.12.6124: Flags [S], seq 1392332290, win 8192, options [mss 1400,nop,nop,sackOK], length 0
01:37:21.718881 IP 222.92.145.18.64890 > 10.0.98.12.6124: Flags [S], seq 2262063563, win 8192, options [mss 1400,nop,nop,sackOK], length 0
01:37:26.046554 IP 121.6.17.108.49921 > 10.0.98.29.6124: Flags [S], seq 2128014852, win 8192, options [mss 1400,nop,wscale 8,nop,nop,sackOK], length 0
01:37:29.048483 IP 121.6.17.108.49921 > 10.0.98.29.6124: Flags [S], seq 2128014852, win 8192, options [mss 1400,nop,wscale 8,nop,nop,sackOK], length 0
01:37:29.482470 IP 39.173.177.245.15538 > 10.0.98.29.6124: Flags [S], seq 3023842581, win 8192, options [mss 1400,nop,wscale 2,nop,nop,sackOK], length 0
01:37:32.481972 IP 39.173.177.245.15538 > 10.0.98.29.6124: Flags [S], seq 3023842581, win 8192, options [mss 1400,nop,wscale 2,nop,nop,sackOK], length 0
01:37:35.047705 IP 121.6.17.108.49921 > 10.0.98.29.6124: Flags [S], seq 2128014852, win 8192, options [mss 1400,nop,nop,sackOK], length 0
01:37:37.080130 IP 104.184.141.164.61288 > 10.0.98.29.3389: Flags [S], seq 2677934780, win 8192, options [mss 1400,nop,wscale 2,nop,nop,sackOK], length 0
01:37:38.482670 IP 39.173.177.245.15538 > 10.0.98.29.6124: Flags [S], seq 3023842581, win 8192, options [mss 1400,nop,nop,sackOK], length 0
01:37:40.075372 IP 104.184.141.164.61288 > 10.0.98.29.3389: Flags [S], seq 2677934780, win 8192, options [mss 1400,nop,wscale 2,nop,nop,sackOK], length 0
01:37:41.608956 IP 42.119.137.146.27123 > 10.0.98.29.6124: Flags [S], seq 4205025941, win 8192, options [mss 1400,nop,wscale 2,nop,nop,sackOK], length 0
01:37:44.600455 IP 42.119.137.146.27123 > 10.0.98.29.6124: Flags [S], seq 4205025941, win 8192, options [mss 1400,nop,wscale 2,nop,nop,sackOK], length 0
01:37:46.108314 IP 104.184.141.164.61288 > 10.0.98.29.3389: Flags [S], seq 2677934780, win 8192, options [mss 1400,nop,nop,sackOK], length 0
01:37:47.189659 IP 104.184.141.164.61827 > 10.0.98.29.3389: Flags [S], seq 2680040629, win 8192, options [mss 1400,nop,wscale 2,nop,nop,sackOK], length 0
01:37:47.912132 IP 104.184.141.164.61865 > 10.0.98.29.3389: Flags [S], seq 2391976664, win 8192, options [mss 1400,nop,wscale 2,nop,nop,sackOK], length 0
01:37:49.615632 IP 10.0.98.12.56125 > 40.100.152.130.587: Flags [S], seq 4186347559, win 8192, options [mss 1360,nop,wscale 8,nop,nop,sackOK], length 0
01:37:49.615664 IP 107.154.96.50.56125 > 40.100.152.130.587: Flags [S], seq 4186347559, win 8192, options [mss 1360,nop,wscale 8,nop,nop,sackOK], length 0
01:37:49.673928 IP 10.0.98.12.56126 > 40.100.152.130.587: Flags [S], seq 3359469111, win 8192, options [mss 1360,nop,wscale 8,nop,nop,sackOK], length 0
01:37:49.673947 IP 107.154.96.50.56126 > 40.100.152.130.587: Flags [S], seq 3359469111, win 8192, options [mss 1360,nop,wscale 8,nop,nop,sackOK], length 0
01:37:49.970011 IP 10.0.98.12.56127 > 40.100.152.130.587: Flags [S], seq 4190980311, win 8192, options [mss 1360,nop,wscale 8,nop,nop,sackOK], length 0
01:37:49.970047 IP 107.154.96.50.56127 > 40.100.152.130.587: Flags [S], seq 4190980311, win 8192, options [mss 1360,nop,wscale 8,nop,nop,sackOK], length 0
01:37:50.189868 IP 104.184.141.164.61827 > 10.0.98.29.3389: Flags [S], seq 2680040629, win 8192, options [mss 1400,nop,wscale 2,nop,nop,sackOK], length 0
01:37:50.603690 IP 42.119.137.146.27123 > 10.0.98.29.6124: Flags [S], seq 4205025941, win 8192, options [mss 1400,nop,nop,sackOK], length 0
01:37:51.852974 IP 104.184.141.164.61614 > 10.0.98.29.3389: Flags [S], seq 1286956617, win 8192, options [mss 1400,nop,nop,sackOK], length 0
01:37:52.527129 IP 115.196.106.9.13066 > 10.0.98.12.6124: Flags [S], seq 156627785, win 16384, options [mss 1400,nop,wscale 0,nop,nop,sackOK], length 0
01:37:52.610134 IP 10.0.98.12.56125 > 40.100.152.130.587: Flags [S], seq 4186347559, win 8192, options [mss 1360,nop,wscale 8,nop,nop,sackOK], length 0
01:37:52.610148 IP 107.154.96.50.56125 > 40.100.152.130.587: Flags [S], seq 4186347559, win 8192, options [mss 1360,nop,wscale 8,nop,nop,sackOK], length 0
01:37:52.673096 IP 10.0.98.12.56126 > 40.100.152.130.587: Flags [S], seq 3359469111, win 8192, options [mss 1360,nop,wscale 8,nop,nop,sackOK], length 0
01:37:52.673124 IP 107.154.96.50.56126 > 40.100.152.130.587: Flags [S], seq 3359469111, win 8192, options [mss 1360,nop,wscale 8,nop,nop,sackOK], length 0
01:37:52.975213 IP 10.0.98.12.56127 > 40.100.152.130.587: Flags [S], seq 4190980311, win 8192, options [mss 1360,nop,wscale 8,nop,nop,sackOK], length 0
01:37:52.975242 IP 107.154.96.50.56127 > 40.100.152.130.587: Flags [S], seq 4190980311, win 8192, options [mss 1360,nop,wscale 8,nop,nop,sackOK], length 0
01:37:55.480656 IP 115.196.106.9.13066 > 10.0.98.12.6124: Flags [S], seq 156627785, win 16384, options [mss 1400,nop,wscale 0,nop,nop,sackOK], length 0
01:37:55.782098 IP 104.184.141.164.62259 > 10.0.98.29.3389: Flags [S], seq 259959960, win 8192, options [mss 1400,nop,wscale 2,nop,nop,sackOK], length 0
01:37:56.214274 IP 104.184.141.164.61827 > 10.0.98.29.3389: Flags [S], seq 2680040629, win 8192, options [mss 1400,nop,nop,sackOK], length 0
01:37:57.226227 IP 113.66.20.140.19948 > 10.0.98.12.6124: Flags [S], seq 1177923013, win 8192, options [mss 1400,nop,wscale 2,nop,nop,sackOK], length 0
01:37:58.608996 IP 10.0.98.12.56125 > 40.100.152.130.587: Flags [S], seq 4186347559, win 8192, options [mss 1360,nop,nop,sackOK], length 0
01:37:58.609038 IP 107.154.96.50.56125 > 40.100.152.130.587: Flags [S], seq 4186347559, win 8192, options [mss 1360,nop,nop,sackOK], length 0
01:37:58.671008 IP 10.0.98.12.56126 > 40.100.152.130.587: Flags [S], seq 3359469111, win 8192, options [mss 1360,nop,nop,sackOK], length 0
01:37:58.671039 IP 107.154.96.50.56126 > 40.100.152.130.587: Flags [S], seq 3359469111, win 8192, options [mss 1360,nop,nop,sackOK], length 0
01:37:58.811051 IP 104.184.141.164.62259 > 10.0.98.29.3389: Flags [S], seq 259959960, win 8192, options [mss 1400,nop,wscale 2,nop,nop,sackOK], length 0
01:37:58.975051 IP 10.0.98.12.56127 > 40.100.152.130.587: Flags [S], seq 4190980311, win 8192, options [mss 1360,nop,nop,sackOK], length 0
01:37:58.975079 IP 107.154.96.50.56127 > 40.100.152.130.587: Flags [S], seq 4190980311, win 8192, options [mss 1360,nop,nop,sackOK], length 0
01:37:59.461331 IP 106.241.31.236.53612 > 10.0.98.12.6124: Flags [S], seq 4152599626, win 8192, options [mss 1400,nop,wscale 8,nop,nop,sackOK], length 0
01:37:59.461700 IP 10.0.98.12.6124 > 106.241.31.236.53612: Flags [S.], seq 1600011730, ack 4152599627, win 32767, options [mss 1360,nop,wscale 0,nop,nop,sackOK], length 0
01:37:59.461722 IP 107.154.96.50.6124 > 106.241.31.236.53612: Flags [S.], seq 1600011730, ack 4152599627, win 32767, options [mss 1360,nop,wscale 0,nop,nop,sackOK], length 0
01:38:00.219177 IP 113.66.20.140.19948 > 10.0.98.12.6124: Flags [S], seq 1177923013, win 8192, options [mss 1400,nop,wscale 2,nop,nop,sackOK], length 0
01:38:01.479149 IP 104.184.141.164.62542 > 10.0.98.29.3389: Flags [S], seq 3177153658, win 8192, options [mss 1400,nop,wscale 2,nop,nop,sackOK], length 0
01:38:01.516152 IP 115.196.106.9.13066 > 10.0.98.12.6124: Flags [S], seq 156627785, win 16384, options [mss 1400,nop,wscale 0,nop,nop,sackOK], length 0
01:38:02.458898 IP 10.0.98.12.6124 > 106.241.31.236.53612: Flags [S.], seq 1600011730, ack 4152599627, win 32767, options [mss 1360,nop,wscale 0,nop,nop,sackOK], length 0
01:38:02.458929 IP 107.154.96.50.6124 > 106.241.31.236.53612: Flags [S.], seq 1600011730, ack 4152599627, win 32767, options [mss 1360,nop,wscale 0,nop,nop,sackOK], length 0
01:38:02.462126 IP 106.241.31.236.53612 > 10.0.98.12.6124: Flags [S], seq 4152599626, win 8192, options [mss 1400,nop,wscale 8,nop,nop,sackOK], length 0
01:38:04.495071 IP 104.184.141.164.62542 > 10.0.98.29.3389: Flags [S], seq 3177153658, win 8192, options [mss 1400,nop,wscale 2,nop,nop,sackOK], length 0
01:38:04.832148 IP 104.184.141.164.62259 > 10.0.98.29.3389: Flags [S], seq 259959960, win 8192, options [mss 1400,nop,nop,sackOK], length 0
01:38:06.214703 IP 113.66.20.140.19989 > 10.0.98.12.6124: Flags [S], seq 1177923013, win 8192, options [mss 1400,nop,nop,sackOK], length 0
01:38:08.458801 IP 10.0.98.12.6124 > 106.241.31.236.53612: Flags [S.], seq 1600011730, ack 4152599627, win 32767, options [mss 1360,nop,nop,sackOK], length 0
01:38:08.458832 IP 107.154.96.50.6124 > 106.241.31.236.53612: Flags [S.], seq 1600011730, ack 4152599627, win 32767, options [mss 1360,nop,nop,sackOK], length 0
01:38:08.464470 IP 106.241.31.236.53612 > 10.0.98.12.6124: Flags [S], seq 4152599626, win 8192, options [mss 1400,nop,nop,sackOK], length 0
01:38:10.611878 IP 10.0.98.12.56125 > 40.100.154.34.587: Flags [S], seq 4140977039, win 8192, options [mss 1360,nop,wscale 8,nop,nop,sackOK], length 0
01:38:10.611914 IP 107.154.96.50.56125 > 40.100.154.34.587: Flags [S], seq 4140977039, win 8192, options [mss 1360,nop,wscale 8,nop,nop,sackOK], length 0
01:38:10.674845 IP 10.0.98.12.56126 > 40.100.154.34.587: Flags [S], seq 1438260492, win 8192, options [mss 1360,nop,wscale 8,nop,nop,sackOK], length 0
01:38:10.674872 IP 107.154.96.50.56126 > 40.100.154.34.587: Flags [S], seq 1438260492, win 8192, options [mss 1360,nop,wscale 8,nop,nop,sackOK], length 0
01:38:10.967916 IP 10.0.98.12.56127 > 40.100.154.34.587: Flags [S], seq 1584425778, win 8192, options [mss 1360,nop,wscale 8,nop,nop,sackOK], length 0
01:38:10.967943 IP 107.154.96.50.56127 > 40.100.154.34.587: Flags [S], seq 1584425778, win 8192, options [mss 1360,nop,wscale 8,nop,nop,sackOK], length 0
01:38:13.609681 IP 10.0.98.12.56125 > 40.100.154.34.587: Flags [S], seq 4140977039, win 8192, options [mss 1360,nop,wscale 8,nop,nop,sackOK], length 0
01:38:13.609711 IP 107.154.96.50.56125 > 40.100.154.34.587: Flags [S], seq 4140977039, win 8192, options [mss 1360,nop,wscale 8,nop,nop,sackOK], length 0
01:38:13.669658 IP 10.0.98.12.56126 > 40.100.154.34.587: Flags [S], seq 1438260492, win 8192, options [mss 1360,nop,wscale 8,nop,nop,sackOK], length 0
01:38:13.669685 IP 107.154.96.50.56126 > 40.100.154.34.587: Flags [S], seq 1438260492, win 8192, options [mss 1360,nop,wscale 8,nop,nop,sackOK], length 0
01:38:13.969686 IP 10.0.98.12.56127 > 40.100.154.34.587: Flags [S], seq 1584425778, win 8192, options [mss 1360,nop,wscale 8,nop,nop,sackOK], length 0
01:38:13.969713 IP 107.154.96.50.56127 > 40.100.154.34.587: Flags [S], seq 1584425778, win 8192, options [mss 1360,nop,wscale 8,nop,nop,sackOK], length 0
01:38:19.608542 IP 10.0.98.12.56125 > 40.100.154.34.587: Flags [S], seq 4140977039, win 8192, options [mss 1360,nop,nop,sackOK], length 0
01:38:19.608559 IP 107.154.96.50.56125 > 40.100.154.34.587: Flags [S], seq 4140977039, win 8192, options [mss 1360,nop,nop,sackOK], length 0
01:38:19.676566 IP 10.0.98.12.56126 > 40.100.154.34.587: Flags [S], seq 1438260492, win 8192, options [mss 1360,nop,nop,sackOK], length 0
01:38:19.676591 IP 107.154.96.50.56126 > 40.100.154.34.587: Flags [S], seq 1438260492, win 8192, options [mss 1360,nop,nop,sackOK], length 0
01:38:19.974608 IP 10.0.98.12.56127 > 40.100.154.34.587: Flags [S], seq 1584425778, win 8192, options [mss 1360,nop,nop,sackOK], length 0
01:38:19.974628 IP 107.154.96.50.56127 > 40.100.154.34.587: Flags [S], seq 1584425778, win 8192, options [mss 1360,nop,nop,sackOK], length 0
01:38:20.458531 IP 10.0.98.12.6124 > 106.241.31.236.53612: Flags [R], seq 1600011731, win 0, length 0
01:38:20.458556 IP 107.154.96.50.6124 > 106.241.31.236.53612: Flags [R], seq 1600011731, win 0, length 0
01:38:22.254405 IP 118.100.72.155.59490 > 10.0.98.12.6124: Flags [S], seq 1446956151, win 8192, options [mss 1400,nop,wscale 8,nop,nop,sackOK], length 0
01:38:25.257121 IP 118.100.72.155.59490 > 10.0.98.12.6124: Flags [S], seq 1446956151, win 8192, options [mss 1400,nop,wscale 8,nop,nop,sackOK], length 0
01:38:28.671284 IP 104.184.141.164.63917 > 10.0.98.29.3389: Flags [S], seq 3940513938, win 8192, options [mss 1400,nop,wscale 2,nop,nop,sackOK], length 0
01:38:31.258676 IP 118.100.72.155.59490 > 10.0.98.12.6124: Flags [S], seq 1446956151, win 8192, options [mss 1400,nop,nop,sackOK], length 0
01:38:31.611476 IP 10.0.98.12.56125 > 40.100.154.162.587: Flags [S], seq 1282085717, win 8192, options [mss 1360,nop,wscale 8,nop,nop,sackOK], length 0
01:38:31.611520 IP 107.154.96.50.56125 > 40.100.154.162.587: Flags [S], seq 1282085717, win 8192, options [mss 1360,nop,wscale 8,nop,nop,sackOK], length 0
01:38:31.665170 IP 104.184.141.164.63917 > 10.0.98.29.3389: Flags [S], seq 3940513938, win 8192, options [mss 1400,nop,wscale 2,nop,nop,sackOK], length 0
01:38:31.673407 IP 10.0.98.12.56126 > 40.100.154.162.587: Flags [S], seq 3882540831, win 8192, options [mss 1360,nop,wscale 8,nop,nop,sackOK], length 0
01:38:31.673421 IP 107.154.96.50.56126 > 40.100.154.162.587: Flags [S], seq 3882540831, win 8192, options [mss 1360,nop,wscale 8,nop,nop,sackOK], length 0
01:38:31.940041 IP 104.184.141.164.64078 > 10.0.98.29.3389: Flags [S], seq 4201900888, win 8192, options [mss 1400,nop,wscale 2,nop,nop,sackOK], length 0
01:38:31.971446 IP 10.0.98.12.56127 > 40.100.154.162.587: Flags [S], seq 958389950, win 8192, options [mss 1360,nop,wscale 8,nop,nop,sackOK], length 0
01:38:31.971479 IP 107.154.96.50.56127 > 40.100.154.162.587: Flags [S], seq 958389950, win 8192, options [mss 1360,nop,wscale 8,nop,nop,sackOK], length 0
01:38:33.866377 IP 104.184.141.164.64021 > 10.0.98.29.3389: Flags [S], seq 644978957, win 8192, options [mss 1400,nop,wscale 2,nop,nop,sackOK], length 0
01:38:34.607304 IP 10.0.98.12.56125 > 40.100.154.162.587: Flags [S], seq 1282085717, win 8192, options [mss 1360,nop,wscale 8,nop,nop,sackOK], length 0
01:38:34.607338 IP 107.154.96.50.56125 > 40.100.154.162.587: Flags [S], seq 1282085717, win 8192, options [mss 1360,nop,wscale 8,nop,nop,sackOK], length 0
01:38:34.673230 IP 10.0.98.12.56126 > 40.100.154.162.587: Flags [S], seq 3882540831, win 8192, options [mss 1360,nop,wscale 8,nop,nop,sackOK], length 0
01:38:34.673241 IP 107.154.96.50.56126 > 40.100.154.162.587: Flags [S], seq 3882540831, win 8192, options [mss 1360,nop,wscale 8,nop,nop,sackOK], length 0
01:38:34.946745 IP 104.184.141.164.64078 > 10.0.98.29.3389: Flags [S], seq 4201900888, win 8192, options [mss 1400,nop,wscale 2,nop,nop,sackOK], length 0
01:38:34.970296 IP 10.0.98.12.56127 > 40.100.154.162.587: Flags [S], seq 958389950, win 8192, options [mss 1360,nop,wscale 8,nop,nop,sackOK], length 0
01:38:34.970317 IP 107.154.96.50.56127 > 40.100.154.162.587: Flags [S], seq 958389950, win 8192, options [mss 1360,nop,wscale 8,nop,nop,sackOK], length 0
01:38:37.755261 IP 104.184.141.164.64375 > 10.0.98.29.3389: Flags [S], seq 2300010941, win 8192, options [mss 1400,nop,wscale 2,nop,nop,sackOK], length 0
01:38:39.926509 IP 104.184.141.164.64021 > 10.0.98.29.3389: Flags [S], seq 644978957, win 8192, options [mss 1400,nop,nop,sackOK], length 0
01:38:40.617173 IP 10.0.98.12.56125 > 40.100.154.162.587: Flags [S], seq 1282085717, win 8192, options [mss 1360,nop,nop,sackOK], length 0
01:38:40.617212 IP 107.154.96.50.56125 > 40.100.154.162.587: Flags [S], seq 1282085717, win 8192, options [mss 1360,nop,nop,sackOK], length 0
01:38:40.674181 IP 10.0.98.12.56126 > 40.100.154.162.587: Flags [S], seq 3882540831, win 8192, options [mss 1360,nop,nop,sackOK], length 0
01:38:40.674199 IP 107.154.96.50.56126 > 40.100.154.162.587: Flags [S], seq 3882540831, win 8192, options [mss 1360,nop,nop,sackOK], length 0
01:38:40.762173 IP 104.184.141.164.64375 > 10.0.98.29.3389: Flags [S], seq 2300010941, win 8192, options [mss 1400,nop,wscale 2,nop,nop,sackOK], length 0
01:38:40.963618 IP 104.184.141.164.64078 > 10.0.98.29.3389: Flags [S], seq 4201900888, win 8192, options [mss 1400,nop,nop,sackOK], length 0
01:38:40.970138 IP 10.0.98.12.56127 > 40.100.154.162.587: Flags [S], seq 958389950, win 8192, options [mss 1360,nop,nop,sackOK], length 0
01:38:40.970159 IP 107.154.96.50.56127 > 40.100.154.162.587: Flags [S], seq 958389950, win 8192, options [mss 1360,nop,nop,sackOK], length 0
01:38:42.029915 IP 113.98.246.213.55150 > 10.0.98.12.6124: Flags [S], seq 3860503428, win 8192, options [mss 1400,nop,wscale 2,nop,nop,sackOK], length 0
01:38:45.029604 IP 113.98.246.213.55150 > 10.0.98.12.6124: Flags [S], seq 3860503428, win 8192, options [mss 1400,nop,wscale 2,nop,nop,sackOK], length 0
01:38:46.784109 IP 104.184.141.164.64375 > 10.0.98.29.3389: Flags [S], seq 2300010941, win 8192, options [mss 1400,nop,nop,sackOK], length 0
01:38:49.661056 IP 221.2.159.9.50963 > 10.0.98.12.6124: Flags [S], seq 2679123120, win 8192, options [mss 1400,nop,nop,sackOK], length 0
01:38:51.021680 IP 113.98.246.213.55150 > 10.0.98.12.6124: Flags [S], seq 3860503428, win 8192, options [mss 1400,nop,nop,sackOK], length 0
01:38:51.631354 IP 114.250.144.130.10904 > 10.0.98.29.6124: Flags [S], seq 1933071879, win 65535, options [mss 1400,nop,wscale 0,nop,nop,sackOK], length 0
01:38:52.609075 IP 10.0.98.12.56125 > 40.100.156.2.587: Flags [S], seq 2379085354, win 8192, options [mss 1360,nop,wscale 8,nop,nop,sackOK], length 0
01:38:52.609126 IP 107.154.96.50.56125 > 40.100.156.2.587: Flags [S], seq 2379085354, win 8192, options [mss 1360,nop,wscale 8,nop,nop,sackOK], length 0
01:38:52.666874 IP 221.2.159.9.50963 > 10.0.98.12.6124: Flags [S], seq 2679123120, win 8192, options [mss 1400,nop,nop,sackOK], length 0
01:38:52.669946 IP 10.0.98.12.56126 > 40.100.156.2.587: Flags [S], seq 3301909261, win 8192, options [mss 1360,nop,wscale 8,nop,nop,sackOK], length 0
01:38:52.669968 IP 107.154.96.50.56126 > 40.100.156.2.587: Flags [S], seq 3301909261, win 8192, options [mss 1360,nop,wscale 8,nop,nop,sackOK], length 0
01:38:52.970007 IP 10.0.98.12.56127 > 40.100.156.2.587: Flags [S], seq 115433103, win 8192, options [mss 1360,nop,wscale 8,nop,nop,sackOK], length 0
01:38:52.970039 IP 107.154.96.50.56127 > 40.100.156.2.587: Flags [S], seq 115433103, win 8192, options [mss 1360,nop,wscale 8,nop,nop,sackOK], length 0
01:38:54.549891 IP 114.250.144.130.10904 > 10.0.98.29.6124: Flags [S], seq 1933071879, win 65535, options [mss 1400,nop,wscale 0,nop,nop,sackOK], length 0
01:38:55.613853 IP 10.0.98.12.56125 > 40.100.156.2.587: Flags [S], seq 2379085354, win 8192, options [mss 1360,nop,wscale 8,nop,nop,sackOK], length 0
01:38:55.613878 IP 107.154.96.50.56125 > 40.100.156.2.587: Flags [S], seq 2379085354, win 8192, options [mss 1360,nop,wscale 8,nop,nop,sackOK], length 0
01:38:55.668831 IP 10.0.98.12.56126 > 40.100.156.2.587: Flags [S], seq 3301909261, win 8192, options [mss 1360,nop,wscale 8,nop,nop,sackOK], length 0
01:38:55.668857 IP 107.154.96.50.56126 > 40.100.156.2.587: Flags [S], seq 3301909261, win 8192, options [mss 1360,nop,wscale 8,nop,nop,sackOK], length 0
01:38:55.968864 IP 10.0.98.12.56127 > 40.100.156.2.587: Flags [S], seq 115433103, win 8192, options [mss 1360,nop,wscale 8,nop,nop,sackOK], length 0
01:38:55.968890 IP 107.154.96.50.56127 > 40.100.156.2.587: Flags [S], seq 115433103, win 8192, options [mss 1360,nop,wscale 8,nop,nop,sackOK], length 0
01:38:58.661092 IP 221.2.159.9.50963 > 10.0.98.12.6124: Flags [S], seq 2679123120, win 8192, options [mss 1400,nop,nop,sackOK], length 0
01:39:00.584250 IP 114.250.144.130.10904 > 10.0.98.29.6124: Flags [S], seq 1933071879, win 65535, options [mss 1400,nop,wscale 0,nop,nop,sackOK], length 0
01:39:01.613741 IP 10.0.98.12.56125 > 40.100.156.2.587: Flags [S], seq 2379085354, win 8192, options [mss 1360,nop,nop,sackOK], length 0
01:39:01.613769 IP 107.154.96.50.56125 > 40.100.156.2.587: Flags [S], seq 2379085354, win 8192, options [mss 1360,nop,nop,sackOK], length 0
01:39:01.667700 IP 10.0.98.12.56126 > 40.100.156.2.587: Flags [S], seq 3301909261, win 8192, options [mss 1360,nop,nop,sackOK], length 0
01:39:01.667731 IP 107.154.96.50.56126 > 40.100.156.2.587: Flags [S], seq 3301909261, win 8192, options [mss 1360,nop,nop,sackOK], length 0
01:39:01.970770 IP 10.0.98.12.56127 > 40.100.156.2.587: Flags [S], seq 115433103, win 8192, options [mss 1360,nop,nop,sackOK], length 0
01:39:01.970798 IP 107.154.96.50.56127 > 40.100.156.2.587: Flags [S], seq 115433103, win 8192, options [mss 1360,nop,nop,sackOK], length 0
01:39:03.431056 IP 118.100.72.155.59495 > 10.0.98.12.6124: Flags [S], seq 2358949633, win 8192, options [mss 1400,nop,wscale 8,nop,nop,sackOK], length 0
01:39:06.430337 IP 118.100.72.155.59495 > 10.0.98.12.6124: Flags [S], seq 2358949633, win 8192, options [mss 1400,nop,wscale 8,nop,nop,sackOK], length 0
01:39:07.017907 IP 104.184.141.164.49462 > 10.0.98.29.3389: Flags [S], seq 2172432355, win 8192, options [mss 1400,nop,wscale 2,nop,nop,sackOK], length 0
01:39:10.028096 IP 104.184.141.164.49462 > 10.0.98.29.3389: Flags [S], seq 2172432355, win 8192, options [mss 1400,nop,wscale 2,nop,nop,sackOK], length 0
01:39:12.430546 IP 118.100.72.155.59495 > 10.0.98.12.6124: Flags [S], seq 2358949633, win 8192, options [mss 1400,nop,nop,sackOK], length 0
01:39:13.613624 IP 10.0.98.12.56125 > 40.100.156.18.587: Flags [S], seq 2179393085, win 8192, options [mss 1360,nop,wscale 8,nop,nop,sackOK], length 0
01:39:13.613661 IP 107.154.96.50.56125 > 40.100.156.18.587: Flags [S], seq 2179393085, win 8192, options [mss 1360,nop,wscale 8,nop,nop,sackOK], length 0
01:39:13.673570 IP 10.0.98.12.56126 > 40.100.156.18.587: Flags [S], seq 2962674423, win 8192, options [mss 1360,nop,wscale 8,nop,nop,sackOK], length 0
01:39:13.673602 IP 107.154.96.50.56126 > 40.100.156.18.587: Flags [S], seq 2962674423, win 8192, options [mss 1360,nop,wscale 8,nop,nop,sackOK], length 0
01:39:13.968607 IP 10.0.98.12.56127 > 40.100.156.18.587: Flags [S], seq 3935309609, win 8192, options [mss 1360,nop,wscale 8,nop,nop,sackOK], length 0
01:39:13.968641 IP 107.154.96.50.56127 > 40.100.156.18.587: Flags [S], seq 3935309609, win 8192, options [mss 1360,nop,wscale 8,nop,nop,sackOK], length 0
01:39:16.116559 IP 104.184.141.164.49462 > 10.0.98.29.3389: Flags [S], seq 2172432355, win 8192, options [mss 1400,nop,nop,sackOK], length 0
01:39:16.613435 IP 10.0.98.12.56125 > 40.100.156.18.587: Flags [S], seq 2179393085, win 8192, options [mss 1360,nop,wscale 8,nop,nop,sackOK], length 0
01:39:16.613466 IP 107.154.96.50.56125 > 40.100.156.18.587: Flags [S], seq 2179393085, win 8192, options [mss 1360,nop,wscale 8,nop,nop,sackOK], length 0
01:39:16.677411 IP 10.0.98.12.56126 > 40.100.156.18.587: Flags [S], seq 2962674423, win 8192, options [mss 1360,nop,wscale 8,nop,nop,sackOK], length 0
01:39:16.677433 IP 107.154.96.50.56126 > 40.100.156.18.587: Flags [S], seq 2962674423, win 8192, options [mss 1360,nop,wscale 8,nop,nop,sackOK], length 0
01:39:16.977435 IP 10.0.98.12.56127 > 40.100.156.18.587: Flags [S], seq 3935309609, win 8192, options [mss 1360,nop,wscale 8,nop,nop,sackOK], length 0
01:39:16.977462 IP 107.154.96.50.56127 > 40.100.156.18.587: Flags [S], seq 3935309609, win 8192, options [mss 1360,nop,wscale 8,nop,nop,sackOK], length 0
01:39:18.808243 IP 104.184.141.164.50079 > 10.0.98.29.3389: Flags [S], seq 3135407018, win 8192, options [mss 1400,nop,wscale 2,nop,nop,sackOK], length 0
01:39:19.283197 IP 156.57.34.102.52005 > 10.0.98.12.6124: Flags [S], seq 1901404921, win 8192, options [mss 1400,nop,wscale 2,nop,nop,sackOK], length 0
01:39:20.637768 IP 104.184.141.164.50020 > 10.0.98.29.3389: Flags [S], seq 967019232, win 8192, options [mss 1400,nop,wscale 2,nop,nop,sackOK], length 0
01:39:21.835704 IP 104.184.141.164.50079 > 10.0.98.29.3389: Flags [S], seq 3135407018, win 8192, options [mss 1400,nop,wscale 2,nop,nop,sackOK], length 0
01:39:22.286806 IP 156.57.34.102.52005 > 10.0.98.12.6124: Flags [S], seq 1901404921, win 8192, options [mss 1400,nop,wscale 2,nop,nop,sackOK], length 0
01:39:22.611325 IP 10.0.98.12.56125 > 40.100.156.18.587: Flags [S], seq 2179393085, win 8192, options [mss 1360,nop,nop,sackOK], length 0
01:39:22.611354 IP 107.154.96.50.56125 > 40.100.156.18.587: Flags [S], seq 2179393085, win 8192, options [mss 1360,nop,nop,sackOK], length 0
01:39:22.674288 IP 10.0.98.12.56126 > 40.100.156.18.587: Flags [S], seq 2962674423, win 8192, options [mss 1360,nop,nop,sackOK], length 0
01:39:22.674313 IP 107.154.96.50.56126 > 40.100.156.18.587: Flags [S], seq 2962674423, win 8192, options [mss 1360,nop,nop,sackOK], length 0
01:39:22.975313 IP 10.0.98.12.56127 > 40.100.156.18.587: Flags [S], seq 3935309609, win 8192, options [mss 1360,nop,nop,sackOK], length 0
01:39:22.975339 IP 107.154.96.50.56127 > 40.100.156.18.587: Flags [S], seq 3935309609, win 8192, options [mss 1360,nop,nop,sackOK], length 0
01:39:27.968361 IP 104.184.141.164.50568 > 10.0.98.29.3389: Flags [S], seq 1933590670, win 8192, options [mss 1400,nop,wscale 2,nop,nop,sackOK], length 0
01:39:28.284172 IP 156.57.34.102.52005 > 10.0.98.12.6124: Flags [S], seq 1901404921, win 8192, options [mss 1400,nop,nop,sackOK], length 0
01:39:34.614242 IP 10.0.98.12.56125 > 40.100.156.114.587: Flags [S], seq 2332911058, win 8192, options [mss 1360,nop,wscale 8,nop,nop,sackOK], length 0
01:39:34.614285 IP 107.154.96.50.56125 > 40.100.156.114.587: Flags [S], seq 2332911058, win 8192, options [mss 1360,nop,wscale 8,nop,nop,sackOK], length 0
01:39:34.668105 IP 10.0.98.12.56126 > 40.100.156.114.587: Flags [S], seq 2229765710, win 8192, options [mss 1360,nop,wscale 8,nop,nop,sackOK], length 0
01:39:34.668127 IP 107.154.96.50.56126 > 40.100.156.114.587: Flags [S], seq 2229765710, win 8192, options [mss 1360,nop,wscale 8,nop,nop,sackOK], length 0
01:39:34.968213 IP 10.0.98.12.56127 > 40.100.156.114.587: Flags [S], seq 3781502945, win 8192, options [mss 1360,nop,wscale 8,nop,nop,sackOK], length 0
01:39:34.968257 IP 107.154.96.50.56127 > 40.100.156.114.587: Flags [S], seq 3781502945, win 8192, options [mss 1360,nop,wscale 8,nop,nop,sackOK], length 0
01:39:37.130466 IP 104.184.141.164.50568 > 10.0.98.29.3389: Flags [S], seq 1933590670, win 8192, options [mss 1400,nop,nop,sackOK], length 0
01:39:37.613021 IP 10.0.98.12.56125 > 40.100.156.114.587: Flags [S], seq 2332911058, win 8192, options [mss 1360,nop,wscale 8,nop,nop,sackOK], length 0
