tcpdump: verbose output suppressed, use -v or -vv for full protocol decode
listening on eth0, link-type EN10MB (Ethernet), capture size 65535 bytes
00:13:24.265479 IP 106.241.31.236.64864 > 10.0.0.236.ssh: Flags [F.], seq 3706535668, ack 2839516592, win 4096, options [nop,nop,TS val 939784769 ecr 233065769], length 0
00:13:24.266918 IP 10.0.0.236.ssh > 106.241.31.236.64864: Flags [F.], seq 1, ack 1, win 323, options [nop,nop,TS val 233065806 ecr 939784769], length 0
00:14:02.974466 IP 106.241.31.236.64869 > 10.0.0.236.ssh: Flags [F.], seq 1168845379, ack 1273159958, win 4096, options [nop,nop,TS val 939821752 ecr 233075451], length 0
00:14:02.975801 IP 10.0.0.236.ssh > 106.241.31.236.64869: Flags [F.], seq 1, ack 1, win 323, options [nop,nop,TS val 233075483 ecr 939821752], length 0
00:21:54.059786 IP 169.254.169.254.http > 10.0.0.236.49660: Flags [F.], seq 39946871, ack 3395036429, win 149, options [nop,nop,TS val 3887403663 ecr 233193254], length 0
00:21:54.059832 IP 10.0.0.236.49660 > 169.254.169.254.http: Flags [F.], seq 1, ack 1, win 219, options [nop,nop,TS val 233193254 ecr 3887403663], length 0
00:21:58.753385 IP 106.241.31.236.65014 > 10.0.0.236.ssh: Flags [F.], seq 2532456598, ack 3485429532, win 4096, options [nop,nop,TS val 940295147 ecr 233194393], length 0
00:21:58.754734 IP 10.0.0.236.ssh > 106.241.31.236.65014: Flags [F.], seq 1, ack 1, win 323, options [nop,nop,TS val 233194428 ecr 940295147], length 0
00:25:03.360917 IP 106.241.31.236.65052 > 10.0.0.236.ssh: Flags [F.], seq 3554755899, ack 2193178749, win 4096, options [nop,nop,TS val 940478765 ecr 233240543], length 0
00:25:03.362161 IP 10.0.0.236.ssh > 106.241.31.236.65052: Flags [F.], seq 1, ack 1, win 323, options [nop,nop,TS val 233240580 ecr 940478765], length 0
00:25:03.505408 IP 106.241.31.236.65052 > 10.0.0.236.ssh: Flags [F.], seq 0, ack 1, win 4096, options [nop,nop,TS val 940478909 ecr 233240580], length 0
00:25:06.315590 IP 106.241.31.236.65054 > 10.0.0.236.ssh: Flags [F.], seq 681421517, ack 3315120636, win 4096, options [nop,nop,TS val 940481694 ecr 233241281], length 0
00:25:06.316887 IP 10.0.0.236.ssh > 106.241.31.236.65054: Flags [F.], seq 1, ack 1, win 323, options [nop,nop,TS val 233241319 ecr 940481694], length 0
00:39:32.984742 IP 106.241.31.236.11475 > 10.0.98.29.pnbs: Flags [R.], seq 77011830, ack 3950960659, win 0, length 0
00:40:47.547843 IP 106.241.31.236.11559 > 10.0.98.29.pnbs: Flags [R.], seq 1184698880, ack 1502904422, win 0, length 0
00:41:50.091175 IP 106.241.31.236.11592 > 10.0.98.29.pnbs: Flags [R.], seq 411080418, ack 1129707284, win 0, length 0
00:44:43.350727 IP 106.241.31.236.8413 > 10.0.98.29.pnbs: Flags [R.], seq 2791482063, ack 1085140329, win 0, length 0
00:44:43.484737 IP 106.241.31.236.8413 > 10.0.98.29.pnbs: Flags [R], seq 2791482063, win 0, length 0
00:44:54.847634 IP 106.241.31.236.11840 > 10.0.98.29.27021: Flags [F.], seq 202858322, ack 2963327453, win 253, length 0
00:44:54.865426 IP 10.0.98.29.27021 > 106.241.31.236.11840: Flags [F.], seq 1, ack 1, win 32536, length 0
00:44:55.812079 IP 106.241.31.236.11838 > 10.0.98.29.27021: Flags [F.], seq 1895303481, ack 1412973439, win 253, length 0
00:44:55.812563 IP 10.0.98.29.27021 > 106.241.31.236.11838: Flags [F.], seq 1, ack 1, win 32536, length 0
00:44:56.706215 IP 106.241.31.236.11836 > 10.0.98.29.27021: Flags [F.], seq 3458060099, ack 965514035, win 253, length 0
00:44:56.706648 IP 10.0.98.29.27021 > 106.241.31.236.11836: Flags [F.], seq 1, ack 1, win 32536, length 0
00:44:57.722446 IP 106.241.31.236.11834 > 10.0.98.29.27021: Flags [F.], seq 2089609663, ack 3289290364, win 253, length 0
00:44:57.722883 IP 10.0.98.29.27021 > 106.241.31.236.11834: Flags [F.], seq 1, ack 1, win 32536, length 0
00:45:15.962216 IP 106.241.31.236.11895 > 10.0.98.29.27021: Flags [F.], seq 3921131095, ack 141469537, win 253, length 0
00:45:15.962708 IP 10.0.98.29.27021 > 106.241.31.236.11895: Flags [F.], seq 1, ack 1, win 32536, length 0
00:45:17.148600 IP 106.241.31.236.11893 > 10.0.98.29.27021: Flags [F.], seq 1423691060, ack 1515900743, win 253, length 0
00:45:17.149036 IP 10.0.98.29.27021 > 106.241.31.236.11893: Flags [F.], seq 1, ack 1, win 32536, length 0
00:45:18.087764 IP 106.241.31.236.11891 > 10.0.98.29.27021: Flags [F.], seq 2937279539, ack 314041284, win 253, length 0
00:45:18.088164 IP 10.0.98.29.27021 > 106.241.31.236.11891: Flags [F.], seq 1, ack 1, win 32536, length 0
00:45:19.054533 IP 106.241.31.236.11889 > 10.0.98.29.27021: Flags [F.], seq 2053109003, ack 1964453129, win 253, length 0
00:45:19.054953 IP 10.0.98.29.27021 > 106.241.31.236.11889: Flags [F.], seq 1, ack 1, win 32536, length 0
00:45:24.988663 IP 106.241.31.236.64991 > 10.0.98.29.pnbs: Flags [R.], seq 2197287195, ack 3130612807, win 0, length 0
00:46:19.528358 IP 106.241.31.236.11908 > 10.0.98.29.27021: Flags [F.], seq 4224874854, ack 3403930600, win 253, length 0
00:46:19.528785 IP 10.0.98.29.27021 > 106.241.31.236.11908: Flags [F.], seq 1, ack 1, win 32536, length 0
00:46:20.742734 IP 106.241.31.236.11905 > 10.0.98.29.27021: Flags [F.], seq 1346515457, ack 4254734534, win 253, length 0
00:46:20.743172 IP 10.0.98.29.27021 > 106.241.31.236.11905: Flags [F.], seq 1, ack 1, win 32536, length 0
00:46:21.141069 IP 106.241.31.236.11904 > 10.0.98.29.27021: Flags [F.], seq 660341002, ack 2825347561, win 253, length 0
00:46:21.141444 IP 10.0.98.29.27021 > 106.241.31.236.11904: Flags [F.], seq 1, ack 1, win 32536, length 0
00:49:51.856975 IP 106.241.31.236.11411 > 10.0.98.29.pnbs: Flags [R.], seq 3429655199, ack 54299519, win 0, length 0
00:50:06.099711 IP 169.254.169.254.http > 10.0.0.236.49662: Flags [F.], seq 709135245, ack 311235155, win 149, options [nop,nop,TS val 3887572867 ecr 233616264], length 0
00:50:06.099765 IP 10.0.0.236.49662 > 169.254.169.254.http: Flags [F.], seq 1, ack 1, win 219, options [nop,nop,TS val 233616264 ecr 3887572867], length 0
00:51:02.141528 IP 106.241.31.236.65148 > 10.0.98.29.pnbs: Flags [R.], seq 3995684220, ack 733739445, win 0, length 0
00:52:16.868277 IP 106.241.31.236.65210 > 10.0.98.29.pnbs: Flags [R.], seq 1542796311, ack 55619779, win 0, length 0
00:53:19.769171 IP 106.241.31.236.64439 > 10.0.98.29.pnbs: Flags [R.], seq 3369832986, ack 228900351, win 0, length 0
00:54:20.029010 IP 106.241.31.236.64700 > 10.0.98.29.pnbs: Flags [R.], seq 2946478097, ack 1624308138, win 0, length 0
00:54:58.926277 IP 106.241.31.236.12254 > 10.0.98.29.27022: Flags [F.], seq 1994975395, ack 2797661454, win 253, length 0
00:54:58.955672 IP 10.0.98.29.27022 > 106.241.31.236.12254: Flags [F.], seq 1, ack 1, win 32364, length 0
00:55:08.371840 IP 106.241.31.236.9005 > 10.0.98.29.27022: Flags [F.], seq 510782913, ack 3174244586, win 253, length 0
00:55:08.372364 IP 10.0.98.29.27022 > 106.241.31.236.9005: Flags [F.], seq 1, ack 1, win 32280, length 0
00:55:22.073268 IP 106.241.31.236.63147 > 10.0.98.29.27022: Flags [F.], seq 865717697, ack 3043194875, win 252, length 0
00:55:22.073709 IP 10.0.98.29.27022 > 106.241.31.236.63147: Flags [F.], seq 1, ack 1, win 32114, length 0
00:55:23.721039 IP 106.241.31.236.8693 > 10.0.98.29.pnbs: Flags [R.], seq 2702928650, ack 3660172692, win 0, length 0
00:55:23.871986 IP 106.241.31.236.8693 > 10.0.98.29.pnbs: Flags [R], seq 2702928650, win 0, length 0
00:58:29.298391 IP 106.241.31.236.65528 > 10.0.98.29.pnbs: Flags [R.], seq 4274055080, ack 1332684151, win 0, length 0
00:59:34.724549 IP 106.241.31.236.12995 > 10.0.98.29.pnbs: Flags [F.], seq 2923245096, ack 3742854684, win 251, length 0
00:59:34.724994 IP 10.0.98.29.pnbs > 106.241.31.236.12995: Flags [F.], seq 1, ack 1, win 32456, length 0
01:00:00.703706 IP 106.241.31.236.63540 > 10.0.98.29.pnbs: Flags [F.], seq 1840339275, ack 3830068769, win 256, length 0
01:00:00.704189 IP 10.0.98.29.pnbs > 106.241.31.236.63540: Flags [F.], seq 1, ack 1, win 32767, length 0
01:00:15.890724 IP 222.34.19.201.22127 > 10.0.98.29.pnbs: Flags [R.], seq 3300583636, ack 3222595997, win 1040, options [nop,nop,TS val 2912086515 ecr 108182049], length 0
01:00:16.004392 IP 183.134.67.195.55398 > 10.0.98.29.pnbs: Flags [R.], seq 3890819561, ack 3879421300, win 1032, options [nop,nop,TS val 557605696 ecr 108182075], length 0
01:00:18.779530 IP 121.135.63.45.6397 > 10.0.98.29.pnbs: Flags [R.], seq 230183137, ack 1164527421, win 0, length 0
01:00:27.407140 IP 47.72.77.183.59571 > 10.0.98.29.pnbs: Flags [F.], seq 619090836, ack 1138949659, win 65535, length 0
01:00:27.407423 IP 10.0.98.29.pnbs > 47.72.77.183.59571: Flags [F.], seq 1, ack 1, win 32767, length 0
01:00:40.054928 IP 211.161.159.14.45466 > 10.0.98.29.pnbs: Flags [R.], seq 380412769, ack 2136276480, win 8326, options [nop,nop,TS val 1640634706 ecr 108184501], length 0
01:00:49.218267 IP 51.7.246.167.63525 > 10.0.98.29.pnbs: Flags [R.], seq 3085157484, ack 1363000485, win 0, length 0
01:00:57.888989 IP 222.34.19.201.22858 > 10.0.98.29.pnbs: Flags [R.], seq 3194259489, ack 2776837764, win 1040, options [nop,nop,TS val 2912128510 ecr 108186236], length 0
01:00:57.987923 IP 183.134.67.195.32595 > 10.0.98.29.pnbs: Flags [R.], seq 512217334, ack 1977785668, win 1032, options [nop,nop,TS val 557647698 ecr 108186235], length 0
01:01:22.068367 IP 211.161.159.14.46037 > 10.0.98.29.pnbs: Flags [R.], seq 1543196635, ack 3265507338, win 8326, options [nop,nop,TS val 1640676716 ecr 108188648], length 0
01:01:31.179975 IP 106.241.31.236.63622 > 10.0.98.29.pnbs: Flags [R.], seq 1420140586, ack 3349739040, win 0, length 0
01:01:39.889698 IP 222.34.19.201.23574 > 10.0.98.29.pnbs: Flags [R.], seq 2073497663, ack 1429504009, win 1040, options [nop,nop,TS val 2912170512 ecr 108190415], length 0
01:01:40.003677 IP 183.134.67.195.51354 > 10.0.98.29.pnbs: Flags [R.], seq 3582362176, ack 4068316878, win 1032, options [nop,nop,TS val 557689693 ecr 108190457], length 0
01:01:50.448684 IP 106.241.31.236.5797 > 10.0.98.29.pnbs: Flags [R.], seq 3416691821, ack 2670859197, win 0, length 0
01:01:53.189422 IP 75.131.30.157.58337 > 10.0.98.29.27021: Flags [F.], seq 2170662654, ack 1172122928, win 16382, length 0
01:01:53.189915 IP 10.0.98.29.27021 > 75.131.30.157.58337: Flags [F.], seq 1, ack 1, win 32050, length 0
01:02:04.056736 IP 211.161.159.14.46552 > 10.0.98.29.pnbs: Flags [R.], seq 1553045002, ack 3024999905, win 8326, options [nop,nop,TS val 1640718711 ecr 108192838], length 0
01:02:30.408239 IP 27.75.143.80.60748 > 10.0.98.29.pnbs: Flags [R.], seq 4019158949, ack 2765527182, win 0, length 0
01:02:34.743898 IP 116.216.30.46.40727 > 10.0.98.29.pnbs: Flags [R.], seq 1555965691, ack 1571313165, win 0, length 0
01:03:37.090757 IP 27.75.143.80.60803 > 10.0.98.29.pnbs: Flags [R.], seq 2251916610, ack 3578215620, win 0, length 0
01:03:52.356987 IP 106.241.31.238.56281 > 10.0.98.29.27021: Flags [F.], seq 3638972704, ack 2956116432, win 4093, options [nop,nop,TS val 817338456 ecr 108203921], length 0
01:03:52.357467 IP 10.0.98.29.27021 > 106.241.31.238.56281: Flags [F.], seq 1, ack 1, win 32397, options [nop,nop,TS val 108204738 ecr 817338456], length 0
01:04:12.484349 IP 61.216.156.81.59435 > 10.0.98.29.pnbs: Flags [R.], seq 3875018576:3875018598, ack 2340901306, win 16376, length 22
01:05:12.596606 IP 61.80.25.119.49506 > 10.0.98.29.27021: Flags [F.], seq 25331189, ack 1277293133, win 255, length 0
01:05:12.597085 IP 10.0.98.29.27021 > 61.80.25.119.49506: Flags [F.], seq 1, ack 1, win 31954, length 0
01:05:57.334238 IP 106.241.31.236.65515 > 10.0.98.29.pnbs: Flags [R.], seq 975335551, ack 2454229652, win 0, length 0
01:06:05.501023 IP 110.188.75.180.16289 > 10.0.98.29.pnbs: Flags [R.], seq 1195794265, ack 2525040811, win 0, length 0
01:06:05.703312 IP 110.188.75.180.16289 > 10.0.98.29.pnbs: Flags [R], seq 1195794265, win 0, length 0
01:06:07.321512 IP 203.128.80.64.52498 > 10.0.98.29.27021: Flags [F.], seq 1697401273, ack 377318478, win 4129, length 0
01:06:07.322011 IP 10.0.98.29.27021 > 203.128.80.64.52498: Flags [F.], seq 1, ack 1, win 32228, length 0
01:06:42.387374 IP 203.128.80.64.52465 > 10.0.98.29.pnbs: Flags [R.], seq 1733690522, ack 663067941, win 0, length 0
01:06:42.463729 IP 203.128.80.64.52465 > 10.0.98.29.pnbs: Flags [R], seq 1733690522, win 0, length 0
01:06:59.220221 IP 59.60.184.155.49442 > 10.0.98.29.pnbs: Flags [R.], seq 109664040, ack 1471536291, win 0, length 0
01:07:12.252241 IP 60.55.55.82.51178 > 10.0.98.29.27021: Flags [R], seq 2255975094, win 0, length 0
01:07:12.830421 IP 153.35.189.200.51178 > 10.0.98.29.27021: Flags [R.], seq 2255975171, ack 952396932, win 0, length 0
01:07:20.644338 IP 211.215.64.41.51252 > 10.0.98.29.pnbs: Flags [R.], seq 581571302, ack 1938528509, win 0, length 0
01:07:20.704098 IP 211.215.64.41.51252 > 10.0.98.29.pnbs: Flags [R], seq 581571302, win 0, length 0
01:07:37.553083 IP 49.142.17.144.50574 > 10.0.98.29.pnbs: Flags [R.], seq 4244422889, ack 1178669539, win 0, length 0
01:07:50.064686 IP 211.161.159.14.24406 > 10.0.98.29.pnbs: Flags [R.], seq 1050590013, ack 3534627441, win 8326, options [nop,nop,TS val 1639286430 ecr 108227437], length 0
01:08:12.391361 IP 121.135.63.45.kti-icad-srvr > 10.0.98.29.pnbs: Flags [R.], seq 3017087117, ack 1171068727, win 0, length 0
01:08:32.068952 IP 211.161.159.14.25666 > 10.0.98.29.pnbs: Flags [R.], seq 1500306905, ack 1845857471, win 8326, options [nop,nop,TS val 1639328428 ecr 108231641], length 0
01:08:37.620880 IP 203.128.80.64.52504 > 10.0.98.29.pnbs: Flags [R.], seq 4011664317, ack 344668452, win 0, length 0
01:08:37.748278 IP 203.128.80.64.52504 > 10.0.98.29.pnbs: Flags [R], seq 4011664317, win 0, length 0
01:08:42.381299 IP 49.142.17.144.50613 > 10.0.98.29.pnbs: Flags [R.], seq 3096368585, ack 1357942894, win 0, length 0
01:09:02.015644 IP 42.100.102.161.57807 > 10.0.98.29.pnbs: Flags [R.], seq 1621807273, ack 1948543614, win 0, length 0
01:09:14.068225 IP 211.161.159.14.26799 > 10.0.98.29.pnbs: Flags [R.], seq 4221946263, ack 1666567200, win 8326, options [nop,nop,TS val 1639370432 ecr 108235840], length 0
01:09:22.608459 IP 10.0.98.29.pnbs > 218.76.7.194.60178: Flags [R.], seq 820053517, ack 3004300663, win 0, length 0
01:09:39.958653 IP 36.110.118.34.10901 > 10.0.98.29.pnbs: Flags [R.], seq 1289649706, ack 3580984200, win 0, length 0
01:09:49.248312 IP 106.241.31.236.12140 > 10.0.98.29.pnbs: Flags [R.], seq 622582626, ack 1543279638, win 0, length 0
01:09:52.281303 IP 146.255.63.118.45397 > 10.0.98.29.pnbs: Flags [F.], seq 2356284246, ack 1860695372, win 3335, options [nop,nop,TS val 1140639673 ecr 108240628], length 0
01:09:52.281706 IP 10.0.98.29.pnbs > 146.255.63.118.45397: Flags [F.], seq 193, ack 1, win 31889, options [nop,nop,TS val 108240729 ecr 1140639673], length 0
01:09:52.550104 IP 146.255.63.118.45397 > 10.0.98.29.pnbs: Flags [R], seq 2356284247, win 0, length 0
01:09:52.550109 IP 146.255.63.118.45397 > 10.0.98.29.pnbs: Flags [R], seq 2356284247, win 0, length 0
01:10:05.797474 IP 121.135.63.45.7537 > 10.0.98.29.pnbs: Flags [R.], seq 2290986261, ack 2962561740, win 0, length 0
01:10:20.606650 IP 183.246.79.122.jdmn-port > 10.0.98.29.pnbs: Flags [R.], seq 1915920497, ack 3109911853, win 0, length 0
01:10:32.083829 IP 121.135.63.45.imqstomps > 10.0.98.29.pnbs: Flags [R.], seq 3097848271, ack 247687726, win 0, length 0
01:10:58.068236 IP 110.188.75.180.16335 > 10.0.98.29.pnbs: Flags [R.], seq 496425648, ack 3736300208, win 0, length 0
01:10:58.370651 IP 110.188.75.180.16335 > 10.0.98.29.pnbs: Flags [R], seq 496425592, win 0, length 0
01:10:58.535565 IP 110.188.75.180.16335 > 10.0.98.29.pnbs: Flags [R], seq 496425592, win 0, length 0
01:11:21.276022 IP 121.135.63.45.14830 > 10.0.98.29.pnbs: Flags [R.], seq 1055170240, ack 4205088680, win 0, length 0
01:11:29.074233 IP 14.168.250.232.49620 > 10.0.98.29.27021: Flags [F.], seq 4234306981, ack 1811482214, win 16467, length 0
01:11:29.074642 IP 10.0.98.29.27021 > 14.168.250.232.49620: Flags [F.], seq 1, ack 1, win 32382, length 0
01:11:34.421648 IP 115.133.94.216.49515 > 10.0.98.29.pnbs: Flags [R.], seq 3237462945, ack 2935482520, win 0, length 0
01:11:38.378925 IP 106.241.31.236.ppactivation > 10.0.98.29.pnbs: Flags [R.], seq 608884671, ack 1065125336, win 0, length 0
01:11:51.860206 IP 218.76.7.194.60178 > 10.0.98.29.pnbs: Flags [R.], seq 537, ack 4294965860, win 0, length 0
01:12:12.635877 IP 110.70.27.46.msgsys > 10.0.98.29.pnbs: Flags [F.], seq 3519691477, ack 3679311852, win 331, options [nop,nop,TS val 23241913 ecr 108253989], length 0
01:12:12.636376 IP 10.0.98.29.pnbs > 110.70.27.46.msgsys: Flags [F.], seq 1, ack 1, win 32767, options [nop,nop,TS val 108254764 ecr 23241913], length 0
01:12:24.843542 IP 153.35.189.232.50368 > 10.0.98.29.27021: Flags [R.], seq 522669798, ack 1809965168, win 0, length 0
01:12:36.486348 IP 122.227.141.78.58593 > 10.0.98.29.27021: Flags [F.], seq 3160110860, ack 3415530616, win 260, options [nop,nop,TS val 224061 ecr 108257109], length 0
01:12:36.486713 IP 10.0.98.29.27021 > 122.227.141.78.58593: Flags [F.], seq 1, ack 1, win 32689, options [nop,nop,TS val 108257149 ecr 224061], length 0
01:12:44.882471 IP 10.0.98.29.27021 > 58.241.39.163.50368: Flags [R], seq 1591243412, win 0, length 0
01:12:50.308403 IP 211.215.64.41.51540 > 10.0.98.29.pnbs: Flags [R.], seq 435121041, ack 4013068680, win 0, length 0
01:12:50.390379 IP 211.215.64.41.51540 > 10.0.98.29.pnbs: Flags [R], seq 435121041, win 0, length 0
01:13:01.363829 IP 1.240.98.76.56588 > 10.0.98.29.pnbs: Flags [R.], seq 857668368, ack 2633967554, win 0, length 0
01:13:04.361878 IP 14.168.250.232.49638 > 10.0.98.29.27021: Flags [F.], seq 1300221598, ack 546342859, win 16635, length 0
01:13:04.362269 IP 10.0.98.29.27021 > 14.168.250.232.49638: Flags [F.], seq 1, ack 1, win 32536, length 0
01:13:09.783376 IP 213.27.245.59.57186 > 10.0.98.29.pnbs: Flags [R.], seq 3742005217, ack 2866586487, win 0, length 0
01:13:09.802806 IP 213.27.245.59.57186 > 10.0.98.29.pnbs: Flags [R], seq 3742005217, win 0, length 0
01:13:12.964155 IP 121.135.63.45.8039 > 10.0.98.29.27021: Flags [F.], seq 2249149231, ack 2347085139, win 16390, length 0
01:13:12.964572 IP 10.0.98.29.27021 > 121.135.63.45.8039: Flags [F.], seq 1, ack 1, win 32614, length 0
01:13:17.548351 IP 120.34.164.141.whosockami > 10.0.98.29.pnbs: Flags [R.], seq 11451373, ack 620936462, win 0, length 0
01:13:17.719982 IP 120.34.164.141.whosockami > 10.0.98.29.pnbs: Flags [R], seq 11451373, win 0, length 0
01:13:25.215665 IP 5.166.167.27.63736 > 10.0.98.29.pnbs: Flags [R.], seq 3572285191, ack 1683464916, win 0, length 0
01:13:33.933729 IP 123.24.205.167.4282 > 10.0.98.29.pnbs: Flags [R.], seq 2001301698, ack 2040549955, win 0, length 0
01:13:34.032177 IP 123.24.205.167.4282 > 10.0.98.29.pnbs: Flags [R], seq 2001301698, win 0, length 0
01:15:16.919879 IP 120.34.164.141.cgn-stat > 10.0.98.29.pnbs: Flags [R.], seq 1710040739, ack 2594146240, win 0, length 0
01:15:17.129858 IP 120.34.164.141.cgn-stat > 10.0.98.29.pnbs: Flags [R], seq 1710040739, win 0, length 0
01:15:18.093857 IP 117.20.114.24.52821 > 10.0.98.29.pnbs: Flags [R.], seq 2427883796, ack 1780166196, win 0, length 0
01:16:20.233918 IP 75.131.30.157.58340 > 10.0.98.29.27021: Flags [F.], seq 2503003078, ack 2879628559, win 16386, length 0
01:16:20.234483 IP 10.0.98.29.27021 > 75.131.30.157.58340: Flags [F.], seq 1, ack 1, win 31717, length 0
01:16:30.211654 IP 112.215.170.32.16444 > 10.0.98.29.pnbs: Flags [R.], seq 1445732791, ack 3454530172, win 0, length 0
01:16:31.539131 IP 59.55.230.148.10720 > 10.0.98.29.pnbs: Flags [R.], seq 2743003150, ack 4211675319, win 0, length 0
01:16:58.045110 IP 123.123.87.10.49274 > 10.0.98.29.pnbs: Flags [R.], seq 3068675993, ack 3957653208, win 0, length 0
01:17:12.899518 IP 75.131.30.157.55397 > 10.0.98.29.27021: Flags [F.], seq 3375872010, ack 3181318529, win 16343, length 0
01:17:12.900042 IP 10.0.98.29.27021 > 75.131.30.157.55397: Flags [F.], seq 1, ack 1, win 31766, length 0
01:17:13.836792 IP 75.131.30.157.58330 > 10.0.98.29.pnbs: Flags [R.], seq 2280366759, ack 1434339274, win 0, length 0
01:17:24.447805 IP 223.104.20.168.drip > 10.0.98.29.pnbs: Flags [F.], seq 3954172089, ack 3214939403, win 4093, options [nop,nop,TS val 629633760 ecr 108285906], length 0
01:17:24.448309 IP 10.0.98.29.pnbs > 223.104.20.168.drip: Flags [F.], seq 1, ack 1, win 32458, options [nop,nop,TS val 108285945 ecr 629633760], length 0
01:17:25.113667 IP 10.0.98.29.pnbs > 59.60.184.155.49604: Flags [R.], seq 3170583845, ack 3001185957, win 0, length 0
01:17:34.473291 IP 190.18.149.95.50950 > 10.0.98.29.27021: Flags [F.], seq 1704272058, ack 1150085975, win 255, length 0
01:17:34.473699 IP 10.0.98.29.27021 > 190.18.149.95.50950: Flags [F.], seq 1, ack 1, win 32204, length 0
01:17:44.236918 IP 121.135.63.45.8558 > 10.0.98.29.27021: Flags [F.], seq 2567603806, ack 3236473972, win 16337, length 0
01:17:44.237369 IP 10.0.98.29.27021 > 121.135.63.45.8558: Flags [F.], seq 1, ack 1, win 32614, length 0
01:17:44.661483 IP 183.246.79.122.aipn-reg > 10.0.98.29.pnbs: Flags [R.], seq 3442748404, ack 1307022725, win 0, length 0
01:17:45.237644 IP 121.135.63.45.7916 > 10.0.98.29.pnbs: Flags [R.], seq 3175500144, ack 1542759903, win 0, length 0
01:17:52.267762 IP 51.7.246.167.63664 > 10.0.98.29.pnbs: Flags [R.], seq 372803072, ack 1623887386, win 0, length 0
01:17:55.939715 IP 183.214.72.6.54897 > 10.0.98.29.pnbs: Flags [R.], seq 3849052953, ack 3781879294, win 0, length 0
01:17:55.942951 IP 183.214.72.6.54897 > 10.0.98.29.pnbs: Flags [R], seq 3849052953, win 0, length 0
01:17:58.390144 IP 124.115.133.145.14221 > 10.0.98.29.pnbs: Flags [R.], seq 4257660770, ack 2946780879, win 0, length 0
01:17:58.513025 IP 124.115.133.145.14221 > 10.0.98.29.pnbs: Flags [R], seq 4257660770, win 0, length 0
01:18:09.625667 IP 118.223.1.135.10389 > 10.0.98.29.pnbs: Flags [R.], seq 1069253549, ack 252724193, win 0, length 0
01:18:29.523799 IP 185.18.148.188.54187 > 10.0.98.29.pnbs: Flags [F.], seq 3776719691, ack 2815928097, win 1820, options [nop,nop,TS val 4062125475 ecr 108292425], length 0
01:18:29.523844 IP 185.18.148.188.54187 > 10.0.98.29.pnbs: Flags [R.], seq 1, ack 1, win 1820, options [nop,nop,TS val 4062125475 ecr 108292425], length 0
01:18:29.779291 IP 185.18.148.188.54187 > 10.0.98.29.pnbs: Flags [R], seq 3776719692, win 0, length 0
01:18:35.653188 IP 49.166.150.170.53871 > 10.0.98.29.pnbs: Flags [R.], seq 3589967424, ack 4052181032, win 0, length 0
01:18:49.560728 IP 117.139.14.221.30908 > 10.0.98.29.27021: Flags [F.], seq 1911117025, ack 4174954635, win 354, options [nop,nop,TS val 19611482 ecr 108294211], length 0
01:18:49.561882 IP 10.0.98.29.27021 > 117.139.14.221.30908: Flags [F.], seq 1, ack 1, win 32381, options [nop,nop,TS val 108294456 ecr 19611482], length 0
01:19:18.100012 IP 169.254.169.254.http > 10.0.0.236.49664: Flags [F.], seq 2778545498, ack 3968070484, win 149, options [nop,nop,TS val 3887748067 ecr 234054264], length 0
01:19:18.100066 IP 10.0.0.236.49664 > 169.254.169.254.http: Flags [F.], seq 1, ack 1, win 219, options [nop,nop,TS val 234054264 ecr 3887748067], length 0
01:19:27.551214 IP 59.60.184.155.49604 > 10.0.98.29.pnbs: Flags [R.], seq 465, ack 4294965948, win 0, length 0
01:19:29.492428 IP 10.0.98.29.pnbs > 124.115.133.145.14650: Flags [R.], seq 998599266, ack 466751912, win 0, length 0
01:19:31.472939 IP 14.177.29.80.eapsp > 10.0.98.29.pnbs: Flags [R.], seq 651811097, ack 1152797546, win 0, length 0
01:19:36.214614 IP 114.111.167.131.9152 > 10.0.98.29.pnbs: Flags [R.], seq 1187261007, ack 3312380624, win 0, length 0
01:19:59.973418 IP 75.131.30.157.55014 > 10.0.98.29.pnbs: Flags [R.], seq 961567261, ack 1490734561, win 0, length 0
01:20:14.005269 IP 202.166.24.150.60877 > 10.0.98.29.pnbs: Flags [R.], seq 3557390626, ack 1890808301, win 0, length 0
01:20:23.622891 IP 10.0.98.29.pnbs > 124.39.61.139.62321: Flags [R.], seq 847505221, ack 3777360276, win 0, length 0
01:20:42.324421 IP 49.166.150.170.ecwcfg > 10.0.98.29.pnbs: Flags [R.], seq 352694252, ack 3659834159, win 0, length 0
01:20:51.893103 IP 75.131.30.157.58361 > 10.0.98.29.pnbs: Flags [R.], seq 598989090, ack 2301817876, win 0, length 0
01:21:16.406957 IP 202.166.24.150.60923 > 10.0.98.29.pnbs: Flags [R.], seq 3531803950, ack 1671804900, win 0, length 0
01:21:57.217348 IP 122.53.101.104.53055 > 10.0.98.29.pnbs: Flags [R.], seq 2167859712, ack 1157008110, win 0, length 0
01:21:57.507460 IP 122.53.101.104.53055 > 10.0.98.29.pnbs: Flags [R], seq 2167859712, win 0, length 0
01:22:18.219993 IP 75.131.30.157.58371 > 10.0.98.29.pnbs: Flags [R.], seq 135044205, ack 1962132912, win 0, length 0
01:22:41.538191 IP 223.104.5.227.28092 > 10.0.98.29.27021: Flags [F.], seq 1372616446, ack 1518463707, win 4096, options [nop,nop,TS val 235699402 ecr 108317401], length 0
01:22:41.538757 IP 10.0.98.29.27021 > 223.104.5.227.28092: Flags [F.], seq 69, ack 1, win 32314, options [nop,nop,TS val 108317653 ecr 235699402], length 0
01:22:41.638096 IP 223.104.5.227.28092 > 10.0.98.29.27021: Flags [R], seq 1372616447, win 0, length 0
01:22:41.638148 IP 223.104.5.227.28092 > 10.0.98.29.27021: Flags [R], seq 1372616447, win 0, length 0
01:22:58.411310 IP 24.197.44.173.51864 > 10.0.98.29.27021: Flags [F.], seq 1258345057, ack 2071002286, win 1027, length 0
01:22:58.411702 IP 10.0.98.29.27021 > 24.197.44.173.51864: Flags [F.], seq 112, ack 1, win 32614, length 0
01:22:58.600153 IP 24.197.44.173.51864 > 10.0.98.29.27021: Flags [R.], seq 1, ack 112, win 0, length 0
01:22:58.600185 IP 24.197.44.173.51864 > 10.0.98.29.27021: Flags [R], seq 1258345058, win 0, length 0
01:22:58.600192 IP 24.197.44.173.51864 > 10.0.98.29.27021: Flags [R], seq 1258345058, win 0, length 0
01:23:01.634208 IP 75.131.30.157.58380 > 10.0.98.29.pnbs: Flags [R.], seq 3951372973, ack 3339866625, win 0, length 0
01:23:29.817107 IP 121.22.191.48.50850 > 10.0.98.29.27021: Flags [F.], seq 2117494939, ack 1995206524, win 258, length 0
01:23:29.817467 IP 10.0.98.29.27021 > 121.22.191.48.50850: Flags [F.], seq 1, ack 1, win 32204, length 0
01:23:30.292023 IP 10.0.98.29.pnbs > 114.111.167.195.37040: Flags [R.], seq 2442662801, ack 2708934958, win 0, length 0
01:23:38.875994 IP 10.0.98.29.pnbs > 219.232.48.157.15121: Flags [R], seq 3880765963, win 0, length 0
01:23:39.952275 IP 117.114.129.170.51655 > 10.0.98.29.pnbs: Flags [F.], seq 1503733225, ack 2544845462, win 4096, options [nop,nop,TS val 1503890036 ecr 108323394], length 0
01:23:39.952803 IP 10.0.98.29.pnbs > 117.114.129.170.51655: Flags [F.], seq 245, ack 1, win 32598, options [nop,nop,TS val 108323494 ecr 1503890036], length 0
01:23:41.122003 IP 10.0.98.29.pnbs > 117.114.129.170.51655: Flags [FP.], seq 1:245, ack 1, win 32598, options [nop,nop,TS val 108323611 ecr 1503890349], length 244
01:23:43.481953 IP 10.0.98.29.pnbs > 117.114.129.170.51655: Flags [FP.], seq 1:245, ack 1, win 32598, options [nop,nop,TS val 108323847 ecr 1503890349], length 244
01:23:43.804728 IP 117.114.129.170.51655 > 10.0.98.29.pnbs: Flags [R], seq 1503733226, win 0, length 0
01:23:49.140787 IP 124.207.50.248.7571 > 10.0.98.29.pnbs: Flags [R.], seq 2634572852, ack 4269389582, win 0, length 0
01:23:53.031631 IP 49.48.248.147.49759 > 10.0.98.29.pnbs: Flags [R.], seq 594464515, ack 4256135606, win 0, length 0
01:23:54.888152 IP 117.114.129.170.51661 > 10.0.98.29.pnbs: Flags [F.], seq 3730320554, ack 4049962174, win 4096, options [nop,nop,TS val 1503904918 ecr 108324918], length 0
01:23:54.888534 IP 10.0.98.29.pnbs > 117.114.129.170.51661: Flags [F.], seq 537, ack 1, win 32685, options [nop,nop,TS val 108324987 ecr 1503904918], length 0
01:23:55.388814 IP 10.0.98.29.pnbs > 117.114.129.170.51661: Flags [FP.], seq 1:537, ack 1, win 32685, options [nop,nop,TS val 108325037 ecr 1503905260], length 536
01:23:56.738847 IP 10.0.98.29.pnbs > 117.114.129.170.51661: Flags [FP.], seq 1:537, ack 1, win 32685, options [nop,nop,TS val 108325172 ecr 1503905260], length 536
01:23:57.066752 IP 117.114.129.170.51661 > 10.0.98.29.pnbs: Flags [R], seq 3730320555, win 0, length 0
01:23:58.552371 IP 117.114.129.170.51662 > 10.0.98.29.pnbs: Flags [R], seq 2269950337, win 0, length 0
01:24:20.373130 IP 223.8.211.204.54221 > 10.0.98.29.pnbs: Flags [R.], seq 456052913, ack 1777100519, win 0, length 0
01:24:20.670591 IP 10.0.98.29.pnbs > 219.232.48.157.15844: Flags [R], seq 1870549049, win 0, length 0
01:24:42.907239 IP 42.55.136.41.35223 > 10.0.98.29.pnbs: Flags [R.], seq 30770349, ack 3356101739, win 8257, options [nop,nop,TS val 1866756834 ecr 108328750], length 0
01:25:02.743145 IP 10.0.98.29.pnbs > 219.232.48.157.16584: Flags [R], seq 3809960665, win 0, length 0
01:25:05.785017 IP 75.131.30.157.58402 > 10.0.98.29.pnbs: Flags [R.], seq 1463858140, ack 1858981989, win 0, length 0
01:25:19.999106 IP 106.241.31.236.55452 > 10.0.98.29.pnbs: Flags [R.], seq 513091008, ack 7622600, win 0, length 0
01:25:21.887342 IP 125.181.94.157.58110 > 10.0.98.29.pnbs: Flags [R.], seq 1555605461, ack 815745554, win 0, length 0
01:25:24.896439 IP 42.55.136.41.48089 > 10.0.98.29.pnbs: Flags [R.], seq 1316074288, ack 2023292477, win 8257, options [nop,nop,TS val 1866798824 ecr 108332933], length 0
01:25:57.902826 IP 125.181.94.157.58140 > 10.0.98.29.pnbs: Flags [R.], seq 2058141738, ack 726939008, win 0, length 0
01:25:58.878156 IP 110.188.75.180.16657 > 10.0.98.29.pnbs: Flags [R.], seq 1396216210, ack 2069270058, win 0, length 0
01:26:06.900527 IP 42.55.136.41.15432 > 10.0.98.29.pnbs: Flags [R.], seq 1266825640, ack 1654857230, win 8257, options [nop,nop,TS val 1866840828 ecr 108337131], length 0
01:26:09.641544 IP 223.104.5.227.29310 > 10.0.98.29.pnbs: Flags [F.], seq 2740376198, ack 3525506556, win 4093, options [nop,nop,TS val 235906412 ecr 108338076], length 0
01:26:09.642023 IP 10.0.98.29.pnbs > 223.104.5.227.29310: Flags [F.], seq 1, ack 1, win 32089, options [nop,nop,TS val 108338462 ecr 235906412], length 0
01:26:18.630995 IP 220.255.30.115.56033 > 10.0.98.29.pnbs: Flags [R.], seq 3138767235, ack 1258971285, win 0, length 0
01:26:23.907804 IP 113.57.246.254.36015 > 10.0.98.29.pnbs: Flags [R], seq 1938662895, win 0, length 0
01:26:40.542427 IP 117.136.67.98.6282 > 10.0.98.29.pnbs: Flags [F.], seq 3892606206, ack 3980145016, win 4120, options [nop,nop,TS val 769439409 ecr 108341312], length 0
01:26:40.542806 IP 10.0.98.29.pnbs > 117.136.67.98.6282: Flags [F.], seq 1, ack 1, win 32767, options [nop,nop,TS val 108341552 ecr 769439409], length 0
01:26:42.024241 IP 117.136.67.98.6283 > 10.0.98.29.pnbs: Flags [F.], seq 2807432922, ack 2658685550, win 4120, options [nop,nop,TS val 769440867 ecr 108341553], length 0
01:26:42.024529 IP 10.0.98.29.pnbs > 117.136.67.98.6283: Flags [F.], seq 1, ack 1, win 32767, options [nop,nop,TS val 108341700 ecr 769440867], length 0
01:26:49.962561 IP 117.136.67.98.6284 > 10.0.98.29.pnbs: Flags [F.], seq 4067733967, ack 4149599137, win 4120, options [nop,nop,TS val 769448799 ecr 108341701], length 0
01:26:49.962906 IP 10.0.98.29.pnbs > 117.136.67.98.6284: Flags [F.], seq 1, ack 1, win 32767, options [nop,nop,TS val 108342494 ecr 769448799], length 0
01:27:31.561024 IP 183.69.198.203.16688 > 10.0.98.29.pnbs: Flags [R.], seq 2763531424, ack 3041873580, win 0, length 0
01:27:31.681914 IP 183.69.198.203.16688 > 10.0.98.29.pnbs: Flags [R], seq 2763531424, win 0, length 0
01:27:56.242107 IP 117.28.255.57.62085 > 10.0.98.29.pnbs: Flags [R.], seq 136150576, ack 3025558721, win 0, length 0
01:28:27.025054 IP 27.27.21.245.16696 > 10.0.98.29.pnbs: Flags [F.], seq 2271664266, ack 3376217194, win 489, options [nop,nop,TS val 14551439 ecr 108352114], length 0
01:28:27.025545 IP 10.0.98.29.pnbs > 27.27.21.245.16696: Flags [F.], seq 1, ack 1, win 32257, options [nop,nop,TS val 108352200 ecr 14551439], length 0
01:28:37.257650 IP 183.207.217.79.55465 > 10.0.98.29.pnbs: Flags [F.], seq 1375814640, ack 1829036888, win 4085, options [nop,nop,TS val 483592879 ecr 108353027], length 0
01:28:37.258018 IP 10.0.98.29.pnbs > 183.207.217.79.55465: Flags [F.], seq 343, ack 1, win 32217, options [nop,nop,TS val 108353223 ecr 483592879], length 0
01:28:37.364219 IP 125.162.251.64.54179 > 10.0.98.29.pnbs: Flags [R.], seq 271311378, ack 2454636107, win 0, length 0
01:28:37.412546 IP 183.207.217.79.55465 > 10.0.98.29.pnbs: Flags [F.], seq 0, ack 343, win 4074, options [nop,nop,TS val 483593278 ecr 108353220], length 0
01:28:47.773776 IP 42.232.118.11.26718 > 10.0.98.29.pnbs: Flags [R.], seq 2249793996, ack 131844850, win 0, length 0
01:29:32.129676 IP 117.92.6.16.18496 > 10.0.98.29.27021: Flags [F.], seq 2682832336, ack 3781256326, win 3237, options [nop,nop,TS val 564373 ecr 108358348], length 0
01:29:32.130116 IP 10.0.98.29.27021 > 117.92.6.16.18496: Flags [F.], seq 162, ack 1, win 32363, options [nop,nop,TS val 108358711 ecr 564373], length 0
01:29:32.303467 IP 10.0.98.29.27021 > 117.92.6.16.18496: Flags [FP.], seq 1:162, ack 1, win 32363, options [nop,nop,TS val 108358728 ecr 564373], length 161
01:29:32.566514 IP 117.92.6.16.18496 > 10.0.98.29.27021: Flags [R], seq 2682832337, win 0, length 0
01:29:32.665877 IP 117.92.6.16.18496 > 10.0.98.29.27021: Flags [R], seq 2682832337, win 0, length 0
01:29:41.158047 IP 61.163.209.102.49579 > 10.0.98.29.27021: Flags [F.], seq 425674582, ack 648626454, win 16635, length 0
01:29:41.158376 IP 10.0.98.29.27021 > 61.163.209.102.49579: Flags [F.], seq 1, ack 1, win 32102, length 0
01:30:28.712899 IP 5.81.250.138.57727 > 10.0.98.29.pnbs: Flags [R.], seq 178940487, ack 4287120743, win 0, length 0
01:30:29.480902 IP 10.0.98.29.pnbs > 124.115.133.145.14999: Flags [R.], seq 2355354447, ack 3886912228, win 0, length 0
01:30:45.646502 IP 24.197.44.173.62841 > 10.0.98.29.27021: Flags [F.], seq 2241397039, ack 1268364560, win 253, length 0
01:30:45.646901 IP 10.0.98.29.27021 > 24.197.44.173.62841: Flags [F.], seq 1, ack 1, win 32614, length 0
01:30:58.013511 IP 60.210.106.122.53483 > 10.0.98.29.pnbs: Flags [R.], seq 2006173430, ack 1400384389, win 2329, options [nop,nop,TS val 10355292 ecr 108367245], length 0
01:31:23.422011 IP 110.188.75.180.16874 > 10.0.98.29.pnbs: Flags [R.], seq 470989028, ack 2352839516, win 0, length 0
01:31:23.580869 IP 110.188.75.180.16874 > 10.0.98.29.pnbs: Flags [R], seq 470989028, win 0, length 0
01:31:46.873598 IP 106.241.31.236.11705 > 10.0.98.29.pnbs: Flags [R.], seq 2711682532, ack 3693095400, win 0, length 0
01:31:47.855094 IP 221.225.190.207.64550 > 10.0.98.29.pnbs: Flags [F.], seq 908712556, ack 4266347518, win 4096, options [nop,nop,TS val 1203728952 ecr 108372065], length 0
01:32:08.858928 IP 117.136.41.59.49219 > 10.0.98.29.pnbs: Flags [R.], seq 761745173, ack 1619073630, win 83, options [nop,nop,TS val 32469010 ecr 108374324], length 0
01:32:09.629607 IP 115.91.238.218.52132 > 10.0.98.29.pnbs: Flags [R.], seq 887870493, ack 3397130714, win 0, length 0
01:32:32.458033 IP 223.65.141.222.53572 > 10.0.98.29.pnbs: Flags [F.], seq 2715643046, ack 2252871363, win 4093, options [nop,nop,TS val 167853973 ecr 108376727], length 0
01:32:32.458434 IP 10.0.98.29.pnbs > 223.65.141.222.53572: Flags [F.], seq 1, ack 1, win 31924, options [nop,nop,TS val 108376743 ecr 167853973], length 0
01:32:35.806884 IP 223.65.141.222.53573 > 10.0.98.29.pnbs: Flags [F.], seq 578313159, ack 3593543011, win 4093, options [nop,nop,TS val 167857307 ecr 108377029], length 0
01:32:35.807280 IP 10.0.98.29.pnbs > 223.65.141.222.53573: Flags [F.], seq 1, ack 1, win 32069, options [nop,nop,TS val 108377078 ecr 167857307], length 0
01:32:39.360618 IP 10.0.98.29.pnbs > 221.225.190.207.64550: Flags [R.], seq 1425, ack 1, win 0, length 0
01:32:43.915362 IP 24.197.44.173.62765 > 10.0.98.29.pnbs: Flags [R.], seq 4278479061, ack 1414410413, win 0, length 0
01:32:45.378818 IP 112.17.235.22.30942 > 10.0.98.29.27021: Flags [F.], seq 1896327673, ack 4010150254, win 4096, options [nop,nop,TS val 206649887 ecr 108377806], length 0
01:32:45.379989 IP 10.0.98.29.27021 > 112.17.235.22.30942: Flags [F.], seq 69, ack 1, win 32297, options [nop,nop,TS val 108378035 ecr 206649887], length 0
01:32:45.493708 IP 112.17.235.22.30942 > 10.0.98.29.27021: Flags [R], seq 1896327674, win 0, length 0
01:32:45.493713 IP 112.17.235.22.30942 > 10.0.98.29.27021: Flags [R], seq 1896327674, win 0, length 0
01:32:51.405002 IP 182.148.114.248.53843 > 10.0.98.29.pnbs: Flags [F.], seq 4044879375, ack 3327897136, win 3409, options [nop,nop,TS val 1953925 ecr 108378326], length 0
01:32:51.528884 IP 203.121.244.171.55572 > 10.0.98.29.pnbs: Flags [R.], seq 2421306970, ack 3587731719, win 0, length 0
01:32:51.911777 IP 182.148.114.248.53843 > 10.0.98.29.pnbs: Flags [R], seq 4044879376, win 0, length 0
01:32:59.239244 IP 220.174.84.205.34399 > 10.0.98.29.27021: Flags [R.], seq 1980407172, ack 1716551368, win 0, length 0
01:33:07.545177 IP 106.241.31.236.9182 > 10.0.98.29.pnbs: Flags [R.], seq 3053806903, ack 963627406, win 0, length 0
01:33:07.624566 IP 106.241.31.236.9182 > 10.0.98.29.pnbs: Flags [R], seq 3053806903, win 0, length 0
01:33:10.482468 IP 223.72.127.20.24533 > 10.0.98.29.pnbs: Flags [R.], seq 1775948424, ack 2472181641, win 1040, options [nop,nop,TS val 347620175 ecr 108379520], length 0
01:33:17.096332 IP 146.255.63.118.46191 > 10.0.98.29.27021: Flags [F.], seq 2837163229, ack 1511252594, win 1037, options [nop,nop,TS val 1140990875 ecr 108381173], length 0
01:33:17.096686 IP 10.0.98.29.27021 > 146.255.63.118.46191: Flags [F.], seq 1, ack 1, win 32201, options [nop,nop,TS val 108381206 ecr 1140990875], length 0
01:33:20.338931 IP 146.255.63.118.56836 > 10.0.98.29.pnbs: Flags [F.], seq 1794523801, ack 3817776772, win 3246, options [nop,nop,TS val 1140991686 ecr 108381472], length 0
01:33:20.339364 IP 10.0.98.29.pnbs > 146.255.63.118.56836: Flags [F.], seq 253, ack 1, win 31349, options [nop,nop,TS val 108381531 ecr 1140991686], length 0
01:33:20.611004 IP 146.255.63.118.56836 > 10.0.98.29.pnbs: Flags [R], seq 1794523802, win 0, length 0
01:33:20.611068 IP 146.255.63.118.56836 > 10.0.98.29.pnbs: Flags [R], seq 1794523802, win 0, length 0
01:33:26.703594 IP 61.184.197.146.51956 > 10.0.98.29.pnbs: Flags [F.], seq 2172015438, ack 4135888053, win 8192, length 0
01:33:43.523780 IP 218.76.7.194.63981 > 10.0.98.29.pnbs: Flags [R.], seq 1404904136, ack 580147456, win 0, length 0
01:33:47.326747 IP 221.192.178.29.46752 > 10.0.98.29.pnbs: Flags [F.], seq 3580657516, ack 2846231629, win 4073, options [nop,nop,TS val 752290782 ecr 108384104], length 0
01:33:47.327108 IP 10.0.98.29.pnbs > 221.192.178.29.46752: Flags [F.], seq 1, ack 1, win 32091, options [nop,nop,TS val 108384229 ecr 752290782], length 0
01:33:52.474417 IP 223.72.127.20.14348 > 10.0.98.29.pnbs: Flags [R.], seq 4130050732, ack 355665578, win 1040, options [nop,nop,TS val 347662166 ecr 108383678], length 0
01:34:04.493845 IP 125.133.27.151.54431 > 10.0.98.29.pnbs: Flags [R.], seq 60971135, ack 20477751, win 0, length 0
01:34:10.100933 IP 112.224.67.127.53575 > 10.0.98.29.pnbs: Flags [F.], seq 325584297, ack 825728296, win 4096, options [nop,nop,TS val 388052023 ecr 108386379], length 0
01:34:10.101292 IP 10.0.98.29.pnbs > 112.224.67.127.53575: Flags [F.], seq 418, ack 1, win 31945, options [nop,nop,TS val 108386507 ecr 388051923], length 0
01:34:10.260844 IP 112.224.67.127.53575 > 10.0.98.29.pnbs: Flags [R], seq 325584298, win 0, length 0
01:34:10.260849 IP 112.224.67.127.53575 > 10.0.98.29.pnbs: Flags [R], seq 325584298, win 0, length 0
01:34:10.598811 IP 117.136.88.125.40238 > 10.0.98.29.pnbs: Flags [F.], seq 3080475574, ack 1657231485, win 4085, options [nop,nop,TS val 69733702 ecr 108386507], length 0
01:34:10.599164 IP 10.0.98.29.pnbs > 117.136.88.125.40238: Flags [F.], seq 1, ack 1, win 31970, options [nop,nop,TS val 108386557 ecr 69733702], length 0
01:34:20.495614 IP 10.0.98.29.pnbs > 223.104.172.226.20214: Flags [R.], seq 3944486652, ack 3719590430, win 0, length 0
01:34:25.189601 IP 124.205.63.251.remctl > 10.0.98.29.pnbs: Flags [R.], seq 2863978945, ack 1573236349, win 0, length 0
01:34:34.435715 IP 58.22.113.142.37696 > 10.0.98.29.pnbs: Flags [F.], seq 3705382024, ack 2954743785, win 754, options [nop,nop,TS val 6222536 ecr 108388904], length 0
01:34:34.436113 IP 10.0.98.29.pnbs > 58.22.113.142.37696: Flags [F.], seq 1, ack 1, win 32165, options [nop,nop,TS val 108388940 ecr 6222536], length 0
