tcpdump: verbose output suppressed, use -v or -vv for full protocol decode
listening on eth0, link-type EN10MB (Ethernet), capture size 65535 bytes
14:57:38.861918 IP 182.19.196.145.46986 > 10.0.0.40.pnbs: Flags [R.], seq 677287958, ack 962178158, win 3128, options [nop,nop,TS val 10698372 ecr 173685729], length 0
14:57:38.861927 IP 182.19.196.145.46986 > 10.0.98.12.pnbs: Flags [R.], seq 677287958, ack 962178158, win 3128, options [nop,nop,TS val 10698372 ecr 173685729], length 0
14:57:38.880829 IP 113.185.42.108.25036 > 10.0.0.40.27022: Flags [S], seq 1462174790, win 65535, options [mss 1340,nop,wscale 5,nop,nop,TS val 1170949092 ecr 0,sackOK,eol], length 0
14:57:38.880846 IP 113.185.42.108.25036 > 10.0.98.12.27022: Flags [S], seq 1462174790, win 65535, options [mss 1340,nop,wscale 5,nop,nop,TS val 1170949092 ecr 0,sackOK,eol], length 0
14:57:38.881017 IP 10.0.98.12.27022 > 113.185.42.108.25036: Flags [S.], seq 956244948, ack 1462174791, win 32767, options [mss 1460,nop,wscale 0,sackOK,TS val 173685782 ecr 1170949092], length 0
14:57:38.881026 IP 10.0.0.40.27022 > 113.185.42.108.25036: Flags [S.], seq 956244948, ack 1462174791, win 32767, options [mss 1460,nop,wscale 0,sackOK,TS val 173685782 ecr 1170949092], length 0
14:57:38.885609 IP 36.45.6.179.31282 > 10.0.0.40.pnbs: Flags [S], seq 221987538, win 65535, options [mss 1380,sackOK,TS val 4746350 ecr 0,nop,wscale 6], length 0
14:57:38.885630 IP 36.45.6.179.31282 > 10.0.98.12.pnbs: Flags [S], seq 221987538, win 65535, options [mss 1380,sackOK,TS val 4746350 ecr 0,nop,wscale 6], length 0
14:57:38.885786 IP 10.0.98.12.pnbs > 36.45.6.179.31282: Flags [S.], seq 4169543464, ack 221987539, win 32767, options [mss 1460,nop,wscale 0,sackOK,TS val 173685782 ecr 4746350], length 0
14:57:38.885815 IP 10.0.0.40.pnbs > 36.45.6.179.31282: Flags [S.], seq 4169543464, ack 221987539, win 32767, options [mss 1460,nop,wscale 0,sackOK,TS val 173685782 ecr 4746350], length 0
14:57:38.947539 IP 182.19.196.145.46986 > 10.0.0.40.pnbs: Flags [R], seq 677287958, win 0, length 0
14:57:38.947554 IP 182.19.196.145.46986 > 10.0.98.12.pnbs: Flags [R], seq 677287958, win 0, length 0
14:57:40.213808 IP 119.115.10.42.53127 > 10.0.0.40.pnbs: Flags [S], seq 4243006475, win 65535, options [mss 1440,sackOK,TS val 2558799 ecr 0,nop,wscale 7], length 0
14:57:40.213830 IP 119.115.10.42.53127 > 10.0.98.12.pnbs: Flags [S], seq 4243006475, win 65535, options [mss 1440,sackOK,TS val 2558799 ecr 0,nop,wscale 7], length 0
14:57:40.213992 IP 10.0.98.12.pnbs > 119.115.10.42.53127: Flags [S.], seq 210318171, ack 4243006476, win 32767, options [mss 1460,nop,wscale 0,sackOK,TS val 173685915 ecr 2558799], length 0
14:57:40.214001 IP 10.0.0.40.pnbs > 119.115.10.42.53127: Flags [S.], seq 210318171, ack 4243006476, win 32767, options [mss 1460,nop,wscale 0,sackOK,TS val 173685915 ecr 2558799], length 0
14:57:40.314304 IP 10.0.98.12.pnbs > 106.39.255.104.23447: Flags [FP.], seq 769817044:769818462, ack 1630542521, win 32767, options [nop,nop,TS val 173685925 ecr 8733572], length 1418
14:57:40.314322 IP 10.0.0.40.pnbs > 106.39.255.104.23447: Flags [FP.], seq 769817044:769818462, ack 1630542521, win 32767, options [nop,nop,TS val 173685925 ecr 8733572], length 1418
14:57:40.942429 IP 123.113.206.57.38501 > 10.0.0.40.27021: Flags [S], seq 233382076, win 8192, options [mss 1440,nop,wscale 8,nop,nop,sackOK], length 0
14:57:40.942446 IP 123.113.206.57.38501 > 10.0.98.12.27021: Flags [S], seq 233382076, win 8192, options [mss 1440,nop,wscale 8,nop,nop,sackOK], length 0
14:57:40.942608 IP 10.0.98.12.27021 > 123.113.206.57.38501: Flags [S.], seq 2121243353, ack 233382077, win 32767, options [mss 1460,nop,wscale 0,nop,nop,sackOK], length 0
14:57:40.942616 IP 10.0.0.40.27021 > 123.113.206.57.38501: Flags [S.], seq 2121243353, ack 233382077, win 32767, options [mss 1460,nop,wscale 0,nop,nop,sackOK], length 0
14:57:40.984322 IP 37.155.138.74.40270 > 10.0.0.40.pnbs: Flags [S], seq 996298036, win 14600, options [mss 1400,sackOK,TS val 1387217 ecr 0,nop,wscale 5], length 0
14:57:40.984346 IP 37.155.138.74.40270 > 10.0.98.12.pnbs: Flags [S], seq 996298036, win 14600, options [mss 1400,sackOK,TS val 1387217 ecr 0,nop,wscale 5], length 0
14:57:40.984511 IP 10.0.98.12.pnbs > 37.155.138.74.40270: Flags [S.], seq 2509231087, ack 996298037, win 32767, options [mss 1460,nop,wscale 0,sackOK,TS val 173685992 ecr 1387217], length 0
14:57:40.984528 IP 10.0.0.40.pnbs > 37.155.138.74.40270: Flags [S.], seq 2509231087, ack 996298037, win 32767, options [mss 1460,nop,wscale 0,sackOK,TS val 173685992 ecr 1387217], length 0
14:57:41.617274 IP 10.0.98.12.27021 > 110.52.236.208.jeol-nsdtp-2: Flags [R.], seq 1776615309, ack 3434143075, win 0, length 0
14:57:41.617292 IP 10.0.0.40.27021 > 110.52.236.208.jeol-nsdtp-2: Flags [R.], seq 1776615309, ack 3434143075, win 0, length 0
14:57:41.698531 IP 182.106.65.209.17781 > 10.0.0.40.pnbs: Flags [F.], seq 463772926, ack 3582825036, win 4096, options [nop,nop,TS val 199994794 ecr 173685418,nop,nop,sack 1 {150:1768}], length 0
14:57:41.698547 IP 182.106.65.209.17781 > 10.0.98.12.pnbs: Flags [F.], seq 463772926, ack 3582825036, win 4096, options [nop,nop,TS val 199994794 ecr 173685418,nop,nop,sack 1 {150:1768}], length 0
14:57:41.812242 IP 110.28.214.187.50533 > 10.0.0.40.pnbs: Flags [F.], seq 867196496, ack 465907462, win 4091, options [nop,nop,TS val 1067976243 ecr 173686038], length 0
14:57:41.812250 IP 110.28.214.187.50533 > 10.0.98.12.pnbs: Flags [F.], seq 867196496, ack 465907462, win 4091, options [nop,nop,TS val 1067976243 ecr 173686038], length 0
14:57:41.812575 IP 10.0.98.12.pnbs > 110.28.214.187.50533: Flags [F.], seq 1, ack 1, win 31484, options [nop,nop,TS val 173686075 ecr 1067976243], length 0
14:57:41.812583 IP 10.0.0.40.pnbs > 110.28.214.187.50533: Flags [F.], seq 1, ack 1, win 31484, options [nop,nop,TS val 173686075 ecr 1067976243], length 0
14:57:42.043419 IP 121.31.251.159.63476 > 10.0.0.40.pnbs: Flags [S], seq 1808707287, win 18980, options [mss 1412,sackOK,TS val 1895805 ecr 0,nop,wscale 6], length 0
14:57:42.043436 IP 121.31.251.159.63476 > 10.0.98.12.pnbs: Flags [S], seq 1808707287, win 18980, options [mss 1412,sackOK,TS val 1895805 ecr 0,nop,wscale 6], length 0
14:57:42.043608 IP 10.0.98.12.pnbs > 121.31.251.159.63476: Flags [S.], seq 2280101180, ack 1808707288, win 32767, options [mss 1460,nop,wscale 0,sackOK,TS val 173686098 ecr 1895805], length 0
14:57:42.043617 IP 10.0.0.40.pnbs > 121.31.251.159.63476: Flags [S.], seq 2280101180, ack 1808707288, win 32767, options [mss 1460,nop,wscale 0,sackOK,TS val 173686098 ecr 1895805], length 0
14:57:42.095279 IP 182.106.65.209.17781 > 10.0.0.40.pnbs: Flags [R], seq 463772927, win 0, length 0
14:57:42.095295 IP 182.106.65.209.17781 > 10.0.98.12.pnbs: Flags [R], seq 463772927, win 0, length 0
14:57:42.608394 IP 121.31.251.159.63476 > 10.0.0.40.pnbs: Flags [S], seq 1808707287, win 18980, options [mss 1412,sackOK,TS val 1895905 ecr 0,nop,wscale 6], length 0
14:57:42.608409 IP 121.31.251.159.63476 > 10.0.98.12.pnbs: Flags [S], seq 1808707287, win 18980, options [mss 1412,sackOK,TS val 1895905 ecr 0,nop,wscale 6], length 0
14:57:42.795380 IP 182.106.65.209.17825 > 10.0.0.40.27021: Flags [F.], seq 3135686328, ack 3359557418, win 4096, options [nop,nop,TS val 199995854 ecr 173685675], length 0
14:57:42.795395 IP 182.106.65.209.17825 > 10.0.98.12.27021: Flags [F.], seq 3135686328, ack 3359557418, win 4096, options [nop,nop,TS val 199995854 ecr 173685675], length 0
14:57:42.795814 IP 10.0.98.12.27021 > 182.106.65.209.17825: Flags [F.], seq 69, ack 1, win 32056, options [nop,nop,TS val 173686173 ecr 199995854], length 0
14:57:42.795823 IP 10.0.0.40.27021 > 182.106.65.209.17825: Flags [F.], seq 69, ack 1, win 32056, options [nop,nop,TS val 173686173 ecr 199995854], length 0
14:57:43.039072 IP 182.106.65.209.17825 > 10.0.0.40.27021: Flags [R], seq 3135686329, win 0, length 0
14:57:43.039088 IP 182.106.65.209.17825 > 10.0.98.12.27021: Flags [R], seq 3135686329, win 0, length 0
14:57:43.039253 IP 182.106.65.209.17825 > 10.0.0.40.27021: Flags [R], seq 3135686329, win 0, length 0
14:57:43.039269 IP 182.106.65.209.17825 > 10.0.98.12.27021: Flags [R], seq 3135686329, win 0, length 0
14:57:44.212888 IP 180.177.65.175.5345 > 10.0.0.40.27021: Flags [F.], seq 3541714991, ack 2075746229, win 16425, length 0
14:57:44.212896 IP 180.177.65.175.5345 > 10.0.98.12.27021: Flags [F.], seq 3541714991, ack 2075746229, win 16425, length 0
14:57:44.213172 IP 10.0.98.12.27021 > 180.177.65.175.5345: Flags [F.], seq 1, ack 1, win 32432, length 0
14:57:44.213181 IP 10.0.0.40.27021 > 180.177.65.175.5345: Flags [F.], seq 1, ack 1, win 32432, length 0
14:57:46.164856 IP 182.106.65.209.17837 > 10.0.0.40.27021: Flags [S], seq 1470264821, win 65535, options [mss 1440,nop,wscale 5,nop,nop,TS val 199999213 ecr 0,sackOK,eol], length 0
14:57:46.164875 IP 182.106.65.209.17837 > 10.0.98.12.27021: Flags [S], seq 1470264821, win 65535, options [mss 1440,nop,wscale 5,nop,nop,TS val 199999213 ecr 0,sackOK,eol], length 0
14:57:46.165040 IP 10.0.98.12.27021 > 182.106.65.209.17837: Flags [S.], seq 4052015335, ack 1470264822, win 32767, options [mss 1460,nop,wscale 0,sackOK,TS val 173686510 ecr 199999213], length 0
14:57:46.165049 IP 10.0.0.40.27021 > 182.106.65.209.17837: Flags [S.], seq 4052015335, ack 1470264822, win 32767, options [mss 1460,nop,wscale 0,sackOK,TS val 173686510 ecr 199999213], length 0
14:57:46.268273 IP 36.149.166.247.tsb2 > 10.0.0.40.pnbs: Flags [F.], seq 3722898579, ack 3478975494, win 1286, options [nop,nop,TS val 18878013 ecr 173686439], length 0
14:57:46.268290 IP 36.149.166.247.tsb2 > 10.0.98.12.pnbs: Flags [F.], seq 3722898579, ack 3478975494, win 1286, options [nop,nop,TS val 18878013 ecr 173686439], length 0
14:57:46.268685 IP 10.0.98.12.pnbs > 36.149.166.247.tsb2: Flags [F.], seq 90, ack 1, win 32054, options [nop,nop,TS val 173686521 ecr 18878013], length 0
14:57:46.268693 IP 10.0.0.40.pnbs > 36.149.166.247.tsb2: Flags [F.], seq 90, ack 1, win 32054, options [nop,nop,TS val 173686521 ecr 18878013], length 0
14:57:46.278538 IP 36.149.166.247.tsb2 > 10.0.0.40.pnbs: Flags [R], seq 3722898579, win 0, length 0
14:57:46.374082 IP 36.149.166.247.tsb2 > 10.0.0.40.pnbs: Flags [R], seq 3722898580, win 0, length 0
14:57:46.374090 IP 36.149.166.247.tsb2 > 10.0.98.12.pnbs: Flags [R], seq 3722898580, win 0, length 0
14:57:46.374403 IP 36.149.166.247.tsb2 > 10.0.0.40.pnbs: Flags [R], seq 3722898580, win 0, length 0
14:57:46.374413 IP 36.149.166.247.tsb2 > 10.0.98.12.pnbs: Flags [R], seq 3722898580, win 0, length 0
14:57:48.208045 IP 1.202.243.141.54434 > 10.0.0.40.pnbs: Flags [F.], seq 3528599939, ack 3755991765, win 1525, options [nop,nop,TS val 14446820 ecr 173686684], length 0
14:57:48.208055 IP 1.202.243.141.54434 > 10.0.98.12.pnbs: Flags [F.], seq 3528599939, ack 3755991765, win 1525, options [nop,nop,TS val 14446820 ecr 173686684], length 0
14:57:48.208363 IP 10.0.98.12.pnbs > 1.202.243.141.54434: Flags [F.], seq 1, ack 1, win 32055, options [nop,nop,TS val 173686715 ecr 14446820], length 0
14:57:48.208374 IP 10.0.0.40.pnbs > 1.202.243.141.54434: Flags [F.], seq 1, ack 1, win 32055, options [nop,nop,TS val 173686715 ecr 14446820], length 0
14:57:48.745120 IP 60.248.53.97.63410 > 10.0.0.40.27021: Flags [S], seq 3182568399, win 8192, options [mss 1360,nop,wscale 2,nop,nop,sackOK], length 0
14:57:48.745152 IP 60.248.53.97.63410 > 10.0.98.12.27021: Flags [S], seq 3182568399, win 8192, options [mss 1360,nop,wscale 2,nop,nop,sackOK], length 0
14:57:48.745324 IP 10.0.98.12.27021 > 60.248.53.97.63410: Flags [S.], seq 3395523998, ack 3182568400, win 32767, options [mss 1460,nop,wscale 0,nop,nop,sackOK], length 0
14:57:48.745333 IP 10.0.0.40.27021 > 60.248.53.97.63410: Flags [S.], seq 3395523998, ack 3182568400, win 32767, options [mss 1460,nop,wscale 0,nop,nop,sackOK], length 0
14:57:49.631206 IP 110.169.179.193.52207 > 10.0.0.40.pnbs: Flags [S], seq 3732684507, win 65535, options [mss 1460,nop,wscale 5,nop,nop,TS val 1432020934 ecr 0,sackOK,eol], length 0
14:57:49.631244 IP 110.169.179.193.52207 > 10.0.98.12.pnbs: Flags [S], seq 3732684507, win 65535, options [mss 1460,nop,wscale 5,nop,nop,TS val 1432020934 ecr 0,sackOK,eol], length 0
14:57:49.631426 IP 10.0.98.12.pnbs > 110.169.179.193.52207: Flags [S.], seq 1481633030, ack 3732684508, win 32767, options [mss 1460,nop,wscale 0,sackOK,TS val 173686857 ecr 1432020934], length 0
14:57:49.631434 IP 10.0.0.40.pnbs > 110.169.179.193.52207: Flags [S.], seq 1481633030, ack 3732684508, win 32767, options [mss 1460,nop,wscale 0,sackOK,TS val 173686857 ecr 1432020934], length 0
14:57:49.848114 IP 1.202.243.141.54435 > 10.0.0.40.pnbs: Flags [S], seq 448945537, win 65535, options [mss 1440,sackOK,TS val 14446984 ecr 0,nop,wscale 8], length 0
14:57:49.848137 IP 1.202.243.141.54435 > 10.0.98.12.pnbs: Flags [S], seq 448945537, win 65535, options [mss 1440,sackOK,TS val 14446984 ecr 0,nop,wscale 8], length 0
14:57:49.848314 IP 10.0.98.12.pnbs > 1.202.243.141.54435: Flags [S.], seq 1208607453, ack 448945538, win 32767, options [mss 1460,nop,wscale 0,sackOK,TS val 173686878 ecr 14446984], length 0
14:57:49.848332 IP 10.0.0.40.pnbs > 1.202.243.141.54435: Flags [S.], seq 1208607453, ack 448945538, win 32767, options [mss 1460,nop,wscale 0,sackOK,TS val 173686878 ecr 14446984], length 0
14:57:50.211197 IP 10.0.98.12.27021 > 113.13.67.35.12721: Flags [R.], seq 3088790887, ack 1643922007, win 0, length 0
14:57:50.211207 IP 10.0.0.40.27021 > 113.13.67.35.12721: Flags [R.], seq 3088790887, ack 1643922007, win 0, length 0
14:57:50.614003 IP 117.136.23.87.60320 > 10.0.0.40.27021: Flags [S], seq 3564450809, win 65535, options [mss 1400,nop,wscale 5,nop,nop,TS val 189973037 ecr 0,sackOK,eol], length 0
14:57:50.614023 IP 117.136.23.87.60320 > 10.0.98.12.27021: Flags [S], seq 3564450809, win 65535, options [mss 1400,nop,wscale 5,nop,nop,TS val 189973037 ecr 0,sackOK,eol], length 0
14:57:50.614182 IP 10.0.98.12.27021 > 117.136.23.87.60320: Flags [S.], seq 876568700, ack 3564450810, win 32767, options [mss 1460,nop,wscale 0,sackOK,TS val 173686955 ecr 189973037], length 0
14:57:50.614190 IP 10.0.0.40.27021 > 117.136.23.87.60320: Flags [S.], seq 876568700, ack 3564450810, win 32767, options [mss 1460,nop,wscale 0,sackOK,TS val 173686955 ecr 189973037], length 0
14:57:50.809677 IP 121.46.18.41.64024 > 10.0.0.40.27021: Flags [F.], seq 1603290894, ack 2870707600, win 17529, length 0
14:57:50.809687 IP 121.46.18.41.64024 > 10.0.98.12.27021: Flags [F.], seq 1603290894, ack 2870707600, win 17529, length 0
14:57:50.809999 IP 10.0.98.12.27021 > 121.46.18.41.64024: Flags [F.], seq 1, ack 1, win 31583, length 0
14:57:50.810007 IP 10.0.0.40.27021 > 121.46.18.41.64024: Flags [F.], seq 1, ack 1, win 31583, length 0
14:57:51.106656 IP 39.7.14.93.63260 > 10.0.0.40.pnbs: Flags [R.], seq 3242243932, ack 11526402, win 12290, options [nop,nop,TS val 0 ecr 173686982], length 0
14:57:51.106675 IP 39.7.14.93.63260 > 10.0.98.12.pnbs: Flags [R.], seq 3242243932, ack 11526402, win 12290, options [nop,nop,TS val 0 ecr 173686982], length 0
14:57:51.239868 IP 113.185.42.108.25036 > 10.0.0.40.27022: Flags [F.], seq 597, ack 10662, win 4096, options [nop,nop,TS val 1170961318 ecr 173686818], length 0
14:57:51.239877 IP 113.185.42.108.25036 > 10.0.98.12.27022: Flags [F.], seq 597, ack 10662, win 4096, options [nop,nop,TS val 1170961318 ecr 173686818], length 0
14:57:51.280645 IP 10.0.98.12.27022 > 113.185.42.108.25036: Flags [F.], seq 10730, ack 598, win 32171, options [nop,nop,TS val 173687022 ecr 1170961317], length 0
14:57:51.280654 IP 10.0.0.40.27022 > 113.185.42.108.25036: Flags [F.], seq 10730, ack 598, win 32171, options [nop,nop,TS val 173687022 ecr 1170961317], length 0
14:57:51.357590 IP 175.167.146.125.32058 > 10.0.0.40.27021: Flags [S], seq 1535067083, win 65535, options [mss 1260,sackOK,TS val 12365624 ecr 0,nop,wscale 8], length 0
14:57:51.357608 IP 175.167.146.125.32058 > 10.0.98.12.27021: Flags [S], seq 1535067083, win 65535, options [mss 1260,sackOK,TS val 12365624 ecr 0,nop,wscale 8], length 0
14:57:51.357763 IP 10.0.98.12.27021 > 175.167.146.125.32058: Flags [S.], seq 3055814226, ack 1535067084, win 32767, options [mss 1460,nop,wscale 0,sackOK,TS val 173687029 ecr 12365624], length 0
14:57:51.357772 IP 10.0.0.40.27021 > 175.167.146.125.32058: Flags [S.], seq 3055814226, ack 1535067084, win 32767, options [mss 1460,nop,wscale 0,sackOK,TS val 173687029 ecr 12365624], length 0
14:57:51.439425 IP 113.185.42.108.25036 > 10.0.0.40.27022: Flags [R], seq 1462175388, win 0, length 0
14:57:51.439437 IP 113.185.42.108.25036 > 10.0.98.12.27022: Flags [R], seq 1462175388, win 0, length 0
14:57:51.439454 IP 113.185.42.108.25036 > 10.0.0.40.27022: Flags [R], seq 1462175388, win 0, length 0
14:57:51.439457 IP 113.185.42.108.25036 > 10.0.98.12.27022: Flags [R], seq 1462175388, win 0, length 0
14:57:52.228521 IP 123.119.188.230.61872 > 10.0.0.40.27022: Flags [F.], seq 848127643, ack 1876107214, win 4096, options [nop,nop,TS val 888058094 ecr 173687022], length 0
14:57:52.228530 IP 123.119.188.230.61872 > 10.0.98.12.27022: Flags [F.], seq 848127643, ack 1876107214, win 4096, options [nop,nop,TS val 888058094 ecr 173687022], length 0
14:57:52.228944 IP 10.0.98.12.27022 > 123.119.188.230.61872: Flags [F.], seq 69, ack 1, win 32174, options [nop,nop,TS val 173687117 ecr 888058094], length 0
14:57:52.228952 IP 10.0.0.40.27022 > 123.119.188.230.61872: Flags [F.], seq 69, ack 1, win 32174, options [nop,nop,TS val 173687117 ecr 888058094], length 0
14:57:52.343103 IP 123.119.188.230.61872 > 10.0.0.40.27022: Flags [R], seq 848127644, win 0, length 0
14:57:52.343111 IP 123.119.188.230.61872 > 10.0.98.12.27022: Flags [R], seq 848127644, win 0, length 0
14:57:52.343112 IP 123.119.188.230.61872 > 10.0.0.40.27022: Flags [R], seq 848127644, win 0, length 0
14:57:52.343114 IP 123.119.188.230.61872 > 10.0.98.12.27022: Flags [R], seq 848127644, win 0, length 0
14:57:52.762593 IP 2.37.153.113.57640 > 10.0.0.40.27021: Flags [S], seq 725926535, win 8192, options [mss 1452,nop,wscale 8,nop,nop,sackOK], length 0
14:57:52.762630 IP 2.37.153.113.57640 > 10.0.98.12.27021: Flags [S], seq 725926535, win 8192, options [mss 1452,nop,wscale 8,nop,nop,sackOK], length 0
14:57:52.762817 IP 10.0.98.12.27021 > 2.37.153.113.57640: Flags [S.], seq 1241223785, ack 725926536, win 32767, options [mss 1460,nop,wscale 0,nop,nop,sackOK], length 0
14:57:52.762849 IP 10.0.0.40.27021 > 2.37.153.113.57640: Flags [S.], seq 1241223785, ack 725926536, win 32767, options [mss 1460,nop,wscale 0,nop,nop,sackOK], length 0
14:57:53.395817 IP 120.209.176.205.sep > 10.0.0.40.27022: Flags [F.], seq 4081823090, ack 785693826, win 389, options [nop,nop,TS val 26978342 ecr 173687117], length 0
14:57:53.395835 IP 120.209.176.205.sep > 10.0.98.12.27022: Flags [F.], seq 4081823090, ack 785693826, win 389, options [nop,nop,TS val 26978342 ecr 173687117], length 0
14:57:53.396143 IP 10.0.98.12.27022 > 120.209.176.205.sep: Flags [FP.], seq 69:137, ack 1, win 32097, options [nop,nop,TS val 173687233 ecr 26978342], length 68
14:57:53.396152 IP 10.0.0.40.27022 > 120.209.176.205.sep: Flags [FP.], seq 69:137, ack 1, win 32097, options [nop,nop,TS val 173687233 ecr 26978342], length 68
14:57:53.402770 IP 120.209.176.205.sep > 10.0.0.40.27022: Flags [R], seq 4081822956, win 0, length 0
14:57:53.510332 IP 120.209.176.205.sep > 10.0.0.40.27022: Flags [R], seq 4081823091, win 0, length 0
14:57:53.510341 IP 120.209.176.205.sep > 10.0.98.12.27022: Flags [R], seq 4081823091, win 0, length 0
14:57:53.510435 IP 120.209.176.205.sep > 10.0.0.40.27022: Flags [R], seq 4081823091, win 0, length 0
14:57:53.510441 IP 120.209.176.205.sep > 10.0.98.12.27022: Flags [R], seq 4081823091, win 0, length 0
14:57:53.914206 IP 10.0.98.12.pnbs > 106.39.255.104.23447: Flags [FP.], seq 0:1418, ack 1, win 32767, options [nop,nop,TS val 173687285 ecr 8733572], length 1418
14:57:53.914224 IP 10.0.0.40.pnbs > 106.39.255.104.23447: Flags [FP.], seq 0:1418, ack 1, win 32767, options [nop,nop,TS val 173687285 ecr 8733572], length 1418
14:57:54.702467 IP 1.200.193.74.34158 > 10.0.0.40.pnbs: Flags [F.], seq 4082831885, ack 813476924, win 10220, options [nop,nop,TS val 747170 ecr 173687338], length 0
14:57:54.702486 IP 1.200.193.74.34158 > 10.0.98.12.pnbs: Flags [F.], seq 4082831885, ack 813476924, win 10220, options [nop,nop,TS val 747170 ecr 173687338], length 0
14:57:54.702812 IP 10.0.98.12.pnbs > 1.200.193.74.34158: Flags [F.], seq 1, ack 1, win 31762, options [nop,nop,TS val 173687364 ecr 747170], length 0
14:57:54.702828 IP 10.0.0.40.pnbs > 1.200.193.74.34158: Flags [F.], seq 1, ack 1, win 31762, options [nop,nop,TS val 173687364 ecr 747170], length 0
14:57:56.495004 IP 124.49.107.107.56892 > 10.0.0.40.pnbs: Flags [F.], seq 11161030, ack 2892691385, win 2519, options [nop,nop,TS val 11328965 ecr 173687511], length 0
14:57:56.495023 IP 124.49.107.107.56892 > 10.0.98.12.pnbs: Flags [F.], seq 11161030, ack 2892691385, win 2519, options [nop,nop,TS val 11328965 ecr 173687511], length 0
14:57:56.495408 IP 10.0.98.12.pnbs > 124.49.107.107.56892: Flags [FP.], seq 150:497, ack 1, win 32159, options [nop,nop,TS val 173687543 ecr 11328965], length 347
14:57:56.495419 IP 10.0.0.40.pnbs > 124.49.107.107.56892: Flags [FP.], seq 150:497, ack 1, win 32159, options [nop,nop,TS val 173687543 ecr 11328965], length 347
14:57:56.496021 IP 124.49.107.107.56892 > 10.0.0.40.pnbs: Flags [R], seq 11161030, win 0, length 0
14:57:56.614321 IP 124.49.107.107.56892 > 10.0.0.40.pnbs: Flags [R], seq 11161031, win 0, length 0
14:57:56.614328 IP 124.49.107.107.56892 > 10.0.98.12.pnbs: Flags [R], seq 11161031, win 0, length 0
14:57:56.614457 IP 124.49.107.107.56892 > 10.0.0.40.pnbs: Flags [R], seq 11161031, win 0, length 0
14:57:56.614464 IP 124.49.107.107.56892 > 10.0.98.12.pnbs: Flags [R], seq 11161031, win 0, length 0
14:57:56.935195 IP 27.246.139.197.50048 > 10.0.0.40.pnbs: Flags [S], seq 1165742299, win 65535, options [mss 1410,nop,wscale 5,nop,nop,TS val 837658636 ecr 0,sackOK,eol], length 0
14:57:56.935209 IP 27.246.139.197.50048 > 10.0.98.12.pnbs: Flags [S], seq 1165742299, win 65535, options [mss 1410,nop,wscale 5,nop,nop,TS val 837658636 ecr 0,sackOK,eol], length 0
14:57:56.935361 IP 10.0.98.12.pnbs > 27.246.139.197.50048: Flags [S.], seq 756198804, ack 1165742300, win 32767, options [mss 1460,nop,wscale 0,sackOK,TS val 173687587 ecr 837658636], length 0
14:57:56.935368 IP 10.0.0.40.pnbs > 27.246.139.197.50048: Flags [S.], seq 756198804, ack 1165742300, win 32767, options [mss 1460,nop,wscale 0,sackOK,TS val 173687587 ecr 837658636], length 0
14:57:57.872510 IP 106.241.31.236.51799 > 10.0.0.40.pnbs: Flags [R.], seq 1845535435, ack 3676463728, win 0, length 0
14:57:57.872516 IP 106.241.31.236.51799 > 10.0.98.12.pnbs: Flags [R.], seq 1845535435, ack 3676463728, win 0, length 0
14:57:58.879747 IP 124.49.107.107.56894 > 10.0.0.40.pnbs: Flags [S], seq 2180244241, win 65535, options [mss 1460,sackOK,TS val 11329203 ecr 0,nop,wscale 8], length 0
14:57:58.879761 IP 124.49.107.107.56894 > 10.0.98.12.pnbs: Flags [S], seq 2180244241, win 65535, options [mss 1460,sackOK,TS val 11329203 ecr 0,nop,wscale 8], length 0
14:57:58.879935 IP 10.0.98.12.pnbs > 124.49.107.107.56894: Flags [S.], seq 1124403224, ack 2180244242, win 32767, options [mss 1460,nop,wscale 0,sackOK,TS val 173687782 ecr 11329203], length 0
14:57:58.879939 IP 10.0.0.40.pnbs > 124.49.107.107.56894: Flags [S.], seq 1124403224, ack 2180244242, win 32767, options [mss 1460,nop,wscale 0,sackOK,TS val 173687782 ecr 11329203], length 0
14:57:59.012913 IP 93.140.37.93.58198 > 10.0.0.40.pnbs: Flags [F.], seq 1435912385, ack 968935203, win 7167, options [nop,nop,TS val 796308 ecr 173687729], length 0
14:57:59.012919 IP 93.140.37.93.58198 > 10.0.98.12.pnbs: Flags [F.], seq 1435912385, ack 968935203, win 7167, options [nop,nop,TS val 796308 ecr 173687729], length 0
14:57:59.013298 IP 10.0.98.12.pnbs > 93.140.37.93.58198: Flags [F.], seq 1, ack 1, win 32056, options [nop,nop,TS val 173687795 ecr 796308], length 0
14:57:59.013302 IP 10.0.0.40.pnbs > 93.140.37.93.58198: Flags [F.], seq 1, ack 1, win 32056, options [nop,nop,TS val 173687795 ecr 796308], length 0
14:58:00.143685 IP 180.204.6.149.l3t-at-an > 10.0.0.40.pnbs: Flags [S], seq 2619542873, win 65535, options [mss 1460,sackOK,TS val 11011563 ecr 0,nop,wscale 6], length 0
14:58:00.143699 IP 180.204.6.149.l3t-at-an > 10.0.98.12.pnbs: Flags [S], seq 2619542873, win 65535, options [mss 1460,sackOK,TS val 11011563 ecr 0,nop,wscale 6], length 0
14:58:00.143873 IP 10.0.98.12.pnbs > 180.204.6.149.l3t-at-an: Flags [S.], seq 154330033, ack 2619542874, win 32767, options [mss 1460,nop,wscale 0,sackOK,TS val 173687908 ecr 11011563], length 0
14:58:00.143879 IP 10.0.0.40.pnbs > 180.204.6.149.l3t-at-an: Flags [S.], seq 154330033, ack 2619542874, win 32767, options [mss 1460,nop,wscale 0,sackOK,TS val 173687908 ecr 11011563], length 0
14:58:00.197872 IP 175.167.146.125.32058 > 10.0.0.40.27021: Flags [F.], seq 596, ack 18672, win 514, options [nop,nop,TS val 12366507 ecr 173687856], length 0
14:58:00.197877 IP 175.167.146.125.32058 > 10.0.98.12.27021: Flags [F.], seq 596, ack 18672, win 514, options [nop,nop,TS val 12366507 ecr 173687856], length 0
14:58:00.198283 IP 10.0.98.12.27021 > 175.167.146.125.32058: Flags [F.], seq 19017, ack 597, win 32172, options [nop,nop,TS val 173687913 ecr 12366507], length 0
14:58:00.198287 IP 10.0.0.40.27021 > 175.167.146.125.32058: Flags [F.], seq 19017, ack 597, win 32172, options [nop,nop,TS val 173687913 ecr 12366507], length 0
14:58:00.352730 IP 175.167.146.125.32058 > 10.0.0.40.27021: Flags [R], seq 1535067545, win 0, length 0
14:58:00.417961 IP 175.167.146.125.32058 > 10.0.0.40.27021: Flags [R], seq 1535067680, win 0, length 0
14:58:00.417966 IP 175.167.146.125.32058 > 10.0.98.12.27021: Flags [R], seq 1535067680, win 0, length 0
14:58:00.417967 IP 175.167.146.125.32058 > 10.0.0.40.27021: Flags [R], seq 1535067680, win 0, length 0
14:58:00.417968 IP 175.167.146.125.32058 > 10.0.98.12.27021: Flags [R], seq 1535067680, win 0, length 0
14:58:01.387704 IP 60.248.53.97.63410 > 10.0.0.40.27021: Flags [F.], seq 395, ack 22686, win 16459, length 0
14:58:01.387711 IP 60.248.53.97.63410 > 10.0.98.12.27021: Flags [F.], seq 395, ack 22686, win 16459, length 0
14:58:01.388015 IP 10.0.98.12.27021 > 60.248.53.97.63410: Flags [F.], seq 22686, ack 396, win 32373, length 0
14:58:01.388019 IP 10.0.0.40.27021 > 60.248.53.97.63410: Flags [F.], seq 22686, ack 396, win 32373, length 0
14:58:02.561688 IP 175.174.118.15.50799 > 10.0.0.40.pnbs: Flags [S], seq 3905929491, win 65535, options [mss 1440,nop,wscale 5,nop,nop,TS val 1003252584 ecr 0,sackOK,eol], length 0
14:58:02.561705 IP 175.174.118.15.50799 > 10.0.98.12.pnbs: Flags [S], seq 3905929491, win 65535, options [mss 1440,nop,wscale 5,nop,nop,TS val 1003252584 ecr 0,sackOK,eol], length 0
14:58:02.561894 IP 10.0.98.12.pnbs > 175.174.118.15.50799: Flags [S.], seq 6791098, ack 3905929492, win 32767, options [mss 1460,nop,wscale 0,sackOK,TS val 173688150 ecr 1003252584], length 0
14:58:02.561900 IP 10.0.0.40.pnbs > 175.174.118.15.50799: Flags [S.], seq 6791098, ack 3905929492, win 32767, options [mss 1460,nop,wscale 0,sackOK,TS val 173688150 ecr 1003252584], length 0
14:58:02.926788 IP 121.31.251.159.8679 > 10.0.0.40.27021: Flags [S], seq 87069435, win 18980, options [mss 1412,sackOK,TS val 1897936 ecr 0,nop,wscale 6], length 0
14:58:02.926804 IP 121.31.251.159.8679 > 10.0.98.12.27021: Flags [S], seq 87069435, win 18980, options [mss 1412,sackOK,TS val 1897936 ecr 0,nop,wscale 6], length 0
14:58:02.926981 IP 10.0.98.12.27021 > 121.31.251.159.8679: Flags [S.], seq 2994638325, ack 87069436, win 32767, options [mss 1460,nop,wscale 0,sackOK,TS val 173688186 ecr 1897936], length 0
14:58:02.926988 IP 10.0.0.40.27021 > 121.31.251.159.8679: Flags [S.], seq 2994638325, ack 87069436, win 32767, options [mss 1460,nop,wscale 0,sackOK,TS val 173688186 ecr 1897936], length 0
14:58:04.920204 IP 180.176.155.199.57779 > 10.0.0.40.pnbs: Flags [F.], seq 1248378986, ack 1894363323, win 6133, options [nop,nop,TS val 15128954 ecr 173688364], length 0
14:58:04.920210 IP 180.176.155.199.57779 > 10.0.98.12.pnbs: Flags [F.], seq 1248378986, ack 1894363323, win 6133, options [nop,nop,TS val 15128954 ecr 173688364], length 0
14:58:04.920658 IP 10.0.98.12.pnbs > 180.176.155.199.57779: Flags [F.], seq 1, ack 1, win 32137, options [nop,nop,TS val 173688386 ecr 15128954], length 0
14:58:04.920662 IP 10.0.0.40.pnbs > 180.176.155.199.57779: Flags [F.], seq 1, ack 1, win 32137, options [nop,nop,TS val 173688386 ecr 15128954], length 0
14:58:06.206448 IP 175.111.59.43.63547 > 10.0.0.40.27021: Flags [S], seq 2518618975, win 65535, options [mss 1460,nop,wscale 5,nop,nop,TS val 670702684 ecr 0,sackOK,eol], length 0
14:58:06.206463 IP 175.111.59.43.63547 > 10.0.98.12.27021: Flags [S], seq 2518618975, win 65535, options [mss 1460,nop,wscale 5,nop,nop,TS val 670702684 ecr 0,sackOK,eol], length 0
14:58:06.206622 IP 10.0.98.12.27021 > 175.111.59.43.63547: Flags [S.], seq 348615143, ack 2518618976, win 32767, options [mss 1460,nop,wscale 0,sackOK,TS val 173688514 ecr 670702684], length 0
14:58:06.206630 IP 10.0.0.40.27021 > 175.111.59.43.63547: Flags [S.], seq 348615143, ack 2518618976, win 32767, options [mss 1460,nop,wscale 0,sackOK,TS val 173688514 ecr 670702684], length 0
14:58:07.586064 IP 180.176.155.199.57782 > 10.0.0.40.pnbs: Flags [S], seq 3264760263, win 65535, options [mss 1460,sackOK,TS val 15129221 ecr 0,nop,wscale 7], length 0
14:58:07.586079 IP 180.176.155.199.57782 > 10.0.98.12.pnbs: Flags [S], seq 3264760263, win 65535, options [mss 1460,sackOK,TS val 15129221 ecr 0,nop,wscale 7], length 0
14:58:07.586251 IP 10.0.98.12.pnbs > 180.176.155.199.57782: Flags [S.], seq 2496922733, ack 3264760264, win 32767, options [mss 1460,nop,wscale 0,sackOK,TS val 173688652 ecr 15129221], length 0
14:58:07.586255 IP 10.0.0.40.pnbs > 180.176.155.199.57782: Flags [S.], seq 2496922733, ack 3264760264, win 32767, options [mss 1460,nop,wscale 0,sackOK,TS val 173688652 ecr 15129221], length 0
14:58:07.860475 IP 120.8.182.121.49366 > 10.0.0.40.pnbs: Flags [S], seq 21082430, win 13600, options [mss 1300,sackOK,nop,nop,nop,nop,nop,nop,nop,nop,nop,nop,nop,wscale 7], length 0
14:58:07.860490 IP 120.8.182.121.49366 > 10.0.98.12.pnbs: Flags [S], seq 21082430, win 13600, options [mss 1300,sackOK,nop,nop,nop,nop,nop,nop,nop,nop,nop,nop,nop,wscale 7], length 0
14:58:07.860655 IP 10.0.98.12.pnbs > 120.8.182.121.49366: Flags [S.], seq 1649943590, ack 21082431, win 32767, options [mss 1460,nop,wscale 0,nop,nop,sackOK], length 0
14:58:07.860660 IP 10.0.0.40.pnbs > 120.8.182.121.49366: Flags [S.], seq 1649943590, ack 21082431, win 32767, options [mss 1460,nop,wscale 0,nop,nop,sackOK], length 0
14:58:08.002342 IP 59.63.182.13.27865 > 10.0.0.40.pnbs: Flags [S], seq 3663441067, win 8192, options [mss 1440,nop,wscale 2,nop,nop,sackOK], length 0
14:58:08.002361 IP 59.63.182.13.27865 > 10.0.98.12.pnbs: Flags [S], seq 3663441067, win 8192, options [mss 1440,nop,wscale 2,nop,nop,sackOK], length 0
14:58:08.002533 IP 10.0.98.12.pnbs > 59.63.182.13.27865: Flags [S.], seq 527771501, ack 3663441068, win 32767, options [mss 1460,nop,wscale 0,nop,nop,sackOK], length 0
14:58:08.002539 IP 10.0.0.40.pnbs > 59.63.182.13.27865: Flags [S.], seq 527771501, ack 3663441068, win 32767, options [mss 1460,nop,wscale 0,nop,nop,sackOK], length 0
14:58:09.029246 IP 119.4.174.92.9699 > 10.0.0.40.pnbs: Flags [F.], seq 2457780920, ack 500915226, win 8171, options [nop,nop,TS val 2312453 ecr 173688766], length 0
14:58:09.029252 IP 119.4.174.92.9699 > 10.0.98.12.pnbs: Flags [F.], seq 2457780920, ack 500915226, win 8171, options [nop,nop,TS val 2312453 ecr 173688766], length 0
14:58:09.029736 IP 10.0.98.12.pnbs > 119.4.174.92.9699: Flags [F.], seq 350, ack 1, win 32055, options [nop,nop,TS val 173688797 ecr 2312453], length 0
14:58:09.029745 IP 10.0.0.40.pnbs > 119.4.174.92.9699: Flags [F.], seq 350, ack 1, win 32055, options [nop,nop,TS val 173688797 ecr 2312453], length 0
14:58:09.201990 IP 119.4.174.92.9699 > 10.0.0.40.pnbs: Flags [R], seq 2457780920, win 0, length 0
14:58:09.234470 IP 119.4.174.92.9699 > 10.0.0.40.pnbs: Flags [R], seq 2457780921, win 0, length 0
14:58:09.234475 IP 119.4.174.92.9699 > 10.0.98.12.pnbs: Flags [R], seq 2457780921, win 0, length 0
14:58:09.234477 IP 119.4.174.92.9699 > 10.0.0.40.pnbs: Flags [R], seq 2457780921, win 0, length 0
14:58:09.234478 IP 119.4.174.92.9699 > 10.0.98.12.pnbs: Flags [R], seq 2457780921, win 0, length 0
14:58:10.042016 IP 113.52.80.46.9879 > 10.0.0.40.pnbs: Flags [S], seq 3529930514, win 65535, options [mss 1400,sackOK,TS val 36391424 ecr 0,nop,wscale 6], length 0
14:58:10.042032 IP 113.52.80.46.9879 > 10.0.98.12.pnbs: Flags [S], seq 3529930514, win 65535, options [mss 1400,sackOK,TS val 36391424 ecr 0,nop,wscale 6], length 0
14:58:10.042194 IP 10.0.98.12.pnbs > 113.52.80.46.9879: Flags [S.], seq 1077605112, ack 3529930515, win 32767, options [mss 1460,nop,wscale 0,sackOK,TS val 173688898 ecr 36391424], length 0
14:58:10.042200 IP 10.0.0.40.pnbs > 113.52.80.46.9879: Flags [S.], seq 1077605112, ack 3529930515, win 32767, options [mss 1460,nop,wscale 0,sackOK,TS val 173688898 ecr 36391424], length 0
14:58:11.415146 IP 183.134.69.173.13507 > 10.0.0.40.pnbs: Flags [S], seq 1730213001, win 65535, options [mss 1448,nop,wscale 6,sackOK,TS val 1212680697 ecr 0], length 0
14:58:11.415161 IP 183.134.69.173.13507 > 10.0.98.12.pnbs: Flags [S], seq 1730213001, win 65535, options [mss 1448,nop,wscale 6,sackOK,TS val 1212680697 ecr 0], length 0
14:58:11.415319 IP 10.0.98.12.pnbs > 183.134.69.173.13507: Flags [S.], seq 65892614, ack 1730213002, win 32767, options [mss 1460,nop,wscale 0,sackOK,TS val 173689035 ecr 1212680697], length 0
14:58:11.415324 IP 10.0.0.40.pnbs > 183.134.69.173.13507: Flags [S.], seq 65892614, ack 1730213002, win 32767, options [mss 1460,nop,wscale 0,sackOK,TS val 173689035 ecr 1212680697], length 0
14:58:11.936904 IP 223.104.5.206.28582 > 10.0.0.40.pnbs: Flags [S], seq 3764978617, win 14600, options [mss 1400,sackOK,TS val 2508914 ecr 0,nop,wscale 6], length 0
14:58:11.936918 IP 223.104.5.206.28582 > 10.0.98.12.pnbs: Flags [S], seq 3764978617, win 14600, options [mss 1400,sackOK,TS val 2508914 ecr 0,nop,wscale 6], length 0
14:58:11.937110 IP 10.0.98.12.pnbs > 223.104.5.206.28582: Flags [S.], seq 1475017712, ack 3764978618, win 32767, options [mss 1460,nop,wscale 0,sackOK,TS val 173689087 ecr 2508914], length 0
14:58:11.937116 IP 10.0.0.40.pnbs > 223.104.5.206.28582: Flags [S.], seq 1475017712, ack 3764978618, win 32767, options [mss 1460,nop,wscale 0,sackOK,TS val 173689087 ecr 2508914], length 0
14:58:12.170388 IP 113.185.55.113.4723 > 10.0.0.40.pnbs: Flags [S], seq 2676672258, win 65535, options [mss 1340,sackOK,TS val 7042312 ecr 0,nop,wscale 8], length 0
14:58:12.170403 IP 113.185.55.113.4723 > 10.0.98.12.pnbs: Flags [S], seq 2676672258, win 65535, options [mss 1340,sackOK,TS val 7042312 ecr 0,nop,wscale 8], length 0
14:58:12.170560 IP 10.0.98.12.pnbs > 113.185.55.113.4723: Flags [S.], seq 2014324922, ack 2676672259, win 32767, options [mss 1460,nop,wscale 0,sackOK,TS val 173689111 ecr 7042312], length 0
14:58:12.170566 IP 10.0.0.40.pnbs > 113.185.55.113.4723: Flags [S.], seq 2014324922, ack 2676672259, win 32767, options [mss 1460,nop,wscale 0,sackOK,TS val 173689111 ecr 7042312], length 0
14:58:12.826359 IP 110.16.10.103.34520 > 10.0.0.40.pnbs: Flags [S], seq 779401307, win 13600, options [mss 1360,sackOK,TS val 44801731 ecr 0,nop,wscale 6], length 0
14:58:12.826374 IP 110.16.10.103.34520 > 10.0.98.12.pnbs: Flags [S], seq 779401307, win 13600, options [mss 1360,sackOK,TS val 44801731 ecr 0,nop,wscale 6], length 0
14:58:12.826535 IP 10.0.98.12.pnbs > 110.16.10.103.34520: Flags [S.], seq 1932687674, ack 779401308, win 32767, options [mss 1460,nop,wscale 0,sackOK,TS val 173689176 ecr 44801731], length 0
14:58:12.826540 IP 10.0.0.40.pnbs > 110.16.10.103.34520: Flags [S.], seq 1932687674, ack 779401308, win 32767, options [mss 1460,nop,wscale 0,sackOK,TS val 173689176 ecr 44801731], length 0
14:58:13.471666 IP 119.115.10.42.53127 > 10.0.0.40.pnbs: Flags [F.], seq 2138, ack 139574, win 4094, options [nop,nop,TS val 2562090 ecr 173689159], length 0
14:58:13.471680 IP 119.115.10.42.53127 > 10.0.98.12.pnbs: Flags [F.], seq 2138, ack 139574, win 4094, options [nop,nop,TS val 2562090 ecr 173689159], length 0
14:58:13.472330 IP 10.0.98.12.pnbs > 119.115.10.42.53127: Flags [FP.], seq 139921:140957, ack 2139, win 32061, options [nop,nop,TS val 173689241 ecr 2562090], length 1036
14:58:13.472335 IP 10.0.0.40.pnbs > 119.115.10.42.53127: Flags [FP.], seq 139921:140957, ack 2139, win 32061, options [nop,nop,TS val 173689241 ecr 2562090], length 1036
14:58:13.478502 IP 119.115.10.42.53127 > 10.0.0.40.pnbs: Flags [R], seq 4243008613, win 0, length 0
14:58:13.605018 IP 10.0.98.12.pnbs > 119.115.10.42.53127: Flags [FP.], seq 139574:140957, ack 2139, win 32061, options [nop,nop,TS val 173689254 ecr 2562090], length 1383
14:58:13.605024 IP 10.0.0.40.pnbs > 119.115.10.42.53127: Flags [FP.], seq 139574:140957, ack 2139, win 32061, options [nop,nop,TS val 173689254 ecr 2562090], length 1383
14:58:13.756609 IP 119.115.10.42.53127 > 10.0.0.40.pnbs: Flags [R], seq 4243008614, win 0, length 0
14:58:13.756615 IP 119.115.10.42.53127 > 10.0.98.12.pnbs: Flags [R], seq 4243008614, win 0, length 0
14:58:13.757571 IP 119.115.10.42.53127 > 10.0.0.40.pnbs: Flags [R], seq 4243008614, win 0, length 0
14:58:13.757575 IP 119.115.10.42.53127 > 10.0.98.12.pnbs: Flags [R], seq 4243008614, win 0, length 0
14:58:14.280341 IP 222.209.5.87.31100 > 10.0.0.40.27021: Flags [S], seq 2165556151, win 65535, options [mss 1420,nop,wscale 0,nop,nop,sackOK], length 0
14:58:14.280357 IP 222.209.5.87.31100 > 10.0.98.12.27021: Flags [S], seq 2165556151, win 65535, options [mss 1420,nop,wscale 0,nop,nop,sackOK], length 0
14:58:14.280521 IP 10.0.98.12.27021 > 222.209.5.87.31100: Flags [S.], seq 2599943061, ack 2165556152, win 32767, options [mss 1460,nop,wscale 0,nop,nop,sackOK], length 0
14:58:14.280526 IP 10.0.0.40.27021 > 222.209.5.87.31100: Flags [S.], seq 2599943061, ack 2165556152, win 32767, options [mss 1460,nop,wscale 0,nop,nop,sackOK], length 0
14:58:14.684033 IP 123.119.188.230.61874 > 10.0.0.40.27022: Flags [S], seq 1231337125, win 65535, options [mss 1440,nop,wscale 5,nop,nop,TS val 888080410 ecr 0,sackOK,eol], length 0
14:58:14.684048 IP 123.119.188.230.61874 > 10.0.98.12.27022: Flags [S], seq 1231337125, win 65535, options [mss 1440,nop,wscale 5,nop,nop,TS val 888080410 ecr 0,sackOK,eol], length 0
14:58:14.684202 IP 10.0.98.12.27022 > 123.119.188.230.61874: Flags [S.], seq 586831195, ack 1231337126, win 32767, options [mss 1460,nop,wscale 0,sackOK,TS val 173689362 ecr 888080410], length 0
14:58:14.684209 IP 10.0.0.40.27022 > 123.119.188.230.61874: Flags [S.], seq 586831195, ack 1231337126, win 32767, options [mss 1460,nop,wscale 0,sackOK,TS val 173689362 ecr 888080410], length 0
14:58:14.787729 IP 120.209.176.205.lrp > 10.0.0.40.27022: Flags [S], seq 2648804746, win 13600, options [mss 1360,sackOK,TS val 26980482 ecr 0,nop,wscale 7], length 0
14:58:14.787743 IP 120.209.176.205.lrp > 10.0.98.12.27022: Flags [S], seq 2648804746, win 13600, options [mss 1360,sackOK,TS val 26980482 ecr 0,nop,wscale 7], length 0
14:58:14.787889 IP 10.0.98.12.27022 > 120.209.176.205.lrp: Flags [S.], seq 442702668, ack 2648804747, win 32767, options [mss 1460,nop,wscale 0,sackOK,TS val 173689372 ecr 26980482], length 0
14:58:14.787899 IP 10.0.0.40.27022 > 120.209.176.205.lrp: Flags [S.], seq 442702668, ack 2648804747, win 32767, options [mss 1460,nop,wscale 0,sackOK,TS val 173689372 ecr 26980482], length 0
14:58:15.301968 IP 119.56.122.171.52753 > 10.0.0.40.27022: Flags [S], seq 1645604633, win 65535, options [mss 1400,sackOK,TS val 1412844 ecr 0,nop,wscale 6], length 0
