tcpdump: verbose output suppressed, use -v or -vv for full protocol decode
listening on eth0, link-type EN10MB (Ethernet), capture size 65535 bytes
00:12:57.641919 IP 183.78.62.217.56593 > 10.0.98.12.pnbs: Flags [R.], seq 3214732094, ack 0, win 0, length 0
00:27:22.128728 IP 169.254.169.254.http > 10.0.0.40.49628: Flags [F.], seq 2926607319, ack 1755079382, win 149, options [nop,nop,TS val 1654872089 ecr 233275120], length 0
00:27:22.128806 IP 10.0.0.40.49628 > 169.254.169.254.http: Flags [F.], seq 1, ack 1, win 219, options [nop,nop,TS val 233275120 ecr 1654872089], length 0
00:31:02.690904 IP 116.86.28.249.57491 > 10.0.98.12.pnbs: Flags [FP.], seq 3126056276:3126056801, ack 518524240, win 4096, options [nop,nop,TS val 1056887570 ecr 107836541], length 525
00:31:03.337214 IP 116.86.28.249.57491 > 10.0.98.12.pnbs: Flags [FP.], seq 4294967195:525, ack 1, win 4096, options [nop,nop,TS val 1056888206 ecr 107836541], length 626
00:31:04.511198 IP 116.86.28.249.57491 > 10.0.98.12.pnbs: Flags [FP.], seq 4294967195:525, ack 1, win 4096, options [nop,nop,TS val 1056889380 ecr 107836541], length 626
00:31:06.660953 IP 116.86.28.249.57491 > 10.0.98.12.pnbs: Flags [FP.], seq 4294967195:525, ack 1, win 4096, options [nop,nop,TS val 1056891528 ecr 107836541], length 626
00:31:10.757719 IP 116.86.28.249.57491 > 10.0.98.12.pnbs: Flags [FP.], seq 4294967195:525, ack 1, win 4096, options [nop,nop,TS val 1056895624 ecr 107836541], length 626
00:31:18.767808 IP 116.86.28.249.57491 > 10.0.98.12.pnbs: Flags [FP.], seq 4294967195:525, ack 1, win 4096, options [nop,nop,TS val 1056903616 ecr 107836541], length 626
00:31:28.309694 IP 116.86.28.249.57491 > 10.0.98.12.pnbs: Flags [FP.], seq 4294967195:525, ack 1, win 4096, options [nop,nop,TS val 1056913064 ecr 107836541], length 626
00:31:47.124625 IP 116.86.28.249.57491 > 10.0.98.12.pnbs: Flags [FP.], seq 4294967195:525, ack 1, win 4096, options [nop,nop,TS val 1056931760 ecr 107836541], length 626
00:32:05.977507 IP 116.86.28.249.57491 > 10.0.98.12.pnbs: Flags [FP.], seq 4294967195:525, ack 1, win 4096, options [nop,nop,TS val 1056950456 ecr 107836541], length 626
00:32:24.776885 IP 116.86.28.249.57491 > 10.0.98.12.pnbs: Flags [FP.], seq 4294967195:525, ack 1, win 4096, options [nop,nop,TS val 1056969152 ecr 107836541], length 626
00:32:43.617742 IP 116.86.28.249.57491 > 10.0.98.12.pnbs: Flags [FP.], seq 4294967195:525, ack 1, win 4096, options [nop,nop,TS val 1056987849 ecr 107836541], length 626
00:33:02.410947 IP 116.86.28.249.57491 > 10.0.98.12.pnbs: Flags [FP.], seq 4294967195:525, ack 1, win 4096, options [nop,nop,TS val 1057006546 ecr 107836541], length 626
00:33:21.293098 IP 116.86.28.249.57491 > 10.0.98.12.pnbs: Flags [FP.], seq 4294967195:525, ack 1, win 4096, options [nop,nop,TS val 1057025242 ecr 107836541], length 626
00:33:40.043158 IP 116.86.28.249.57491 > 10.0.98.12.pnbs: Flags [R.], seq 526, ack 1, win 4096, length 0
00:34:01.776295 IP 104.176.13.103.50040 > 10.0.98.12.pnbs: Flags [R.], seq 1031697248, ack 2503862197, win 0, length 0
00:39:40.812919 IP 106.241.31.236.11505 > 10.0.98.12.pnbs: Flags [R.], seq 2210075072, ack 1690650203, win 0, length 0
00:42:58.549492 IP 106.241.31.236.8605 > 10.0.98.12.pnbs: Flags [R.], seq 2475092173, ack 1753497538, win 0, length 0
00:42:59.847888 IP 106.241.31.236.11767 > 10.0.98.12.pnbs: Flags [R.], seq 4131511145, ack 2279441691, win 0, length 0
00:44:55.292528 IP 106.241.31.236.11839 > 10.0.98.12.27021: Flags [F.], seq 23615037, ack 1203897979, win 253, length 0
00:44:55.306854 IP 10.0.98.12.27021 > 106.241.31.236.11839: Flags [F.], seq 1, ack 1, win 32536, length 0
00:44:56.217710 IP 106.241.31.236.11837 > 10.0.98.12.27021: Flags [F.], seq 4275239323, ack 1824727451, win 253, length 0
00:44:56.218087 IP 10.0.98.12.27021 > 106.241.31.236.11837: Flags [F.], seq 1, ack 1, win 32536, length 0
00:44:57.143761 IP 106.241.31.236.11835 > 10.0.98.12.27021: Flags [F.], seq 3214601597, ack 495974444, win 253, length 0
00:44:57.144090 IP 10.0.98.12.27021 > 106.241.31.236.11835: Flags [F.], seq 1, ack 1, win 32536, length 0
00:45:16.526024 IP 106.241.31.236.11894 > 10.0.98.12.27021: Flags [F.], seq 3658576948, ack 3996531218, win 253, length 0
00:45:16.526418 IP 10.0.98.12.27021 > 106.241.31.236.11894: Flags [F.], seq 1, ack 1, win 32536, length 0
00:45:17.670376 IP 106.241.31.236.11892 > 10.0.98.12.27021: Flags [F.], seq 3921808485, ack 1707678656, win 253, length 0
00:45:17.670770 IP 10.0.98.12.27021 > 106.241.31.236.11892: Flags [F.], seq 1, ack 1, win 32536, length 0
00:45:18.530488 IP 106.241.31.236.11890 > 10.0.98.12.27021: Flags [F.], seq 2985534336, ack 2656118541, win 253, length 0
00:45:18.530901 IP 10.0.98.12.27021 > 106.241.31.236.11890: Flags [F.], seq 1, ack 1, win 32536, length 0
00:45:19.658548 IP 106.241.31.236.11888 > 10.0.98.12.27021: Flags [F.], seq 1647806075, ack 3966188258, win 255, length 0
00:45:19.658948 IP 10.0.98.12.27021 > 106.241.31.236.11888: Flags [F.], seq 1, ack 1, win 32536, length 0
00:45:20.402028 IP 106.241.31.236.11833 > 10.0.98.12.27021: Flags [F.], seq 4096291612, ack 2078914212, win 254, length 0
00:45:20.402400 IP 10.0.98.12.27021 > 106.241.31.236.11833: Flags [F.], seq 1, ack 1, win 32536, length 0
00:45:36.758894 IP 106.241.31.236.62756 > 10.0.98.12.pnbs: Flags [F.], seq 3799833929, ack 3013033645, win 253, length 0
00:45:36.759383 IP 10.0.98.12.pnbs > 106.241.31.236.62756: Flags [F.], seq 1, ack 1, win 32066, length 0
00:46:19.949565 IP 106.241.31.236.11907 > 10.0.98.12.27021: Flags [F.], seq 1085292345, ack 3528574067, win 253, length 0
00:46:19.949995 IP 10.0.98.12.27021 > 106.241.31.236.11907: Flags [F.], seq 1, ack 1, win 32536, length 0
00:46:20.310964 IP 106.241.31.236.11906 > 10.0.98.12.27021: Flags [F.], seq 1626307737, ack 3385544328, win 253, length 0
00:46:20.311371 IP 10.0.98.12.27021 > 106.241.31.236.11906: Flags [F.], seq 1, ack 1, win 32536, length 0
00:46:21.547977 IP 106.241.31.236.11903 > 10.0.98.12.27021: Flags [F.], seq 3081451505, ack 492649251, win 256, length 0
00:46:21.548387 IP 10.0.98.12.27021 > 106.241.31.236.11903: Flags [F.], seq 1, ack 1, win 32536, length 0
00:46:22.092279 IP 106.241.31.236.11902 > 10.0.98.12.27021: Flags [F.], seq 4049141801, ack 3478469226, win 256, length 0
00:46:22.092664 IP 10.0.98.12.27021 > 106.241.31.236.11902: Flags [F.], seq 1, ack 1, win 32536, length 0
00:46:51.065169 IP 106.241.31.236.62932 > 10.0.98.12.pnbs: Flags [F.], seq 3189028197, ack 2332146735, win 255, length 0
00:46:51.065643 IP 10.0.98.12.pnbs > 106.241.31.236.62932: Flags [F.], seq 1, ack 1, win 32473, length 0
00:46:59.608027 IP 106.241.31.236.10596 > 10.0.98.12.27021: Flags [F.], seq 115675175, ack 2194978485, win 254, length 0
00:46:59.608392 IP 10.0.98.12.27021 > 106.241.31.236.10596: Flags [F.], seq 1, ack 1, win 31635, length 0
00:47:01.818097 IP 106.241.31.236.62847 > 10.0.98.12.27021: Flags [F.], seq 2484630252, ack 2551165882, win 255, length 0
00:47:01.818452 IP 10.0.98.12.27021 > 106.241.31.236.62847: Flags [F.], seq 1, ack 1, win 31631, length 0
00:47:32.864316 IP 106.241.31.236.65086 > 10.0.98.12.pnbs: Flags [R.], seq 3404594027, ack 674610809, win 0, length 0
00:48:04.841625 IP 106.241.31.236.62879 > 10.0.98.12.27021: Flags [F.], seq 2368099786, ack 2971307839, win 250, length 0
00:48:04.842050 IP 10.0.98.12.27021 > 106.241.31.236.62879: Flags [F.], seq 1, ack 1, win 31539, length 0
00:48:06.439668 IP 106.241.31.236.62880 > 10.0.98.12.27021: Flags [F.], seq 288474152, ack 2068759054, win 252, length 0
00:48:06.440104 IP 10.0.98.12.27021 > 106.241.31.236.62880: Flags [F.], seq 1, ack 1, win 32372, length 0
00:48:24.507512 IP 106.241.31.236.10671 > 10.0.98.12.27021: Flags [F.], seq 3451226900, ack 1685860677, win 253, length 0
00:48:24.507942 IP 10.0.98.12.27021 > 106.241.31.236.10671: Flags [F.], seq 1, ack 1, win 31539, length 0
00:48:26.115380 IP 106.241.31.236.10639 > 10.0.98.12.27021: Flags [F.], seq 2421262738, ack 4273590628, win 251, length 0
00:48:26.115774 IP 10.0.98.12.27021 > 106.241.31.236.10639: Flags [F.], seq 1, ack 1, win 32368, length 0
00:48:26.475235 IP 106.241.31.236.8581 > 10.0.98.12.pnbs: Flags [R.], seq 3498926758, ack 1322880323, win 0, length 0
00:48:26.477275 IP 106.241.31.236.8682 > 10.0.98.12.27021: Flags [R.], seq 144494269, ack 826835778, win 0, length 0
00:48:30.077056 IP 106.241.31.236.10655 > 10.0.98.12.27021: Flags [F.], seq 2106711938, ack 2405160719, win 256, length 0
00:48:30.077416 IP 10.0.98.12.27021 > 106.241.31.236.10655: Flags [F.], seq 1, ack 1, win 32536, length 0
00:48:32.268174 IP 106.241.31.236.10218 > 10.0.98.12.pnbs: Flags [R.], seq 1337976887, ack 432094899, win 0, length 0
00:48:37.767711 IP 106.241.31.236.65175 > 10.0.98.12.27021: Flags [F.], seq 1791432938, ack 3171276907, win 251, length 0
00:48:37.768146 IP 10.0.98.12.27021 > 106.241.31.236.65175: Flags [F.], seq 1, ack 1, win 32614, length 0
00:50:34.243815 IP 106.241.31.236.8818 > 10.0.98.12.27022: Flags [F.], seq 1475888282, ack 162744614, win 254, length 0
00:50:34.261029 IP 10.0.98.12.27022 > 106.241.31.236.8818: Flags [F.], seq 1, ack 1, win 32612, length 0
00:50:55.910574 IP 106.241.31.236.63060 > 10.0.98.12.27022: Flags [F.], seq 3373885742, ack 2834152929, win 253, length 0
00:50:55.911030 IP 10.0.98.12.27022 > 106.241.31.236.63060: Flags [F.], seq 1, ack 1, win 32534, length 0
00:50:55.911367 IP 106.241.31.236.11792 > 10.0.98.12.27022: Flags [F.], seq 3792186197, ack 1085962127, win 256, length 0
00:50:55.911709 IP 10.0.98.12.27022 > 106.241.31.236.11792: Flags [F.], seq 1, ack 1, win 32534, length 0
00:51:18.052845 IP 106.241.31.236.8758 > 10.0.98.12.27021: Flags [F.], seq 826611575, ack 1684573191, win 252, length 0
00:51:18.053373 IP 10.0.98.12.27021 > 106.241.31.236.8758: Flags [F.], seq 1, ack 1, win 31963, length 0
00:52:35.438485 IP 106.241.31.236.65239 > 10.0.98.12.pnbs: Flags [R.], seq 1479514270, ack 102007882, win 0, length 0
00:53:16.127965 IP 169.254.169.254.http > 10.0.0.40.49630: Flags [F.], seq 895312639, ack 1865290550, win 149, options [nop,nop,TS val 1655027489 ecr 233663619], length 0
00:53:16.128024 IP 10.0.0.40.49630 > 169.254.169.254.http: Flags [F.], seq 1, ack 1, win 219, options [nop,nop,TS val 233663619 ecr 1655027489], length 0
00:53:33.168811 IP 106.241.31.236.65272 > 10.0.98.12.pnbs: Flags [R.], seq 1532533394, ack 2495330737, win 0, length 0
00:54:38.394131 IP 106.241.31.236.65300 > 10.0.98.12.pnbs: Flags [R.], seq 3027777030, ack 3125513346, win 0, length 0
00:56:39.191369 IP 106.241.31.236.62300 > 10.0.98.12.pnbs: Flags [R.], seq 712161948, ack 1043273205, win 0, length 0
00:58:02.792993 IP 106.241.31.236.13020 > 10.0.98.12.27021: Flags [F.], seq 961833966, ack 1149975391, win 251, length 0
00:58:02.793570 IP 10.0.98.12.27021 > 106.241.31.236.13020: Flags [F.], seq 1, ack 1, win 31787, length 0
00:58:19.395315 IP 106.241.31.236.13019 > 10.0.98.12.27021: Flags [F.], seq 821235906, ack 3159578711, win 251, length 0
00:58:19.398678 IP 10.0.98.12.27021 > 106.241.31.236.13019: Flags [F.], seq 1, ack 1, win 32635, length 0
00:59:51.013142 IP 114.226.198.102.21231 > 10.0.98.12.pnbs: Flags [R], seq 1388770836, win 0, length 0
00:59:56.927466 IP 114.226.198.102.21232 > 10.0.98.12.pnbs: Flags [F.], seq 2409656192, ack 352178367, win 4105, options [nop,nop,TS val 767837234 ecr 108180763], length 0
00:59:56.928123 IP 10.0.98.12.pnbs > 114.226.198.102.21232: Flags [F.], seq 1, ack 1, win 32767, options [nop,nop,TS val 108181572 ecr 767837234], length 0
00:59:59.955002 IP 10.0.98.12.pnbs > 114.226.198.102.21232: Flags [F.], seq 1, ack 1, win 32767, options [nop,nop,TS val 108181875 ecr 767837234], length 0
01:00:06.019946 IP 10.0.98.12.pnbs > 114.226.198.102.21232: Flags [F.], seq 1, ack 1, win 32767, options [nop,nop,TS val 108182481 ecr 767837234], length 0
01:00:17.932909 IP 10.0.98.12.pnbs > 114.226.198.102.21235: Flags [R], seq 3870689300, win 0, length 0
01:00:18.135877 IP 10.0.98.12.pnbs > 114.226.198.102.21232: Flags [F.], seq 1, ack 1, win 32767, options [nop,nop,TS val 108183693 ecr 767837234], length 0
01:00:37.450140 IP 60.55.55.82.50998 > 10.0.98.12.pnbs: Flags [R], seq 902637875, win 0, length 0
01:00:42.376644 IP 10.0.98.12.pnbs > 114.226.198.102.21232: Flags [F.], seq 1, ack 1, win 32767, options [nop,nop,TS val 108186117 ecr 767837234], length 0
01:00:57.937526 IP 10.0.98.12.pnbs > 153.35.188.200.50998: Flags [R], seq 1328374770, win 0, length 0
01:01:50.426689 IP 202.166.24.150.59830 > 10.0.98.12.27021: Flags [F.], seq 531674113, ack 1722149713, win 16357, length 0
01:01:50.427108 IP 10.0.98.12.27021 > 202.166.24.150.59830: Flags [F.], seq 498, ack 1, win 32201, length 0
01:01:50.726364 IP 202.166.24.150.59830 > 10.0.98.12.27021: Flags [R.], seq 1, ack 498, win 0, length 0
01:02:06.696939 IP 121.135.63.45.sun-sr-iiop > 10.0.98.12.pnbs: Flags [R.], seq 3039006557, ack 446190689, win 0, length 0
01:02:09.063508 IP 211.161.159.14.46605 > 10.0.98.12.27021: Flags [R.], seq 3456594545, ack 1951629725, win 8326, options [nop,nop,TS val 1640723711 ecr 108193792], length 0
01:02:18.373912 IP 106.241.31.236.63726 > 10.0.98.12.27021: Flags [F.], seq 2366034271, ack 892958598, win 256, length 0
01:02:18.374659 IP 10.0.98.12.27021 > 106.241.31.236.63726: Flags [F.], seq 69, ack 1, win 32463, length 0
01:02:19.064303 IP 113.57.61.4.starquiz-port > 10.0.98.12.27021: Flags [F.], seq 1319845222, ack 1739769048, win 16212, length 0
01:02:19.064702 IP 10.0.98.12.27021 > 113.57.61.4.starquiz-port: Flags [F.], seq 1, ack 1, win 32201, length 0
01:02:20.180564 IP 106.241.31.238.56253 > 10.0.98.12.27021: Flags [F.], seq 1424387841, ack 207797354, win 4096, options [nop,nop,TS val 817246845 ecr 108195801], length 0
01:02:20.180956 IP 10.0.98.12.27021 > 106.241.31.238.56253: Flags [F.], seq 69, ack 1, win 32466, options [nop,nop,TS val 108195897 ecr 817246845], length 0
01:02:20.347489 IP 106.241.31.238.56253 > 10.0.98.12.27021: Flags [R], seq 1424387842, win 0, length 0
01:02:20.347609 IP 106.241.31.238.56253 > 10.0.98.12.27021: Flags [R], seq 1424387842, win 0, length 0
01:02:51.057657 IP 211.161.159.14.47106 > 10.0.98.12.27021: Flags [R.], seq 3940604191, ack 4197531396, win 8326, options [nop,nop,TS val 1640765711 ecr 108197917], length 0
01:03:16.314913 IP 51.7.246.167.63558 > 10.0.98.12.pnbs: Flags [R.], seq 213025269, ack 3518428382, win 0, length 0
01:03:33.058601 IP 211.161.159.14.47602 > 10.0.98.12.27021: Flags [R.], seq 3702179392, ack 1715619692, win 8326, options [nop,nop,TS val 1640807714 ecr 108202115], length 0
01:03:38.220144 IP 75.131.30.157.58338 > 10.0.98.12.27021: Flags [F.], seq 2722818398, ack 2826598387, win 16382, length 0
01:03:38.220557 IP 10.0.98.12.27021 > 75.131.30.157.58338: Flags [F.], seq 1, ack 1, win 32211, length 0
01:03:40.976845 IP 183.134.67.195.4281 > 10.0.98.12.pnbs: Flags [R.], seq 2922317183, ack 4179979957, win 1032, options [nop,nop,TS val 557810694 ecr 108202996], length 0
01:03:52.356888 IP 106.241.31.238.56282 > 10.0.98.12.27021: Flags [F.], seq 420568911, ack 1653541354, win 4060, options [nop,nop,TS val 817338456 ecr 108205088], length 0
01:03:52.357385 IP 10.0.98.12.27021 > 106.241.31.238.56282: Flags [F.], seq 1, ack 1, win 32514, options [nop,nop,TS val 108205114 ecr 817338456], length 0
01:03:52.357501 IP 106.241.31.238.56251 > 10.0.98.12.pnbs: Flags [F.], seq 2378317629, ack 433550642, win 4070, options [nop,nop,TS val 817338456 ecr 108205088], length 0
01:03:52.357903 IP 10.0.98.12.pnbs > 106.241.31.238.56251: Flags [F.], seq 1, ack 1, win 32432, options [nop,nop,TS val 108205114 ecr 817338456], length 0
01:03:56.548935 IP 113.57.61.19.12824 > 10.0.98.12.27021: Flags [F.], seq 3708308741, ack 2359307758, win 16475, length 0
01:03:56.549334 IP 10.0.98.12.27021 > 113.57.61.19.12824: Flags [F.], seq 1, ack 1, win 32536, length 0
01:04:22.989211 IP 183.134.67.195.32171 > 10.0.98.12.pnbs: Flags [R.], seq 274869392, ack 4141010609, win 1032, options [nop,nop,TS val 557852694 ecr 108207135], length 0
01:04:27.633562 IP 153.35.189.200.50998 > 10.0.98.12.pnbs: Flags [R.], seq 902643679, ack 1043150165, win 0, length 0
01:04:35.504065 IP 106.241.31.238.58768 > 10.0.98.12.pnbs: Flags [F.], seq 587131209, ack 866616601, win 4087, options [nop,nop,TS val 2698557807 ecr 108208635], length 0
01:04:35.504415 IP 10.0.98.12.pnbs > 106.241.31.238.58768: Flags [F.], seq 1, ack 1, win 32224, options [nop,nop,TS val 108209429 ecr 2698557807], length 0
01:04:36.817792 IP 122.53.101.100.11830 > 10.0.98.12.pnbs: Flags [R.], seq 893846491, ack 1193625061, win 0, length 0
01:04:37.013997 IP 122.53.101.100.11830 > 10.0.98.12.pnbs: Flags [R], seq 893846491, win 0, length 0
01:04:37.718947 IP 106.241.31.236.63668 > 10.0.98.12.pnbs: Flags [F.], seq 3552162944, ack 3732503905, win 251, length 0
01:04:37.719346 IP 10.0.98.12.pnbs > 106.241.31.236.63668: Flags [F.], seq 1, ack 1, win 31789, length 0
01:05:04.996654 IP 183.134.67.195.5664 > 10.0.98.12.pnbs: Flags [R.], seq 3852059024, ack 3326016246, win 1032, options [nop,nop,TS val 557894694 ecr 108211337], length 0
01:05:27.568384 IP 183.134.67.248.52543 > 10.0.98.12.pnbs: Flags [R.], seq 1757221131, ack 2519208003, win 0, length 0
01:05:36.739388 IP 101.51.2.1.26565 > 10.0.98.12.pnbs: Flags [R.], seq 3019947295, ack 410266087, win 0, length 0
01:05:37.592173 IP 5.44.169.199.58008 > 10.0.98.12.pnbs: Flags [R.], seq 3736466157, ack 1171420283, win 0, length 0
01:05:37.855675 IP 5.44.169.199.58008 > 10.0.98.12.pnbs: Flags [R], seq 3736466157, win 0, length 0
01:05:45.470134 IP 106.241.31.236.65459 > 10.0.98.12.27021: Flags [R.], seq 4000114580, ack 3415356149, win 0, length 0
01:05:45.471849 IP 106.241.31.236.65366 > 10.0.98.12.pnbs: Flags [R.], seq 3158398202, ack 3041220306, win 0, length 0
01:05:45.477731 IP 106.241.31.236.65433 > 10.0.98.12.27021: Flags [R.], seq 2352023184, ack 1072973264, win 0, length 0
01:06:16.330995 IP 42.113.135.55.49448 > 10.0.98.12.pnbs: Flags [R.], seq 3563958682, ack 3430080491, win 0, length 0
01:06:39.756842 IP 203.128.80.64.52497 > 10.0.98.12.27021: Flags [F.], seq 3290861612, ack 377924769, win 4151, length 0
01:06:39.757306 IP 10.0.98.12.27021 > 203.128.80.64.52497: Flags [F.], seq 245, ack 1, win 32209, length 0
01:06:39.968630 IP 203.128.80.64.52497 > 10.0.98.12.27021: Flags [R.], seq 1, ack 245, win 0, length 0
01:06:39.972896 IP 203.128.80.64.52497 > 10.0.98.12.27021: Flags [R], seq 3290861613, win 0, length 0
01:06:40.533429 IP 203.128.80.64.52499 > 10.0.98.12.27021: Flags [F.], seq 3373275949, ack 2123708463, win 4129, length 0
01:06:40.533801 IP 10.0.98.12.27021 > 203.128.80.64.52499: Flags [F.], seq 1, ack 1, win 32219, length 0
01:07:01.353981 IP 112.148.13.104.mmpft > 10.0.98.12.pnbs: Flags [R.], seq 2184462539, ack 2266550395, win 0, length 0
01:07:12.697099 IP 183.246.79.122.dcs-config > 10.0.98.12.pnbs: Flags [R.], seq 36100005, ack 3788297246, win 0, length 0
01:07:23.585818 IP 220.70.59.218.6777 > 10.0.98.12.pnbs: Flags [R.], seq 396144040, ack 2254228123, win 0, length 0
01:07:24.337398 IP 112.148.13.104.3097 > 10.0.98.12.pnbs: Flags [R.], seq 3825228045, ack 3190187027, win 0, length 0
01:07:48.187920 IP 121.135.63.45.6777 > 10.0.98.12.27021: Flags [F.], seq 2312840926, ack 1880850681, win 16088, length 0
01:07:48.188398 IP 10.0.98.12.27021 > 121.135.63.45.6777: Flags [F.], seq 1, ack 1, win 31866, length 0
01:07:49.794666 IP 112.14.112.42.22200 > 10.0.98.12.27021: Flags [F.], seq 2615264908, ack 2190605263, win 16665, length 0
01:07:49.795053 IP 10.0.98.12.27021 > 112.14.112.42.22200: Flags [F.], seq 286, ack 1, win 32614, length 0
01:07:49.875258 IP 112.14.112.42.22200 > 10.0.98.12.27021: Flags [R.], seq 1, ack 286, win 0, length 0
01:07:58.517130 IP 112.14.112.42.22172 > 10.0.98.12.pnbs: Flags [R.], seq 2856907683, ack 3674345835, win 0, length 0
01:08:06.628649 IP 121.135.63.45.7373 > 10.0.98.12.27021: Flags [F.], seq 220065412, ack 3008374778, win 16415, length 0
01:08:06.629143 IP 10.0.98.12.27021 > 121.135.63.45.7373: Flags [F.], seq 1, ack 1, win 32228, length 0
01:08:10.134963 IP 5.166.167.27.63701 > 10.0.98.12.pnbs: Flags [R.], seq 628439343, ack 2941426998, win 0, length 0
01:08:18.410623 IP 171.96.181.31.61817 > 10.0.98.12.27021: Flags [F.], seq 4022871795, ack 319471563, win 256, length 0
01:08:18.411029 IP 10.0.98.12.27021 > 171.96.181.31.61817: Flags [F.], seq 237, ack 1, win 32536, length 0
01:08:18.546350 IP 171.96.181.31.61817 > 10.0.98.12.27021: Flags [R.], seq 1, ack 237, win 0, length 0
01:08:27.499362 IP 27.105.229.226.49493 > 10.0.98.12.pnbs: Flags [R.], seq 3210905101, ack 3057998233, win 0, length 0
01:08:34.193622 IP 183.246.67.47.20801 > 10.0.98.12.pnbs: Flags [R.], seq 1293736860, ack 2776879419, win 0, length 0
01:08:52.114995 IP 183.92.41.96.53163 > 10.0.98.12.pnbs: Flags [R.], seq 3741218430, ack 235743483, win 0, length 0
01:08:55.923044 IP 106.241.31.236.8825 > 10.0.98.12.27021: Flags [F.], seq 4046183020, ack 3825050827, win 256, length 0
01:08:55.923585 IP 10.0.98.12.27021 > 106.241.31.236.8825: Flags [F.], seq 1, ack 1, win 32614, length 0
01:08:58.713756 IP 121.135.63.45.7454 > 10.0.98.12.pnbs: Flags [R.], seq 1561664261, ack 2707217296, win 0, length 0
01:09:03.350120 IP 171.96.181.31.61841 > 10.0.98.12.27021: Flags [F.], seq 3207868222, ack 2729135563, win 255, length 0
01:09:03.350486 IP 10.0.98.12.27021 > 171.96.181.31.61841: Flags [F.], seq 417, ack 1, win 32536, length 0
01:09:03.490932 IP 171.96.181.31.61841 > 10.0.98.12.27021: Flags [R.], seq 1, ack 417, win 0, length 0
01:09:21.052651 IP 10.0.98.12.27021 > 223.73.121.106.54848: Flags [R.], seq 1885162064, ack 3396977620, win 0, length 0
01:09:21.974118 IP 106.241.31.236.11796 > 10.0.98.12.pnbs: Flags [R.], seq 3446176910, ack 2944678919, win 0, length 0
01:09:41.644453 IP 183.246.79.122.ltp > 10.0.98.12.27021: Flags [F.], seq 2455523743, ack 2060233422, win 64111, length 0
01:09:41.644900 IP 10.0.98.12.27021 > 183.246.79.122.ltp: Flags [F.], seq 1, ack 1, win 32536, length 0
01:10:00.895082 IP 27.105.229.226.49532 > 10.0.98.12.pnbs: Flags [R.], seq 1905002014, ack 1999075101, win 0, length 0
01:10:10.074138 IP 89.111.24.7.43896 > 10.0.98.12.pnbs: Flags [F.], seq 797841101, ack 1865774733, win 1202, options [nop,nop,TS val 1274798769 ecr 108242682], length 0
01:10:10.074521 IP 10.0.98.12.pnbs > 89.111.24.7.43896: Flags [F.], seq 40, ack 1, win 32767, options [nop,nop,TS val 108242885 ecr 1274798769], length 0
01:10:10.362942 IP 89.111.24.7.43896 > 10.0.98.12.pnbs: Flags [R], seq 797841102, win 0, length 0
01:10:10.363069 IP 89.111.24.7.43896 > 10.0.98.12.pnbs: Flags [R], seq 797841102, win 0, length 0
01:10:18.068882 IP 183.246.79.122.4048 > 10.0.98.12.27021: Flags [F.], seq 3598718713, ack 2572077103, win 65169, length 0
01:10:18.069466 IP 10.0.98.12.27021 > 183.246.79.122.4048: Flags [F.], seq 1, ack 1, win 32205, length 0
01:10:36.672524 IP 171.96.181.31.61884 > 10.0.98.12.27021: Flags [F.], seq 149488155, ack 521769321, win 254, length 0
01:10:36.672989 IP 10.0.98.12.27021 > 171.96.181.31.61884: Flags [F.], seq 1, ack 1, win 32297, length 0
01:10:41.500405 IP 185.18.148.188.47661 > 10.0.98.12.pnbs: Flags [F.], seq 441431547, ack 184534872, win 1606, options [nop,nop,TS val 4062008472 ecr 108245939], length 0
01:10:41.500447 IP 185.18.148.188.47661 > 10.0.98.12.pnbs: Flags [R.], seq 1, ack 1, win 1606, options [nop,nop,TS val 4062008472 ecr 108245939], length 0
01:10:41.751459 IP 185.18.148.188.47661 > 10.0.98.12.pnbs: Flags [R], seq 441431548, win 0, length 0
01:10:56.283237 IP 37.46.80.104.48434 > 10.0.98.12.pnbs: Flags [F.], seq 2496787752, ack 1809159090, win 5627, options [nop,nop,TS val 3103590564 ecr 108247393], length 0
01:10:56.283720 IP 10.0.98.12.pnbs > 37.46.80.104.48434: Flags [F.], seq 1, ack 1, win 32767, options [nop,nop,TS val 108247506 ecr 3103590564], length 0
01:11:00.847790 IP 120.34.164.141.ibm-dt-2 > 10.0.98.12.pnbs: Flags [R.], seq 354842417, ack 1898619967, win 0, length 0
01:11:09.328823 IP 41.132.116.29.52218 > 10.0.98.12.pnbs: Flags [R.], seq 1841142418, ack 3075427381, win 0, length 0
01:11:12.726630 IP 42.55.136.187.ovhpas > 10.0.98.12.pnbs: Flags [R.], seq 2550959668, ack 1559830870, win 8257, options [nop,nop,TS val 2139146973 ecr 108248115], length 0
01:11:26.531407 IP 190.18.149.95.50908 > 10.0.98.12.27021: Flags [F.], seq 280245927, ack 3790129994, win 252, length 0
01:11:26.531836 IP 10.0.98.12.27021 > 190.18.149.95.50908: Flags [F.], seq 1, ack 1, win 32373, length 0
01:11:54.721438 IP 42.55.136.187.11086 > 10.0.98.12.pnbs: Flags [R.], seq 3865060034, ack 3576730567, win 8257, options [nop,nop,TS val 2139188972 ecr 108252295], length 0
01:12:02.859258 IP 180.190.89.118.54230 > 10.0.98.12.pnbs: Flags [R.], seq 98034942, ack 2527218189, win 0, length 0
01:12:15.724306 IP 223.73.121.106.54862 > 10.0.98.12.27021: Flags [F.], seq 435873361, ack 2380504486, win 16550, length 0
01:12:15.724716 IP 10.0.98.12.27021 > 223.73.121.106.54862: Flags [F.], seq 1, ack 1, win 32373, length 0
01:12:19.530332 IP 183.15.193.87.digital-notary > 10.0.98.12.pnbs: Flags [R.], seq 602325, ack 3616625690, win 0, length 0
01:12:19.841103 IP 183.15.193.87.digital-notary > 10.0.98.12.pnbs: Flags [R], seq 602325, win 0, length 0
01:12:24.301353 IP 110.185.82.198.52740 > 10.0.98.12.pnbs: Flags [R.], seq 2212684451, ack 2050334010, win 0, length 0
01:12:25.676912 IP 95.129.41.153.45426 > 10.0.98.12.pnbs: Flags [R.], seq 2218998034, ack 1012814770, win 1486, options [nop,nop,TS val 4042338622 ecr 108256340], length 0
01:12:25.676922 IP 95.129.41.153.45426 > 10.0.98.12.pnbs: Flags [F.], seq 4294967295, ack 1, win 1486, options [nop,nop,TS val 4042338622 ecr 108256340], length 0
01:12:25.677356 IP 10.0.98.12.pnbs > 95.129.41.153.45426: Flags [F.], seq 1, ack 0, win 32150, options [nop,nop,TS val 108256445 ecr 4042338622], length 0
01:12:25.977066 IP 95.129.41.153.45426 > 10.0.98.12.pnbs: Flags [R], seq 2218998034, win 0, length 0
01:12:25.977103 IP 95.129.41.153.45426 > 10.0.98.12.pnbs: Flags [R], seq 2218998034, win 0, length 0
01:12:36.707224 IP 42.55.136.187.10924 > 10.0.98.12.pnbs: Flags [R.], seq 3218244481, ack 2911616805, win 8257, options [nop,nop,TS val 2139230958 ecr 108256481], length 0
01:12:39.616787 IP 223.73.121.106.54868 > 10.0.98.12.27021: Flags [F.], seq 3792186127, ack 661433310, win 16328, length 0
01:12:39.617240 IP 10.0.98.12.27021 > 223.73.121.106.54868: Flags [F.], seq 1, ack 1, win 32373, length 0
01:12:43.299306 IP 10.0.98.12.pnbs > 110.70.27.46.33545: Flags [F.], seq 3914819248, ack 3184944786, win 32767, options [nop,nop,TS val 108258207 ecr 23241920], length 0
01:12:43.788118 IP 110.70.27.46.33545 > 10.0.98.12.pnbs: Flags [F.], seq 1, ack 1, win 331, options [nop,nop,TS val 23245028 ecr 108258207], length 0
01:12:43.964862 IP 60.28.126.38.montage-lm > 10.0.98.12.pnbs: Flags [R.], seq 904180322, ack 4189200102, win 0, length 0
01:12:46.682501 IP 223.73.121.106.54848 > 10.0.98.12.27021: Flags [R.], seq 79, ack 4294965860, win 0, length 0
01:13:12.613087 IP 118.223.1.135.10307 > 10.0.98.12.pnbs: Flags [R.], seq 4196778050, ack 354166241, win 0, length 0
01:13:14.973545 IP 121.135.63.45.8024 > 10.0.98.12.27021: Flags [F.], seq 1128095140, ack 3037487340, win 16363, length 0
01:13:14.974047 IP 10.0.98.12.27021 > 121.135.63.45.8024: Flags [F.], seq 1, ack 1, win 32614, length 0
01:14:08.629739 IP 123.24.205.167.krb524 > 10.0.98.12.pnbs: Flags [R.], seq 3882517293, ack 1523356512, win 0, length 0
01:14:08.827934 IP 123.24.205.167.krb524 > 10.0.98.12.pnbs: Flags [R], seq 3882517293, win 0, length 0
01:14:37.491331 IP 112.209.67.150.49558 > 10.0.98.12.27021: Flags [F.], seq 2411046932, ack 2010973545, win 16392, length 0
01:14:37.491883 IP 10.0.98.12.27021 > 112.209.67.150.49558: Flags [F.], seq 1, ack 1, win 32373, length 0
01:14:38.051225 IP 10.0.98.12.27021 > 112.209.67.150.49558: Flags [F.], seq 1, ack 1, win 32373, length 0
01:14:57.401046 IP 80.93.28.171.37424 > 10.0.98.12.pnbs: Flags [F.], seq 254646921, ack 663468658, win 522, options [nop,nop,TS val 154303132 ecr 108271446], length 0
01:14:57.401056 IP 80.93.28.171.37424 > 10.0.98.12.pnbs: Flags [R.], seq 1, ack 1, win 522, options [nop,nop,TS val 154303132 ecr 108271446], length 0
01:15:00.162444 IP 201.223.218.189.63024 > 10.0.98.12.pnbs: Flags [R.], seq 3771659850, ack 3347854244, win 0, length 0
01:15:01.919586 IP 112.207.255.12.61007 > 10.0.98.12.pnbs: Flags [R.], seq 825998852, ack 3022377135, win 0, length 0
01:15:03.064342 IP 211.161.159.14.36564 > 10.0.98.12.27021: Flags [R.], seq 1654837221, ack 1011078181, win 8326, options [nop,nop,TS val 1639719430 ecr 108271169], length 0
01:15:05.025507 IP 118.70.169.246.63905 > 10.0.98.12.pnbs: Flags [R.], seq 630810802, ack 958524254, win 0, length 0
01:15:22.976196 IP 122.227.141.78.56953 > 10.0.98.12.27021: Flags [F.], seq 218693225, ack 600024220, win 260, options [nop,nop,TS val 240710 ecr 108274133], length 0
01:15:22.976632 IP 10.0.98.12.27021 > 122.227.141.78.56953: Flags [F.], seq 1, ack 1, win 32428, options [nop,nop,TS val 108274174 ecr 240710], length 0
01:15:24.881388 IP 122.227.141.78.56450 > 10.0.98.12.pnbs: Flags [R.], seq 908550791, ack 2566682015, win 0, length 0
01:15:24.945017 IP 124.173.71.189.50121 > 10.0.98.12.pnbs: Flags [R.], seq 1978916963, ack 348227146, win 0, length 0
01:15:25.098872 IP 124.173.71.189.50121 > 10.0.98.12.pnbs: Flags [R], seq 1978916907, win 0, length 0
01:15:26.579862 IP 112.97.52.18.54387 > 10.0.98.12.pnbs: Flags [R.], seq 47543132, ack 2944686766, win 0, length 0
01:15:37.650455 IP 122.191.204.129.14253 > 10.0.98.12.27021: Flags [F.], seq 3345259238, ack 2661098014, win 16507, length 0
01:15:37.650843 IP 10.0.98.12.27021 > 122.191.204.129.14253: Flags [F.], seq 1, ack 1, win 32536, length 0
01:15:45.059916 IP 211.161.159.14.37914 > 10.0.98.12.27021: Flags [R.], seq 1559160747, ack 2046068982, win 8326, options [nop,nop,TS val 1639761429 ecr 108275314], length 0
01:15:54.546965 IP 183.246.79.122.4077 > 10.0.98.12.27021: Flags [F.], seq 846283304, ack 2062934798, win 64328, length 0
01:15:54.547433 IP 10.0.98.12.27021 > 183.246.79.122.4077: Flags [F.], seq 1, ack 1, win 32045, length 0
01:15:56.241292 IP 183.246.79.122.minger > 10.0.98.12.pnbs: Flags [R.], seq 1858255085, ack 720771013, win 0, length 0
01:16:00.526161 IP 223.104.20.168.36998 > 10.0.98.12.pnbs: Flags [F.], seq 1898200204, ack 18839628, win 4091, options [nop,nop,TS val 629550778 ecr 108277874], length 0
01:16:00.526516 IP 10.0.98.12.pnbs > 223.104.20.168.36998: Flags [F.], seq 1, ack 1, win 32767, options [nop,nop,TS val 108277929 ecr 629550778], length 0
01:16:23.698131 IP 122.191.204.104.8389 > 10.0.98.12.27021: Flags [R], seq 3287922506, win 0, length 0
01:16:23.701505 IP 122.191.123.151.8389 > 10.0.98.12.27021: Flags [R], seq 3287922506, win 0, length 0
01:16:27.074652 IP 211.161.159.14.39178 > 10.0.98.12.27021: Flags [R.], seq 506076288, ack 1256309891, win 8326, options [nop,nop,TS val 1639803437 ecr 108279517], length 0
01:16:28.439742 IP 123.123.87.10.49462 > 10.0.98.12.27021: Flags [F.], seq 2935293080, ack 2218279576, win 16326, length 0
01:16:28.440187 IP 10.0.98.12.27021 > 123.123.87.10.49462: Flags [F.], seq 1, ack 1, win 32536, length 0
01:17:21.677769 IP 121.135.63.45.tmi > 10.0.98.12.27021: Flags [F.], seq 3589423619, ack 3667519109, win 16135, length 0
01:17:21.678190 IP 10.0.98.12.27021 > 121.135.63.45.tmi: Flags [F.], seq 1, ack 1, win 32614, length 0
01:17:21.929089 IP 118.223.1.135.10449 > 10.0.98.12.27021: Flags [F.], seq 3205962457, ack 3995236304, win 16143, length 0
01:17:21.929400 IP 10.0.98.12.27021 > 118.223.1.135.10449: Flags [F.], seq 1, ack 1, win 32614, length 0
01:17:24.913616 IP 51.7.246.167.63741 > 10.0.98.12.27021: Flags [F.], seq 681128544, ack 2127427534, win 256, length 0
01:17:24.913998 IP 10.0.98.12.27021 > 51.7.246.167.63741: Flags [F.], seq 438, ack 1, win 32228, length 0
01:17:25.167795 IP 51.7.246.167.63741 > 10.0.98.12.27021: Flags [R.], seq 1, ack 438, win 0, length 0
01:17:37.410736 IP 51.7.246.167.63795 > 10.0.98.12.27021: Flags [F.], seq 1390276226, ack 2513492447, win 258, length 0
01:17:37.411195 IP 10.0.98.12.27021 > 51.7.246.167.63795: Flags [F.], seq 1, ack 1, win 32382, length 0
01:17:39.940372 IP 146.255.63.118.41675 > 10.0.98.12.pnbs: Flags [F.], seq 1999487899, ack 647712932, win 3100, options [nop,nop,TS val 1140756586 ecr 108287659], length 0
01:17:39.940902 IP 10.0.98.12.pnbs > 146.255.63.118.41675: Flags [F.], seq 193, ack 1, win 32458, options [nop,nop,TS val 108287870 ecr 1140756586], length 0
01:17:40.215044 IP 146.255.63.118.41675 > 10.0.98.12.pnbs: Flags [R], seq 1999487900, win 0, length 0
01:17:40.215137 IP 146.255.63.118.41675 > 10.0.98.12.pnbs: Flags [R], seq 1999487900, win 0, length 0
01:17:45.190394 IP 51.7.246.167.63799 > 10.0.98.12.27021: Flags [F.], seq 4185856707, ack 3744036472, win 257, length 0
01:17:45.190857 IP 10.0.98.12.27021 > 51.7.246.167.63799: Flags [F.], seq 42, ack 1, win 32373, length 0
01:17:45.448487 IP 51.7.246.167.63799 > 10.0.98.12.27021: Flags [R.], seq 1, ack 42, win 0, length 0
01:17:57.712733 IP 10.0.98.12.27021 > 223.73.121.106.54850: Flags [R.], seq 411435311, ack 2049276751, win 0, length 0
01:17:58.754135 IP 89.111.24.7.60609 > 10.0.98.12.pnbs: Flags [F.], seq 3840672858, ack 2961366069, win 1002, options [nop,nop,TS val 1274915935 ecr 108289676], length 0
01:17:58.754543 IP 10.0.98.12.pnbs > 89.111.24.7.60609: Flags [F.], seq 40, ack 1, win 32767, options [nop,nop,TS val 108289751 ecr 1274915935], length 0
01:17:59.037514 IP 89.111.24.7.60609 > 10.0.98.12.pnbs: Flags [R], seq 3840672859, win 0, length 0
01:17:59.037651 IP 89.111.24.7.60609 > 10.0.98.12.pnbs: Flags [R], seq 3840672859, win 0, length 0
01:18:03.015101 IP 120.29.74.56.49763 > 10.0.98.12.pnbs: Flags [R.], seq 3480248013, ack 53340668, win 0, length 0
01:18:03.129737 IP 120.29.74.56.49763 > 10.0.98.12.pnbs: Flags [R], seq 3480248013, win 0, length 0
01:18:04.740429 IP 223.65.141.222.48897 > 10.0.98.12.pnbs: Flags [F.], seq 3698021255, ack 3220455871, win 4093, options [nop,nop,TS val 166988201 ecr 108290215], length 0
01:18:04.740970 IP 10.0.98.12.pnbs > 223.65.141.222.48897: Flags [F.], seq 1, ack 1, win 32071, options [nop,nop,TS val 108290350 ecr 166988201], length 0
01:18:06.411668 IP 121.31.251.234.61850 > 10.0.98.12.27021: Flags [F.], seq 3493652577, ack 2347617935, win 16110, length 0
01:18:06.412253 IP 10.0.98.12.27021 > 121.31.251.234.61850: Flags [F.], seq 1, ack 1, win 32536, length 0
01:18:23.517086 IP 180.169.41.166.56539 > 10.0.98.12.27021: Flags [F.], seq 4046775073, ack 1751698299, win 16174, length 0
01:18:23.517461 IP 10.0.98.12.27021 > 180.169.41.166.56539: Flags [F.], seq 1, ack 1, win 32536, length 0
01:18:25.083487 IP 223.65.141.222.48898 > 10.0.98.12.pnbs: Flags [F.], seq 3024775040, ack 4086712962, win 4088, options [nop,nop,TS val 167008526 ecr 108292363], length 0
01:18:25.083865 IP 10.0.98.12.pnbs > 223.65.141.222.48898: Flags [F.], seq 1, ack 1, win 32069, options [nop,nop,TS val 108292384 ecr 167008526], length 0
01:18:45.510524 IP 37.46.80.104.40452 > 10.0.98.12.pnbs: Flags [F.], seq 532337911, ack 78453568, win 11492, options [nop,nop,TS val 3103702056 ecr 108294338], length 0
01:18:45.510980 IP 10.0.98.12.pnbs > 37.46.80.104.40452: Flags [F.], seq 1, ack 1, win 31555, options [nop,nop,TS val 108294427 ecr 3103702056], length 0
01:19:02.637850 IP 190.18.149.95.52129 > 10.0.98.12.27021: Flags [F.], seq 2984029544, ack 2791368175, win 255, length 0
01:19:02.638349 IP 10.0.98.12.27021 > 190.18.149.95.52129: Flags [F.], seq 1, ack 1, win 32382, length 0
01:19:12.924214 IP 222.34.19.201.40763 > 10.0.98.12.27021: Flags [R.], seq 1273919365, ack 2918938565, win 1040, options [nop,nop,TS val 2913223517 ecr 108296154], length 0
01:19:16.834203 IP 202.166.24.150.59895 > 10.0.98.12.27021: Flags [F.], seq 4220939782, ack 942627653, win 16200, length 0
01:19:16.834550 IP 10.0.98.12.27021 > 202.166.24.150.59895: Flags [F.], seq 1, ack 1, win 32434, length 0
01:19:24.421910 IP 202.166.24.150.59791 > 10.0.98.12.pnbs: Flags [R.], seq 3051232128, ack 135783667, win 0, length 0
01:19:46.460493 IP 106.241.31.236.8829 > 10.0.98.12.27021: Flags [F.], seq 2856553748, ack 401151680, win 254, length 0
01:19:46.461056 IP 10.0.98.12.27021 > 106.241.31.236.8829: Flags [F.], seq 1, ack 1, win 32614, length 0
01:19:54.919421 IP 222.34.19.201.41459 > 10.0.98.12.27021: Flags [R.], seq 2825860973, ack 3492669314, win 1040, options [nop,nop,TS val 2913265508 ecr 108300315], length 0
01:19:59.792244 IP 75.131.30.157.56010 > 10.0.98.12.pnbs: Flags [R.], seq 2160580401, ack 3502414459, win 0, length 0
01:20:12.724466 IP 95.129.41.153.33504 > 10.0.98.12.27021: Flags [F.], seq 607634767, ack 3190547042, win 501, options [nop,nop,TS val 4042805670 ecr 108303096], length 0
01:20:12.724471 IP 95.129.41.153.33504 > 10.0.98.12.27021: Flags [R.], seq 1, ack 1, win 501, options [nop,nop,TS val 4042805670 ecr 108303096], length 0
01:20:14.653847 IP 223.65.141.222.48899 > 10.0.98.12.pnbs: Flags [F.], seq 1498887253, ack 959575498, win 4088, options [nop,nop,TS val 167118000 ecr 108303252], length 0
01:20:14.654251 IP 10.0.98.12.pnbs > 223.65.141.222.48899: Flags [F.], seq 1, ack 1, win 32070, options [nop,nop,TS val 108303341 ecr 167118000], length 0
01:20:15.920643 IP 95.129.41.153.52796 > 10.0.98.12.pnbs: Flags [FP.], seq 1432258509:1432258565, ack 3381334066, win 1398, options [nop,nop,TS val 4042808866 ecr 108303239], length 56
01:20:15.920654 IP 95.129.41.153.52796 > 10.0.98.12.pnbs: Flags [R.], seq 57, ack 1, win 1398, options [nop,nop,TS val 4042808866 ecr 108303239], length 0
01:20:15.958046 IP 95.129.41.153.52796 > 10.0.98.12.pnbs: Flags [R], seq 1432258509, win 0, length 0
01:20:24.159856 IP 27.36.229.67.48381 > 10.0.98.12.27021: Flags [F.], seq 1809496624, ack 2328055054, win 258, length 0
01:20:24.160222 IP 10.0.98.12.27021 > 27.36.229.67.48381: Flags [F.], seq 1, ack 1, win 32536, length 0
01:20:34.600801 IP 223.65.141.222.48900 > 10.0.98.12.pnbs: Flags [F.], seq 1880767011, ack 2934376396, win 4093, options [nop,nop,TS val 167137929 ecr 108305246], length 0
01:20:34.601189 IP 10.0.98.12.pnbs > 223.65.141.222.48900: Flags [F.], seq 1, ack 1, win 32069, options [nop,nop,TS val 108305336 ecr 167137929], length 0
01:20:36.923316 IP 222.34.19.201.42168 > 10.0.98.12.27021: Flags [R.], seq 104214217, ack 1895724342, win 1040, options [nop,nop,TS val 2913307514 ecr 108304518], length 0
01:21:09.343833 IP 41.132.116.29.52453 > 10.0.98.12.pnbs: Flags [R.], seq 613762949, ack 1839436373, win 0, length 0
01:21:16.032079 IP 169.254.169.254.http > 10.0.0.40.49632: Flags [F.], seq 2410709034, ack 206496987, win 149, options [nop,nop,TS val 1655195480 ecr 234083595], length 0
01:21:16.032162 IP 10.0.0.40.49632 > 169.254.169.254.http: Flags [F.], seq 1, ack 1, win 219, options [nop,nop,TS val 234083596 ecr 1655195480], length 0
01:21:25.796703 IP 116.28.111.173.58158 > 10.0.98.12.pnbs: Flags [R.], seq 1886887950, ack 40973811, win 0, length 0
01:21:26.098512 IP 116.28.111.173.58158 > 10.0.98.12.pnbs: Flags [R], seq 1886887950, win 0, length 0
01:21:28.794349 IP 116.93.87.34.54290 > 10.0.98.12.pnbs: Flags [R.], seq 829013939, ack 399682774, win 0, length 0
01:21:44.415275 IP 106.241.31.236.63971 > 10.0.98.12.pnbs: Flags [R.], seq 3309289627, ack 193974083, win 0, length 0
01:22:46.252666 IP 80.93.28.171.38175 > 10.0.98.12.pnbs: Flags [F.], seq 3792664717, ack 3290102098, win 601, options [nop,nop,TS val 154420341 ecr 108318444], length 0
01:22:46.252711 IP 80.93.28.171.38175 > 10.0.98.12.pnbs: Flags [R.], seq 1, ack 1, win 601, options [nop,nop,TS val 154420341 ecr 108318444], length 0
01:23:05.363296 IP 10.0.98.12.pnbs > 60.50.0.55.56304: Flags [R.], seq 3441036792, ack 626704519, win 0, length 0
01:23:09.985798 IP 220.203.63.32.8389 > 10.0.98.12.27021: Flags [F.], seq 3287922737, ack 3313041914, win 16299, length 0
01:23:09.986231 IP 10.0.98.12.27021 > 220.203.63.32.8389: Flags [F.], seq 1, ack 1, win 32536, length 0
