tcpdump: verbose output suppressed, use -v or -vv for full protocol decode
listening on eth0, link-type EN10MB (Ethernet), capture size 65535 bytes
01:38:00.947820 IP 217.33.71.186.47715 > 10.0.98.12.3389: Flags [SEW], seq 938055381, win 8192, options [mss 1400,nop,wscale 8,nop,nop,sackOK], length 0
01:38:01.616715 IP 217.33.71.186.49332 > 10.0.98.12.3389: Flags [SEW], seq 1394075716, win 8192, options [mss 1400,nop,wscale 8,nop,nop,sackOK], length 0
01:38:02.105988 IP 217.33.71.186.63909 > 10.0.98.12.3389: Flags [S], seq 3051553149, win 8192, options [mss 1400,nop,nop,sackOK], length 0
01:38:03.771156 IP 217.33.71.186.53575 > 10.0.98.12.3389: Flags [SEW], seq 2068494886, win 8192, options [mss 1400,nop,wscale 8,nop,nop,sackOK], length 0
01:38:03.935564 IP 217.33.71.186.47715 > 10.0.98.12.3389: Flags [SEW], seq 938055381, win 8192, options [mss 1400,nop,wscale 8,nop,nop,sackOK], length 0
01:38:04.097423 IP 217.33.71.186.35429 > 10.0.98.12.3389: Flags [S], seq 1277961768, win 8192, options [mss 1400,nop,nop,sackOK], length 0
01:38:04.636232 IP 217.33.71.186.49332 > 10.0.98.12.3389: Flags [SEW], seq 1394075716, win 8192, options [mss 1400,nop,wscale 8,nop,nop,sackOK], length 0
01:38:06.756986 IP 217.33.71.186.53575 > 10.0.98.12.3389: Flags [SEW], seq 2068494886, win 8192, options [mss 1400,nop,wscale 8,nop,nop,sackOK], length 0
01:38:08.148022 IP 217.33.71.186.62086 > 10.0.98.12.3389: Flags [SEW], seq 3483436593, win 8192, options [mss 1400,nop,wscale 8,nop,nop,sackOK], length 0
01:38:09.936654 IP 217.33.71.186.47715 > 10.0.98.12.3389: Flags [S], seq 938055381, win 8192, options [mss 1400,nop,nop,sackOK], length 0
01:38:10.111056 IP 217.33.71.186.33448 > 10.0.98.12.3389: Flags [SEW], seq 264548487, win 8192, options [mss 1400,nop,wscale 8,nop,nop,sackOK], length 0
01:38:10.631438 IP 217.33.71.186.49332 > 10.0.98.12.3389: Flags [S], seq 1394075716, win 8192, options [mss 1400,nop,nop,sackOK], length 0
01:38:11.122568 IP 217.33.71.186.62086 > 10.0.98.12.3389: Flags [SEW], seq 3483436593, win 8192, options [mss 1400,nop,wscale 8,nop,nop,sackOK], length 0
01:38:11.265111 IP 10.0.98.29.59970 > 132.245.144.66.587: Flags [S], seq 3217565448, win 8192, options [mss 1360,nop,wscale 8,nop,nop,sackOK], length 0
01:38:11.265149 IP 107.154.96.51.59970 > 132.245.144.66.587: Flags [S], seq 3217565448, win 8192, options [mss 1360,nop,wscale 8,nop,nop,sackOK], length 0
01:38:11.275092 IP 10.0.98.29.59971 > 132.245.144.66.587: Flags [S], seq 4092626341, win 8192, options [mss 1360,nop,wscale 8,nop,nop,sackOK], length 0
01:38:11.275106 IP 107.154.96.51.59971 > 132.245.144.66.587: Flags [S], seq 4092626341, win 8192, options [mss 1360,nop,wscale 8,nop,nop,sackOK], length 0
01:38:11.355074 IP 10.0.98.29.59972 > 132.245.144.66.587: Flags [S], seq 1235544845, win 8192, options [mss 1360,nop,wscale 8,nop,nop,sackOK], length 0
01:38:11.355095 IP 107.154.96.51.59972 > 132.245.144.66.587: Flags [S], seq 1235544845, win 8192, options [mss 1360,nop,wscale 8,nop,nop,sackOK], length 0
01:38:12.317249 IP 217.33.71.186.37895 > 10.0.98.12.3389: Flags [SEW], seq 3784976448, win 8192, options [mss 1400,nop,wscale 8,nop,nop,sackOK], length 0
01:38:12.768412 IP 217.33.71.186.53575 > 10.0.98.12.3389: Flags [S], seq 2068494886, win 8192, options [mss 1400,nop,nop,sackOK], length 0
01:38:13.133453 IP 217.33.71.186.33448 > 10.0.98.12.3389: Flags [SEW], seq 264548487, win 8192, options [mss 1400,nop,wscale 8,nop,nop,sackOK], length 0
01:38:14.261987 IP 10.0.98.29.59970 > 132.245.144.66.587: Flags [S], seq 3217565448, win 8192, options [mss 1360,nop,wscale 8,nop,nop,sackOK], length 0
01:38:14.262007 IP 107.154.96.51.59970 > 132.245.144.66.587: Flags [S], seq 3217565448, win 8192, options [mss 1360,nop,wscale 8,nop,nop,sackOK], length 0
01:38:14.270918 IP 10.0.98.29.59971 > 132.245.144.66.587: Flags [S], seq 4092626341, win 8192, options [mss 1360,nop,wscale 8,nop,nop,sackOK], length 0
01:38:14.270927 IP 107.154.96.51.59971 > 132.245.144.66.587: Flags [S], seq 4092626341, win 8192, options [mss 1360,nop,wscale 8,nop,nop,sackOK], length 0
01:38:14.351985 IP 10.0.98.29.59972 > 132.245.144.66.587: Flags [S], seq 1235544845, win 8192, options [mss 1360,nop,wscale 8,nop,nop,sackOK], length 0
01:38:14.351998 IP 107.154.96.51.59972 > 132.245.144.66.587: Flags [S], seq 1235544845, win 8192, options [mss 1360,nop,wscale 8,nop,nop,sackOK], length 0
01:38:15.292794 IP 217.33.71.186.37895 > 10.0.98.12.3389: Flags [SEW], seq 3784976448, win 8192, options [mss 1400,nop,wscale 8,nop,nop,sackOK], length 0
01:38:16.634212 IP 217.33.71.186.46383 > 10.0.98.12.3389: Flags [SEW], seq 2803729532, win 8192, options [mss 1400,nop,wscale 8,nop,nop,sackOK], length 0
01:38:17.125604 IP 217.33.71.186.62086 > 10.0.98.12.3389: Flags [S], seq 3483436593, win 8192, options [mss 1400,nop,nop,sackOK], length 0
01:38:18.766508 IP 217.33.71.186.50698 > 10.0.98.12.3389: Flags [SEW], seq 3375208465, win 8192, options [mss 1400,nop,wscale 8,nop,nop,sackOK], length 0
01:38:19.106459 IP 217.33.71.186.33448 > 10.0.98.12.3389: Flags [S], seq 264548487, win 8192, options [mss 1400,nop,nop,sackOK], length 0
01:38:19.641857 IP 217.33.71.186.46383 > 10.0.98.12.3389: Flags [SEW], seq 2803729532, win 8192, options [mss 1400,nop,wscale 8,nop,nop,sackOK], length 0
01:38:20.262158 IP 10.0.98.29.59970 > 132.245.144.66.587: Flags [S], seq 3217565448, win 8192, options [mss 1360,nop,nop,sackOK], length 0
01:38:20.262184 IP 107.154.96.51.59970 > 132.245.144.66.587: Flags [S], seq 3217565448, win 8192, options [mss 1360,nop,nop,sackOK], length 0
01:38:20.273109 IP 10.0.98.29.59971 > 132.245.144.66.587: Flags [S], seq 4092626341, win 8192, options [mss 1360,nop,nop,sackOK], length 0
01:38:20.273127 IP 107.154.96.51.59971 > 132.245.144.66.587: Flags [S], seq 4092626341, win 8192, options [mss 1360,nop,nop,sackOK], length 0
01:38:20.348133 IP 10.0.98.29.59972 > 132.245.144.66.587: Flags [S], seq 1235544845, win 8192, options [mss 1360,nop,nop,sackOK], length 0
01:38:20.348151 IP 107.154.96.51.59972 > 132.245.144.66.587: Flags [S], seq 1235544845, win 8192, options [mss 1360,nop,nop,sackOK], length 0
01:38:20.844639 IP 217.33.71.186.54971 > 10.0.98.12.3389: Flags [SEW], seq 707204206, win 8192, options [mss 1400,nop,wscale 8,nop,nop,sackOK], length 0
01:38:21.389549 IP 217.33.71.186.37895 > 10.0.98.12.3389: Flags [S], seq 3784976448, win 8192, options [mss 1400,nop,nop,sackOK], length 0
01:38:21.761759 IP 217.33.71.186.50698 > 10.0.98.12.3389: Flags [SEW], seq 3375208465, win 8192, options [mss 1400,nop,wscale 8,nop,nop,sackOK], length 0
01:38:23.845428 IP 217.33.71.186.54971 > 10.0.98.12.3389: Flags [SEW], seq 707204206, win 8192, options [mss 1400,nop,wscale 8,nop,nop,sackOK], length 0
01:38:25.108726 IP 217.33.71.186.63276 > 10.0.98.12.3389: Flags [SEW], seq 2397627676, win 8192, options [mss 1400,nop,wscale 8,nop,nop,sackOK], length 0
01:38:25.662137 IP 217.33.71.186.46383 > 10.0.98.12.3389: Flags [S], seq 2803729532, win 8192, options [mss 1400,nop,nop,sackOK], length 0
01:38:27.313824 IP 217.33.71.186.34969 > 10.0.98.12.3389: Flags [SEW], seq 910416583, win 8192, options [mss 1400,nop,wscale 8,nop,nop,sackOK], length 0
01:38:27.854210 IP 217.33.71.186.50698 > 10.0.98.12.3389: Flags [S], seq 3375208465, win 8192, options [mss 1400,nop,nop,sackOK], length 0
01:38:28.169189 IP 217.33.71.186.63276 > 10.0.98.12.3389: Flags [SEW], seq 2397627676, win 8192, options [mss 1400,nop,wscale 8,nop,nop,sackOK], length 0
01:38:29.419907 IP 217.33.71.186.40342 > 10.0.98.12.3389: Flags [SEW], seq 198875327, win 8192, options [mss 1400,nop,wscale 8,nop,nop,sackOK], length 0
01:38:29.838219 IP 217.33.71.186.54971 > 10.0.98.12.3389: Flags [S], seq 707204206, win 8192, options [mss 1400,nop,nop,sackOK], length 0
01:38:30.352676 IP 217.33.71.186.34969 > 10.0.98.12.3389: Flags [SEW], seq 910416583, win 8192, options [mss 1400,nop,wscale 8,nop,nop,sackOK], length 0
01:38:30.474151 IP 36.83.137.153.60758 > 10.0.98.12.6124: Flags [S], seq 3472787582, win 8192, options [mss 1400,nop,wscale 8,nop,nop,sackOK], length 0
01:38:32.262651 IP 10.0.98.29.59970 > 40.100.152.130.587: Flags [S], seq 4204391266, win 8192, options [mss 1360,nop,wscale 8,nop,nop,sackOK], length 0
01:38:32.262698 IP 107.154.96.51.59970 > 40.100.152.130.587: Flags [S], seq 4204391266, win 8192, options [mss 1360,nop,wscale 8,nop,nop,sackOK], length 0
01:38:32.276591 IP 10.0.98.29.59971 > 40.100.152.130.587: Flags [S], seq 601087891, win 8192, options [mss 1360,nop,wscale 8,nop,nop,sackOK], length 0
01:38:32.276618 IP 107.154.96.51.59971 > 40.100.152.130.587: Flags [S], seq 601087891, win 8192, options [mss 1360,nop,wscale 8,nop,nop,sackOK], length 0
01:38:32.352653 IP 10.0.98.29.59972 > 40.100.152.130.587: Flags [S], seq 2527033170, win 8192, options [mss 1360,nop,wscale 8,nop,nop,sackOK], length 0
01:38:32.352670 IP 107.154.96.51.59972 > 40.100.152.130.587: Flags [S], seq 2527033170, win 8192, options [mss 1360,nop,wscale 8,nop,nop,sackOK], length 0
01:38:32.411098 IP 217.33.71.186.40342 > 10.0.98.12.3389: Flags [SEW], seq 198875327, win 8192, options [mss 1400,nop,wscale 8,nop,nop,sackOK], length 0
01:38:33.473259 IP 36.83.137.153.60758 > 10.0.98.12.6124: Flags [S], seq 3472787582, win 8192, options [mss 1400,nop,wscale 8,nop,nop,sackOK], length 0
01:38:33.782186 IP 217.33.71.186.48795 > 10.0.98.12.3389: Flags [SEW], seq 3161925453, win 8192, options [mss 1400,nop,wscale 8,nop,nop,sackOK], length 0
01:38:34.156186 IP 217.33.71.186.63276 > 10.0.98.12.3389: Flags [S], seq 2397627676, win 8192, options [mss 1400,nop,nop,sackOK], length 0
01:38:35.260624 IP 10.0.98.29.59970 > 40.100.152.130.587: Flags [S], seq 4204391266, win 8192, options [mss 1360,nop,wscale 8,nop,nop,sackOK], length 0
01:38:35.260649 IP 107.154.96.51.59970 > 40.100.152.130.587: Flags [S], seq 4204391266, win 8192, options [mss 1360,nop,wscale 8,nop,nop,sackOK], length 0
01:38:35.276587 IP 10.0.98.29.59971 > 40.100.152.130.587: Flags [S], seq 601087891, win 8192, options [mss 1360,nop,wscale 8,nop,nop,sackOK], length 0
01:38:35.276600 IP 107.154.96.51.59971 > 40.100.152.130.587: Flags [S], seq 601087891, win 8192, options [mss 1360,nop,wscale 8,nop,nop,sackOK], length 0
01:38:35.357621 IP 10.0.98.29.59972 > 40.100.152.130.587: Flags [S], seq 2527033170, win 8192, options [mss 1360,nop,wscale 8,nop,nop,sackOK], length 0
01:38:35.357629 IP 107.154.96.51.59972 > 40.100.152.130.587: Flags [S], seq 2527033170, win 8192, options [mss 1360,nop,wscale 8,nop,nop,sackOK], length 0
01:38:35.843216 IP 217.33.71.186.53126 > 10.0.98.12.3389: Flags [SEW], seq 256482089, win 8192, options [mss 1400,nop,wscale 8,nop,nop,sackOK], length 0
01:38:36.406461 IP 217.33.71.186.34969 > 10.0.98.12.3389: Flags [S], seq 910416583, win 8192, options [mss 1400,nop,nop,sackOK], length 0
01:38:36.793891 IP 217.33.71.186.48795 > 10.0.98.12.3389: Flags [SEW], seq 3161925453, win 8192, options [mss 1400,nop,wscale 8,nop,nop,sackOK], length 0
01:38:37.996622 IP 217.33.71.186.57453 > 10.0.98.12.3389: Flags [SEW], seq 326483171, win 8192, options [mss 1400,nop,wscale 8,nop,nop,sackOK], length 0
01:38:38.430136 IP 217.33.71.186.40342 > 10.0.98.12.3389: Flags [S], seq 198875327, win 8192, options [mss 1400,nop,nop,sackOK], length 0
01:38:38.869549 IP 217.33.71.186.53126 > 10.0.98.12.3389: Flags [SEW], seq 256482089, win 8192, options [mss 1400,nop,wscale 8,nop,nop,sackOK], length 0
01:38:39.473273 IP 36.83.137.153.60758 > 10.0.98.12.6124: Flags [S], seq 3472787582, win 8192, options [mss 1400,nop,nop,sackOK], length 0
01:38:41.010968 IP 217.33.71.186.57453 > 10.0.98.12.3389: Flags [SEW], seq 326483171, win 8192, options [mss 1400,nop,wscale 8,nop,nop,sackOK], length 0
01:38:41.260839 IP 10.0.98.29.59970 > 40.100.152.130.587: Flags [S], seq 4204391266, win 8192, options [mss 1360,nop,nop,sackOK], length 0
01:38:41.260867 IP 107.154.96.51.59970 > 40.100.152.130.587: Flags [S], seq 4204391266, win 8192, options [mss 1360,nop,nop,sackOK], length 0
01:38:41.276795 IP 10.0.98.29.59971 > 40.100.152.130.587: Flags [S], seq 601087891, win 8192, options [mss 1360,nop,nop,sackOK], length 0
01:38:41.276811 IP 107.154.96.51.59971 > 40.100.152.130.587: Flags [S], seq 601087891, win 8192, options [mss 1360,nop,nop,sackOK], length 0
01:38:41.357815 IP 10.0.98.29.59972 > 40.100.152.130.587: Flags [S], seq 2527033170, win 8192, options [mss 1360,nop,nop,sackOK], length 0
01:38:41.357833 IP 107.154.96.51.59972 > 40.100.152.130.587: Flags [S], seq 2527033170, win 8192, options [mss 1360,nop,nop,sackOK], length 0
01:38:42.324649 IP 217.33.71.186.33060 > 10.0.98.12.3389: Flags [SEW], seq 2638477022, win 8192, options [mss 1400,nop,wscale 8,nop,nop,sackOK], length 0
01:38:42.791684 IP 217.33.71.186.48795 > 10.0.98.12.3389: Flags [S], seq 3161925453, win 8192, options [mss 1400,nop,nop,sackOK], length 0
01:38:44.444294 IP 217.33.71.186.37335 > 10.0.98.12.3389: Flags [SEW], seq 3908545194, win 8192, options [mss 1400,nop,wscale 8,nop,nop,sackOK], length 0
01:38:44.900906 IP 217.33.71.186.53126 > 10.0.98.12.3389: Flags [S], seq 256482089, win 8192, options [mss 1400,nop,nop,sackOK], length 0
01:38:45.310705 IP 217.33.71.186.33060 > 10.0.98.12.3389: Flags [SEW], seq 2638477022, win 8192, options [mss 1400,nop,wscale 8,nop,nop,sackOK], length 0
01:38:46.584703 IP 217.33.71.186.41773 > 10.0.98.12.3389: Flags [SEW], seq 1861128482, win 8192, options [mss 1400,nop,wscale 8,nop,nop,sackOK], length 0
01:38:47.027084 IP 217.33.71.186.57453 > 10.0.98.12.3389: Flags [S], seq 326483171, win 8192, options [mss 1400,nop,nop,sackOK], length 0
01:38:47.436746 IP 217.33.71.186.37335 > 10.0.98.12.3389: Flags [SEW], seq 3908545194, win 8192, options [mss 1400,nop,wscale 8,nop,nop,sackOK], length 0
01:38:49.584632 IP 217.33.71.186.41773 > 10.0.98.12.3389: Flags [SEW], seq 1861128482, win 8192, options [mss 1400,nop,wscale 8,nop,nop,sackOK], length 0
01:38:50.868652 IP 217.33.71.186.49984 > 10.0.98.12.3389: Flags [SEW], seq 1323934453, win 8192, options [mss 1400,nop,wscale 8,nop,nop,sackOK], length 0
01:38:51.318155 IP 217.33.71.186.33060 > 10.0.98.12.3389: Flags [S], seq 2638477022, win 8192, options [mss 1400,nop,nop,sackOK], length 0
01:38:53.001377 IP 217.33.71.186.54527 > 10.0.98.12.3389: Flags [SEW], seq 449876609, win 8192, options [mss 1400,nop,wscale 8,nop,nop,sackOK], length 0
01:38:53.266354 IP 10.0.98.29.59970 > 40.100.154.34.587: Flags [S], seq 668763427, win 8192, options [mss 1360,nop,wscale 8,nop,nop,sackOK], length 0
01:38:53.266381 IP 107.154.96.51.59970 > 40.100.154.34.587: Flags [S], seq 668763427, win 8192, options [mss 1360,nop,wscale 8,nop,nop,sackOK], length 0
01:38:53.277230 IP 10.0.98.29.59971 > 40.100.154.34.587: Flags [S], seq 339854099, win 8192, options [mss 1360,nop,wscale 8,nop,nop,sackOK], length 0
01:38:53.277245 IP 107.154.96.51.59971 > 40.100.154.34.587: Flags [S], seq 339854099, win 8192, options [mss 1360,nop,wscale 8,nop,nop,sackOK], length 0
01:38:53.358315 IP 10.0.98.29.59972 > 40.100.154.34.587: Flags [S], seq 2882448275, win 8192, options [mss 1360,nop,wscale 8,nop,nop,sackOK], length 0
01:38:53.358346 IP 107.154.96.51.59972 > 40.100.154.34.587: Flags [S], seq 2882448275, win 8192, options [mss 1360,nop,wscale 8,nop,nop,sackOK], length 0
01:38:53.430070 IP 217.33.71.186.37335 > 10.0.98.12.3389: Flags [S], seq 3908545194, win 8192, options [mss 1400,nop,nop,sackOK], length 0
01:38:53.855516 IP 217.33.71.186.49984 > 10.0.98.12.3389: Flags [SEW], seq 1323934453, win 8192, options [mss 1400,nop,wscale 8,nop,nop,sackOK], length 0
01:38:55.588706 IP 217.33.71.186.41773 > 10.0.98.12.3389: Flags [S], seq 1861128482, win 8192, options [mss 1400,nop,nop,sackOK], length 0
01:38:55.994240 IP 217.33.71.186.54527 > 10.0.98.12.3389: Flags [SEW], seq 449876609, win 8192, options [mss 1400,nop,wscale 8,nop,nop,sackOK], length 0
01:38:56.267294 IP 10.0.98.29.59970 > 40.100.154.34.587: Flags [S], seq 668763427, win 8192, options [mss 1360,nop,wscale 8,nop,nop,sackOK], length 0
01:38:56.267322 IP 107.154.96.51.59970 > 40.100.154.34.587: Flags [S], seq 668763427, win 8192, options [mss 1360,nop,wscale 8,nop,nop,sackOK], length 0
01:38:56.276234 IP 10.0.98.29.59971 > 40.100.154.34.587: Flags [S], seq 339854099, win 8192, options [mss 1360,nop,wscale 8,nop,nop,sackOK], length 0
01:38:56.276246 IP 107.154.96.51.59971 > 40.100.154.34.587: Flags [S], seq 339854099, win 8192, options [mss 1360,nop,wscale 8,nop,nop,sackOK], length 0
01:38:56.356237 IP 10.0.98.29.59972 > 40.100.154.34.587: Flags [S], seq 2882448275, win 8192, options [mss 1360,nop,wscale 8,nop,nop,sackOK], length 0
01:38:56.356246 IP 107.154.96.51.59972 > 40.100.154.34.587: Flags [S], seq 2882448275, win 8192, options [mss 1360,nop,wscale 8,nop,nop,sackOK], length 0
01:38:59.471560 IP 217.33.71.186.36635 > 10.0.98.12.3389: Flags [SEW], seq 2224504981, win 8192, options [mss 1400,nop,wscale 8,nop,nop,sackOK], length 0
01:38:59.857502 IP 217.33.71.186.49984 > 10.0.98.12.3389: Flags [S], seq 1323934453, win 8192, options [mss 1400,nop,nop,sackOK], length 0
01:39:01.568931 IP 217.33.71.186.42718 > 10.0.98.12.3389: Flags [SEW], seq 3287570838, win 8192, options [mss 1400,nop,wscale 8,nop,nop,sackOK], length 0
01:39:02.011381 IP 217.33.71.186.54527 > 10.0.98.12.3389: Flags [S], seq 449876609, win 8192, options [mss 1400,nop,nop,sackOK], length 0
01:39:02.267428 IP 10.0.98.29.59970 > 40.100.154.34.587: Flags [S], seq 668763427, win 8192, options [mss 1360,nop,nop,sackOK], length 0
01:39:02.267461 IP 107.154.96.51.59970 > 40.100.154.34.587: Flags [S], seq 668763427, win 8192, options [mss 1360,nop,nop,sackOK], length 0
01:39:02.276381 IP 10.0.98.29.59971 > 40.100.154.34.587: Flags [S], seq 339854099, win 8192, options [mss 1360,nop,nop,sackOK], length 0
01:39:02.276394 IP 107.154.96.51.59971 > 40.100.154.34.587: Flags [S], seq 339854099, win 8192, options [mss 1360,nop,nop,sackOK], length 0
01:39:02.357404 IP 10.0.98.29.59972 > 40.100.154.34.587: Flags [S], seq 2882448275, win 8192, options [mss 1360,nop,nop,sackOK], length 0
01:39:02.357417 IP 107.154.96.51.59972 > 40.100.154.34.587: Flags [S], seq 2882448275, win 8192, options [mss 1360,nop,nop,sackOK], length 0
01:39:02.624177 IP 217.33.71.186.36635 > 10.0.98.12.3389: Flags [SEW], seq 2224504981, win 8192, options [mss 1400,nop,wscale 8,nop,nop,sackOK], length 0
01:39:04.616468 IP 217.33.71.186.42718 > 10.0.98.12.3389: Flags [SEW], seq 3287570838, win 8192, options [mss 1400,nop,wscale 8,nop,nop,sackOK], length 0
01:39:06.062271 IP 223.207.243.110.50275 > 10.0.98.29.6124: Flags [S], seq 1186659399, win 8192, options [mss 1400,nop,wscale 8,nop,nop,sackOK], length 0
01:39:07.305372 IP 36.83.137.153.60850 > 10.0.98.12.6124: Flags [S], seq 2865923803, win 8192, options [mss 1400,nop,wscale 8,nop,nop,sackOK], length 0
01:39:08.015112 IP 217.33.71.186.59162 > 10.0.98.12.3389: Flags [SEW], seq 3230515106, win 8192, options [mss 1400,nop,wscale 8,nop,nop,sackOK], length 0
01:39:08.620613 IP 217.33.71.186.36635 > 10.0.98.12.3389: Flags [S], seq 2224504981, win 8192, options [mss 1400,nop,nop,sackOK], length 0
01:39:09.069485 IP 223.207.243.110.50275 > 10.0.98.29.6124: Flags [S], seq 1186659399, win 8192, options [mss 1400,nop,wscale 8,nop,nop,sackOK], length 0
01:39:10.301325 IP 36.83.137.153.60850 > 10.0.98.12.6124: Flags [S], seq 2865923803, win 8192, options [mss 1400,nop,wscale 8,nop,nop,sackOK], length 0
01:39:10.664741 IP 217.33.71.186.42718 > 10.0.98.12.3389: Flags [S], seq 3287570838, win 8192, options [mss 1400,nop,nop,sackOK], length 0
01:39:11.088164 IP 217.33.71.186.59162 > 10.0.98.12.3389: Flags [SEW], seq 3230515106, win 8192, options [mss 1400,nop,wscale 8,nop,nop,sackOK], length 0
01:39:14.269900 IP 10.0.98.29.59970 > 40.100.154.162.587: Flags [S], seq 149803577, win 8192, options [mss 1360,nop,wscale 8,nop,nop,sackOK], length 0
01:39:14.269937 IP 107.154.96.51.59970 > 40.100.154.162.587: Flags [S], seq 149803577, win 8192, options [mss 1360,nop,wscale 8,nop,nop,sackOK], length 0
01:39:14.274810 IP 10.0.98.29.59971 > 40.100.154.162.587: Flags [S], seq 1622794435, win 8192, options [mss 1360,nop,wscale 8,nop,nop,sackOK], length 0
01:39:14.274826 IP 107.154.96.51.59971 > 40.100.154.162.587: Flags [S], seq 1622794435, win 8192, options [mss 1360,nop,wscale 8,nop,nop,sackOK], length 0
01:39:14.354845 IP 10.0.98.29.59972 > 40.100.154.162.587: Flags [S], seq 4133968107, win 8192, options [mss 1360,nop,wscale 8,nop,nop,sackOK], length 0
01:39:14.354868 IP 107.154.96.51.59972 > 40.100.154.162.587: Flags [S], seq 4133968107, win 8192, options [mss 1360,nop,wscale 8,nop,nop,sackOK], length 0
01:39:15.068732 IP 223.207.243.110.50275 > 10.0.98.29.6124: Flags [S], seq 1186659399, win 8192, options [mss 1400,nop,nop,sackOK], length 0
01:39:16.297899 IP 36.83.137.153.60850 > 10.0.98.12.6124: Flags [S], seq 2865923803, win 8192, options [mss 1400,nop,nop,sackOK], length 0
01:39:16.588089 IP 217.33.71.186.46986 > 10.0.98.12.3389: Flags [SEW], seq 1526901926, win 8192, options [mss 1400,nop,wscale 8,nop,nop,sackOK], length 0
01:39:17.184161 IP 217.33.71.186.59162 > 10.0.98.12.3389: Flags [S], seq 3230515106, win 8192, options [mss 1400,nop,nop,sackOK], length 0
01:39:17.264886 IP 10.0.98.29.59970 > 40.100.154.162.587: Flags [S], seq 149803577, win 8192, options [mss 1360,nop,wscale 8,nop,nop,sackOK], length 0
01:39:17.264906 IP 107.154.96.51.59970 > 40.100.154.162.587: Flags [S], seq 149803577, win 8192, options [mss 1360,nop,wscale 8,nop,nop,sackOK], length 0
01:39:17.274852 IP 10.0.98.29.59971 > 40.100.154.162.587: Flags [S], seq 1622794435, win 8192, options [mss 1360,nop,wscale 8,nop,nop,sackOK], length 0
01:39:17.274872 IP 107.154.96.51.59971 > 40.100.154.162.587: Flags [S], seq 1622794435, win 8192, options [mss 1360,nop,wscale 8,nop,nop,sackOK], length 0
01:39:17.354849 IP 10.0.98.29.59972 > 40.100.154.162.587: Flags [S], seq 4133968107, win 8192, options [mss 1360,nop,wscale 8,nop,nop,sackOK], length 0
01:39:17.354860 IP 107.154.96.51.59972 > 40.100.154.162.587: Flags [S], seq 4133968107, win 8192, options [mss 1360,nop,wscale 8,nop,nop,sackOK], length 0
01:39:19.590414 IP 217.33.71.186.46986 > 10.0.98.12.3389: Flags [SEW], seq 1526901926, win 8192, options [mss 1400,nop,wscale 8,nop,nop,sackOK], length 0
01:39:23.262029 IP 10.0.98.29.59970 > 40.100.154.162.587: Flags [S], seq 149803577, win 8192, options [mss 1360,nop,nop,sackOK], length 0
01:39:23.262050 IP 107.154.96.51.59970 > 40.100.154.162.587: Flags [S], seq 149803577, win 8192, options [mss 1360,nop,nop,sackOK], length 0
01:39:23.274982 IP 10.0.98.29.59971 > 40.100.154.162.587: Flags [S], seq 1622794435, win 8192, options [mss 1360,nop,nop,sackOK], length 0
01:39:23.274993 IP 107.154.96.51.59971 > 40.100.154.162.587: Flags [S], seq 1622794435, win 8192, options [mss 1360,nop,nop,sackOK], length 0
01:39:23.355024 IP 10.0.98.29.59972 > 40.100.154.162.587: Flags [S], seq 4133968107, win 8192, options [mss 1360,nop,nop,sackOK], length 0
01:39:23.355038 IP 107.154.96.51.59972 > 40.100.154.162.587: Flags [S], seq 4133968107, win 8192, options [mss 1360,nop,nop,sackOK], length 0
01:39:25.606819 IP 217.33.71.186.46986 > 10.0.98.12.3389: Flags [S], seq 1526901926, win 8192, options [mss 1400,nop,nop,sackOK], length 0
01:39:27.274220 IP 171.5.250.216.16380 > 10.0.98.12.6124: Flags [S], seq 2710512595, win 16384, options [mss 1400,nop,nop,sackOK], length 0
01:39:30.216209 IP 171.5.250.216.16380 > 10.0.98.12.6124: Flags [S], seq 2710512595, win 16384, options [mss 1400,nop,nop,sackOK], length 0
01:39:35.270589 IP 10.0.98.29.59970 > 40.100.156.2.587: Flags [S], seq 973733511, win 8192, options [mss 1360,nop,wscale 8,nop,nop,sackOK], length 0
01:39:35.270620 IP 107.154.96.51.59970 > 40.100.156.2.587: Flags [S], seq 973733511, win 8192, options [mss 1360,nop,wscale 8,nop,nop,sackOK], length 0
01:39:35.274542 IP 10.0.98.29.59971 > 40.100.156.2.587: Flags [S], seq 265862900, win 8192, options [mss 1360,nop,wscale 8,nop,nop,sackOK], length 0
01:39:35.274561 IP 107.154.96.51.59971 > 40.100.156.2.587: Flags [S], seq 265862900, win 8192, options [mss 1360,nop,wscale 8,nop,nop,sackOK], length 0
01:39:35.355494 IP 10.0.98.29.59972 > 40.100.156.2.587: Flags [S], seq 1841118509, win 8192, options [mss 1360,nop,wscale 8,nop,nop,sackOK], length 0
01:39:35.355533 IP 107.154.96.51.59972 > 40.100.156.2.587: Flags [S], seq 1841118509, win 8192, options [mss 1360,nop,wscale 8,nop,nop,sackOK], length 0
01:39:36.251973 IP 171.5.250.216.16380 > 10.0.98.12.6124: Flags [S], seq 2710512595, win 16384, options [mss 1400,nop,nop,sackOK], length 0
01:39:38.264479 IP 10.0.98.29.59970 > 40.100.156.2.587: Flags [S], seq 973733511, win 8192, options [mss 1360,nop,wscale 8,nop,nop,sackOK], length 0
01:39:38.264502 IP 107.154.96.51.59970 > 40.100.156.2.587: Flags [S], seq 973733511, win 8192, options [mss 1360,nop,wscale 8,nop,nop,sackOK], length 0
01:39:38.275479 IP 10.0.98.29.59971 > 40.100.156.2.587: Flags [S], seq 265862900, win 8192, options [mss 1360,nop,wscale 8,nop,nop,sackOK], length 0
01:39:38.275494 IP 107.154.96.51.59971 > 40.100.156.2.587: Flags [S], seq 265862900, win 8192, options [mss 1360,nop,wscale 8,nop,nop,sackOK], length 0
01:39:38.359483 IP 10.0.98.29.59972 > 40.100.156.2.587: Flags [S], seq 1841118509, win 8192, options [mss 1360,nop,wscale 8,nop,nop,sackOK], length 0
01:39:38.359495 IP 107.154.96.51.59972 > 40.100.156.2.587: Flags [S], seq 1841118509, win 8192, options [mss 1360,nop,wscale 8,nop,nop,sackOK], length 0
01:39:44.268715 IP 10.0.98.29.59970 > 40.100.156.2.587: Flags [S], seq 973733511, win 8192, options [mss 1360,nop,nop,sackOK], length 0
01:39:44.268753 IP 107.154.96.51.59970 > 40.100.156.2.587: Flags [S], seq 973733511, win 8192, options [mss 1360,nop,nop,sackOK], length 0
01:39:44.275638 IP 10.0.98.29.59971 > 40.100.156.2.587: Flags [S], seq 265862900, win 8192, options [mss 1360,nop,nop,sackOK], length 0
01:39:44.275654 IP 107.154.96.51.59971 > 40.100.156.2.587: Flags [S], seq 265862900, win 8192, options [mss 1360,nop,nop,sackOK], length 0
01:39:44.358688 IP 10.0.98.29.59972 > 40.100.156.2.587: Flags [S], seq 1841118509, win 8192, options [mss 1360,nop,nop,sackOK], length 0
01:39:44.358697 IP 107.154.96.51.59972 > 40.100.156.2.587: Flags [S], seq 1841118509, win 8192, options [mss 1360,nop,nop,sackOK], length 0
01:39:55.148383 IP 78.84.186.166.63093 > 10.0.98.29.6124: Flags [S], seq 1922102545, win 8192, options [mss 1400,nop,wscale 8,nop,nop,sackOK], length 0
01:39:56.266200 IP 10.0.98.29.59970 > 40.100.156.18.587: Flags [S], seq 1850853760, win 8192, options [mss 1360,nop,wscale 8,nop,nop,sackOK], length 0
01:39:56.266228 IP 107.154.96.51.59970 > 40.100.156.18.587: Flags [S], seq 1850853760, win 8192, options [mss 1360,nop,wscale 8,nop,nop,sackOK], length 0
01:39:56.278218 IP 10.0.98.29.59971 > 40.100.156.18.587: Flags [S], seq 4119622860, win 8192, options [mss 1360,nop,wscale 8,nop,nop,sackOK], length 0
01:39:56.278233 IP 107.154.96.51.59971 > 40.100.156.18.587: Flags [S], seq 4119622860, win 8192, options [mss 1360,nop,wscale 8,nop,nop,sackOK], length 0
01:39:56.357208 IP 10.0.98.29.59972 > 40.100.156.18.587: Flags [S], seq 4124198553, win 8192, options [mss 1360,nop,wscale 8,nop,nop,sackOK], length 0
01:39:56.357235 IP 107.154.96.51.59972 > 40.100.156.18.587: Flags [S], seq 4124198553, win 8192, options [mss 1360,nop,wscale 8,nop,nop,sackOK], length 0
01:39:58.237197 IP 78.84.186.166.63093 > 10.0.98.29.6124: Flags [S], seq 1922102545, win 8192, options [mss 1400,nop,wscale 8,nop,nop,sackOK], length 0
01:39:59.269131 IP 10.0.98.29.59970 > 40.100.156.18.587: Flags [S], seq 1850853760, win 8192, options [mss 1360,nop,wscale 8,nop,nop,sackOK], length 0
01:39:59.269160 IP 107.154.96.51.59970 > 40.100.156.18.587: Flags [S], seq 1850853760, win 8192, options [mss 1360,nop,wscale 8,nop,nop,sackOK], length 0
01:39:59.278122 IP 10.0.98.29.59971 > 40.100.156.18.587: Flags [S], seq 4119622860, win 8192, options [mss 1360,nop,wscale 8,nop,nop,sackOK], length 0
01:39:59.278132 IP 107.154.96.51.59971 > 40.100.156.18.587: Flags [S], seq 4119622860, win 8192, options [mss 1360,nop,wscale 8,nop,nop,sackOK], length 0
01:39:59.357095 IP 10.0.98.29.59972 > 40.100.156.18.587: Flags [S], seq 4124198553, win 8192, options [mss 1360,nop,wscale 8,nop,nop,sackOK], length 0
01:39:59.357102 IP 107.154.96.51.59972 > 40.100.156.18.587: Flags [S], seq 4124198553, win 8192, options [mss 1360,nop,wscale 8,nop,nop,sackOK], length 0
01:40:04.243677 IP 78.84.186.166.63093 > 10.0.98.29.6124: Flags [S], seq 1922102545, win 8192, options [mss 1400,nop,nop,sackOK], length 0
01:40:05.264309 IP 10.0.98.29.59970 > 40.100.156.18.587: Flags [S], seq 1850853760, win 8192, options [mss 1360,nop,nop,sackOK], length 0
01:40:05.264338 IP 107.154.96.51.59970 > 40.100.156.18.587: Flags [S], seq 1850853760, win 8192, options [mss 1360,nop,nop,sackOK], length 0
01:40:05.275256 IP 10.0.98.29.59971 > 40.100.156.18.587: Flags [S], seq 4119622860, win 8192, options [mss 1360,nop,nop,sackOK], length 0
01:40:05.275267 IP 107.154.96.51.59971 > 40.100.156.18.587: Flags [S], seq 4119622860, win 8192, options [mss 1360,nop,nop,sackOK], length 0
01:40:05.358299 IP 10.0.98.29.59972 > 40.100.156.18.587: Flags [S], seq 4124198553, win 8192, options [mss 1360,nop,nop,sackOK], length 0
01:40:05.358316 IP 107.154.96.51.59972 > 40.100.156.18.587: Flags [S], seq 4124198553, win 8192, options [mss 1360,nop,nop,sackOK], length 0
01:40:17.267924 IP 10.0.98.29.59970 > 40.100.156.114.587: Flags [S], seq 3572615493, win 8192, options [mss 1360,nop,wscale 8,nop,nop,sackOK], length 0
01:40:17.267958 IP 107.154.96.51.59970 > 40.100.156.114.587: Flags [S], seq 3572615493, win 8192, options [mss 1360,nop,wscale 8,nop,nop,sackOK], length 0
01:40:17.282826 IP 10.0.98.29.59971 > 40.100.156.114.587: Flags [S], seq 418256089, win 8192, options [mss 1360,nop,wscale 8,nop,nop,sackOK], length 0
01:40:17.282854 IP 107.154.96.51.59971 > 40.100.156.114.587: Flags [S], seq 418256089, win 8192, options [mss 1360,nop,wscale 8,nop,nop,sackOK], length 0
01:40:17.358853 IP 10.0.98.29.59972 > 40.100.156.114.587: Flags [S], seq 4249350756, win 8192, options [mss 1360,nop,wscale 8,nop,nop,sackOK], length 0
01:40:17.358867 IP 107.154.96.51.59972 > 40.100.156.114.587: Flags [S], seq 4249350756, win 8192, options [mss 1360,nop,wscale 8,nop,nop,sackOK], length 0
01:40:20.264767 IP 10.0.98.29.59970 > 40.100.156.114.587: Flags [S], seq 3572615493, win 8192, options [mss 1360,nop,wscale 8,nop,nop,sackOK], length 0
01:40:20.264793 IP 107.154.96.51.59970 > 40.100.156.114.587: Flags [S], seq 3572615493, win 8192, options [mss 1360,nop,wscale 8,nop,nop,sackOK], length 0
01:40:20.283713 IP 10.0.98.29.59971 > 40.100.156.114.587: Flags [S], seq 418256089, win 8192, options [mss 1360,nop,wscale 8,nop,nop,sackOK], length 0
01:40:20.283736 IP 107.154.96.51.59971 > 40.100.156.114.587: Flags [S], seq 418256089, win 8192, options [mss 1360,nop,wscale 8,nop,nop,sackOK], length 0
01:40:20.358747 IP 10.0.98.29.59972 > 40.100.156.114.587: Flags [S], seq 4249350756, win 8192, options [mss 1360,nop,wscale 8,nop,nop,sackOK], length 0
01:40:20.358770 IP 107.154.96.51.59972 > 40.100.156.114.587: Flags [S], seq 4249350756, win 8192, options [mss 1360,nop,wscale 8,nop,nop,sackOK], length 0
01:40:26.268933 IP 10.0.98.29.59970 > 40.100.156.114.587: Flags [S], seq 3572615493, win 8192, options [mss 1360,nop,nop,sackOK], length 0
01:40:26.268948 IP 107.154.96.51.59970 > 40.100.156.114.587: Flags [S], seq 3572615493, win 8192, options [mss 1360,nop,nop,sackOK], length 0
01:40:26.278919 IP 10.0.98.29.59971 > 40.100.156.114.587: Flags [S], seq 418256089, win 8192, options [mss 1360,nop,nop,sackOK], length 0
01:40:26.278930 IP 107.154.96.51.59971 > 40.100.156.114.587: Flags [S], seq 418256089, win 8192, options [mss 1360,nop,nop,sackOK], length 0
01:40:26.358904 IP 10.0.98.29.59972 > 40.100.156.114.587: Flags [S], seq 4249350756, win 8192, options [mss 1360,nop,nop,sackOK], length 0
01:40:26.358916 IP 107.154.96.51.59972 > 40.100.156.114.587: Flags [S], seq 4249350756, win 8192, options [mss 1360,nop,nop,sackOK], length 0
01:40:36.466105 IP 171.5.250.216.16453 > 10.0.98.29.6124: Flags [S], seq 1021130629, win 16384, options [mss 1400,nop,nop,sackOK], length 0
01:40:38.269418 IP 10.0.98.29.59970 > 40.100.156.130.587: Flags [S], seq 4262957938, win 8192, options [mss 1360,nop,wscale 8,nop,nop,sackOK], length 0
01:40:38.269449 IP 107.154.96.51.59970 > 40.100.156.130.587: Flags [S], seq 4262957938, win 8192, options [mss 1360,nop,wscale 8,nop,nop,sackOK], length 0
01:40:38.281407 IP 10.0.98.29.59971 > 40.100.156.130.587: Flags [S], seq 3194606712, win 8192, options [mss 1360,nop,wscale 8,nop,nop,sackOK], length 0
01:40:38.281439 IP 107.154.96.51.59971 > 40.100.156.130.587: Flags [S], seq 3194606712, win 8192, options [mss 1360,nop,wscale 8,nop,nop,sackOK], length 0
01:40:38.359478 IP 10.0.98.29.59972 > 40.100.156.130.587: Flags [S], seq 1620133931, win 8192, options [mss 1360,nop,wscale 8,nop,nop,sackOK], length 0
01:40:38.359497 IP 107.154.96.51.59972 > 40.100.156.130.587: Flags [S], seq 1620133931, win 8192, options [mss 1360,nop,wscale 8,nop,nop,sackOK], length 0
01:40:39.420558 IP 171.5.250.216.16453 > 10.0.98.29.6124: Flags [S], seq 1021130629, win 16384, options [mss 1400,nop,nop,sackOK], length 0
01:40:39.900632 IP 2.91.235.147.50221 > 10.0.98.12.23: Flags [S], seq 1805279282, win 1584, options [mss 536], length 0
01:40:41.269395 IP 10.0.98.29.59970 > 40.100.156.130.587: Flags [S], seq 4262957938, win 8192, options [mss 1360,nop,wscale 8,nop,nop,sackOK], length 0
01:40:41.269419 IP 107.154.96.51.59970 > 40.100.156.130.587: Flags [S], seq 4262957938, win 8192, options [mss 1360,nop,wscale 8,nop,nop,sackOK], length 0
01:40:41.281369 IP 10.0.98.29.59971 > 40.100.156.130.587: Flags [S], seq 3194606712, win 8192, options [mss 1360,nop,wscale 8,nop,nop,sackOK], length 0
01:40:41.281381 IP 107.154.96.51.59971 > 40.100.156.130.587: Flags [S], seq 3194606712, win 8192, options [mss 1360,nop,wscale 8,nop,nop,sackOK], length 0
01:40:41.359392 IP 10.0.98.29.59972 > 40.100.156.130.587: Flags [S], seq 1620133931, win 8192, options [mss 1360,nop,wscale 8,nop,nop,sackOK], length 0
01:40:41.359409 IP 107.154.96.51.59972 > 40.100.156.130.587: Flags [S], seq 1620133931, win 8192, options [mss 1360,nop,wscale 8,nop,nop,sackOK], length 0
01:40:45.455520 IP 171.5.250.216.16453 > 10.0.98.29.6124: Flags [S], seq 1021130629, win 16384, options [mss 1400,nop,nop,sackOK], length 0
01:40:47.275578 IP 10.0.98.29.59970 > 40.100.156.130.587: Flags [S], seq 4262957938, win 8192, options [mss 1360,nop,nop,sackOK], length 0
01:40:47.275603 IP 107.154.96.51.59970 > 40.100.156.130.587: Flags [S], seq 4262957938, win 8192, options [mss 1360,nop,nop,sackOK], length 0
01:40:47.281546 IP 10.0.98.29.59971 > 40.100.156.130.587: Flags [S], seq 3194606712, win 8192, options [mss 1360,nop,nop,sackOK], length 0
01:40:47.281561 IP 107.154.96.51.59971 > 40.100.156.130.587: Flags [S], seq 3194606712, win 8192, options [mss 1360,nop,nop,sackOK], length 0
01:40:47.359550 IP 10.0.98.29.59972 > 40.100.156.130.587: Flags [S], seq 1620133931, win 8192, options [mss 1360,nop,nop,sackOK], length 0
01:40:47.359565 IP 107.154.96.51.59972 > 40.100.156.130.587: Flags [S], seq 1620133931, win 8192, options [mss 1360,nop,nop,sackOK], length 0
01:41:39.087671 IP 14.192.208.27.3469 > 10.0.98.12.6124: Flags [S], seq 3979054858, win 8192, options [mss 1400,nop,wscale 8,nop,nop,sackOK], length 0
01:41:39.703959 IP 171.5.250.216.16532 > 10.0.98.29.6124: Flags [S], seq 1472374341, win 16384, options [mss 1400,nop,nop,sackOK], length 0
01:41:42.087348 IP 14.192.208.27.3469 > 10.0.98.12.6124: Flags [S], seq 3979054858, win 8192, options [mss 1400,nop,wscale 8,nop,nop,sackOK], length 0
01:41:42.689502 IP 171.5.250.216.16532 > 10.0.98.29.6124: Flags [S], seq 1472374341, win 16384, options [mss 1400,nop,nop,sackOK], length 0
01:41:48.087595 IP 14.192.208.27.3469 > 10.0.98.12.6124: Flags [S], seq 3979054858, win 8192, options [mss 1400,nop,nop,sackOK], length 0
01:41:48.624007 IP 171.5.250.216.16532 > 10.0.98.29.6124: Flags [S], seq 1472374341, win 16384, options [mss 1400,nop,nop,sackOK], length 0
01:41:50.223772 IP 10.0.98.29.59977 > 40.100.152.114.587: Flags [S], seq 360169177, win 8192, options [mss 1360,nop,wscale 8,nop,nop,sackOK], length 0
01:41:50.223809 IP 107.154.96.51.59977 > 40.100.152.114.587: Flags [S], seq 360169177, win 8192, options [mss 1360,nop,wscale 8,nop,nop,sackOK], length 0
01:41:50.331450 IP 10.0.98.29.59978 > 40.100.152.114.587: Flags [S], seq 1032737348, win 8192, options [mss 1360,nop,wscale 8,nop,nop,sackOK], length 0
01:41:50.331486 IP 107.154.96.51.59978 > 40.100.152.114.587: Flags [S], seq 1032737348, win 8192, options [mss 1360,nop,wscale 8,nop,nop,sackOK], length 0
01:41:50.409442 IP 10.0.98.29.59979 > 40.100.152.114.587: Flags [S], seq 3155394689, win 8192, options [mss 1360,nop,wscale 8,nop,nop,sackOK], length 0
01:41:50.409468 IP 107.154.96.51.59979 > 40.100.152.114.587: Flags [S], seq 3155394689, win 8192, options [mss 1360,nop,wscale 8,nop,nop,sackOK], length 0
01:41:53.228510 IP 10.0.98.29.59977 > 40.100.152.114.587: Flags [S], seq 360169177, win 8192, options [mss 1360,nop,wscale 8,nop,nop,sackOK], length 0
01:41:53.228535 IP 107.154.96.51.59977 > 40.100.152.114.587: Flags [S], seq 360169177, win 8192, options [mss 1360,nop,wscale 8,nop,nop,sackOK], length 0
01:41:53.331497 IP 10.0.98.29.59978 > 40.100.152.114.587: Flags [S], seq 1032737348, win 8192, options [mss 1360,nop,wscale 8,nop,nop,sackOK], length 0
01:41:53.331527 IP 107.154.96.51.59978 > 40.100.152.114.587: Flags [S], seq 1032737348, win 8192, options [mss 1360,nop,wscale 8,nop,nop,sackOK], length 0
01:41:53.415561 IP 10.0.98.29.59979 > 40.100.152.114.587: Flags [S], seq 3155394689, win 8192, options [mss 1360,nop,wscale 8,nop,nop,sackOK], length 0
01:41:53.415582 IP 107.154.96.51.59979 > 40.100.152.114.587: Flags [S], seq 3155394689, win 8192, options [mss 1360,nop,wscale 8,nop,nop,sackOK], length 0
01:41:59.223691 IP 10.0.98.29.59977 > 40.100.152.114.587: Flags [S], seq 360169177, win 8192, options [mss 1360,nop,nop,sackOK], length 0
01:41:59.223718 IP 107.154.96.51.59977 > 40.100.152.114.587: Flags [S], seq 360169177, win 8192, options [mss 1360,nop,nop,sackOK], length 0
01:41:59.331668 IP 10.0.98.29.59978 > 40.100.152.114.587: Flags [S], seq 1032737348, win 8192, options [mss 1360,nop,nop,sackOK], length 0
01:41:59.331697 IP 107.154.96.51.59978 > 40.100.152.114.587: Flags [S], seq 1032737348, win 8192, options [mss 1360,nop,nop,sackOK], length 0
01:41:59.417672 IP 10.0.98.29.59979 > 40.100.152.114.587: Flags [S], seq 3155394689, win 8192, options [mss 1360,nop,nop,sackOK], length 0
01:41:59.417693 IP 107.154.96.51.59979 > 40.100.152.114.587: Flags [S], seq 3155394689, win 8192, options [mss 1360,nop,nop,sackOK], length 0
01:42:11.226259 IP 10.0.98.29.59977 > 40.100.154.50.587: Flags [S], seq 1208207360, win 8192, options [mss 1360,nop,wscale 8,nop,nop,sackOK], length 0
01:42:11.226293 IP 107.154.96.51.59977 > 40.100.154.50.587: Flags [S], seq 1208207360, win 8192, options [mss 1360,nop,wscale 8,nop,nop,sackOK], length 0
01:42:11.333187 IP 10.0.98.29.59978 > 40.100.154.50.587: Flags [S], seq 387684254, win 8192, options [mss 1360,nop,wscale 8,nop,nop,sackOK], length 0
01:42:11.333213 IP 107.154.96.51.59978 > 40.100.154.50.587: Flags [S], seq 387684254, win 8192, options [mss 1360,nop,wscale 8,nop,nop,sackOK], length 0
01:42:11.416206 IP 10.0.98.29.59979 > 40.100.154.50.587: Flags [S], seq 2693129118, win 8192, options [mss 1360,nop,wscale 8,nop,nop,sackOK], length 0
01:42:11.416235 IP 107.154.96.51.59979 > 40.100.154.50.587: Flags [S], seq 2693129118, win 8192, options [mss 1360,nop,wscale 8,nop,nop,sackOK], length 0
01:42:13.720661 IP 86.126.229.228.52348 > 10.0.98.29.6124: Flags [S], seq 2031434481, win 8192, options [mss 1400,nop,wscale 2,nop,nop,sackOK], length 0
01:42:14.223187 IP 10.0.98.29.59977 > 40.100.154.50.587: Flags [S], seq 1208207360, win 8192, options [mss 1360,nop,wscale 8,nop,nop,sackOK], length 0
