tcpdump: verbose output suppressed, use -v or -vv for full protocol decode
listening on eth0, link-type EN10MB (Ethernet), capture size 65535 bytes
14:57:59.651863 IP 60.180.55.195.nbt-wol > 10.0.0.236.27021: Flags [F.], seq 1810795967, ack 25041975, win 16560, length 0
14:57:59.651897 IP 60.180.55.195.nbt-wol > 10.0.98.29.27021: Flags [F.], seq 1810795967, ack 25041975, win 16560, length 0
14:57:59.652164 IP 10.0.98.29.27021 > 60.180.55.195.nbt-wol: Flags [F.], seq 1, ack 1, win 32767, length 0
14:57:59.652181 IP 10.0.0.236.27021 > 60.180.55.195.nbt-wol: Flags [F.], seq 1, ack 1, win 32767, length 0
14:57:59.652621 IP 60.180.55.195.6135 > 10.0.0.236.27021: Flags [S], seq 664121019, win 8192, options [mss 1440,nop,wscale 2,nop,nop,sackOK], length 0
14:57:59.652641 IP 60.180.55.195.6135 > 10.0.98.29.27021: Flags [S], seq 664121019, win 8192, options [mss 1440,nop,wscale 2,nop,nop,sackOK], length 0
14:57:59.652801 IP 10.0.98.29.27021 > 60.180.55.195.6135: Flags [S.], seq 4267075155, ack 664121020, win 32767, options [mss 1460,nop,wscale 0,nop,nop,sackOK], length 0
14:57:59.652814 IP 10.0.0.236.27021 > 60.180.55.195.6135: Flags [S.], seq 4267075155, ack 664121020, win 32767, options [mss 1460,nop,wscale 0,nop,nop,sackOK], length 0
14:58:00.016097 IP 183.206.172.223.12726 > 10.0.0.236.27021: Flags [S], seq 1137705302, win 8192, options [mss 1440,nop,wscale 2,nop,nop,sackOK], length 0
14:58:00.016117 IP 183.206.172.223.12726 > 10.0.98.29.27021: Flags [S], seq 1137705302, win 8192, options [mss 1440,nop,wscale 2,nop,nop,sackOK], length 0
14:58:00.016274 IP 10.0.98.29.27021 > 183.206.172.223.12726: Flags [S.], seq 2895159067, ack 1137705303, win 32767, options [mss 1460,nop,wscale 0,nop,nop,sackOK], length 0
14:58:00.016283 IP 10.0.0.236.27021 > 183.206.172.223.12726: Flags [S.], seq 2895159067, ack 1137705303, win 32767, options [mss 1460,nop,wscale 0,nop,nop,sackOK], length 0
14:58:00.162530 IP 175.42.236.55.ups-engine > 10.0.0.236.27021: Flags [F.], seq 4183644909, ack 3923447173, win 64216, length 0
14:58:00.162558 IP 175.42.236.55.ups-engine > 10.0.98.29.27021: Flags [F.], seq 4183644909, ack 3923447173, win 64216, length 0
14:58:00.162834 IP 10.0.98.29.27021 > 175.42.236.55.ups-engine: Flags [F.], seq 1, ack 1, win 32246, length 0
14:58:00.162857 IP 10.0.0.236.27021 > 175.42.236.55.ups-engine: Flags [F.], seq 1, ack 1, win 32246, length 0
14:58:00.805680 IP 60.180.55.195.6138 > 10.0.0.236.27021: Flags [S], seq 3567287542, win 8192, options [mss 1440,nop,wscale 2,nop,nop,sackOK], length 0
14:58:00.805696 IP 60.180.55.195.6138 > 10.0.98.29.27021: Flags [S], seq 3567287542, win 8192, options [mss 1440,nop,wscale 2,nop,nop,sackOK], length 0
14:58:00.805859 IP 10.0.98.29.27021 > 60.180.55.195.6138: Flags [S.], seq 768764778, ack 3567287543, win 32767, options [mss 1460,nop,wscale 0,nop,nop,sackOK], length 0
14:58:00.805868 IP 10.0.0.236.27021 > 60.180.55.195.6138: Flags [S.], seq 768764778, ack 3567287543, win 32767, options [mss 1460,nop,wscale 0,nop,nop,sackOK], length 0
14:58:00.806182 IP 60.180.55.195.6135 > 10.0.0.236.27021: Flags [F.], seq 1, ack 1, win 16560, length 0
14:58:00.806194 IP 60.180.55.195.6135 > 10.0.98.29.27021: Flags [F.], seq 1, ack 1, win 16560, length 0
14:58:00.806525 IP 10.0.98.29.27021 > 60.180.55.195.6135: Flags [F.], seq 1, ack 2, win 32767, length 0
14:58:00.806538 IP 10.0.0.236.27021 > 60.180.55.195.6135: Flags [F.], seq 1, ack 2, win 32767, length 0
14:58:01.731098 IP 1.200.193.74.34224 > 10.0.0.236.pnbs: Flags [S], seq 1116464848, win 13180, options [mss 1318,sackOK,TS val 747443 ecr 0,nop,wscale 6], length 0
14:58:01.731117 IP 1.200.193.74.34224 > 10.0.98.29.pnbs: Flags [S], seq 1116464848, win 13180, options [mss 1318,sackOK,TS val 747443 ecr 0,nop,wscale 6], length 0
14:58:01.731275 IP 10.0.98.29.pnbs > 1.200.193.74.34224: Flags [S.], seq 2047745338, ack 1116464849, win 32767, options [mss 1460,nop,wscale 0,sackOK,TS val 173687712 ecr 747443], length 0
14:58:01.731290 IP 10.0.0.236.pnbs > 1.200.193.74.34224: Flags [S.], seq 2047745338, ack 1116464849, win 32767, options [mss 1460,nop,wscale 0,sackOK,TS val 173687712 ecr 747443], length 0
14:58:01.844390 IP 58.182.10.22.55224 > 10.0.0.236.27021: Flags [S], seq 3158252879, win 8192, options [mss 1460,nop,wscale 2,nop,nop,sackOK], length 0
14:58:01.844404 IP 58.182.10.22.55224 > 10.0.98.29.27021: Flags [S], seq 3158252879, win 8192, options [mss 1460,nop,wscale 2,nop,nop,sackOK], length 0
14:58:01.844561 IP 10.0.98.29.27021 > 58.182.10.22.55224: Flags [S.], seq 1670388179, ack 3158252880, win 32767, options [mss 1460,nop,wscale 0,nop,nop,sackOK], length 0
14:58:01.844573 IP 10.0.0.236.27021 > 58.182.10.22.55224: Flags [S.], seq 1670388179, ack 3158252880, win 32767, options [mss 1460,nop,wscale 0,nop,nop,sackOK], length 0
14:58:02.006587 IP 60.180.55.195.6138 > 10.0.0.236.27021: Flags [F.], seq 1, ack 1, win 16560, length 0
14:58:02.006608 IP 60.180.55.195.6138 > 10.0.98.29.27021: Flags [F.], seq 1, ack 1, win 16560, length 0
14:58:02.007003 IP 10.0.98.29.27021 > 60.180.55.195.6138: Flags [F.], seq 1, ack 2, win 32767, length 0
14:58:02.007018 IP 10.0.0.236.27021 > 60.180.55.195.6138: Flags [F.], seq 1, ack 2, win 32767, length 0
14:58:02.007200 IP 60.180.55.195.6139 > 10.0.0.236.27021: Flags [S], seq 570802729, win 8192, options [mss 1440,nop,wscale 2,nop,nop,sackOK], length 0
14:58:02.007223 IP 60.180.55.195.6139 > 10.0.98.29.27021: Flags [S], seq 570802729, win 8192, options [mss 1440,nop,wscale 2,nop,nop,sackOK], length 0
14:58:02.007447 IP 10.0.98.29.27021 > 60.180.55.195.6139: Flags [S.], seq 3257223065, ack 570802730, win 32767, options [mss 1460,nop,wscale 0,nop,nop,sackOK], length 0
14:58:02.007459 IP 10.0.0.236.27021 > 60.180.55.195.6139: Flags [S.], seq 3257223065, ack 570802730, win 32767, options [mss 1460,nop,wscale 0,nop,nop,sackOK], length 0
14:58:02.248519 IP 110.169.179.193.52210 > 10.0.0.236.27021: Flags [S], seq 3362347452, win 65535, options [mss 1460,nop,wscale 5,nop,nop,TS val 1432033451 ecr 0,sackOK,eol], length 0
14:58:02.248541 IP 110.169.179.193.52210 > 10.0.98.29.27021: Flags [S], seq 3362347452, win 65535, options [mss 1460,nop,wscale 5,nop,nop,TS val 1432033451 ecr 0,sackOK,eol], length 0
14:58:02.248696 IP 10.0.98.29.27021 > 110.169.179.193.52210: Flags [S.], seq 2060785934, ack 3362347453, win 32767, options [mss 1460,nop,wscale 0,sackOK,TS val 173687763 ecr 1432033451], length 0
14:58:02.248705 IP 10.0.0.236.27021 > 110.169.179.193.52210: Flags [S.], seq 2060785934, ack 3362347453, win 32767, options [mss 1460,nop,wscale 0,sackOK,TS val 173687763 ecr 1432033451], length 0
14:58:03.208348 IP 60.180.55.195.pulsonixnls > 10.0.0.236.27021: Flags [S], seq 686388563, win 8192, options [mss 1440,nop,wscale 2,nop,nop,sackOK], length 0
14:58:03.208374 IP 60.180.55.195.pulsonixnls > 10.0.98.29.27021: Flags [S], seq 686388563, win 8192, options [mss 1440,nop,wscale 2,nop,nop,sackOK], length 0
14:58:03.208527 IP 10.0.98.29.27021 > 60.180.55.195.pulsonixnls: Flags [S.], seq 973359277, ack 686388564, win 32767, options [mss 1460,nop,wscale 0,nop,nop,sackOK], length 0
14:58:03.208537 IP 10.0.0.236.27021 > 60.180.55.195.pulsonixnls: Flags [S.], seq 973359277, ack 686388564, win 32767, options [mss 1460,nop,wscale 0,nop,nop,sackOK], length 0
14:58:03.208609 IP 60.180.55.195.6139 > 10.0.0.236.27021: Flags [F.], seq 1, ack 1, win 16560, length 0
14:58:03.208628 IP 60.180.55.195.6139 > 10.0.98.29.27021: Flags [F.], seq 1, ack 1, win 16560, length 0
14:58:03.208907 IP 10.0.98.29.27021 > 60.180.55.195.6139: Flags [F.], seq 1, ack 2, win 32767, length 0
14:58:03.208921 IP 10.0.0.236.27021 > 60.180.55.195.6139: Flags [F.], seq 1, ack 2, win 32767, length 0
14:58:03.217178 IP 117.136.39.207.vocaltec-gold > 10.0.0.236.pnbs: Flags [F.], seq 257651605, ack 1912844227, win 1369, options [nop,nop,TS val 12488757 ecr 173687839], length 0
14:58:03.217206 IP 117.136.39.207.vocaltec-gold > 10.0.98.29.pnbs: Flags [F.], seq 257651605, ack 1912844227, win 1369, options [nop,nop,TS val 12488757 ecr 173687839], length 0
14:58:03.217807 IP 10.0.98.29.pnbs > 117.136.39.207.vocaltec-gold: Flags [F.], seq 603, ack 1, win 31952, options [nop,nop,TS val 173687860 ecr 12488757], length 0
14:58:03.217820 IP 10.0.0.236.pnbs > 117.136.39.207.vocaltec-gold: Flags [F.], seq 603, ack 1, win 31952, options [nop,nop,TS val 173687860 ecr 12488757], length 0
14:58:03.376878 IP 117.136.39.207.vocaltec-gold > 10.0.0.236.pnbs: Flags [R], seq 257651606, win 0, length 0
14:58:03.376894 IP 117.136.39.207.vocaltec-gold > 10.0.98.29.pnbs: Flags [R], seq 257651606, win 0, length 0
14:58:04.351707 IP 27.246.139.197.50054 > 10.0.0.236.27021: Flags [S], seq 3351498265, win 65535, options [mss 1410,nop,wscale 5,nop,nop,TS val 837665908 ecr 0,sackOK,eol], length 0
14:58:04.351743 IP 27.246.139.197.50054 > 10.0.98.29.27021: Flags [S], seq 3351498265, win 65535, options [mss 1410,nop,wscale 5,nop,nop,TS val 837665908 ecr 0,sackOK,eol], length 0
14:58:04.351926 IP 10.0.98.29.27021 > 27.246.139.197.50054: Flags [S.], seq 451274158, ack 3351498266, win 32767, options [mss 1460,nop,wscale 0,sackOK,TS val 173687974 ecr 837665908], length 0
14:58:04.351953 IP 10.0.0.236.27021 > 27.246.139.197.50054: Flags [S.], seq 451274158, ack 3351498266, win 32767, options [mss 1460,nop,wscale 0,sackOK,TS val 173687974 ecr 837665908], length 0
14:58:04.378549 IP 60.180.55.195.pulsonixnls > 10.0.0.236.27021: Flags [F.], seq 1, ack 1, win 16560, length 0
14:58:04.378563 IP 60.180.55.195.pulsonixnls > 10.0.98.29.27021: Flags [F.], seq 1, ack 1, win 16560, length 0
14:58:04.378825 IP 10.0.98.29.27021 > 60.180.55.195.pulsonixnls: Flags [F.], seq 1, ack 2, win 32767, length 0
14:58:04.378839 IP 10.0.0.236.27021 > 60.180.55.195.pulsonixnls: Flags [F.], seq 1, ack 2, win 32767, length 0
14:58:04.379458 IP 60.180.55.195.meta-corp > 10.0.0.236.27021: Flags [S], seq 757561788, win 8192, options [mss 1440,nop,wscale 2,nop,nop,sackOK], length 0
14:58:04.379474 IP 60.180.55.195.meta-corp > 10.0.98.29.27021: Flags [S], seq 757561788, win 8192, options [mss 1440,nop,wscale 2,nop,nop,sackOK], length 0
14:58:04.379621 IP 10.0.98.29.27021 > 60.180.55.195.meta-corp: Flags [S.], seq 1211422928, ack 757561789, win 32767, options [mss 1460,nop,wscale 0,nop,nop,sackOK], length 0
14:58:04.379631 IP 10.0.0.236.27021 > 60.180.55.195.meta-corp: Flags [S.], seq 1211422928, ack 757561789, win 32767, options [mss 1460,nop,wscale 0,nop,nop,sackOK], length 0
14:58:04.683125 IP 218.26.170.138.4542 > 10.0.0.236.27021: Flags [F.], seq 3153572280, ack 1833134030, win 255, length 0
14:58:04.683143 IP 218.26.170.138.4542 > 10.0.98.29.27021: Flags [F.], seq 3153572280, ack 1833134030, win 255, length 0
14:58:04.683412 IP 10.0.98.29.27021 > 218.26.170.138.4542: Flags [F.], seq 1, ack 1, win 31728, length 0
14:58:04.683427 IP 10.0.0.236.27021 > 218.26.170.138.4542: Flags [F.], seq 1, ack 1, win 31728, length 0
14:58:04.991057 IP 45.64.240.63.45386 > 10.0.0.236.pnbs: Flags [F.], seq 1984813341, ack 2640112848, win 2783, options [nop,nop,TS val 1202178 ecr 173688008], length 0
14:58:04.991078 IP 45.64.240.63.45386 > 10.0.98.29.pnbs: Flags [F.], seq 1984813341, ack 2640112848, win 2783, options [nop,nop,TS val 1202178 ecr 173688008], length 0
14:58:04.991391 IP 10.0.98.29.pnbs > 45.64.240.63.45386: Flags [F.], seq 1, ack 1, win 32055, options [nop,nop,TS val 173688038 ecr 1202178], length 0
14:58:04.991406 IP 10.0.0.236.pnbs > 45.64.240.63.45386: Flags [F.], seq 1, ack 1, win 32055, options [nop,nop,TS val 173688038 ecr 1202178], length 0
14:58:05.294085 IP 210.108.34.17.51028 > 10.0.0.236.27021: Flags [F.], seq 3492042115, ack 411260185, win 16329, length 0
14:58:05.294103 IP 210.108.34.17.51028 > 10.0.98.29.27021: Flags [F.], seq 3492042115, ack 411260185, win 16329, length 0
14:58:05.294396 IP 10.0.98.29.27021 > 210.108.34.17.51028: Flags [F.], seq 1, ack 1, win 32266, length 0
14:58:05.294410 IP 10.0.0.236.27021 > 210.108.34.17.51028: Flags [F.], seq 1, ack 1, win 32266, length 0
14:58:05.302771 IP 43.243.17.4.14515 > 10.0.0.236.pnbs: Flags [S], seq 2908099419, win 65535, options [mss 1400,nop,wscale 5,nop,nop,TS val 687132834 ecr 0,sackOK,eol], length 0
14:58:05.302789 IP 43.243.17.4.14515 > 10.0.98.29.pnbs: Flags [S], seq 2908099419, win 65535, options [mss 1400,nop,wscale 5,nop,nop,TS val 687132834 ecr 0,sackOK,eol], length 0
14:58:05.302957 IP 10.0.98.29.pnbs > 43.243.17.4.14515: Flags [S.], seq 1955645869, ack 2908099420, win 32767, options [mss 1460,nop,wscale 0,sackOK,TS val 173688069 ecr 687132834], length 0
14:58:05.302968 IP 10.0.0.236.pnbs > 43.243.17.4.14515: Flags [S.], seq 1955645869, ack 2908099420, win 32767, options [mss 1460,nop,wscale 0,sackOK,TS val 173688069 ecr 687132834], length 0
14:58:05.522636 IP 117.136.39.207.p4p-portal > 10.0.0.236.pnbs: Flags [S], seq 1401962628, win 65535, options [mss 1380,nop,wscale 8,sackOK,TS val 12489202 ecr 0], length 0
14:58:05.522656 IP 117.136.39.207.p4p-portal > 10.0.98.29.pnbs: Flags [S], seq 1401962628, win 65535, options [mss 1380,nop,wscale 8,sackOK,TS val 12489202 ecr 0], length 0
14:58:05.522823 IP 10.0.98.29.pnbs > 117.136.39.207.p4p-portal: Flags [S.], seq 2457806080, ack 1401962629, win 32767, options [mss 1460,nop,wscale 0,sackOK,TS val 173688091 ecr 12489202], length 0
14:58:05.522836 IP 10.0.0.236.pnbs > 117.136.39.207.p4p-portal: Flags [S.], seq 2457806080, ack 1401962629, win 32767, options [mss 1460,nop,wscale 0,sackOK,TS val 173688091 ecr 12489202], length 0
14:58:05.548532 IP 60.180.55.195.aspentec-lm > 10.0.0.236.27021: Flags [S], seq 84076887, win 8192, options [mss 1440,nop,wscale 2,nop,nop,sackOK], length 0
14:58:05.548546 IP 60.180.55.195.aspentec-lm > 10.0.98.29.27021: Flags [S], seq 84076887, win 8192, options [mss 1440,nop,wscale 2,nop,nop,sackOK], length 0
14:58:05.548694 IP 10.0.98.29.27021 > 60.180.55.195.aspentec-lm: Flags [S.], seq 3246357349, ack 84076888, win 32767, options [mss 1460,nop,wscale 0,nop,nop,sackOK], length 0
14:58:05.548704 IP 10.0.0.236.27021 > 60.180.55.195.aspentec-lm: Flags [S.], seq 3246357349, ack 84076888, win 32767, options [mss 1460,nop,wscale 0,nop,nop,sackOK], length 0
14:58:05.548833 IP 60.180.55.195.meta-corp > 10.0.0.236.27021: Flags [F.], seq 1, ack 1, win 16560, length 0
14:58:05.548849 IP 60.180.55.195.meta-corp > 10.0.98.29.27021: Flags [F.], seq 1, ack 1, win 16560, length 0
14:58:05.549119 IP 10.0.98.29.27021 > 60.180.55.195.meta-corp: Flags [F.], seq 1, ack 2, win 32767, length 0
14:58:05.549132 IP 10.0.0.236.27021 > 60.180.55.195.meta-corp: Flags [F.], seq 1, ack 2, win 32767, length 0
14:58:06.701820 IP 60.180.55.195.watershed-lm > 10.0.0.236.27021: Flags [S], seq 1326080835, win 8192, options [mss 1440,nop,wscale 2,nop,nop,sackOK], length 0
14:58:06.701838 IP 60.180.55.195.watershed-lm > 10.0.98.29.27021: Flags [S], seq 1326080835, win 8192, options [mss 1440,nop,wscale 2,nop,nop,sackOK], length 0
14:58:06.702009 IP 10.0.98.29.27021 > 60.180.55.195.watershed-lm: Flags [S.], seq 2572359866, ack 1326080836, win 32767, options [mss 1460,nop,wscale 0,nop,nop,sackOK], length 0
14:58:06.702037 IP 10.0.0.236.27021 > 60.180.55.195.watershed-lm: Flags [S.], seq 2572359866, ack 1326080836, win 32767, options [mss 1460,nop,wscale 0,nop,nop,sackOK], length 0
14:58:06.702318 IP 60.180.55.195.aspentec-lm > 10.0.0.236.27021: Flags [F.], seq 1, ack 1, win 16560, length 0
14:58:06.702352 IP 60.180.55.195.aspentec-lm > 10.0.98.29.27021: Flags [F.], seq 1, ack 1, win 16560, length 0
14:58:06.702638 IP 10.0.98.29.27021 > 60.180.55.195.aspentec-lm: Flags [F.], seq 1, ack 2, win 32767, length 0
14:58:06.702651 IP 10.0.0.236.27021 > 60.180.55.195.aspentec-lm: Flags [F.], seq 1, ack 2, win 32767, length 0
14:58:06.764100 IP 45.64.240.63.45387 > 10.0.0.236.pnbs: Flags [S], seq 297842785, win 65535, options [mss 1400,sackOK,TS val 1202358 ecr 0,nop,wscale 8], length 0
14:58:06.764115 IP 45.64.240.63.45387 > 10.0.98.29.pnbs: Flags [S], seq 297842785, win 65535, options [mss 1400,sackOK,TS val 1202358 ecr 0,nop,wscale 8], length 0
14:58:06.764262 IP 10.0.98.29.pnbs > 45.64.240.63.45387: Flags [S.], seq 4206882310, ack 297842786, win 32767, options [mss 1460,nop,wscale 0,sackOK,TS val 173688215 ecr 1202358], length 0
14:58:06.764272 IP 10.0.0.236.pnbs > 45.64.240.63.45387: Flags [S.], seq 4206882310, ack 297842786, win 32767, options [mss 1460,nop,wscale 0,sackOK,TS val 173688215 ecr 1202358], length 0
14:58:06.773982 IP 218.26.170.138.33869 > 10.0.0.236.pnbs: Flags [R.], seq 4038663377, ack 3792474958, win 0, length 0
14:58:06.773996 IP 218.26.170.138.33869 > 10.0.98.29.pnbs: Flags [R.], seq 4038663377, ack 3792474958, win 0, length 0
14:58:06.926035 IP 58.182.10.22.55224 > 10.0.0.236.27021: Flags [F.], seq 232, ack 13880, win 16273, length 0
14:58:06.926049 IP 58.182.10.22.55224 > 10.0.98.29.27021: Flags [F.], seq 232, ack 13880, win 16273, length 0
14:58:06.926308 IP 10.0.98.29.27021 > 58.182.10.22.55224: Flags [F.], seq 13880, ack 233, win 32536, length 0
14:58:06.926323 IP 10.0.0.236.27021 > 58.182.10.22.55224: Flags [F.], seq 13880, ack 233, win 32536, length 0
14:58:07.190268 IP 10.0.98.29.27021 > 60.180.55.195.aspentec-lm: Flags [F.], seq 1, ack 2, win 32767, length 0
14:58:07.190287 IP 10.0.0.236.27021 > 60.180.55.195.aspentec-lm: Flags [F.], seq 1, ack 2, win 32767, length 0
14:58:07.649859 IP 113.52.81.46.7143 > 10.0.0.236.pnbs: Flags [F.], seq 3262917758, ack 3791700449, win 5712, options [nop,nop,TS val 36391186 ecr 173688285], length 0
14:58:07.649877 IP 113.52.81.46.7143 > 10.0.98.29.pnbs: Flags [F.], seq 3262917758, ack 3791700449, win 5712, options [nop,nop,TS val 36391186 ecr 173688285], length 0
14:58:07.650308 IP 10.0.98.29.pnbs > 113.52.81.46.7143: Flags [F.], seq 352, ack 1, win 32055, options [nop,nop,TS val 173688303 ecr 36391186], length 0
14:58:07.650322 IP 10.0.0.236.pnbs > 113.52.81.46.7143: Flags [F.], seq 352, ack 1, win 32055, options [nop,nop,TS val 173688303 ecr 36391186], length 0
14:58:07.720339 IP 113.52.81.46.7143 > 10.0.0.236.pnbs: Flags [R], seq 3262917758, win 0, length 0
14:58:07.753780 IP 183.206.172.223.12726 > 10.0.0.236.27021: Flags [F.], seq 471, ack 12624, win 16347, length 0
14:58:07.753799 IP 183.206.172.223.12726 > 10.0.98.29.27021: Flags [F.], seq 471, ack 12624, win 16347, length 0
14:58:07.754153 IP 10.0.98.29.27021 > 183.206.172.223.12726: Flags [F.], seq 12624, ack 472, win 32297, length 0
14:58:07.754169 IP 10.0.0.236.27021 > 183.206.172.223.12726: Flags [F.], seq 12624, ack 472, win 32297, length 0
14:58:07.780031 IP 113.52.81.46.7143 > 10.0.0.236.pnbs: Flags [R], seq 3262917759, win 0, length 0
14:58:07.780045 IP 113.52.81.46.7143 > 10.0.98.29.pnbs: Flags [R], seq 3262917759, win 0, length 0
14:58:07.780049 IP 113.52.81.46.7143 > 10.0.0.236.pnbs: Flags [R], seq 3262917759, win 0, length 0
14:58:07.780052 IP 113.52.81.46.7143 > 10.0.98.29.pnbs: Flags [R], seq 3262917759, win 0, length 0
14:58:07.903573 IP 60.180.55.195.watershed-lm > 10.0.0.236.27021: Flags [F.], seq 1, ack 1, win 16560, length 0
14:58:07.903586 IP 60.180.55.195.watershed-lm > 10.0.98.29.27021: Flags [F.], seq 1, ack 1, win 16560, length 0
14:58:07.903861 IP 10.0.98.29.27021 > 60.180.55.195.watershed-lm: Flags [F.], seq 1, ack 2, win 32767, length 0
14:58:07.903876 IP 10.0.0.236.27021 > 60.180.55.195.watershed-lm: Flags [F.], seq 1, ack 2, win 32767, length 0
14:58:07.904444 IP 60.180.55.195.statsci1-lm > 10.0.0.236.27021: Flags [S], seq 3478187856, win 8192, options [mss 1440,nop,wscale 2,nop,nop,sackOK], length 0
14:58:07.904482 IP 60.180.55.195.statsci1-lm > 10.0.98.29.27021: Flags [S], seq 3478187856, win 8192, options [mss 1440,nop,wscale 2,nop,nop,sackOK], length 0
14:58:07.904643 IP 10.0.98.29.27021 > 60.180.55.195.statsci1-lm: Flags [S.], seq 560938597, ack 3478187857, win 32767, options [mss 1460,nop,wscale 0,nop,nop,sackOK], length 0
14:58:07.904653 IP 10.0.0.236.27021 > 60.180.55.195.statsci1-lm: Flags [S.], seq 560938597, ack 3478187857, win 32767, options [mss 1460,nop,wscale 0,nop,nop,sackOK], length 0
14:58:07.933997 IP 110.169.179.193.52210 > 10.0.0.236.27021: Flags [F.], seq 533, ack 15221, win 4096, options [nop,nop,TS val 1432039086 ecr 173688302], length 0
14:58:07.934010 IP 110.169.179.193.52210 > 10.0.98.29.27021: Flags [F.], seq 533, ack 15221, win 4096, options [nop,nop,TS val 1432039086 ecr 173688302], length 0
14:58:07.934395 IP 10.0.98.29.27021 > 110.169.179.193.52210: Flags [FP.], seq 15382:15450, ack 534, win 32235, options [nop,nop,TS val 173688332 ecr 1432039086], length 68
14:58:07.934409 IP 10.0.0.236.27021 > 110.169.179.193.52210: Flags [FP.], seq 15382:15450, ack 534, win 32235, options [nop,nop,TS val 173688332 ecr 1432039086], length 68
14:58:07.981472 IP 110.169.179.193.52210 > 10.0.0.236.27021: Flags [R], seq 3362347850, win 0, length 0
14:58:08.132871 IP 183.206.172.223.12727 > 10.0.0.236.27021: Flags [S], seq 2599943016, win 8192, options [mss 1440,nop,wscale 2,nop,nop,sackOK], length 0
14:58:08.132910 IP 183.206.172.223.12727 > 10.0.98.29.27021: Flags [S], seq 2599943016, win 8192, options [mss 1440,nop,wscale 2,nop,nop,sackOK], length 0
14:58:08.133082 IP 10.0.98.29.27021 > 183.206.172.223.12727: Flags [S.], seq 2576112060, ack 2599943017, win 32767, options [mss 1460,nop,wscale 0,nop,nop,sackOK], length 0
14:58:08.133101 IP 10.0.0.236.27021 > 183.206.172.223.12727: Flags [S.], seq 2576112060, ack 2599943017, win 32767, options [mss 1460,nop,wscale 0,nop,nop,sackOK], length 0
14:58:08.380278 IP 10.0.98.29.27021 > 110.169.179.193.52210: Flags [FP.], seq 15221:15450, ack 534, win 32235, options [nop,nop,TS val 173688376 ecr 1432039086], length 229
14:58:08.380296 IP 10.0.0.236.27021 > 110.169.179.193.52210: Flags [FP.], seq 15221:15450, ack 534, win 32235, options [nop,nop,TS val 173688376 ecr 1432039086], length 229
14:58:09.040338 IP 10.0.98.29.27021 > 110.169.179.193.52210: Flags [FP.], seq 15221:15450, ack 534, win 32235, options [nop,nop,TS val 173688442 ecr 1432039086], length 229
14:58:09.040354 IP 10.0.0.236.27021 > 110.169.179.193.52210: Flags [FP.], seq 15221:15450, ack 534, win 32235, options [nop,nop,TS val 173688442 ecr 1432039086], length 229
14:58:09.115193 IP 60.180.55.195.lonewolf-lm > 10.0.0.236.27021: Flags [S], seq 4037255338, win 8192, options [mss 1440,nop,wscale 2,nop,nop,sackOK], length 0
14:58:09.115217 IP 60.180.55.195.lonewolf-lm > 10.0.98.29.27021: Flags [S], seq 4037255338, win 8192, options [mss 1440,nop,wscale 2,nop,nop,sackOK], length 0
14:58:09.115352 IP 60.180.55.195.statsci1-lm > 10.0.0.236.27021: Flags [F.], seq 1, ack 1, win 16560, length 0
14:58:09.115370 IP 60.180.55.195.statsci1-lm > 10.0.98.29.27021: Flags [F.], seq 1, ack 1, win 16560, length 0
14:58:09.115374 IP 10.0.98.29.27021 > 60.180.55.195.lonewolf-lm: Flags [S.], seq 2616234745, ack 4037255339, win 32767, options [mss 1460,nop,wscale 0,nop,nop,sackOK], length 0
14:58:09.115379 IP 10.0.0.236.27021 > 60.180.55.195.lonewolf-lm: Flags [S.], seq 2616234745, ack 4037255339, win 32767, options [mss 1460,nop,wscale 0,nop,nop,sackOK], length 0
14:58:09.115635 IP 10.0.98.29.27021 > 60.180.55.195.statsci1-lm: Flags [F.], seq 1, ack 2, win 32767, length 0
14:58:09.115649 IP 10.0.0.236.27021 > 60.180.55.195.statsci1-lm: Flags [F.], seq 1, ack 2, win 32767, length 0
14:58:10.082424 IP 110.16.10.103.53240 > 10.0.0.236.pnbs: Flags [F.], seq 2301747229, ack 2377875348, win 8171, options [nop,nop,TS val 44801175 ecr 173688518], length 0
14:58:10.082441 IP 110.16.10.103.53240 > 10.0.98.29.pnbs: Flags [F.], seq 2301747229, ack 2377875348, win 8171, options [nop,nop,TS val 44801175 ecr 173688518], length 0
14:58:10.082444 IP 110.16.10.103.53240 > 10.0.0.236.pnbs: Flags [R.], seq 1, ack 1, win 8171, options [nop,nop,TS val 44801176 ecr 173688518], length 0
14:58:10.082449 IP 110.16.10.103.53240 > 10.0.98.29.pnbs: Flags [R.], seq 1, ack 1, win 8171, options [nop,nop,TS val 44801176 ecr 173688518], length 0
14:58:10.091756 IP 223.104.5.227.22146 > 10.0.0.236.27021: Flags [S], seq 4265831312, win 65535, options [mss 1260,sackOK,TS val 23800964 ecr 0,nop,wscale 6], length 0
14:58:10.091772 IP 223.104.5.227.22146 > 10.0.98.29.27021: Flags [S], seq 4265831312, win 65535, options [mss 1260,sackOK,TS val 23800964 ecr 0,nop,wscale 6], length 0
14:58:10.091935 IP 10.0.98.29.27021 > 223.104.5.227.22146: Flags [S.], seq 3384110237, ack 4265831313, win 32767, options [mss 1460,nop,wscale 0,sackOK,TS val 173688548 ecr 23800964], length 0
14:58:10.091946 IP 10.0.0.236.27021 > 223.104.5.227.22146: Flags [S.], seq 3384110237, ack 4265831313, win 32767, options [mss 1460,nop,wscale 0,sackOK,TS val 173688548 ecr 23800964], length 0
14:58:10.125420 IP 39.7.14.93.applusservice > 10.0.0.236.pnbs: Flags [S], seq 4161920806, win 65535, options [mss 1382,sackOK,TS val 43401256 ecr 0,nop,wscale 7], length 0
14:58:10.125438 IP 39.7.14.93.applusservice > 10.0.98.29.pnbs: Flags [S], seq 4161920806, win 65535, options [mss 1382,sackOK,TS val 43401256 ecr 0,nop,wscale 7], length 0
14:58:10.125578 IP 10.0.98.29.pnbs > 39.7.14.93.applusservice: Flags [S.], seq 3040993255, ack 4161920807, win 32767, options [mss 1460,nop,wscale 0,sackOK,TS val 173688551 ecr 43401256], length 0
14:58:10.125585 IP 10.0.0.236.pnbs > 39.7.14.93.applusservice: Flags [S.], seq 3040993255, ack 4161920807, win 32767, options [mss 1460,nop,wscale 0,sackOK,TS val 173688551 ecr 43401256], length 0
14:58:10.274952 IP 60.180.55.195.lonewolf-lm > 10.0.0.236.27021: Flags [F.], seq 1, ack 1, win 16560, length 0
14:58:10.274972 IP 60.180.55.195.lonewolf-lm > 10.0.98.29.27021: Flags [F.], seq 1, ack 1, win 16560, length 0
14:58:10.275231 IP 10.0.98.29.27021 > 60.180.55.195.lonewolf-lm: Flags [F.], seq 1, ack 2, win 32767, length 0
14:58:10.275245 IP 10.0.0.236.27021 > 60.180.55.195.lonewolf-lm: Flags [F.], seq 1, ack 2, win 32767, length 0
14:58:10.275753 IP 60.180.55.195.tal-pod > 10.0.0.236.27021: Flags [S], seq 2366422696, win 8192, options [mss 1440,nop,wscale 2,nop,nop,sackOK], length 0
14:58:10.275774 IP 60.180.55.195.tal-pod > 10.0.98.29.27021: Flags [S], seq 2366422696, win 8192, options [mss 1440,nop,wscale 2,nop,nop,sackOK], length 0
14:58:10.275919 IP 10.0.98.29.27021 > 60.180.55.195.tal-pod: Flags [S.], seq 114522741, ack 2366422697, win 32767, options [mss 1460,nop,wscale 0,nop,nop,sackOK], length 0
14:58:10.275929 IP 10.0.0.236.27021 > 60.180.55.195.tal-pod: Flags [S.], seq 114522741, ack 2366422697, win 32767, options [mss 1460,nop,wscale 0,nop,nop,sackOK], length 0
14:58:10.360291 IP 10.0.98.29.27021 > 110.169.179.193.52210: Flags [FP.], seq 15221:15450, ack 534, win 32235, options [nop,nop,TS val 173688574 ecr 1432039086], length 229
14:58:10.360306 IP 10.0.0.236.27021 > 110.169.179.193.52210: Flags [FP.], seq 15221:15450, ack 534, win 32235, options [nop,nop,TS val 173688574 ecr 1432039086], length 229
14:58:10.403518 IP 113.185.55.113.19851 > 10.0.0.236.pnbs: Flags [F.], seq 2222378137, ack 4168583794, win 381, options [nop,nop,TS val 7042135 ecr 173688560], length 0
14:58:10.403531 IP 113.185.55.113.19851 > 10.0.98.29.pnbs: Flags [F.], seq 2222378137, ack 4168583794, win 381, options [nop,nop,TS val 7042135 ecr 173688560], length 0
14:58:10.403839 IP 10.0.98.29.pnbs > 113.185.55.113.19851: Flags [F.], seq 342, ack 1, win 32054, options [nop,nop,TS val 173688579 ecr 7042135], length 0
14:58:10.403852 IP 10.0.0.236.pnbs > 113.185.55.113.19851: Flags [F.], seq 342, ack 1, win 32054, options [nop,nop,TS val 173688579 ecr 7042135], length 0
14:58:10.405431 IP 113.185.55.113.19851 > 10.0.0.236.pnbs: Flags [R.], seq 1, ack 1, win 387, options [nop,nop,TS val 7042135 ecr 173688560], length 0
14:58:10.405454 IP 113.185.55.113.19851 > 10.0.98.29.pnbs: Flags [R.], seq 1, ack 1, win 387, options [nop,nop,TS val 7042135 ecr 173688560], length 0
14:58:10.523043 IP 113.185.55.113.19851 > 10.0.0.236.pnbs: Flags [R], seq 2222378137, win 0, length 0
14:58:10.553726 IP 113.185.55.113.19851 > 10.0.0.236.pnbs: Flags [R], seq 2222378138, win 0, length 0
14:58:10.553738 IP 113.185.55.113.19851 > 10.0.98.29.pnbs: Flags [R], seq 2222378138, win 0, length 0
14:58:10.556270 IP 113.185.55.113.19851 > 10.0.0.236.pnbs: Flags [R], seq 2222378138, win 0, length 0
14:58:10.556282 IP 113.185.55.113.19851 > 10.0.98.29.pnbs: Flags [R], seq 2222378138, win 0, length 0
14:58:10.622126 IP 171.217.129.200.50053 > 10.0.0.236.pnbs: Flags [F.], seq 2249668404, ack 1697882659, win 4096, options [nop,nop,TS val 539602302 ecr 173688582], length 0
14:58:10.622139 IP 171.217.129.200.50053 > 10.0.98.29.pnbs: Flags [F.], seq 2249668404, ack 1697882659, win 4096, options [nop,nop,TS val 539602302 ecr 173688582], length 0
14:58:10.622468 IP 10.0.98.29.pnbs > 171.217.129.200.50053: Flags [F.], seq 340, ack 1, win 31722, options [nop,nop,TS val 173688601 ecr 539602302], length 0
14:58:10.622481 IP 10.0.0.236.pnbs > 171.217.129.200.50053: Flags [F.], seq 340, ack 1, win 31722, options [nop,nop,TS val 173688601 ecr 539602302], length 0
14:58:10.716120 IP 171.217.129.200.50053 > 10.0.0.236.pnbs: Flags [R], seq 2249668404, win 0, length 0
14:58:10.741562 IP 171.217.129.200.50053 > 10.0.0.236.pnbs: Flags [R], seq 2249668405, win 0, length 0
14:58:10.741586 IP 171.217.129.200.50053 > 10.0.98.29.pnbs: Flags [R], seq 2249668405, win 0, length 0
14:58:10.741591 IP 171.217.129.200.50053 > 10.0.0.236.pnbs: Flags [R], seq 2249668405, win 0, length 0
14:58:10.741599 IP 171.217.129.200.50053 > 10.0.98.29.pnbs: Flags [R], seq 2249668405, win 0, length 0
14:58:10.797753 IP 93.140.37.93.52235 > 10.0.0.236.pnbs: Flags [S], seq 1637890875, win 65535, options [mss 1452,sackOK,TS val 796770 ecr 0,nop,wscale 6], length 0
14:58:10.797781 IP 93.140.37.93.52235 > 10.0.98.29.pnbs: Flags [S], seq 1637890875, win 65535, options [mss 1452,sackOK,TS val 796770 ecr 0,nop,wscale 6], length 0
14:58:10.797948 IP 10.0.98.29.pnbs > 93.140.37.93.52235: Flags [S.], seq 447951626, ack 1637890876, win 32767, options [mss 1460,nop,wscale 0,sackOK,TS val 173688618 ecr 796770], length 0
14:58:10.797968 IP 10.0.0.236.pnbs > 93.140.37.93.52235: Flags [S.], seq 447951626, ack 1637890876, win 32767, options [mss 1460,nop,wscale 0,sackOK,TS val 173688618 ecr 796770], length 0
14:58:11.285280 IP 10.0.98.29.pnbs > 101.231.92.122.31576: Flags [R.], seq 679330254, ack 941169910, win 0, length 0
14:58:11.285300 IP 10.0.0.236.pnbs > 101.231.92.122.31576: Flags [R.], seq 679330254, ack 941169910, win 0, length 0
14:58:11.296592 IP 119.56.122.171.33493 > 10.0.0.236.27022: Flags [F.], seq 2622003692, ack 1604264226, win 5183, options [nop,nop,TS val 1412441 ecr 173688641], length 0
14:58:11.296605 IP 119.56.122.171.33493 > 10.0.98.29.27022: Flags [F.], seq 2622003692, ack 1604264226, win 5183, options [nop,nop,TS val 1412441 ecr 173688641], length 0
14:58:11.297038 IP 10.0.98.29.27022 > 119.56.122.171.33493: Flags [F.], seq 69, ack 1, win 31655, options [nop,nop,TS val 173688668 ecr 1412441], length 0
14:58:11.297053 IP 10.0.0.236.27022 > 119.56.122.171.33493: Flags [F.], seq 69, ack 1, win 31655, options [nop,nop,TS val 173688668 ecr 1412441], length 0
14:58:11.374497 IP 119.56.122.171.33493 > 10.0.0.236.27022: Flags [R], seq 2622003692, win 0, length 0
14:58:11.382367 IP 119.56.122.171.33493 > 10.0.0.236.27022: Flags [R], seq 2622003693, win 0, length 0
14:58:11.382379 IP 119.56.122.171.33493 > 10.0.98.29.27022: Flags [R], seq 2622003693, win 0, length 0
14:58:11.383445 IP 119.56.122.171.33493 > 10.0.0.236.27022: Flags [R], seq 2622003693, win 0, length 0
14:58:11.383475 IP 119.56.122.171.33493 > 10.0.98.29.27022: Flags [R], seq 2622003693, win 0, length 0
14:58:11.460513 IP 60.180.55.195.tal-pod > 10.0.0.236.27021: Flags [F.], seq 1, ack 1, win 16560, length 0
14:58:11.460528 IP 60.180.55.195.tal-pod > 10.0.98.29.27021: Flags [F.], seq 1, ack 1, win 16560, length 0
14:58:11.460666 IP 60.180.55.195.6150 > 10.0.0.236.27021: Flags [S], seq 1196319241, win 8192, options [mss 1440,nop,wscale 2,nop,nop,sackOK], length 0
14:58:11.460681 IP 60.180.55.195.6150 > 10.0.98.29.27021: Flags [S], seq 1196319241, win 8192, options [mss 1440,nop,wscale 2,nop,nop,sackOK], length 0
14:58:11.460798 IP 10.0.98.29.27021 > 60.180.55.195.tal-pod: Flags [F.], seq 1, ack 2, win 32767, length 0
14:58:11.460812 IP 10.0.0.236.27021 > 60.180.55.195.tal-pod: Flags [F.], seq 1, ack 2, win 32767, length 0
14:58:11.460847 IP 10.0.98.29.27021 > 60.180.55.195.6150: Flags [S.], seq 3185951586, ack 1196319242, win 32767, options [mss 1460,nop,wscale 0,nop,nop,sackOK], length 0
14:58:11.460861 IP 10.0.0.236.27021 > 60.180.55.195.6150: Flags [S.], seq 3185951586, ack 1196319242, win 32767, options [mss 1460,nop,wscale 0,nop,nop,sackOK], length 0
14:58:11.638544 IP 119.4.174.92.32275 > 10.0.0.236.pnbs: Flags [S], seq 3798148763, win 65535, options [mss 1370,sackOK,TS val 2312714 ecr 0,nop,wscale 6], length 0
14:58:11.638577 IP 119.4.174.92.32275 > 10.0.98.29.pnbs: Flags [S], seq 3798148763, win 65535, options [mss 1370,sackOK,TS val 2312714 ecr 0,nop,wscale 6], length 0
14:58:11.638751 IP 10.0.98.29.pnbs > 119.4.174.92.32275: Flags [S.], seq 3669243166, ack 3798148764, win 32767, options [mss 1460,nop,wscale 0,sackOK,TS val 173688702 ecr 2312714], length 0
14:58:11.638778 IP 10.0.0.236.pnbs > 119.4.174.92.32275: Flags [S.], seq 3669243166, ack 3798148764, win 32767, options [mss 1460,nop,wscale 0,sackOK,TS val 173688702 ecr 2312714], length 0
14:58:12.602584 IP 110.169.179.193.52211 > 10.0.0.236.27021: Flags [S], seq 3123686899, win 65535, options [mss 1460,nop,wscale 5,nop,nop,TS val 1432043744 ecr 0,sackOK,eol], length 0
14:58:12.602616 IP 110.169.179.193.52211 > 10.0.98.29.27021: Flags [S], seq 3123686899, win 65535, options [mss 1460,nop,wscale 5,nop,nop,TS val 1432043744 ecr 0,sackOK,eol], length 0
14:58:12.602798 IP 10.0.98.29.27021 > 110.169.179.193.52211: Flags [S.], seq 3526177611, ack 3123686900, win 32767, options [mss 1460,nop,wscale 0,sackOK,TS val 173688799 ecr 1432043744], length 0
14:58:12.602818 IP 10.0.0.236.27021 > 110.169.179.193.52211: Flags [S.], seq 3526177611, ack 3123686900, win 32767, options [mss 1460,nop,wscale 0,sackOK,TS val 173688799 ecr 1432043744], length 0
14:58:12.629890 IP 60.180.55.195.6158 > 10.0.0.236.27021: Flags [S], seq 1861497067, win 8192, options [mss 1440,nop,wscale 2,nop,nop,sackOK], length 0
14:58:12.629902 IP 60.180.55.195.6158 > 10.0.98.29.27021: Flags [S], seq 1861497067, win 8192, options [mss 1440,nop,wscale 2,nop,nop,sackOK], length 0
14:58:12.630038 IP 10.0.98.29.27021 > 60.180.55.195.6158: Flags [S.], seq 3189178552, ack 1861497068, win 32767, options [mss 1460,nop,wscale 0,nop,nop,sackOK], length 0
14:58:12.630051 IP 10.0.0.236.27021 > 60.180.55.195.6158: Flags [S.], seq 3189178552, ack 1861497068, win 32767, options [mss 1460,nop,wscale 0,nop,nop,sackOK], length 0
14:58:12.630204 IP 60.180.55.195.6150 > 10.0.0.236.27021: Flags [F.], seq 1, ack 1, win 16560, length 0
14:58:12.630220 IP 60.180.55.195.6150 > 10.0.98.29.27021: Flags [F.], seq 1, ack 1, win 16560, length 0
14:58:12.630478 IP 10.0.98.29.27021 > 60.180.55.195.6150: Flags [F.], seq 1, ack 2, win 32767, length 0
14:58:12.630493 IP 10.0.0.236.27021 > 60.180.55.195.6150: Flags [F.], seq 1, ack 2, win 32767, length 0
14:58:13.000316 IP 10.0.98.29.27021 > 110.169.179.193.52210: Flags [FP.], seq 15221:15450, ack 534, win 32235, options [nop,nop,TS val 173688838 ecr 1432039086], length 229
14:58:13.000335 IP 10.0.0.236.27021 > 110.169.179.193.52210: Flags [FP.], seq 15221:15450, ack 534, win 32235, options [nop,nop,TS val 173688838 ecr 1432039086], length 229
14:58:13.025632 IP 39.7.14.93.56833 > 10.0.0.236.27021: Flags [S], seq 3678099577, win 65535, options [mss 1382,sackOK,TS val 43401545 ecr 0,nop,wscale 7], length 0
14:58:13.025654 IP 39.7.14.93.56833 > 10.0.98.29.27021: Flags [S], seq 3678099577, win 65535, options [mss 1382,sackOK,TS val 43401545 ecr 0,nop,wscale 7], length 0
14:58:13.025816 IP 10.0.98.29.27021 > 39.7.14.93.56833: Flags [S.], seq 430842543, ack 3678099578, win 32767, options [mss 1460,nop,wscale 0,sackOK,TS val 173688841 ecr 43401545], length 0
14:58:13.025829 IP 10.0.0.236.27021 > 39.7.14.93.56833: Flags [S.], seq 430842543, ack 3678099578, win 32767, options [mss 1460,nop,wscale 0,sackOK,TS val 173688841 ecr 43401545], length 0
14:58:13.799723 IP 60.180.55.195.6158 > 10.0.0.236.27021: Flags [F.], seq 1, ack 1, win 16560, length 0
14:58:13.799753 IP 60.180.55.195.6158 > 10.0.98.29.27021: Flags [F.], seq 1, ack 1, win 16560, length 0
14:58:13.800103 IP 10.0.98.29.27021 > 60.180.55.195.6158: Flags [F.], seq 1, ack 2, win 32767, length 0
14:58:13.800118 IP 10.0.0.236.27021 > 60.180.55.195.6158: Flags [F.], seq 1, ack 2, win 32767, length 0
14:58:13.800382 IP 60.180.55.195.6159 > 10.0.0.236.27021: Flags [S], seq 3233119633, win 8192, options [mss 1440,nop,wscale 2,nop,nop,sackOK], length 0
14:58:13.800402 IP 60.180.55.195.6159 > 10.0.98.29.27021: Flags [S], seq 3233119633, win 8192, options [mss 1440,nop,wscale 2,nop,nop,sackOK], length 0
14:58:13.800567 IP 10.0.98.29.27021 > 60.180.55.195.6159: Flags [S.], seq 183072843, ack 3233119634, win 32767, options [mss 1460,nop,wscale 0,nop,nop,sackOK], length 0
14:58:13.800575 IP 10.0.0.236.27021 > 60.180.55.195.6159: Flags [S.], seq 183072843, ack 3233119634, win 32767, options [mss 1460,nop,wscale 0,nop,nop,sackOK], length 0
14:58:14.950680 IP 119.115.10.42.39503 > 10.0.0.236.pnbs: Flags [S], seq 680065631, win 65535, options [mss 1440,sackOK,TS val 2562275 ecr 0,nop,wscale 7], length 0
14:58:14.950701 IP 119.115.10.42.39503 > 10.0.98.29.pnbs: Flags [S], seq 680065631, win 65535, options [mss 1440,sackOK,TS val 2562275 ecr 0,nop,wscale 7], length 0
14:58:14.950852 IP 10.0.98.29.pnbs > 119.115.10.42.39503: Flags [S.], seq 4035637648, ack 680065632, win 32767, options [mss 1460,nop,wscale 0,sackOK,TS val 173689033 ecr 2562275], length 0
14:58:14.950863 IP 10.0.0.236.pnbs > 119.115.10.42.39503: Flags [S.], seq 4035637648, ack 680065632, win 32767, options [mss 1460,nop,wscale 0,sackOK,TS val 173689033 ecr 2562275], length 0
14:58:14.954799 IP 60.180.55.195.6159 > 10.0.0.236.27021: Flags [F.], seq 1, ack 1, win 16560, length 0
14:58:14.954816 IP 60.180.55.195.6159 > 10.0.98.29.27021: Flags [F.], seq 1, ack 1, win 16560, length 0
14:58:14.954928 IP 60.180.55.195.pscribe > 10.0.0.236.27021: Flags [S], seq 1081258077, win 8192, options [mss 1440,nop,wscale 2,nop,nop,sackOK], length 0
14:58:14.954946 IP 60.180.55.195.pscribe > 10.0.98.29.27021: Flags [S], seq 1081258077, win 8192, options [mss 1440,nop,wscale 2,nop,nop,sackOK], length 0
14:58:14.955097 IP 10.0.98.29.27021 > 60.180.55.195.pscribe: Flags [S.], seq 1871488948, ack 1081258078, win 32767, options [mss 1460,nop,wscale 0,nop,nop,sackOK], length 0
14:58:14.955108 IP 10.0.0.236.27021 > 60.180.55.195.pscribe: Flags [S.], seq 1871488948, ack 1081258078, win 32767, options [mss 1460,nop,wscale 0,nop,nop,sackOK], length 0
14:58:14.955119 IP 10.0.98.29.27021 > 60.180.55.195.6159: Flags [F.], seq 1, ack 2, win 32767, length 0
14:58:14.955137 IP 10.0.0.236.27021 > 60.180.55.195.6159: Flags [F.], seq 1, ack 2, win 32767, length 0
14:58:15.089030 IP 113.165.89.229.20382 > 10.0.0.236.pnbs: Flags [S], seq 4189859379, win 8192, options [mss 1400,nop,wscale 8,nop,nop,sackOK], length 0
14:58:15.089055 IP 113.165.89.229.20382 > 10.0.98.29.pnbs: Flags [S], seq 4189859379, win 8192, options [mss 1400,nop,wscale 8,nop,nop,sackOK], length 0
14:58:15.089215 IP 10.0.98.29.pnbs > 113.165.89.229.20382: Flags [S.], seq 2759541060, ack 4189859380, win 32767, options [mss 1460,nop,wscale 0,nop,nop,sackOK], length 0
14:58:15.089229 IP 10.0.0.236.pnbs > 113.165.89.229.20382: Flags [S.], seq 2759541060, ack 4189859380, win 32767, options [mss 1460,nop,wscale 0,nop,nop,sackOK], length 0
14:58:15.333311 IP 183.206.172.223.12727 > 10.0.0.236.27021: Flags [F.], seq 471, ack 13946, win 16374, length 0
14:58:15.333332 IP 183.206.172.223.12727 > 10.0.98.29.27021: Flags [F.], seq 471, ack 13946, win 16374, length 0
