tcpdump: verbose output suppressed, use -v or -vv for full protocol decode
listening on eth0, link-type EN10MB (Ethernet), capture size 65535 bytes
00:57:12.466363 IP 123.112.254.86.36837 > 10.0.0.40.pnbs: Flags [S], seq 3346480434, win 8192, options [mss 1412,nop,wscale 2,nop,nop,sackOK], length 0
00:57:12.466397 IP 123.112.254.86.36837 > 10.0.98.12.pnbs: Flags [S], seq 3346480434, win 8192, options [mss 1400,nop,wscale 2,nop,nop,sackOK], length 0
00:57:13.804414 IP 202.166.24.150.49825 > 10.0.0.40.pnbs: Flags [S], seq 3926547591, win 8192, options [mss 1460,nop,wscale 2,nop,nop,sackOK], length 0
00:57:13.804450 IP 202.166.24.150.49825 > 10.0.98.12.pnbs: Flags [S], seq 3926547591, win 8192, options [mss 1400,nop,wscale 2,nop,nop,sackOK], length 0
00:57:15.466049 IP 123.112.254.86.36837 > 10.0.0.40.pnbs: Flags [S], seq 3346480434, win 8192, options [mss 1412,nop,wscale 2,nop,nop,sackOK], length 0
00:57:15.466075 IP 123.112.254.86.36837 > 10.0.98.12.pnbs: Flags [S], seq 3346480434, win 8192, options [mss 1400,nop,wscale 2,nop,nop,sackOK], length 0
00:57:16.800927 IP 202.166.24.150.49825 > 10.0.0.40.pnbs: Flags [S], seq 3926547591, win 8192, options [mss 1460,nop,wscale 2,nop,nop,sackOK], length 0
00:57:16.800956 IP 202.166.24.150.49825 > 10.0.98.12.pnbs: Flags [S], seq 3926547591, win 8192, options [mss 1400,nop,wscale 2,nop,nop,sackOK], length 0
00:57:21.466984 IP 123.112.254.86.36837 > 10.0.0.40.pnbs: Flags [S], seq 3346480434, win 8192, options [mss 1412,nop,nop,sackOK], length 0
00:57:21.467011 IP 123.112.254.86.36837 > 10.0.98.12.pnbs: Flags [S], seq 3346480434, win 8192, options [mss 1400,nop,nop,sackOK], length 0
00:57:22.663891 IP 123.26.27.17.13450 > 10.0.0.40.pnbs: Flags [S], seq 3498415061, win 8192, options [mss 1400,nop,wscale 2,nop,nop,sackOK], length 0
00:57:22.663928 IP 123.26.27.17.13450 > 10.0.98.12.pnbs: Flags [S], seq 3498415061, win 8192, options [mss 1400,nop,wscale 2,nop,nop,sackOK], length 0
00:57:22.798252 IP 202.166.24.150.49825 > 10.0.0.40.pnbs: Flags [S], seq 3926547591, win 8192, options [mss 1460,nop,nop,sackOK], length 0
00:57:22.798275 IP 202.166.24.150.49825 > 10.0.98.12.pnbs: Flags [S], seq 3926547591, win 8192, options [mss 1400,nop,nop,sackOK], length 0
00:57:25.662338 IP 123.26.27.17.13450 > 10.0.0.40.pnbs: Flags [S], seq 3498415061, win 8192, options [mss 1400,nop,wscale 2,nop,nop,sackOK], length 0
00:57:25.662364 IP 123.26.27.17.13450 > 10.0.98.12.pnbs: Flags [S], seq 3498415061, win 8192, options [mss 1400,nop,wscale 2,nop,nop,sackOK], length 0
00:57:26.182224 IP 49.80.219.38.23536 > 10.0.0.40.pnbs: Flags [S], seq 3524211133, win 8192, options [mss 1460,nop,wscale 8,nop,nop,sackOK], length 0
00:57:26.182259 IP 49.80.219.38.23536 > 10.0.98.12.pnbs: Flags [S], seq 3524211133, win 8192, options [mss 1400,nop,wscale 8,nop,nop,sackOK], length 0
00:57:29.189758 IP 49.80.219.38.23536 > 10.0.0.40.pnbs: Flags [S], seq 3524211133, win 8192, options [mss 1460,nop,wscale 8,nop,nop,sackOK], length 0
00:57:29.189787 IP 49.80.219.38.23536 > 10.0.98.12.pnbs: Flags [S], seq 3524211133, win 8192, options [mss 1400,nop,wscale 8,nop,nop,sackOK], length 0
00:57:31.663407 IP 123.26.27.17.13450 > 10.0.0.40.pnbs: Flags [S], seq 3498415061, win 8192, options [mss 1400,nop,nop,sackOK], length 0
00:57:31.663423 IP 123.26.27.17.13450 > 10.0.98.12.pnbs: Flags [S], seq 3498415061, win 8192, options [mss 1400,nop,nop,sackOK], length 0
00:57:35.189625 IP 49.80.219.38.23543 > 10.0.0.40.pnbs: Flags [S], seq 3524211133, win 8192, options [mss 1460,nop,nop,sackOK], length 0
00:57:35.189660 IP 49.80.219.38.23543 > 10.0.98.12.pnbs: Flags [S], seq 3524211133, win 8192, options [mss 1400,nop,nop,sackOK], length 0
00:57:40.337606 IP 171.250.75.189.25617 > 10.0.98.12.telnet: Flags [S], seq 1805267601, win 24001, options [mss 1400], length 0
00:57:58.190406 IP 88.203.106.68.64627 > 10.0.0.40.pnbs: Flags [S], seq 4060817120, win 8192, options [mss 1460,nop,wscale 8,nop,nop,sackOK], length 0
00:57:58.190447 IP 88.203.106.68.64627 > 10.0.98.12.pnbs: Flags [S], seq 4060817120, win 8192, options [mss 1400,nop,wscale 8,nop,nop,sackOK], length 0
00:58:01.186128 IP 88.203.106.68.64627 > 10.0.0.40.pnbs: Flags [S], seq 4060817120, win 8192, options [mss 1460,nop,wscale 8,nop,nop,sackOK], length 0
00:58:01.186154 IP 88.203.106.68.64627 > 10.0.98.12.pnbs: Flags [S], seq 4060817120, win 8192, options [mss 1400,nop,wscale 8,nop,nop,sackOK], length 0
00:58:07.187034 IP 88.203.106.68.64627 > 10.0.0.40.pnbs: Flags [S], seq 4060817120, win 8192, options [mss 1460,nop,nop,sackOK], length 0
00:58:07.187062 IP 88.203.106.68.64627 > 10.0.98.12.pnbs: Flags [S], seq 4060817120, win 8192, options [mss 1400,nop,nop,sackOK], length 0
00:58:15.097223 IP 60.182.34.238.26847 > 10.0.0.40.pnbs: Flags [S], seq 1352775038, win 8192, options [mss 1452,nop,wscale 2,nop,nop,sackOK], length 0
00:58:15.097259 IP 60.182.34.238.26847 > 10.0.98.12.pnbs: Flags [S], seq 1352775038, win 8192, options [mss 1400,nop,wscale 2,nop,nop,sackOK], length 0
00:58:18.103514 IP 60.182.34.238.26847 > 10.0.0.40.pnbs: Flags [S], seq 1352775038, win 8192, options [mss 1452,nop,wscale 2,nop,nop,sackOK], length 0
00:58:18.103537 IP 60.182.34.238.26847 > 10.0.98.12.pnbs: Flags [S], seq 1352775038, win 8192, options [mss 1400,nop,wscale 2,nop,nop,sackOK], length 0
00:58:18.594510 IP 14.117.156.146.58378 > 10.0.0.40.pnbs: Flags [S], seq 4015591329, win 8192, options [mss 1440,nop,wscale 8,nop,nop,sackOK], length 0
00:58:18.594541 IP 14.117.156.146.58378 > 10.0.98.12.pnbs: Flags [S], seq 4015591329, win 8192, options [mss 1400,nop,wscale 8,nop,nop,sackOK], length 0
00:58:21.588774 IP 14.117.156.146.58378 > 10.0.0.40.pnbs: Flags [S], seq 4015591329, win 8192, options [mss 1460,nop,wscale 8,nop,nop,sackOK], length 0
00:58:21.588803 IP 14.117.156.146.58378 > 10.0.98.12.pnbs: Flags [S], seq 4015591329, win 8192, options [mss 1400,nop,wscale 8,nop,nop,sackOK], length 0
00:58:24.104893 IP 60.182.34.238.26847 > 10.0.0.40.pnbs: Flags [S], seq 1352775038, win 8192, options [mss 1452,nop,nop,sackOK], length 0
00:58:24.104918 IP 60.182.34.238.26847 > 10.0.98.12.pnbs: Flags [S], seq 1352775038, win 8192, options [mss 1400,nop,nop,sackOK], length 0
00:58:25.554735 IP 113.140.7.218.49639 > 10.0.0.40.pnbs: Flags [S], seq 2696784767, win 8192, options [mss 1400,nop,nop,sackOK], length 0
00:58:25.554769 IP 113.140.7.218.49639 > 10.0.98.12.pnbs: Flags [S], seq 2696784767, win 8192, options [mss 1400,nop,nop,sackOK], length 0
00:58:27.593782 IP 14.117.156.146.58378 > 10.0.0.40.pnbs: Flags [S], seq 4015591329, win 8192, options [mss 1460,nop,nop,sackOK], length 0
00:58:27.593810 IP 14.117.156.146.58378 > 10.0.98.12.pnbs: Flags [S], seq 4015591329, win 8192, options [mss 1400,nop,nop,sackOK], length 0
00:58:28.549089 IP 113.140.7.218.49639 > 10.0.0.40.pnbs: Flags [S], seq 2696784767, win 8192, options [mss 1400,nop,nop,sackOK], length 0
00:58:28.549116 IP 113.140.7.218.49639 > 10.0.98.12.pnbs: Flags [S], seq 2696784767, win 8192, options [mss 1400,nop,nop,sackOK], length 0
00:58:34.557410 IP 113.140.7.218.49639 > 10.0.0.40.pnbs: Flags [S], seq 2696784767, win 8192, options [mss 1400,nop,nop,sackOK], length 0
00:58:34.557441 IP 113.140.7.218.49639 > 10.0.98.12.pnbs: Flags [S], seq 2696784767, win 8192, options [mss 1400,nop,nop,sackOK], length 0
00:58:36.327096 IP 78.175.43.213.50372 > 10.0.0.40.pnbs: Flags [S], seq 3858119156, win 8192, options [mss 1452,nop,wscale 2,nop,nop,sackOK], length 0
00:58:36.327131 IP 78.175.43.213.50372 > 10.0.98.12.pnbs: Flags [S], seq 3858119156, win 8192, options [mss 1400,nop,wscale 2,nop,nop,sackOK], length 0
00:58:39.328130 IP 78.175.43.213.50372 > 10.0.0.40.pnbs: Flags [S], seq 3858119156, win 8192, options [mss 1452,nop,wscale 2,nop,nop,sackOK], length 0
00:58:39.328161 IP 78.175.43.213.50372 > 10.0.98.12.pnbs: Flags [S], seq 3858119156, win 8192, options [mss 1400,nop,wscale 2,nop,nop,sackOK], length 0
00:58:40.831383 IP 88.203.106.68.64634 > 10.0.0.40.pnbs: Flags [S], seq 1595820964, win 8192, options [mss 1460,nop,wscale 8,nop,nop,sackOK], length 0
00:58:40.831416 IP 88.203.106.68.64634 > 10.0.98.12.pnbs: Flags [S], seq 1595820964, win 8192, options [mss 1400,nop,wscale 8,nop,nop,sackOK], length 0
00:58:43.831841 IP 88.203.106.68.64634 > 10.0.0.40.pnbs: Flags [S], seq 1595820964, win 8192, options [mss 1460,nop,wscale 8,nop,nop,sackOK], length 0
00:58:43.831866 IP 88.203.106.68.64634 > 10.0.98.12.pnbs: Flags [S], seq 1595820964, win 8192, options [mss 1400,nop,wscale 8,nop,nop,sackOK], length 0
00:58:45.322469 IP 78.175.43.213.50372 > 10.0.0.40.pnbs: Flags [S], seq 3858119156, win 8192, options [mss 1452,nop,nop,sackOK], length 0
00:58:45.322514 IP 78.175.43.213.50372 > 10.0.98.12.pnbs: Flags [S], seq 3858119156, win 8192, options [mss 1400,nop,nop,sackOK], length 0
00:58:49.830832 IP 88.203.106.68.64634 > 10.0.0.40.pnbs: Flags [S], seq 1595820964, win 8192, options [mss 1460,nop,nop,sackOK], length 0
00:58:49.830857 IP 88.203.106.68.64634 > 10.0.98.12.pnbs: Flags [S], seq 1595820964, win 8192, options [mss 1400,nop,nop,sackOK], length 0
00:58:50.243066 IP 124.5.239.134.6118 > 10.0.0.40.pnbs: Flags [S], seq 176461231, win 8192, options [mss 1460,nop,wscale 2,nop,nop,sackOK], length 0
00:58:50.243107 IP 124.5.239.134.6118 > 10.0.98.12.pnbs: Flags [S], seq 176461231, win 8192, options [mss 1400,nop,wscale 2,nop,nop,sackOK], length 0
00:58:53.254132 IP 124.5.239.134.6118 > 10.0.0.40.pnbs: Flags [S], seq 176461231, win 8192, options [mss 1460,nop,wscale 2,nop,nop,sackOK], length 0
00:58:53.254160 IP 124.5.239.134.6118 > 10.0.98.12.pnbs: Flags [S], seq 176461231, win 8192, options [mss 1400,nop,wscale 2,nop,nop,sackOK], length 0
00:58:59.331075 IP 124.5.239.134.6118 > 10.0.0.40.pnbs: Flags [S], seq 176461231, win 8192, options [mss 1460,nop,nop,sackOK], length 0
00:58:59.331108 IP 124.5.239.134.6118 > 10.0.98.12.pnbs: Flags [S], seq 176461231, win 8192, options [mss 1400,nop,nop,sackOK], length 0
00:59:03.246271 IP 112.209.134.94.49844 > 10.0.0.40.pnbs: Flags [S], seq 3040238761, win 8192, options [mss 1460,nop,wscale 2,nop,nop,sackOK], length 0
00:59:03.246306 IP 112.209.134.94.49844 > 10.0.98.12.pnbs: Flags [S], seq 3040238761, win 8192, options [mss 1400,nop,wscale 2,nop,nop,sackOK], length 0
00:59:06.254080 IP 112.209.134.94.49844 > 10.0.0.40.pnbs: Flags [S], seq 3040238761, win 8192, options [mss 1460,nop,wscale 2,nop,nop,sackOK], length 0
00:59:06.254106 IP 112.209.134.94.49844 > 10.0.98.12.pnbs: Flags [S], seq 3040238761, win 8192, options [mss 1400,nop,wscale 2,nop,nop,sackOK], length 0
00:59:12.252245 IP 112.209.134.94.49844 > 10.0.0.40.pnbs: Flags [S], seq 3040238761, win 8192, options [mss 1460,nop,nop,sackOK], length 0
00:59:12.252271 IP 112.209.134.94.49844 > 10.0.98.12.pnbs: Flags [S], seq 3040238761, win 8192, options [mss 1400,nop,nop,sackOK], length 0
00:59:27.832504 IP 1.243.255.191.firstcall42 > 10.0.0.40.pnbs: Flags [S], seq 420482547, win 8192, options [mss 1460,nop,wscale 8,nop,nop,sackOK], length 0
00:59:27.832539 IP 1.243.255.191.firstcall42 > 10.0.98.12.pnbs: Flags [S], seq 420482547, win 8192, options [mss 1400,nop,wscale 8,nop,nop,sackOK], length 0
00:59:30.832576 IP 1.243.255.191.firstcall42 > 10.0.0.40.pnbs: Flags [S], seq 420482547, win 8192, options [mss 1460,nop,wscale 8,nop,nop,sackOK], length 0
00:59:30.832607 IP 1.243.255.191.firstcall42 > 10.0.98.12.pnbs: Flags [S], seq 420482547, win 8192, options [mss 1400,nop,wscale 8,nop,nop,sackOK], length 0
00:59:33.469025 IP 124.5.239.134.6125 > 10.0.0.40.pnbs: Flags [S], seq 1150856088, win 8192, options [mss 1460,nop,wscale 2,nop,nop,sackOK], length 0
00:59:33.469069 IP 124.5.239.134.6125 > 10.0.98.12.pnbs: Flags [S], seq 1150856088, win 8192, options [mss 1400,nop,wscale 2,nop,nop,sackOK], length 0
00:59:34.296708 IP 117.156.14.145.8568 > 10.0.0.40.pnbs: Flags [S], seq 4293934558, win 8192, options [mss 1400,nop,wscale 2,nop,nop,sackOK], length 0
00:59:34.296744 IP 117.156.14.145.8568 > 10.0.98.12.pnbs: Flags [S], seq 4293934558, win 8192, options [mss 1400,nop,wscale 2,nop,nop,sackOK], length 0
00:59:36.471095 IP 124.5.239.134.6125 > 10.0.0.40.pnbs: Flags [S], seq 1150856088, win 8192, options [mss 1460,nop,wscale 2,nop,nop,sackOK], length 0
00:59:36.471131 IP 124.5.239.134.6125 > 10.0.98.12.pnbs: Flags [S], seq 1150856088, win 8192, options [mss 1400,nop,wscale 2,nop,nop,sackOK], length 0
00:59:36.832628 IP 1.243.255.191.firstcall42 > 10.0.0.40.pnbs: Flags [S], seq 420482547, win 8192, options [mss 1460,nop,nop,sackOK], length 0
00:59:36.832653 IP 1.243.255.191.firstcall42 > 10.0.98.12.pnbs: Flags [S], seq 420482547, win 8192, options [mss 1400,nop,nop,sackOK], length 0
00:59:37.296645 IP 117.156.14.145.8568 > 10.0.0.40.pnbs: Flags [S], seq 4293934558, win 8192, options [mss 1400,nop,wscale 2,nop,nop,sackOK], length 0
00:59:37.296666 IP 117.156.14.145.8568 > 10.0.98.12.pnbs: Flags [S], seq 4293934558, win 8192, options [mss 1400,nop,wscale 2,nop,nop,sackOK], length 0
00:59:38.046442 IP 175.139.38.116.54556 > 10.0.0.40.pnbs: Flags [S], seq 810811261, win 8192, options [mss 1452,nop,wscale 2,nop,nop,sackOK], length 0
00:59:38.046474 IP 175.139.38.116.54556 > 10.0.98.12.pnbs: Flags [S], seq 810811261, win 8192, options [mss 1400,nop,wscale 2,nop,nop,sackOK], length 0
00:59:41.038254 IP 175.139.38.116.54556 > 10.0.0.40.pnbs: Flags [S], seq 810811261, win 8192, options [mss 1452,nop,wscale 2,nop,nop,sackOK], length 0
00:59:41.038283 IP 175.139.38.116.54556 > 10.0.98.12.pnbs: Flags [S], seq 810811261, win 8192, options [mss 1400,nop,wscale 2,nop,nop,sackOK], length 0
00:59:42.464999 IP 124.5.239.134.6125 > 10.0.0.40.pnbs: Flags [S], seq 1150856088, win 8192, options [mss 1460,nop,nop,sackOK], length 0
00:59:42.465022 IP 124.5.239.134.6125 > 10.0.98.12.pnbs: Flags [S], seq 1150856088, win 8192, options [mss 1400,nop,nop,sackOK], length 0
00:59:42.961106 IP 118.137.84.169.61910 > 10.0.0.40.pnbs: Flags [S], seq 3348202808, win 8192, options [mss 1460,nop,wscale 2,nop,nop,sackOK], length 0
00:59:42.961150 IP 118.137.84.169.61910 > 10.0.98.12.pnbs: Flags [S], seq 3348202808, win 8192, options [mss 1400,nop,wscale 2,nop,nop,sackOK], length 0
00:59:43.300678 IP 117.156.14.145.8568 > 10.0.0.40.pnbs: Flags [S], seq 4293934558, win 8192, options [mss 1400,nop,nop,sackOK], length 0
00:59:43.300698 IP 117.156.14.145.8568 > 10.0.98.12.pnbs: Flags [S], seq 4293934558, win 8192, options [mss 1400,nop,nop,sackOK], length 0
00:59:46.020644 IP 118.137.84.169.61910 > 10.0.0.40.pnbs: Flags [S], seq 3348202808, win 8192, options [mss 1460,nop,wscale 2,nop,nop,sackOK], length 0
00:59:46.020668 IP 118.137.84.169.61910 > 10.0.98.12.pnbs: Flags [S], seq 3348202808, win 8192, options [mss 1400,nop,wscale 2,nop,nop,sackOK], length 0
00:59:47.047499 IP 175.139.38.116.54556 > 10.0.0.40.pnbs: Flags [S], seq 810811261, win 8192, options [mss 1452,nop,nop,sackOK], length 0
00:59:47.047521 IP 175.139.38.116.54556 > 10.0.98.12.pnbs: Flags [S], seq 810811261, win 8192, options [mss 1400,nop,nop,sackOK], length 0
00:59:52.074666 IP 118.137.84.169.61910 > 10.0.0.40.pnbs: Flags [S], seq 3348202808, win 8192, options [mss 1460,nop,nop,sackOK], length 0
00:59:52.074689 IP 118.137.84.169.61910 > 10.0.98.12.pnbs: Flags [S], seq 3348202808, win 8192, options [mss 1400,nop,nop,sackOK], length 0
01:00:08.099429 IP 110.52.211.133.pxc-sapxom > 10.0.0.40.pnbs: Flags [S], seq 1890766674, win 8192, options [mss 1440,nop,wscale 8,nop,nop,sackOK], length 0
01:00:08.099463 IP 110.52.211.133.pxc-sapxom > 10.0.98.12.pnbs: Flags [S], seq 1890766674, win 8192, options [mss 1400,nop,wscale 8,nop,nop,sackOK], length 0
01:00:09.282062 IP 101.127.91.37.57911 > 10.0.0.40.pnbs: Flags [S], seq 2179108839, win 8192, options [mss 1460,nop,wscale 2,nop,nop,sackOK], length 0
01:00:09.282096 IP 101.127.91.37.57911 > 10.0.98.12.pnbs: Flags [S], seq 2179108839, win 8192, options [mss 1400,nop,wscale 2,nop,nop,sackOK], length 0
01:00:11.100166 IP 110.52.211.133.pxc-sapxom > 10.0.0.40.pnbs: Flags [S], seq 1890766674, win 8192, options [mss 1448,nop,wscale 8,nop,nop,sackOK], length 0
01:00:11.100192 IP 110.52.211.133.pxc-sapxom > 10.0.98.12.pnbs: Flags [S], seq 1890766674, win 8192, options [mss 1400,nop,wscale 8,nop,nop,sackOK], length 0
01:00:12.355152 IP 101.127.91.37.57911 > 10.0.0.40.pnbs: Flags [S], seq 2179108839, win 8192, options [mss 1460,nop,wscale 2,nop,nop,sackOK], length 0
01:00:12.355178 IP 101.127.91.37.57911 > 10.0.98.12.pnbs: Flags [S], seq 2179108839, win 8192, options [mss 1400,nop,wscale 2,nop,nop,sackOK], length 0
01:00:17.101702 IP 110.52.211.133.pxc-sapxom > 10.0.0.40.pnbs: Flags [S], seq 1890766674, win 8192, options [mss 1448,nop,nop,sackOK], length 0
01:00:17.101729 IP 110.52.211.133.pxc-sapxom > 10.0.98.12.pnbs: Flags [S], seq 1890766674, win 8192, options [mss 1400,nop,nop,sackOK], length 0
01:00:18.354448 IP 101.127.91.37.57911 > 10.0.0.40.pnbs: Flags [S], seq 2179108839, win 8192, options [mss 1460,nop,nop,sackOK], length 0
01:00:18.354467 IP 101.127.91.37.57911 > 10.0.98.12.pnbs: Flags [S], seq 2179108839, win 8192, options [mss 1400,nop,nop,sackOK], length 0
01:00:26.837589 IP 193.201.224.98.58371 > 10.0.98.12.ms-wbt-server: Flags [S], seq 3021307391, win 8192, options [mss 1400,nop,wscale 8,nop,nop,sackOK], length 0
01:00:29.827623 IP 193.201.224.98.58371 > 10.0.98.12.ms-wbt-server: Flags [S], seq 3021307391, win 8192, options [mss 1400,nop,wscale 8,nop,nop,sackOK], length 0
01:00:35.839185 IP 193.201.224.98.58371 > 10.0.98.12.ms-wbt-server: Flags [S], seq 3021307391, win 8192, options [mss 1400,nop,nop,sackOK], length 0
01:00:52.629038 IP 221.4.34.223.xrpc-registry > 10.0.0.40.pnbs: Flags [S], seq 2387777893, win 8192, options [mss 1448,nop,wscale 2,nop,nop,sackOK], length 0
01:00:52.629073 IP 221.4.34.223.xrpc-registry > 10.0.98.12.pnbs: Flags [S], seq 2387777893, win 8192, options [mss 1400,nop,wscale 2,nop,nop,sackOK], length 0
01:00:55.632269 IP 221.4.34.223.xrpc-registry > 10.0.0.40.pnbs: Flags [S], seq 2387777893, win 8192, options [mss 1448,nop,wscale 2,nop,nop,sackOK], length 0
01:00:55.632297 IP 221.4.34.223.xrpc-registry > 10.0.98.12.pnbs: Flags [S], seq 2387777893, win 8192, options [mss 1400,nop,wscale 2,nop,nop,sackOK], length 0
01:01:01.632082 IP 221.4.34.223.xrpc-registry > 10.0.0.40.pnbs: Flags [S], seq 2387777893, win 8192, options [mss 1448,nop,nop,sackOK], length 0
01:01:01.632112 IP 221.4.34.223.xrpc-registry > 10.0.98.12.pnbs: Flags [S], seq 2387777893, win 8192, options [mss 1400,nop,nop,sackOK], length 0
01:01:23.293446 IP 203.151.213.171.64004 > 10.0.98.12.microsoft-ds: Flags [SEW], seq 2117619801, win 8192, options [mss 1400,nop,wscale 8,nop,nop,sackOK], length 0
01:01:24.307678 IP 203.151.213.171.64128 > 10.0.98.12.netbios-ssn: Flags [SEW], seq 3181191554, win 8192, options [mss 1400,nop,wscale 8,nop,nop,sackOK], length 0
01:01:26.289919 IP 203.151.213.171.64004 > 10.0.98.12.microsoft-ds: Flags [SEW], seq 2117619801, win 8192, options [mss 1400,nop,wscale 8,nop,nop,sackOK], length 0
01:01:27.305904 IP 203.151.213.171.64128 > 10.0.98.12.netbios-ssn: Flags [SEW], seq 3181191554, win 8192, options [mss 1400,nop,wscale 8,nop,nop,sackOK], length 0
01:01:27.864363 IP 101.127.91.37.57939 > 10.0.0.40.pnbs: Flags [S], seq 584936542, win 8192, options [mss 1460,nop,wscale 2,nop,nop,sackOK], length 0
01:01:27.864400 IP 101.127.91.37.57939 > 10.0.98.12.pnbs: Flags [S], seq 584936542, win 8192, options [mss 1400,nop,wscale 2,nop,nop,sackOK], length 0
01:01:30.861005 IP 101.127.91.37.57939 > 10.0.0.40.pnbs: Flags [S], seq 584936542, win 8192, options [mss 1460,nop,wscale 2,nop,nop,sackOK], length 0
01:01:30.861033 IP 101.127.91.37.57939 > 10.0.98.12.pnbs: Flags [S], seq 584936542, win 8192, options [mss 1400,nop,wscale 2,nop,nop,sackOK], length 0
01:01:32.289030 IP 203.151.213.171.64004 > 10.0.98.12.microsoft-ds: Flags [S], seq 2117619801, win 8192, options [mss 1400,nop,nop,sackOK], length 0
01:01:33.303439 IP 203.151.213.171.64128 > 10.0.98.12.netbios-ssn: Flags [S], seq 3181191554, win 8192, options [mss 1400,nop,nop,sackOK], length 0
01:01:33.977878 IP 115.198.6.37.63401 > 10.0.0.40.pnbs: Flags [S], seq 3351981825, win 16384, options [mss 1460,nop,wscale 0,nop,nop,sackOK], length 0
01:01:33.977911 IP 115.198.6.37.63401 > 10.0.98.12.pnbs: Flags [S], seq 3351981825, win 16384, options [mss 1400,nop,wscale 0,nop,nop,sackOK], length 0
01:01:36.861317 IP 101.127.91.37.57939 > 10.0.0.40.pnbs: Flags [S], seq 584936542, win 8192, options [mss 1460,nop,nop,sackOK], length 0
01:01:36.861342 IP 101.127.91.37.57939 > 10.0.98.12.pnbs: Flags [S], seq 584936542, win 8192, options [mss 1400,nop,nop,sackOK], length 0
01:01:36.955642 IP 115.198.6.37.63401 > 10.0.0.40.pnbs: Flags [S], seq 3351981825, win 16384, options [mss 1460,nop,wscale 0,nop,nop,sackOK], length 0
01:01:36.955661 IP 115.198.6.37.63401 > 10.0.98.12.pnbs: Flags [S], seq 3351981825, win 16384, options [mss 1400,nop,wscale 0,nop,nop,sackOK], length 0
01:01:40.877970 IP 101.127.164.134.57359 > 10.0.0.40.pnbs: Flags [S], seq 3387639801, win 8192, options [mss 1460,nop,wscale 8,nop,nop,sackOK], length 0
01:01:40.878006 IP 101.127.164.134.57359 > 10.0.98.12.pnbs: Flags [S], seq 3387639801, win 8192, options [mss 1400,nop,wscale 8,nop,nop,sackOK], length 0
01:01:42.848083 IP 202.166.24.150.50115 > 10.0.0.40.pnbs: Flags [S], seq 4113657712, win 8192, options [mss 1460,nop,wscale 2,nop,nop,sackOK], length 0
01:01:42.848120 IP 202.166.24.150.50115 > 10.0.98.12.pnbs: Flags [S], seq 4113657712, win 8192, options [mss 1400,nop,wscale 2,nop,nop,sackOK], length 0
01:01:42.889900 IP 115.198.6.37.63401 > 10.0.0.40.pnbs: Flags [S], seq 3351981825, win 16384, options [mss 1460,nop,wscale 0,nop,nop,sackOK], length 0
01:01:42.889913 IP 115.198.6.37.63401 > 10.0.98.12.pnbs: Flags [S], seq 3351981825, win 16384, options [mss 1400,nop,wscale 0,nop,nop,sackOK], length 0
01:01:43.364553 IP 78.171.105.230.56034 > 10.0.0.40.pnbs: Flags [S], seq 1272071938, win 8192, options [mss 1452,nop,wscale 8,nop,nop,sackOK], length 0
01:01:43.364590 IP 78.171.105.230.56034 > 10.0.98.12.pnbs: Flags [S], seq 1272071938, win 8192, options [mss 1400,nop,wscale 8,nop,nop,sackOK], length 0
01:01:43.877081 IP 101.127.164.134.57359 > 10.0.0.40.pnbs: Flags [S], seq 3387639801, win 8192, options [mss 1460,nop,wscale 8,nop,nop,sackOK], length 0
01:01:43.877118 IP 101.127.164.134.57359 > 10.0.98.12.pnbs: Flags [S], seq 3387639801, win 8192, options [mss 1400,nop,wscale 8,nop,nop,sackOK], length 0
01:01:45.893337 IP 202.166.24.150.50115 > 10.0.0.40.pnbs: Flags [S], seq 4113657712, win 8192, options [mss 1460,nop,wscale 2,nop,nop,sackOK], length 0
01:01:45.893359 IP 202.166.24.150.50115 > 10.0.98.12.pnbs: Flags [S], seq 4113657712, win 8192, options [mss 1400,nop,wscale 2,nop,nop,sackOK], length 0
01:01:46.364464 IP 78.171.105.230.56034 > 10.0.0.40.pnbs: Flags [S], seq 1272071938, win 8192, options [mss 1452,nop,wscale 8,nop,nop,sackOK], length 0
01:01:46.364484 IP 78.171.105.230.56034 > 10.0.98.12.pnbs: Flags [S], seq 1272071938, win 8192, options [mss 1400,nop,wscale 8,nop,nop,sackOK], length 0
01:01:49.877889 IP 101.127.164.134.57359 > 10.0.0.40.pnbs: Flags [S], seq 3387639801, win 8192, options [mss 1460,nop,nop,sackOK], length 0
01:01:49.877913 IP 101.127.164.134.57359 > 10.0.98.12.pnbs: Flags [S], seq 3387639801, win 8192, options [mss 1400,nop,nop,sackOK], length 0
01:01:51.893736 IP 202.166.24.150.50115 > 10.0.0.40.pnbs: Flags [S], seq 4113657712, win 8192, options [mss 1460,nop,nop,sackOK], length 0
01:01:51.893759 IP 202.166.24.150.50115 > 10.0.98.12.pnbs: Flags [S], seq 4113657712, win 8192, options [mss 1400,nop,nop,sackOK], length 0
01:01:52.366362 IP 78.171.105.230.56034 > 10.0.0.40.pnbs: Flags [S], seq 1272071938, win 8192, options [mss 1452,nop,nop,sackOK], length 0
01:01:52.366387 IP 78.171.105.230.56034 > 10.0.98.12.pnbs: Flags [S], seq 1272071938, win 8192, options [mss 1400,nop,nop,sackOK], length 0
01:01:59.510048 IP 117.156.14.17.58218 > 10.0.0.40.pnbs: Flags [S], seq 3691068124, win 8192, options [mss 1400,nop,wscale 2,nop,nop,sackOK], length 0
01:01:59.510082 IP 117.156.14.17.58218 > 10.0.98.12.pnbs: Flags [S], seq 3691068124, win 8192, options [mss 1400,nop,wscale 2,nop,nop,sackOK], length 0
01:02:02.510064 IP 117.156.14.17.58218 > 10.0.0.40.pnbs: Flags [S], seq 3691068124, win 8192, options [mss 1400,nop,wscale 2,nop,nop,sackOK], length 0
01:02:02.510090 IP 117.156.14.17.58218 > 10.0.98.12.pnbs: Flags [S], seq 3691068124, win 8192, options [mss 1400,nop,wscale 2,nop,nop,sackOK], length 0
01:02:08.380864 IP 101.127.164.134.57365 > 10.0.0.40.pnbs: Flags [S], seq 250307983, win 8192, options [mss 1460,nop,wscale 8,nop,nop,sackOK], length 0
01:02:08.380900 IP 101.127.164.134.57365 > 10.0.98.12.pnbs: Flags [S], seq 250307983, win 8192, options [mss 1400,nop,wscale 8,nop,nop,sackOK], length 0
01:02:08.514025 IP 117.156.14.17.58218 > 10.0.0.40.pnbs: Flags [S], seq 3691068124, win 8192, options [mss 1400,nop,nop,sackOK], length 0
01:02:08.514051 IP 117.156.14.17.58218 > 10.0.98.12.pnbs: Flags [S], seq 3691068124, win 8192, options [mss 1400,nop,nop,sackOK], length 0
01:02:11.387545 IP 101.127.164.134.57365 > 10.0.0.40.pnbs: Flags [S], seq 250307983, win 8192, options [mss 1460,nop,wscale 8,nop,nop,sackOK], length 0
01:02:11.387568 IP 101.127.164.134.57365 > 10.0.98.12.pnbs: Flags [S], seq 250307983, win 8192, options [mss 1400,nop,wscale 8,nop,nop,sackOK], length 0
01:02:17.379403 IP 101.127.164.134.57365 > 10.0.0.40.pnbs: Flags [S], seq 250307983, win 8192, options [mss 1460,nop,nop,sackOK], length 0
01:02:17.379430 IP 101.127.164.134.57365 > 10.0.98.12.pnbs: Flags [S], seq 250307983, win 8192, options [mss 1400,nop,nop,sackOK], length 0
01:02:36.894151 IP 10.0.98.12.49221 > 52.85.13.44.https: Flags [S], seq 4113188251, win 8192, options [mss 1360,nop,wscale 8,nop,nop,sackOK], length 0
01:02:36.897286 IP 52.85.13.44.https > 10.0.98.12.49221: Flags [S.], seq 2142976082, ack 4113188252, win 29200, options [mss 1400,nop,nop,sackOK,nop,wscale 8], length 0
01:02:37.118122 IP 10.0.98.12.49225 > 52.85.13.44.https: Flags [S], seq 4175436347, win 8192, options [mss 1360,nop,wscale 8,nop,nop,sackOK], length 0
01:02:37.121179 IP 52.85.13.44.https > 10.0.98.12.49225: Flags [S.], seq 4216001011, ack 4175436348, win 29200, options [mss 1400,nop,nop,sackOK,nop,wscale 8], length 0
01:02:37.580679 IP 10.0.98.12.49228 > 52.85.13.44.https: Flags [S], seq 1396965932, win 8192, options [mss 1360,nop,wscale 8,nop,nop,sackOK], length 0
01:02:37.583767 IP 52.85.13.44.https > 10.0.98.12.49228: Flags [S.], seq 1200989031, ack 1396965933, win 29200, options [mss 1400,nop,nop,sackOK,nop,wscale 8], length 0
01:02:37.709820 IP 10.0.98.12.49229 > 52.85.13.44.https: Flags [S], seq 2429054411, win 8192, options [mss 1360,nop,wscale 8,nop,nop,sackOK], length 0
01:02:37.712921 IP 52.85.13.44.https > 10.0.98.12.49229: Flags [S.], seq 1497572151, ack 2429054412, win 29200, options [mss 1400,nop,nop,sackOK,nop,wscale 8], length 0
01:02:37.962573 IP 10.0.98.12.49232 > 52.85.13.44.https: Flags [S], seq 3771797330, win 8192, options [mss 1360,nop,wscale 8,nop,nop,sackOK], length 0
01:02:37.963885 IP 10.0.98.12.49233 > 52.85.13.44.https: Flags [S], seq 1042375072, win 8192, options [mss 1360,nop,wscale 8,nop,nop,sackOK], length 0
01:02:37.965599 IP 52.85.13.44.https > 10.0.98.12.49232: Flags [S.], seq 666070693, ack 3771797331, win 29200, options [mss 1400,nop,nop,sackOK,nop,wscale 8], length 0
01:02:37.966953 IP 52.85.13.44.https > 10.0.98.12.49233: Flags [S.], seq 2601890485, ack 1042375073, win 29200, options [mss 1400,nop,nop,sackOK,nop,wscale 8], length 0
01:02:37.974469 IP 10.0.98.12.49236 > 52.85.13.44.https: Flags [S], seq 58811763, win 8192, options [mss 1360,nop,wscale 8,nop,nop,sackOK], length 0
01:02:37.977432 IP 52.85.13.44.https > 10.0.98.12.49236: Flags [S.], seq 852685033, ack 58811764, win 29200, options [mss 1400,nop,nop,sackOK,nop,wscale 8], length 0
01:02:50.069816 IP 104.236.132.76.55833 > 10.0.98.12.ssh: Flags [S], seq 859074488, win 65535, options [mss 536], length 0
01:03:06.532414 IP 118.71.223.97.50612 > 10.0.0.40.pnbs: Flags [S], seq 1699867355, win 8192, options [mss 1412,nop,wscale 2,nop,nop,sackOK], length 0
01:03:06.532451 IP 118.71.223.97.50612 > 10.0.98.12.pnbs: Flags [S], seq 1699867355, win 8192, options [mss 1400,nop,wscale 2,nop,nop,sackOK], length 0
01:03:09.522227 IP 118.71.223.97.50612 > 10.0.0.40.pnbs: Flags [S], seq 1699867355, win 8192, options [mss 1412,nop,wscale 2,nop,nop,sackOK], length 0
01:03:09.522258 IP 118.71.223.97.50612 > 10.0.98.12.pnbs: Flags [S], seq 1699867355, win 8192, options [mss 1400,nop,wscale 2,nop,nop,sackOK], length 0
01:03:15.523352 IP 118.71.223.97.50612 > 10.0.0.40.pnbs: Flags [S], seq 1699867355, win 8192, options [mss 1412,nop,nop,sackOK], length 0
01:03:15.523377 IP 118.71.223.97.50612 > 10.0.98.12.pnbs: Flags [S], seq 1699867355, win 8192, options [mss 1400,nop,nop,sackOK], length 0
01:03:27.057138 IP 167.0.19.41.50466 > 10.0.98.12.telnet: Flags [S], seq 2395309587, win 5440, options [mss 1360,nop,nop,sackOK], length 0
01:03:30.052839 IP 167.0.19.41.50466 > 10.0.98.12.telnet: Flags [S], seq 2395309587, win 5440, options [mss 1360,nop,nop,sackOK], length 0
01:03:33.991590 IP 193.201.224.98.59898 > 10.0.98.12.ms-wbt-server: Flags [S], seq 329487389, win 8192, options [mss 1400,nop,wscale 8,nop,nop,sackOK], length 0
01:03:37.000533 IP 193.201.224.98.59898 > 10.0.98.12.ms-wbt-server: Flags [S], seq 329487389, win 8192, options [mss 1400,nop,wscale 8,nop,nop,sackOK], length 0
01:03:38.476942 IP 118.137.84.169.62098 > 10.0.0.40.pnbs: Flags [S], seq 21360970, win 8192, options [mss 1460,nop,wscale 2,nop,nop,sackOK], length 0
01:03:38.476988 IP 118.137.84.169.62098 > 10.0.98.12.pnbs: Flags [S], seq 21360970, win 8192, options [mss 1400,nop,wscale 2,nop,nop,sackOK], length 0
01:03:41.240402 IP 211.255.155.191.51856 > 10.0.0.40.pnbs: Flags [S], seq 1772805214, win 8192, options [mss 1360,nop,wscale 8,nop,nop,sackOK], length 0
01:03:41.240436 IP 211.255.155.191.51856 > 10.0.98.12.pnbs: Flags [S], seq 1772805214, win 8192, options [mss 1360,nop,wscale 8,nop,nop,sackOK], length 0
01:03:41.475721 IP 118.137.84.169.62098 > 10.0.0.40.pnbs: Flags [S], seq 21360970, win 8192, options [mss 1460,nop,wscale 2,nop,nop,sackOK], length 0
01:03:41.475748 IP 118.137.84.169.62098 > 10.0.98.12.pnbs: Flags [S], seq 21360970, win 8192, options [mss 1400,nop,wscale 2,nop,nop,sackOK], length 0
01:03:43.023923 IP 193.201.224.98.59898 > 10.0.98.12.ms-wbt-server: Flags [S], seq 329487389, win 8192, options [mss 1400,nop,nop,sackOK], length 0
01:03:43.773896 IP 78.175.43.213.50464 > 10.0.0.40.pnbs: Flags [S], seq 3108564003, win 8192, options [mss 1452,nop,wscale 2,nop,nop,sackOK], length 0
01:03:43.773926 IP 78.175.43.213.50464 > 10.0.98.12.pnbs: Flags [S], seq 3108564003, win 8192, options [mss 1400,nop,wscale 2,nop,nop,sackOK], length 0
01:03:44.244124 IP 211.255.155.191.51856 > 10.0.0.40.pnbs: Flags [S], seq 1772805214, win 8192, options [mss 1360,nop,wscale 8,nop,nop,sackOK], length 0
01:03:44.244151 IP 211.255.155.191.51856 > 10.0.98.12.pnbs: Flags [S], seq 1772805214, win 8192, options [mss 1360,nop,wscale 8,nop,nop,sackOK], length 0
01:03:46.769315 IP 78.175.43.213.50464 > 10.0.0.40.pnbs: Flags [S], seq 3108564003, win 8192, options [mss 1452,nop,wscale 2,nop,nop,sackOK], length 0
01:03:46.769344 IP 78.175.43.213.50464 > 10.0.98.12.pnbs: Flags [S], seq 3108564003, win 8192, options [mss 1400,nop,wscale 2,nop,nop,sackOK], length 0
01:03:47.461005 IP 118.137.84.169.62098 > 10.0.0.40.pnbs: Flags [S], seq 21360970, win 8192, options [mss 1460,nop,nop,sackOK], length 0
01:03:47.461022 IP 118.137.84.169.62098 > 10.0.98.12.pnbs: Flags [S], seq 21360970, win 8192, options [mss 1400,nop,nop,sackOK], length 0
01:03:49.044376 IP 123.26.27.17.13623 > 10.0.0.40.pnbs: Flags [S], seq 2022320653, win 8192, options [mss 1400,nop,wscale 2,nop,nop,sackOK], length 0
01:03:49.044407 IP 123.26.27.17.13623 > 10.0.98.12.pnbs: Flags [S], seq 2022320653, win 8192, options [mss 1400,nop,wscale 2,nop,nop,sackOK], length 0
01:03:50.239328 IP 211.255.155.191.51856 > 10.0.0.40.pnbs: Flags [S], seq 1772805214, win 8192, options [mss 1360,nop,nop,sackOK], length 0
01:03:50.239347 IP 211.255.155.191.51856 > 10.0.98.12.pnbs: Flags [S], seq 1772805214, win 8192, options [mss 1360,nop,nop,sackOK], length 0
01:03:52.044581 IP 123.26.27.17.13623 > 10.0.0.40.pnbs: Flags [S], seq 2022320653, win 8192, options [mss 1400,nop,wscale 2,nop,nop,sackOK], length 0
01:03:52.044606 IP 123.26.27.17.13623 > 10.0.98.12.pnbs: Flags [S], seq 2022320653, win 8192, options [mss 1400,nop,wscale 2,nop,nop,sackOK], length 0
01:03:52.775740 IP 78.175.43.213.50464 > 10.0.0.40.pnbs: Flags [S], seq 3108564003, win 8192, options [mss 1452,nop,nop,sackOK], length 0
01:03:52.775762 IP 78.175.43.213.50464 > 10.0.98.12.pnbs: Flags [S], seq 3108564003, win 8192, options [mss 1400,nop,nop,sackOK], length 0
01:03:58.043890 IP 123.26.27.17.13623 > 10.0.0.40.pnbs: Flags [S], seq 2022320653, win 8192, options [mss 1400,nop,nop,sackOK], length 0
01:03:58.043930 IP 123.26.27.17.13623 > 10.0.98.12.pnbs: Flags [S], seq 2022320653, win 8192, options [mss 1400,nop,nop,sackOK], length 0
01:04:08.978331 IP 101.127.91.37.57960 > 10.0.0.40.pnbs: Flags [S], seq 3478061456, win 8192, options [mss 1460,nop,wscale 2,nop,nop,sackOK], length 0
01:04:08.978368 IP 101.127.91.37.57960 > 10.0.98.12.pnbs: Flags [S], seq 3478061456, win 8192, options [mss 1400,nop,wscale 2,nop,nop,sackOK], length 0
01:04:11.977278 IP 101.127.91.37.57960 > 10.0.0.40.pnbs: Flags [S], seq 3478061456, win 8192, options [mss 1460,nop,wscale 2,nop,nop,sackOK], length 0
01:04:11.977302 IP 101.127.91.37.57960 > 10.0.98.12.pnbs: Flags [S], seq 3478061456, win 8192, options [mss 1400,nop,wscale 2,nop,nop,sackOK], length 0
01:04:13.544217 IP 115.224.29.38.44384 > 10.0.0.40.pnbs: Flags [S], seq 3511282242, win 8192, options [mss 1420,nop,wscale 2,nop,nop,sackOK], length 0
01:04:13.544252 IP 115.224.29.38.44384 > 10.0.98.12.pnbs: Flags [S], seq 3511282242, win 8192, options [mss 1400,nop,wscale 2,nop,nop,sackOK], length 0
01:04:16.543699 IP 115.224.29.38.44384 > 10.0.0.40.pnbs: Flags [S], seq 3511282242, win 8192, options [mss 1420,nop,wscale 2,nop,nop,sackOK], length 0
01:04:16.543726 IP 115.224.29.38.44384 > 10.0.98.12.pnbs: Flags [S], seq 3511282242, win 8192, options [mss 1400,nop,wscale 2,nop,nop,sackOK], length 0
01:04:17.971489 IP 101.127.91.37.57960 > 10.0.0.40.pnbs: Flags [S], seq 3478061456, win 8192, options [mss 1460,nop,nop,sackOK], length 0
01:04:17.971516 IP 101.127.91.37.57960 > 10.0.98.12.pnbs: Flags [S], seq 3478061456, win 8192, options [mss 1400,nop,nop,sackOK], length 0
01:04:19.433294 IP 10.0.98.12.49221 > 52.85.13.44.https: Flags [F.], seq 1690, ack 4088, win 255, length 0
01:04:19.434766 IP 10.0.98.12.49225 > 52.85.13.44.https: Flags [F.], seq 1706, ack 4088, win 255, length 0
01:04:19.436424 IP 52.85.13.44.https > 10.0.98.12.49221: Flags [F.], seq 4088, ack 1691, win 135, length 0
01:04:19.440196 IP 52.85.13.44.https > 10.0.98.12.49225: Flags [F.], seq 4088, ack 1707, win 135, length 0
01:04:20.295099 IP 10.0.98.12.49228 > 52.85.13.44.https: Flags [F.], seq 1690, ack 4088, win 255, length 0
01:04:20.298184 IP 52.85.13.44.https > 10.0.98.12.49228: Flags [F.], seq 4088, ack 1691, win 135, length 0
01:04:20.631856 IP 10.0.98.12.49229 > 52.85.13.44.https: Flags [F.], seq 1690, ack 4088, win 255, length 0
01:04:20.632940 IP 10.0.98.12.49232 > 52.85.13.44.https: Flags [F.], seq 1690, ack 4088, win 255, length 0
01:04:20.633116 IP 10.0.98.12.49233 > 52.85.13.44.https: Flags [F.], seq 1690, ack 4088, win 260, length 0
01:04:20.633232 IP 10.0.98.12.49236 > 52.85.13.44.https: Flags [F.], seq 1690, ack 4088, win 255, length 0
01:04:20.634969 IP 52.85.13.44.https > 10.0.98.12.49229: Flags [F.], seq 4088, ack 1691, win 135, length 0
01:04:20.635980 IP 52.85.13.44.https > 10.0.98.12.49232: Flags [F.], seq 4088, ack 1691, win 135, length 0
01:04:20.636217 IP 52.85.13.44.https > 10.0.98.12.49233: Flags [F.], seq 4088, ack 1691, win 135, length 0
01:04:20.636302 IP 52.85.13.44.https > 10.0.98.12.49236: Flags [F.], seq 4088, ack 1691, win 135, length 0
01:04:22.055616 IP 42.116.106.77.23281 > 10.0.0.40.pnbs: Flags [S], seq 3165790178, win 8192, options [mss 1440,nop,wscale 2,nop,nop,sackOK], length 0
01:04:22.055654 IP 42.116.106.77.23281 > 10.0.98.12.pnbs: Flags [S], seq 3165790178, win 8192, options [mss 1400,nop,wscale 2,nop,nop,sackOK], length 0
01:04:22.544813 IP 115.224.29.38.44384 > 10.0.0.40.pnbs: Flags [S], seq 3511282242, win 8192, options [mss 1420,nop,nop,sackOK], length 0
01:04:22.544839 IP 115.224.29.38.44384 > 10.0.98.12.pnbs: Flags [S], seq 3511282242, win 8192, options [mss 1400,nop,nop,sackOK], length 0
01:04:23.860926 IP 101.127.164.134.57391 > 10.0.0.40.pnbs: Flags [S], seq 3127407004, win 8192, options [mss 1460,nop,wscale 8,nop,nop,sackOK], length 0
01:04:23.860959 IP 101.127.164.134.57391 > 10.0.98.12.pnbs: Flags [S], seq 3127407004, win 8192, options [mss 1400,nop,wscale 8,nop,nop,sackOK], length 0
01:04:25.046501 IP 42.116.106.77.23281 > 10.0.0.40.pnbs: Flags [S], seq 3165790178, win 8192, options [mss 1440,nop,wscale 2,nop,nop,sackOK], length 0
01:04:25.046526 IP 42.116.106.77.23281 > 10.0.98.12.pnbs: Flags [S], seq 3165790178, win 8192, options [mss 1400,nop,wscale 2,nop,nop,sackOK], length 0
01:04:26.857885 IP 101.127.164.134.57391 > 10.0.0.40.pnbs: Flags [S], seq 3127407004, win 8192, options [mss 1460,nop,wscale 8,nop,nop,sackOK], length 0
01:04:26.857914 IP 101.127.164.134.57391 > 10.0.98.12.pnbs: Flags [S], seq 3127407004, win 8192, options [mss 1400,nop,wscale 8,nop,nop,sackOK], length 0
01:04:31.046846 IP 42.116.106.77.23281 > 10.0.0.40.pnbs: Flags [S], seq 3165790178, win 8192, options [mss 1440,nop,nop,sackOK], length 0
01:04:31.046873 IP 42.116.106.77.23281 > 10.0.98.12.pnbs: Flags [S], seq 3165790178, win 8192, options [mss 1400,nop,nop,sackOK], length 0
01:04:32.859620 IP 101.127.164.134.57391 > 10.0.0.40.pnbs: Flags [S], seq 3127407004, win 8192, options [mss 1460,nop,nop,sackOK], length 0
01:04:32.859662 IP 101.127.164.134.57391 > 10.0.98.12.pnbs: Flags [S], seq 3127407004, win 8192, options [mss 1400,nop,nop,sackOK], length 0
01:05:31.433996 IP 1.224.137.122.55980 > 10.0.0.40.pnbs: Flags [S], seq 3661899622, win 8192, options [mss 1460,nop,wscale 8,nop,nop,sackOK], length 0
01:05:31.434032 IP 1.224.137.122.55980 > 10.0.98.12.pnbs: Flags [S], seq 3661899622, win 8192, options [mss 1400,nop,wscale 8,nop,nop,sackOK], length 0
01:05:34.430046 IP 1.224.137.122.55980 > 10.0.0.40.pnbs: Flags [S], seq 3661899622, win 8192, options [mss 1460,nop,wscale 8,nop,nop,sackOK], length 0
01:05:34.430076 IP 1.224.137.122.55980 > 10.0.98.12.pnbs: Flags [S], seq 3661899622, win 8192, options [mss 1400,nop,wscale 8,nop,nop,sackOK], length 0
01:05:37.502043 IP 36.35.25.110.50171 > 10.0.0.40.pnbs: Flags [S], seq 2173065165, win 8192, options [mss 1440,nop,wscale 2,nop,nop,sackOK], length 0
01:05:37.502084 IP 36.35.25.110.50171 > 10.0.98.12.pnbs: Flags [S], seq 2173065165, win 8192, options [mss 1400,nop,wscale 2,nop,nop,sackOK], length 0
01:05:38.097323 IP 101.127.91.37.57980 > 10.0.0.40.pnbs: Flags [S], seq 3563688506, win 8192, options [mss 1460,nop,wscale 2,nop,nop,sackOK], length 0
01:05:38.097366 IP 101.127.91.37.57980 > 10.0.98.12.pnbs: Flags [S], seq 3563688506, win 8192, options [mss 1400,nop,wscale 2,nop,nop,sackOK], length 0
01:05:40.434162 IP 1.224.137.122.55980 > 10.0.0.40.pnbs: Flags [S], seq 3661899622, win 8192, options [mss 1460,nop,nop,sackOK], length 0
01:05:40.434199 IP 1.224.137.122.55980 > 10.0.98.12.pnbs: Flags [S], seq 3661899622, win 8192, options [mss 1400,nop,nop,sackOK], length 0
01:05:40.501825 IP 36.35.25.110.50171 > 10.0.0.40.pnbs: Flags [S], seq 2173065165, win 8192, options [mss 1460,nop,wscale 2,nop,nop,sackOK], length 0
01:05:40.501837 IP 36.35.25.110.50171 > 10.0.98.12.pnbs: Flags [S], seq 2173065165, win 8192, options [mss 1400,nop,wscale 2,nop,nop,sackOK], length 0
