tcpdump: verbose output suppressed, use -v or -vv for full protocol decode
listening on eth0, link-type EN10MB (Ethernet), capture size 65535 bytes
00:57:30.490105 IP 24.99.181.117.52827 > 10.0.0.236.27021: Flags [S], seq 1118615329, win 8192, options [mss 1460,nop,wscale 2,nop,nop,sackOK], length 0
00:57:30.490139 IP 24.99.181.117.52827 > 10.0.98.29.27021: Flags [S], seq 1118615329, win 8192, options [mss 1400,nop,wscale 2,nop,nop,sackOK], length 0
00:57:33.489559 IP 24.99.181.117.52827 > 10.0.0.236.27021: Flags [S], seq 1118615329, win 8192, options [mss 1460,nop,wscale 2,nop,nop,sackOK], length 0
00:57:33.489588 IP 24.99.181.117.52827 > 10.0.98.29.27021: Flags [S], seq 1118615329, win 8192, options [mss 1400,nop,wscale 2,nop,nop,sackOK], length 0
00:57:37.057216 IP 221.4.34.223.8854 > 10.0.0.236.pnbs: Flags [S], seq 3944891191, win 8192, options [mss 1448,nop,wscale 2,nop,nop,sackOK], length 0
00:57:37.057260 IP 221.4.34.223.8854 > 10.0.98.29.pnbs: Flags [S], seq 3944891191, win 8192, options [mss 1400,nop,wscale 2,nop,nop,sackOK], length 0
00:57:39.488494 IP 24.99.181.117.52827 > 10.0.0.236.27021: Flags [S], seq 1118615329, win 8192, options [mss 1460,nop,nop,sackOK], length 0
00:57:39.488520 IP 24.99.181.117.52827 > 10.0.98.29.27021: Flags [S], seq 1118615329, win 8192, options [mss 1400,nop,nop,sackOK], length 0
00:57:40.057438 IP 221.4.34.223.8854 > 10.0.0.236.pnbs: Flags [S], seq 3944891191, win 8192, options [mss 1448,nop,wscale 2,nop,nop,sackOK], length 0
00:57:40.057467 IP 221.4.34.223.8854 > 10.0.98.29.pnbs: Flags [S], seq 3944891191, win 8192, options [mss 1400,nop,wscale 2,nop,nop,sackOK], length 0
00:57:45.849084 IP 14.117.156.146.58366 > 10.0.0.236.pnbs: Flags [S], seq 3935681725, win 8192, options [mss 1440,nop,wscale 8,nop,nop,sackOK], length 0
00:57:45.849116 IP 14.117.156.146.58366 > 10.0.98.29.pnbs: Flags [S], seq 3935681725, win 8192, options [mss 1400,nop,wscale 8,nop,nop,sackOK], length 0
00:57:46.058479 IP 221.4.34.223.8854 > 10.0.0.236.pnbs: Flags [S], seq 3944891191, win 8192, options [mss 1448,nop,nop,sackOK], length 0
00:57:46.058507 IP 221.4.34.223.8854 > 10.0.98.29.pnbs: Flags [S], seq 3944891191, win 8192, options [mss 1400,nop,nop,sackOK], length 0
00:57:48.848616 IP 14.117.156.146.58366 > 10.0.0.236.pnbs: Flags [S], seq 3935681725, win 8192, options [mss 1460,nop,wscale 8,nop,nop,sackOK], length 0
00:57:48.848653 IP 14.117.156.146.58366 > 10.0.98.29.pnbs: Flags [S], seq 3935681725, win 8192, options [mss 1400,nop,wscale 8,nop,nop,sackOK], length 0
00:57:52.510740 IP 24.99.181.117.52829 > 10.0.0.236.27021: Flags [S], seq 1263985171, win 8192, options [mss 1460,nop,wscale 2,nop,nop,sackOK], length 0
00:57:52.510774 IP 24.99.181.117.52829 > 10.0.98.29.27021: Flags [S], seq 1263985171, win 8192, options [mss 1400,nop,wscale 2,nop,nop,sackOK], length 0
00:57:54.855024 IP 14.117.156.146.58366 > 10.0.0.236.pnbs: Flags [S], seq 3935681725, win 8192, options [mss 1460,nop,nop,sackOK], length 0
00:57:54.855061 IP 14.117.156.146.58366 > 10.0.98.29.pnbs: Flags [S], seq 3935681725, win 8192, options [mss 1400,nop,nop,sackOK], length 0
00:57:55.505943 IP 24.99.181.117.52829 > 10.0.0.236.27021: Flags [S], seq 1263985171, win 8192, options [mss 1460,nop,wscale 2,nop,nop,sackOK], length 0
00:57:55.505972 IP 24.99.181.117.52829 > 10.0.98.29.27021: Flags [S], seq 1263985171, win 8192, options [mss 1400,nop,wscale 2,nop,nop,sackOK], length 0
00:57:55.894677 IP 78.175.43.213.50367 > 10.0.0.236.pnbs: Flags [S], seq 3409609399, win 8192, options [mss 1452,nop,wscale 2,nop,nop,sackOK], length 0
00:57:55.894709 IP 78.175.43.213.50367 > 10.0.98.29.pnbs: Flags [S], seq 3409609399, win 8192, options [mss 1400,nop,wscale 2,nop,nop,sackOK], length 0
00:57:56.410996 IP 61.14.177.51.65090 > 10.0.0.236.pnbs: Flags [S], seq 1341004838, win 8192, options [mss 1460,nop,wscale 8,nop,nop,sackOK], length 0
00:57:56.411029 IP 61.14.177.51.65090 > 10.0.98.29.pnbs: Flags [S], seq 1341004838, win 8192, options [mss 1400,nop,wscale 8,nop,nop,sackOK], length 0
00:57:58.897109 IP 78.175.43.213.50367 > 10.0.0.236.pnbs: Flags [S], seq 3409609399, win 8192, options [mss 1452,nop,wscale 2,nop,nop,sackOK], length 0
00:57:58.897147 IP 78.175.43.213.50367 > 10.0.98.29.pnbs: Flags [S], seq 3409609399, win 8192, options [mss 1400,nop,wscale 2,nop,nop,sackOK], length 0
00:57:59.415806 IP 61.14.177.51.65090 > 10.0.0.236.pnbs: Flags [S], seq 1341004838, win 8192, options [mss 1460,nop,wscale 8,nop,nop,sackOK], length 0
00:57:59.415834 IP 61.14.177.51.65090 > 10.0.98.29.pnbs: Flags [S], seq 1341004838, win 8192, options [mss 1400,nop,wscale 8,nop,nop,sackOK], length 0
00:58:01.510814 IP 24.99.181.117.52829 > 10.0.0.236.27021: Flags [S], seq 1263985171, win 8192, options [mss 1460,nop,nop,sackOK], length 0
00:58:01.510839 IP 24.99.181.117.52829 > 10.0.98.29.27021: Flags [S], seq 1263985171, win 8192, options [mss 1400,nop,nop,sackOK], length 0
00:58:04.899392 IP 78.175.43.213.50367 > 10.0.0.236.pnbs: Flags [S], seq 3409609399, win 8192, options [mss 1452,nop,nop,sackOK], length 0
00:58:04.899417 IP 78.175.43.213.50367 > 10.0.98.29.pnbs: Flags [S], seq 3409609399, win 8192, options [mss 1400,nop,nop,sackOK], length 0
00:58:05.421994 IP 61.14.177.51.65090 > 10.0.0.236.pnbs: Flags [S], seq 1341004838, win 8192, options [mss 1460,nop,nop,sackOK], length 0
00:58:05.422021 IP 61.14.177.51.65090 > 10.0.98.29.pnbs: Flags [S], seq 1341004838, win 8192, options [mss 1400,nop,nop,sackOK], length 0
00:58:09.638086 IP 221.4.34.223.dist-upgrade > 10.0.0.236.pnbs: Flags [S], seq 2908028704, win 8192, options [mss 1448,nop,wscale 2,nop,nop,sackOK], length 0
00:58:09.638122 IP 221.4.34.223.dist-upgrade > 10.0.98.29.pnbs: Flags [S], seq 2908028704, win 8192, options [mss 1400,nop,wscale 2,nop,nop,sackOK], length 0
00:58:11.588559 IP 221.209.46.82.ssc-agent > 10.0.0.236.pnbs: Flags [S], seq 1175623219, win 65535, options [mss 1460,nop,wscale 2,nop,nop,sackOK], length 0
00:58:11.588591 IP 221.209.46.82.ssc-agent > 10.0.98.29.pnbs: Flags [S], seq 1175623219, win 65535, options [mss 1400,nop,wscale 2,nop,nop,sackOK], length 0
00:58:12.637718 IP 221.4.34.223.dist-upgrade > 10.0.0.236.pnbs: Flags [S], seq 2908028704, win 8192, options [mss 1448,nop,wscale 2,nop,nop,sackOK], length 0
00:58:12.637744 IP 221.4.34.223.dist-upgrade > 10.0.98.29.pnbs: Flags [S], seq 2908028704, win 8192, options [mss 1400,nop,wscale 2,nop,nop,sackOK], length 0
00:58:14.517008 IP 24.99.181.117.52831 > 10.0.0.236.27021: Flags [S], seq 1854468078, win 8192, options [mss 1460,nop,wscale 2,nop,nop,sackOK], length 0
00:58:14.517039 IP 24.99.181.117.52831 > 10.0.98.29.27021: Flags [S], seq 1854468078, win 8192, options [mss 1400,nop,wscale 2,nop,nop,sackOK], length 0
00:58:14.579086 IP 221.209.46.82.ssc-agent > 10.0.0.236.pnbs: Flags [S], seq 1175623219, win 65535, options [mss 1460,nop,wscale 2,nop,nop,sackOK], length 0
00:58:14.579108 IP 221.209.46.82.ssc-agent > 10.0.98.29.pnbs: Flags [S], seq 1175623219, win 65535, options [mss 1400,nop,wscale 2,nop,nop,sackOK], length 0
00:58:16.036724 IP 124.82.43.181.50370 > 10.0.0.236.pnbs: Flags [S], seq 1533519112, win 8192, options [mss 1360,nop,nop,sackOK], length 0
00:58:16.036756 IP 124.82.43.181.50370 > 10.0.98.29.pnbs: Flags [S], seq 1533519112, win 8192, options [mss 1360,nop,nop,sackOK], length 0
00:58:16.374121 IP 124.129.84.80.64896 > 10.0.0.236.pnbs: Flags [S], seq 3997790172, win 8192, options [mss 1440,nop,wscale 2,nop,nop,sackOK], length 0
00:58:16.374156 IP 124.129.84.80.64896 > 10.0.98.29.pnbs: Flags [S], seq 3997790172, win 8192, options [mss 1400,nop,wscale 2,nop,nop,sackOK], length 0
00:58:17.516793 IP 24.99.181.117.52831 > 10.0.0.236.27021: Flags [S], seq 1854468078, win 8192, options [mss 1460,nop,wscale 2,nop,nop,sackOK], length 0
00:58:17.516820 IP 24.99.181.117.52831 > 10.0.98.29.27021: Flags [S], seq 1854468078, win 8192, options [mss 1400,nop,wscale 2,nop,nop,sackOK], length 0
00:58:18.638811 IP 221.4.34.223.dist-upgrade > 10.0.0.236.pnbs: Flags [S], seq 2908028704, win 8192, options [mss 1448,nop,nop,sackOK], length 0
00:58:18.638835 IP 221.4.34.223.dist-upgrade > 10.0.98.29.pnbs: Flags [S], seq 2908028704, win 8192, options [mss 1400,nop,nop,sackOK], length 0
00:58:19.038572 IP 124.82.43.181.50370 > 10.0.0.236.pnbs: Flags [S], seq 1533519112, win 8192, options [mss 1360,nop,nop,sackOK], length 0
00:58:19.038588 IP 124.82.43.181.50370 > 10.0.98.29.pnbs: Flags [S], seq 1533519112, win 8192, options [mss 1360,nop,nop,sackOK], length 0
00:58:19.373703 IP 124.129.84.80.64896 > 10.0.0.236.pnbs: Flags [S], seq 3997790172, win 8192, options [mss 1440,nop,wscale 2,nop,nop,sackOK], length 0
00:58:19.373730 IP 124.129.84.80.64896 > 10.0.98.29.pnbs: Flags [S], seq 3997790172, win 8192, options [mss 1400,nop,wscale 2,nop,nop,sackOK], length 0
00:58:20.513415 IP 221.209.46.82.ssc-agent > 10.0.0.236.pnbs: Flags [S], seq 1175623219, win 65535, options [mss 1460,nop,wscale 2,nop,nop,sackOK], length 0
00:58:20.513441 IP 221.209.46.82.ssc-agent > 10.0.98.29.pnbs: Flags [S], seq 1175623219, win 65535, options [mss 1400,nop,wscale 2,nop,nop,sackOK], length 0
00:58:23.517001 IP 24.99.181.117.52831 > 10.0.0.236.27021: Flags [S], seq 1854468078, win 8192, options [mss 1460,nop,nop,sackOK], length 0
00:58:23.517025 IP 24.99.181.117.52831 > 10.0.98.29.27021: Flags [S], seq 1854468078, win 8192, options [mss 1400,nop,nop,sackOK], length 0
00:58:25.041828 IP 124.82.43.181.50370 > 10.0.0.236.pnbs: Flags [S], seq 1533519112, win 8192, options [mss 1360,nop,nop,sackOK], length 0
00:58:25.041857 IP 124.82.43.181.50370 > 10.0.98.29.pnbs: Flags [S], seq 1533519112, win 8192, options [mss 1360,nop,nop,sackOK], length 0
00:58:25.366108 IP 124.129.84.80.64896 > 10.0.0.236.pnbs: Flags [S], seq 3997790172, win 8192, options [mss 1440,nop,nop,sackOK], length 0
00:58:25.366129 IP 124.129.84.80.64896 > 10.0.98.29.pnbs: Flags [S], seq 3997790172, win 8192, options [mss 1400,nop,nop,sackOK], length 0
00:58:25.433763 IP 49.80.219.38.23597 > 10.0.0.236.pnbs: Flags [S], seq 2940999064, win 8192, options [mss 1460,nop,wscale 8,nop,nop,sackOK], length 0
00:58:25.433789 IP 49.80.219.38.23597 > 10.0.98.29.pnbs: Flags [S], seq 2940999064, win 8192, options [mss 1400,nop,wscale 8,nop,nop,sackOK], length 0
00:58:28.439504 IP 49.80.219.38.23597 > 10.0.0.236.pnbs: Flags [S], seq 2940999064, win 8192, options [mss 1460,nop,wscale 8,nop,nop,sackOK], length 0
00:58:28.439527 IP 49.80.219.38.23597 > 10.0.98.29.pnbs: Flags [S], seq 2940999064, win 8192, options [mss 1400,nop,wscale 8,nop,nop,sackOK], length 0
00:58:34.440907 IP 49.80.219.38.23609 > 10.0.0.236.pnbs: Flags [S], seq 2940999064, win 8192, options [mss 1460,nop,nop,sackOK], length 0
00:58:34.440944 IP 49.80.219.38.23609 > 10.0.98.29.pnbs: Flags [S], seq 2940999064, win 8192, options [mss 1400,nop,nop,sackOK], length 0
00:58:34.604489 IP 42.49.177.152.34751 > 10.0.0.236.pnbs: Flags [S], seq 472171206, win 8192, options [mss 1440,nop,wscale 2,nop,nop,sackOK], length 0
00:58:34.604518 IP 42.49.177.152.34751 > 10.0.98.29.pnbs: Flags [S], seq 472171206, win 8192, options [mss 1400,nop,wscale 2,nop,nop,sackOK], length 0
00:58:35.396197 IP 202.166.24.150.49899 > 10.0.0.236.pnbs: Flags [S], seq 4243834428, win 8192, options [mss 1460,nop,wscale 2,nop,nop,sackOK], length 0
00:58:35.396229 IP 202.166.24.150.49899 > 10.0.98.29.pnbs: Flags [S], seq 4243834428, win 8192, options [mss 1400,nop,wscale 2,nop,nop,sackOK], length 0
00:58:36.527978 IP 24.99.181.117.52832 > 10.0.0.236.27021: Flags [S], seq 972314856, win 8192, options [mss 1460,nop,wscale 2,nop,nop,sackOK], length 0
00:58:36.528014 IP 24.99.181.117.52832 > 10.0.98.29.27021: Flags [S], seq 972314856, win 8192, options [mss 1400,nop,wscale 2,nop,nop,sackOK], length 0
00:58:36.714334 IP 106.241.31.236.50169 > 10.0.98.29.pnbs: Flags [S], seq 3303255965, win 65535, options [mss 1400,nop,wscale 5,nop,nop,TS val 1097924817 ecr 0,sackOK,eol], length 0
00:58:37.606298 IP 42.49.177.152.34751 > 10.0.0.236.pnbs: Flags [S], seq 472171206, win 8192, options [mss 1440,nop,wscale 2,nop,nop,sackOK], length 0
00:58:37.606324 IP 42.49.177.152.34751 > 10.0.98.29.pnbs: Flags [S], seq 472171206, win 8192, options [mss 1400,nop,wscale 2,nop,nop,sackOK], length 0
00:58:37.900840 IP 106.241.31.236.50169 > 10.0.98.29.pnbs: Flags [S], seq 3303255965, win 65535, options [mss 1400,nop,wscale 5,nop,nop,TS val 1097925817 ecr 0,sackOK,eol], length 0
00:58:38.399756 IP 202.166.24.150.49899 > 10.0.0.236.pnbs: Flags [S], seq 4243834428, win 8192, options [mss 1460,nop,wscale 2,nop,nop,sackOK], length 0
00:58:38.399783 IP 202.166.24.150.49899 > 10.0.98.29.pnbs: Flags [S], seq 4243834428, win 8192, options [mss 1400,nop,wscale 2,nop,nop,sackOK], length 0
00:58:38.930057 IP 106.241.31.236.50169 > 10.0.98.29.pnbs: Flags [S], seq 3303255965, win 65535, options [mss 1400,nop,wscale 5,nop,nop,TS val 1097926818 ecr 0,sackOK,eol], length 0
00:58:39.545397 IP 24.99.181.117.52832 > 10.0.0.236.27021: Flags [S], seq 972314856, win 8192, options [mss 1460,nop,wscale 2,nop,nop,sackOK], length 0
00:58:39.545418 IP 24.99.181.117.52832 > 10.0.98.29.27021: Flags [S], seq 972314856, win 8192, options [mss 1400,nop,wscale 2,nop,nop,sackOK], length 0
00:58:40.018900 IP 106.241.31.236.50169 > 10.0.98.29.pnbs: Flags [S], seq 3303255965, win 65535, options [mss 1400,nop,wscale 5,nop,nop,TS val 1097927818 ecr 0,sackOK,eol], length 0
00:58:43.598127 IP 42.49.177.152.34751 > 10.0.0.236.pnbs: Flags [S], seq 472171206, win 8192, options [mss 1440,nop,nop,sackOK], length 0
00:58:43.598155 IP 42.49.177.152.34751 > 10.0.98.29.pnbs: Flags [S], seq 472171206, win 8192, options [mss 1400,nop,nop,sackOK], length 0
00:58:44.400829 IP 202.166.24.150.49899 > 10.0.0.236.pnbs: Flags [S], seq 4243834428, win 8192, options [mss 1460,nop,nop,sackOK], length 0
00:58:44.400857 IP 202.166.24.150.49899 > 10.0.98.29.pnbs: Flags [S], seq 4243834428, win 8192, options [mss 1400,nop,nop,sackOK], length 0
00:58:45.531133 IP 24.99.181.117.52832 > 10.0.0.236.27021: Flags [S], seq 972314856, win 8192, options [mss 1460,nop,nop,sackOK], length 0
00:58:45.531159 IP 24.99.181.117.52832 > 10.0.98.29.27021: Flags [S], seq 972314856, win 8192, options [mss 1400,nop,nop,sackOK], length 0
00:58:50.974075 IP 14.117.156.146.58403 > 10.0.0.236.pnbs: Flags [S], seq 3013629682, win 8192, options [mss 1440,nop,wscale 8,nop,nop,sackOK], length 0
00:58:50.974111 IP 14.117.156.146.58403 > 10.0.98.29.pnbs: Flags [S], seq 3013629682, win 8192, options [mss 1400,nop,wscale 8,nop,nop,sackOK], length 0
00:58:53.979235 IP 14.117.156.146.58403 > 10.0.0.236.pnbs: Flags [S], seq 3013629682, win 8192, options [mss 1460,nop,wscale 8,nop,nop,sackOK], length 0
00:58:53.979258 IP 14.117.156.146.58403 > 10.0.98.29.pnbs: Flags [S], seq 3013629682, win 8192, options [mss 1400,nop,wscale 8,nop,nop,sackOK], length 0
00:58:55.767862 IP 1.243.255.191.solve > 10.0.0.236.pnbs: Flags [S], seq 823700859, win 8192, options [mss 1460,nop,wscale 8,nop,nop,sackOK], length 0
00:58:55.767896 IP 1.243.255.191.solve > 10.0.98.29.pnbs: Flags [S], seq 823700859, win 8192, options [mss 1400,nop,wscale 8,nop,nop,sackOK], length 0
00:58:58.541409 IP 24.99.181.117.52833 > 10.0.0.236.27021: Flags [S], seq 2500186563, win 8192, options [mss 1460,nop,wscale 2,nop,nop,sackOK], length 0
00:58:58.541445 IP 24.99.181.117.52833 > 10.0.98.29.27021: Flags [S], seq 2500186563, win 8192, options [mss 1400,nop,wscale 2,nop,nop,sackOK], length 0
00:58:58.763910 IP 1.243.255.191.solve > 10.0.0.236.pnbs: Flags [S], seq 823700859, win 8192, options [mss 1460,nop,wscale 8,nop,nop,sackOK], length 0
00:58:58.763938 IP 1.243.255.191.solve > 10.0.98.29.pnbs: Flags [S], seq 823700859, win 8192, options [mss 1400,nop,wscale 8,nop,nop,sackOK], length 0
00:58:59.146536 IP 217.23.4.132.56355 > 10.0.0.236.pnbs: Flags [S], seq 449028317, win 64240, options [mss 1460,nop,wscale 2,nop,nop,sackOK], length 0
00:58:59.146576 IP 217.23.4.132.56355 > 10.0.98.29.pnbs: Flags [S], seq 449028317, win 64240, options [mss 1400,nop,wscale 2,nop,nop,sackOK], length 0
00:58:59.298689 IP 217.23.4.132.56356 > 10.0.0.236.pnbs: Flags [S], seq 1773320346, win 64240, options [mss 1460,nop,wscale 2,nop,nop,sackOK], length 0
00:58:59.298719 IP 217.23.4.132.56356 > 10.0.98.29.pnbs: Flags [S], seq 1773320346, win 64240, options [mss 1400,nop,wscale 2,nop,nop,sackOK], length 0
00:58:59.974524 IP 14.117.156.146.58403 > 10.0.0.236.pnbs: Flags [S], seq 3013629682, win 8192, options [mss 1460,nop,nop,sackOK], length 0
00:58:59.974550 IP 14.117.156.146.58403 > 10.0.98.29.pnbs: Flags [S], seq 3013629682, win 8192, options [mss 1400,nop,nop,sackOK], length 0
00:59:01.533773 IP 24.99.181.117.52833 > 10.0.0.236.27021: Flags [S], seq 2500186563, win 8192, options [mss 1460,nop,wscale 2,nop,nop,sackOK], length 0
00:59:01.533798 IP 24.99.181.117.52833 > 10.0.98.29.27021: Flags [S], seq 2500186563, win 8192, options [mss 1400,nop,wscale 2,nop,nop,sackOK], length 0
00:59:02.142446 IP 217.23.4.132.56355 > 10.0.0.236.pnbs: Flags [S], seq 449028317, win 64240, options [mss 1460,nop,wscale 2,nop,nop,sackOK], length 0
00:59:02.142475 IP 217.23.4.132.56355 > 10.0.98.29.pnbs: Flags [S], seq 449028317, win 64240, options [mss 1400,nop,wscale 2,nop,nop,sackOK], length 0
00:59:02.298488 IP 217.23.4.132.56356 > 10.0.0.236.pnbs: Flags [S], seq 1773320346, win 64240, options [mss 1460,nop,wscale 2,nop,nop,sackOK], length 0
00:59:02.298508 IP 217.23.4.132.56356 > 10.0.98.29.pnbs: Flags [S], seq 1773320346, win 64240, options [mss 1400,nop,wscale 2,nop,nop,sackOK], length 0
00:59:03.825045 IP 221.4.34.223.9044 > 10.0.0.236.pnbs: Flags [S], seq 4144099903, win 8192, options [mss 1448,nop,wscale 2,nop,nop,sackOK], length 0
00:59:03.825081 IP 221.4.34.223.9044 > 10.0.98.29.pnbs: Flags [S], seq 4144099903, win 8192, options [mss 1400,nop,wscale 2,nop,nop,sackOK], length 0
00:59:04.768015 IP 1.243.255.191.solve > 10.0.0.236.pnbs: Flags [S], seq 823700859, win 8192, options [mss 1460,nop,nop,sackOK], length 0
00:59:04.768044 IP 1.243.255.191.solve > 10.0.98.29.pnbs: Flags [S], seq 823700859, win 8192, options [mss 1400,nop,nop,sackOK], length 0
00:59:05.389775 IP 188.238.23.66.15136 > 10.0.0.236.pnbs: Flags [S], seq 2863543474, win 8192, options [mss 1400,nop,wscale 2,nop,nop,sackOK], length 0
00:59:05.389809 IP 188.238.23.66.15136 > 10.0.98.29.pnbs: Flags [S], seq 2863543474, win 8192, options [mss 1400,nop,wscale 2,nop,nop,sackOK], length 0
00:59:06.826103 IP 221.4.34.223.9044 > 10.0.0.236.pnbs: Flags [S], seq 4144099903, win 8192, options [mss 1448,nop,wscale 2,nop,nop,sackOK], length 0
00:59:06.826131 IP 221.4.34.223.9044 > 10.0.98.29.pnbs: Flags [S], seq 4144099903, win 8192, options [mss 1400,nop,wscale 2,nop,nop,sackOK], length 0
00:59:07.541047 IP 24.99.181.117.52833 > 10.0.0.236.27021: Flags [S], seq 2500186563, win 8192, options [mss 1460,nop,nop,sackOK], length 0
00:59:07.541070 IP 24.99.181.117.52833 > 10.0.98.29.27021: Flags [S], seq 2500186563, win 8192, options [mss 1400,nop,nop,sackOK], length 0
00:59:08.145884 IP 217.23.4.132.56355 > 10.0.0.236.pnbs: Flags [S], seq 449028317, win 64240, options [mss 1460,nop,nop,sackOK], length 0
00:59:08.145911 IP 217.23.4.132.56355 > 10.0.98.29.pnbs: Flags [S], seq 449028317, win 64240, options [mss 1400,nop,nop,sackOK], length 0
00:59:08.301927 IP 217.23.4.132.56356 > 10.0.0.236.pnbs: Flags [S], seq 1773320346, win 64240, options [mss 1460,nop,nop,sackOK], length 0
00:59:08.301947 IP 217.23.4.132.56356 > 10.0.98.29.pnbs: Flags [S], seq 1773320346, win 64240, options [mss 1400,nop,nop,sackOK], length 0
00:59:08.388684 IP 188.238.23.66.15136 > 10.0.0.236.pnbs: Flags [S], seq 2863543474, win 8192, options [mss 1400,nop,wscale 2,nop,nop,sackOK], length 0
00:59:08.388711 IP 188.238.23.66.15136 > 10.0.98.29.pnbs: Flags [S], seq 2863543474, win 8192, options [mss 1400,nop,wscale 2,nop,nop,sackOK], length 0
00:59:12.827552 IP 221.4.34.223.9044 > 10.0.0.236.pnbs: Flags [S], seq 4144099903, win 8192, options [mss 1448,nop,nop,sackOK], length 0
00:59:12.827580 IP 221.4.34.223.9044 > 10.0.98.29.pnbs: Flags [S], seq 4144099903, win 8192, options [mss 1400,nop,nop,sackOK], length 0
00:59:14.420858 IP 188.238.23.66.15136 > 10.0.0.236.pnbs: Flags [S], seq 2863543474, win 8192, options [mss 1400,nop,nop,sackOK], length 0
00:59:14.420886 IP 188.238.23.66.15136 > 10.0.98.29.pnbs: Flags [S], seq 2863543474, win 8192, options [mss 1400,nop,nop,sackOK], length 0
00:59:20.571240 IP 24.99.181.117.52835 > 10.0.0.236.27021: Flags [S], seq 1272136718, win 8192, options [mss 1460,nop,wscale 2,nop,nop,sackOK], length 0
00:59:20.571274 IP 24.99.181.117.52835 > 10.0.98.29.27021: Flags [S], seq 1272136718, win 8192, options [mss 1400,nop,wscale 2,nop,nop,sackOK], length 0
00:59:23.562115 IP 24.99.181.117.52835 > 10.0.0.236.27021: Flags [S], seq 1272136718, win 8192, options [mss 1460,nop,wscale 2,nop,nop,sackOK], length 0
00:59:23.562141 IP 24.99.181.117.52835 > 10.0.98.29.27021: Flags [S], seq 1272136718, win 8192, options [mss 1400,nop,wscale 2,nop,nop,sackOK], length 0
00:59:23.606455 IP 188.238.23.66.15136 > 10.0.0.236.pnbs: Flags [R.], seq 2863543475, ack 0, win 0, length 0
00:59:23.606475 IP 188.238.23.66.15136 > 10.0.98.29.pnbs: Flags [R.], seq 2863543475, ack 0, win 0, length 0
00:59:29.317811 IP 217.23.4.132.56368 > 10.0.0.236.pnbs: Flags [S], seq 931072875, win 64240, options [mss 1460,nop,wscale 2,nop,nop,sackOK], length 0
00:59:29.317847 IP 217.23.4.132.56368 > 10.0.98.29.pnbs: Flags [S], seq 931072875, win 64240, options [mss 1400,nop,wscale 2,nop,nop,sackOK], length 0
00:59:29.562738 IP 24.99.181.117.52835 > 10.0.0.236.27021: Flags [S], seq 1272136718, win 8192, options [mss 1460,nop,nop,sackOK], length 0
00:59:29.562774 IP 24.99.181.117.52835 > 10.0.98.29.27021: Flags [S], seq 1272136718, win 8192, options [mss 1400,nop,nop,sackOK], length 0
00:59:32.310685 IP 217.23.4.132.56368 > 10.0.0.236.pnbs: Flags [S], seq 931072875, win 64240, options [mss 1460,nop,wscale 2,nop,nop,sackOK], length 0
00:59:32.310713 IP 217.23.4.132.56368 > 10.0.98.29.pnbs: Flags [S], seq 931072875, win 64240, options [mss 1400,nop,wscale 2,nop,nop,sackOK], length 0
00:59:38.314134 IP 217.23.4.132.56368 > 10.0.0.236.pnbs: Flags [S], seq 931072875, win 64240, options [mss 1460,nop,nop,sackOK], length 0
00:59:38.314171 IP 217.23.4.132.56368 > 10.0.98.29.pnbs: Flags [S], seq 931072875, win 64240, options [mss 1400,nop,nop,sackOK], length 0
00:59:42.298140 IP 202.166.24.150.49927 > 10.0.0.236.pnbs: Flags [S], seq 3879492308, win 8192, options [mss 1460,nop,wscale 2,nop,nop,sackOK], length 0
00:59:42.298177 IP 202.166.24.150.49927 > 10.0.98.29.pnbs: Flags [S], seq 3879492308, win 8192, options [mss 1400,nop,wscale 2,nop,nop,sackOK], length 0
00:59:42.576593 IP 24.99.181.117.52837 > 10.0.0.236.27021: Flags [S], seq 3829856124, win 8192, options [mss 1460,nop,wscale 2,nop,nop,sackOK], length 0
00:59:42.576626 IP 24.99.181.117.52837 > 10.0.98.29.27021: Flags [S], seq 3829856124, win 8192, options [mss 1400,nop,wscale 2,nop,nop,sackOK], length 0
00:59:45.296800 IP 202.166.24.150.49927 > 10.0.0.236.pnbs: Flags [S], seq 3879492308, win 8192, options [mss 1460,nop,wscale 2,nop,nop,sackOK], length 0
00:59:45.296824 IP 202.166.24.150.49927 > 10.0.98.29.pnbs: Flags [S], seq 3879492308, win 8192, options [mss 1400,nop,wscale 2,nop,nop,sackOK], length 0
00:59:45.579594 IP 24.99.181.117.52837 > 10.0.0.236.27021: Flags [S], seq 3829856124, win 8192, options [mss 1460,nop,wscale 2,nop,nop,sackOK], length 0
00:59:45.579620 IP 24.99.181.117.52837 > 10.0.98.29.27021: Flags [S], seq 3829856124, win 8192, options [mss 1400,nop,wscale 2,nop,nop,sackOK], length 0
00:59:51.298779 IP 202.166.24.150.49927 > 10.0.0.236.pnbs: Flags [S], seq 3879492308, win 8192, options [mss 1460,nop,nop,sackOK], length 0
00:59:51.298805 IP 202.166.24.150.49927 > 10.0.98.29.pnbs: Flags [S], seq 3879492308, win 8192, options [mss 1400,nop,nop,sackOK], length 0
00:59:51.583861 IP 24.99.181.117.52837 > 10.0.0.236.27021: Flags [S], seq 3829856124, win 8192, options [mss 1460,nop,nop,sackOK], length 0
00:59:51.583887 IP 24.99.181.117.52837 > 10.0.98.29.27021: Flags [S], seq 3829856124, win 8192, options [mss 1400,nop,nop,sackOK], length 0
01:00:04.592451 IP 24.99.181.117.52838 > 10.0.0.236.27021: Flags [S], seq 1006718945, win 8192, options [mss 1460,nop,wscale 2,nop,nop,sackOK], length 0
01:00:04.592485 IP 24.99.181.117.52838 > 10.0.98.29.27021: Flags [S], seq 1006718945, win 8192, options [mss 1400,nop,wscale 2,nop,nop,sackOK], length 0
01:00:07.589310 IP 24.99.181.117.52838 > 10.0.0.236.27021: Flags [S], seq 1006718945, win 8192, options [mss 1460,nop,wscale 2,nop,nop,sackOK], length 0
01:00:07.589338 IP 24.99.181.117.52838 > 10.0.98.29.27021: Flags [S], seq 1006718945, win 8192, options [mss 1400,nop,wscale 2,nop,nop,sackOK], length 0
01:00:13.591076 IP 24.99.181.117.52838 > 10.0.0.236.27021: Flags [S], seq 1006718945, win 8192, options [mss 1460,nop,nop,sackOK], length 0
01:00:13.591104 IP 24.99.181.117.52838 > 10.0.98.29.27021: Flags [S], seq 1006718945, win 8192, options [mss 1400,nop,nop,sackOK], length 0
01:00:17.476014 IP 91.76.152.253.64021 > 10.0.0.236.pnbs: Flags [S], seq 4222058557, win 8192, options [mss 1460,nop,wscale 2,nop,nop,sackOK], length 0
01:00:17.476047 IP 91.76.152.253.64021 > 10.0.98.29.pnbs: Flags [S], seq 4222058557, win 8192, options [mss 1400,nop,wscale 2,nop,nop,sackOK], length 0
01:00:20.471524 IP 91.76.152.253.64021 > 10.0.0.236.pnbs: Flags [S], seq 4222058557, win 8192, options [mss 1460,nop,wscale 2,nop,nop,sackOK], length 0
01:00:20.471556 IP 91.76.152.253.64021 > 10.0.98.29.pnbs: Flags [S], seq 4222058557, win 8192, options [mss 1400,nop,wscale 2,nop,nop,sackOK], length 0
01:00:24.581770 IP 14.176.48.118.snap > 10.0.0.236.pnbs: Flags [S], seq 2662195060, win 65535, options [mss 1440,nop,nop,sackOK], length 0
01:00:24.581792 IP 14.176.48.118.snap > 10.0.98.29.pnbs: Flags [S], seq 2662195060, win 65535, options [mss 1400,nop,nop,sackOK], length 0
01:00:26.466484 IP 91.76.152.253.64021 > 10.0.0.236.pnbs: Flags [S], seq 4222058557, win 8192, options [mss 1460,nop,nop,sackOK], length 0
01:00:26.466497 IP 91.76.152.253.64021 > 10.0.98.29.pnbs: Flags [S], seq 4222058557, win 8192, options [mss 1400,nop,nop,sackOK], length 0
01:00:26.605176 IP 24.99.181.117.52840 > 10.0.0.236.27021: Flags [S], seq 1339036870, win 8192, options [mss 1460,nop,wscale 2,nop,nop,sackOK], length 0
01:00:26.605211 IP 24.99.181.117.52840 > 10.0.98.29.27021: Flags [S], seq 1339036870, win 8192, options [mss 1400,nop,wscale 2,nop,nop,sackOK], length 0
01:00:27.535131 IP 14.176.48.118.snap > 10.0.0.236.pnbs: Flags [S], seq 2662195060, win 65535, options [mss 1440,nop,nop,sackOK], length 0
01:00:27.535163 IP 14.176.48.118.snap > 10.0.98.29.pnbs: Flags [S], seq 2662195060, win 65535, options [mss 1400,nop,nop,sackOK], length 0
01:00:29.604665 IP 24.99.181.117.52840 > 10.0.0.236.27021: Flags [S], seq 1339036870, win 8192, options [mss 1460,nop,wscale 2,nop,nop,sackOK], length 0
01:00:29.604698 IP 24.99.181.117.52840 > 10.0.98.29.27021: Flags [S], seq 1339036870, win 8192, options [mss 1400,nop,wscale 2,nop,nop,sackOK], length 0
01:00:33.470760 IP 14.176.48.118.snap > 10.0.0.236.pnbs: Flags [S], seq 2662195060, win 65535, options [mss 1440,nop,nop,sackOK], length 0
01:00:33.470785 IP 14.176.48.118.snap > 10.0.98.29.pnbs: Flags [S], seq 2662195060, win 65535, options [mss 1400,nop,nop,sackOK], length 0
01:00:34.996399 IP 202.166.24.150.49959 > 10.0.0.236.pnbs: Flags [S], seq 133620661, win 8192, options [mss 1460,nop,wscale 2,nop,nop,sackOK], length 0
01:00:34.996431 IP 202.166.24.150.49959 > 10.0.98.29.pnbs: Flags [S], seq 133620661, win 8192, options [mss 1400,nop,wscale 2,nop,nop,sackOK], length 0
01:00:35.604672 IP 24.99.181.117.52840 > 10.0.0.236.27021: Flags [S], seq 1339036870, win 8192, options [mss 1460,nop,nop,sackOK], length 0
01:00:35.604696 IP 24.99.181.117.52840 > 10.0.98.29.27021: Flags [S], seq 1339036870, win 8192, options [mss 1400,nop,nop,sackOK], length 0
01:00:38.002400 IP 202.166.24.150.49959 > 10.0.0.236.pnbs: Flags [S], seq 133620661, win 8192, options [mss 1460,nop,wscale 2,nop,nop,sackOK], length 0
01:00:38.002427 IP 202.166.24.150.49959 > 10.0.98.29.pnbs: Flags [S], seq 133620661, win 8192, options [mss 1400,nop,wscale 2,nop,nop,sackOK], length 0
01:00:38.400813 IP 118.137.84.169.61996 > 10.0.0.236.pnbs: Flags [S], seq 3234052054, win 8192, options [mss 1460,nop,wscale 2,nop,nop,sackOK], length 0
01:00:38.400849 IP 118.137.84.169.61996 > 10.0.98.29.pnbs: Flags [S], seq 3234052054, win 8192, options [mss 1400,nop,wscale 2,nop,nop,sackOK], length 0
01:00:41.402798 IP 118.137.84.169.61996 > 10.0.0.236.pnbs: Flags [S], seq 3234052054, win 8192, options [mss 1460,nop,wscale 2,nop,nop,sackOK], length 0
01:00:41.402822 IP 118.137.84.169.61996 > 10.0.98.29.pnbs: Flags [S], seq 3234052054, win 8192, options [mss 1400,nop,wscale 2,nop,nop,sackOK], length 0
01:00:43.997709 IP 202.166.24.150.49959 > 10.0.0.236.pnbs: Flags [S], seq 133620661, win 8192, options [mss 1460,nop,nop,sackOK], length 0
01:00:43.997735 IP 202.166.24.150.49959 > 10.0.98.29.pnbs: Flags [S], seq 133620661, win 8192, options [mss 1400,nop,nop,sackOK], length 0
01:00:47.396794 IP 118.137.84.169.61996 > 10.0.0.236.pnbs: Flags [S], seq 3234052054, win 8192, options [mss 1460,nop,nop,sackOK], length 0
01:00:47.396824 IP 118.137.84.169.61996 > 10.0.98.29.pnbs: Flags [S], seq 3234052054, win 8192, options [mss 1400,nop,nop,sackOK], length 0
01:00:48.615616 IP 24.99.181.117.52841 > 10.0.0.236.27021: Flags [S], seq 3669278758, win 8192, options [mss 1460,nop,wscale 2,nop,nop,sackOK], length 0
01:00:48.615649 IP 24.99.181.117.52841 > 10.0.98.29.27021: Flags [S], seq 3669278758, win 8192, options [mss 1400,nop,wscale 2,nop,nop,sackOK], length 0
01:00:51.615172 IP 24.99.181.117.52841 > 10.0.0.236.27021: Flags [S], seq 3669278758, win 8192, options [mss 1460,nop,wscale 2,nop,nop,sackOK], length 0
01:00:51.615199 IP 24.99.181.117.52841 > 10.0.98.29.27021: Flags [S], seq 3669278758, win 8192, options [mss 1400,nop,wscale 2,nop,nop,sackOK], length 0
01:00:57.615303 IP 24.99.181.117.52841 > 10.0.0.236.27021: Flags [S], seq 3669278758, win 8192, options [mss 1460,nop,nop,sackOK], length 0
01:00:57.615333 IP 24.99.181.117.52841 > 10.0.98.29.27021: Flags [S], seq 3669278758, win 8192, options [mss 1400,nop,nop,sackOK], length 0
01:01:10.635282 IP 24.99.181.117.52842 > 10.0.0.236.27021: Flags [S], seq 2192819964, win 8192, options [mss 1460,nop,wscale 2,nop,nop,sackOK], length 0
01:01:10.635314 IP 24.99.181.117.52842 > 10.0.98.29.27021: Flags [S], seq 2192819964, win 8192, options [mss 1400,nop,wscale 2,nop,nop,sackOK], length 0
01:01:13.634560 IP 24.99.181.117.52842 > 10.0.0.236.27021: Flags [S], seq 2192819964, win 8192, options [mss 1460,nop,wscale 2,nop,nop,sackOK], length 0
01:01:13.634587 IP 24.99.181.117.52842 > 10.0.98.29.27021: Flags [S], seq 2192819964, win 8192, options [mss 1400,nop,wscale 2,nop,nop,sackOK], length 0
01:01:19.634695 IP 24.99.181.117.52842 > 10.0.0.236.27021: Flags [S], seq 2192819964, win 8192, options [mss 1460,nop,nop,sackOK], length 0
01:01:19.634720 IP 24.99.181.117.52842 > 10.0.98.29.27021: Flags [S], seq 2192819964, win 8192, options [mss 1400,nop,nop,sackOK], length 0
01:01:28.219208 IP 130.105.191.87.61274 > 10.0.0.236.pnbs: Flags [S], seq 1853578774, win 65535, options [mss 1460,nop,wscale 5,nop,nop,TS val 513746359 ecr 0,sackOK,eol], length 0
01:01:28.219242 IP 130.105.191.87.61274 > 10.0.98.29.pnbs: Flags [S], seq 1853578774, win 65535, options [mss 1400,nop,wscale 5,nop,nop,TS val 513746359 ecr 0,sackOK,eol], length 0
01:01:31.140755 IP 112.198.77.151.11859 > 10.0.0.236.pnbs: Flags [S], seq 246267660, win 65535, options [mss 1400,nop,wscale 5,nop,nop,TS val 513749275 ecr 0,sackOK,eol], length 0
01:01:31.140796 IP 112.198.77.151.11859 > 10.0.98.29.pnbs: Flags [S], seq 246267660, win 65535, options [mss 1400,nop,wscale 5,nop,nop,TS val 513749275 ecr 0,sackOK,eol], length 0
01:01:32.160566 IP 112.198.77.151.11859 > 10.0.0.236.pnbs: Flags [S], seq 246267660, win 65535, options [mss 1400,nop,wscale 5,nop,nop,TS val 513750275 ecr 0,sackOK,eol], length 0
01:01:32.160598 IP 112.198.77.151.11859 > 10.0.98.29.pnbs: Flags [S], seq 246267660, win 65535, options [mss 1400,nop,wscale 5,nop,nop,TS val 513750275 ecr 0,sackOK,eol], length 0
01:01:32.665584 IP 24.99.181.117.52843 > 10.0.0.236.27021: Flags [S], seq 2179530331, win 8192, options [mss 1460,nop,wscale 2,nop,nop,sackOK], length 0
01:01:32.665632 IP 24.99.181.117.52843 > 10.0.98.29.27021: Flags [S], seq 2179530331, win 8192, options [mss 1400,nop,wscale 2,nop,nop,sackOK], length 0
01:01:33.160743 IP 112.198.77.151.11859 > 10.0.0.236.pnbs: Flags [S], seq 246267660, win 65535, options [mss 1400,nop,wscale 5,nop,nop,TS val 513751275 ecr 0,sackOK,eol], length 0
01:01:33.160758 IP 112.198.77.151.11859 > 10.0.98.29.pnbs: Flags [S], seq 246267660, win 65535, options [mss 1400,nop,wscale 5,nop,nop,TS val 513751275 ecr 0,sackOK,eol], length 0
01:01:34.160962 IP 112.198.77.151.11859 > 10.0.0.236.pnbs: Flags [S], seq 246267660, win 65535, options [mss 1400,nop,wscale 5,nop,nop,TS val 513752275 ecr 0,sackOK,eol], length 0
01:01:34.160991 IP 112.198.77.151.11859 > 10.0.98.29.pnbs: Flags [S], seq 246267660, win 65535, options [mss 1400,nop,wscale 5,nop,nop,TS val 513752275 ecr 0,sackOK,eol], length 0
01:01:35.160462 IP 112.198.77.151.11859 > 10.0.0.236.pnbs: Flags [S], seq 246267660, win 65535, options [mss 1400,nop,wscale 5,nop,nop,TS val 513753275 ecr 0,sackOK,eol], length 0
01:01:35.160486 IP 112.198.77.151.11859 > 10.0.98.29.pnbs: Flags [S], seq 246267660, win 65535, options [mss 1400,nop,wscale 5,nop,nop,TS val 513753275 ecr 0,sackOK,eol], length 0
01:01:35.665086 IP 24.99.181.117.52843 > 10.0.0.236.27021: Flags [S], seq 2179530331, win 8192, options [mss 1460,nop,wscale 2,nop,nop,sackOK], length 0
01:01:35.665126 IP 24.99.181.117.52843 > 10.0.98.29.27021: Flags [S], seq 2179530331, win 8192, options [mss 1400,nop,wscale 2,nop,nop,sackOK], length 0
01:01:36.160739 IP 112.198.77.151.11859 > 10.0.0.236.pnbs: Flags [S], seq 246267660, win 65535, options [mss 1400,nop,wscale 5,nop,nop,TS val 513754276 ecr 0,sackOK,eol], length 0
01:01:36.160764 IP 112.198.77.151.11859 > 10.0.98.29.pnbs: Flags [S], seq 246267660, win 65535, options [mss 1400,nop,wscale 5,nop,nop,TS val 513754276 ecr 0,sackOK,eol], length 0
01:01:38.160535 IP 112.198.77.151.11859 > 10.0.0.236.pnbs: Flags [S], seq 246267660, win 65535, options [mss 1400,nop,wscale 5,nop,nop,TS val 513756276 ecr 0,sackOK,eol], length 0
01:01:38.160559 IP 112.198.77.151.11859 > 10.0.98.29.pnbs: Flags [S], seq 246267660, win 65535, options [mss 1400,nop,wscale 5,nop,nop,TS val 513756276 ecr 0,sackOK,eol], length 0
01:01:41.159219 IP 112.198.77.151.39315 > 10.0.0.236.pnbs: Flags [S], seq 1568103837, win 65535, options [mss 1400,nop,wscale 5,nop,nop,TS val 513759268 ecr 0,sackOK,eol], length 0
01:01:41.159254 IP 112.198.77.151.39315 > 10.0.98.29.pnbs: Flags [S], seq 1568103837, win 65535, options [mss 1400,nop,wscale 5,nop,nop,TS val 513759268 ecr 0,sackOK,eol], length 0
01:01:41.652823 IP 24.99.181.117.52843 > 10.0.0.236.27021: Flags [S], seq 2179530331, win 8192, options [mss 1460,nop,nop,sackOK], length 0
01:01:41.652853 IP 24.99.181.117.52843 > 10.0.98.29.27021: Flags [S], seq 2179530331, win 8192, options [mss 1400,nop,nop,sackOK], length 0
01:01:42.159052 IP 112.198.77.151.39315 > 10.0.0.236.pnbs: Flags [S], seq 1568103837, win 65535, options [mss 1400,nop,wscale 5,nop,nop,TS val 513760275 ecr 0,sackOK,eol], length 0
01:01:42.159078 IP 112.198.77.151.39315 > 10.0.98.29.pnbs: Flags [S], seq 1568103837, win 65535, options [mss 1400,nop,wscale 5,nop,nop,TS val 513760275 ecr 0,sackOK,eol], length 0
01:01:43.159501 IP 112.198.77.151.39315 > 10.0.0.236.pnbs: Flags [S], seq 1568103837, win 65535, options [mss 1400,nop,wscale 5,nop,nop,TS val 513761275 ecr 0,sackOK,eol], length 0
01:01:43.159525 IP 112.198.77.151.39315 > 10.0.98.29.pnbs: Flags [S], seq 1568103837, win 65535, options [mss 1400,nop,wscale 5,nop,nop,TS val 513761275 ecr 0,sackOK,eol], length 0
01:01:44.159387 IP 112.198.77.151.39315 > 10.0.0.236.pnbs: Flags [S], seq 1568103837, win 65535, options [mss 1400,nop,wscale 5,nop,nop,TS val 513762275 ecr 0,sackOK,eol], length 0
01:01:44.159411 IP 112.198.77.151.39315 > 10.0.98.29.pnbs: Flags [S], seq 1568103837, win 65535, options [mss 1400,nop,wscale 5,nop,nop,TS val 513762275 ecr 0,sackOK,eol], length 0
01:01:45.159305 IP 112.198.77.151.39315 > 10.0.0.236.pnbs: Flags [S], seq 1568103837, win 65535, options [mss 1400,nop,wscale 5,nop,nop,TS val 513763275 ecr 0,sackOK,eol], length 0
01:01:45.159328 IP 112.198.77.151.39315 > 10.0.98.29.pnbs: Flags [S], seq 1568103837, win 65535, options [mss 1400,nop,wscale 5,nop,nop,TS val 513763275 ecr 0,sackOK,eol], length 0
01:01:46.159552 IP 112.198.77.151.39315 > 10.0.0.236.pnbs: Flags [S], seq 1568103837, win 65535, options [mss 1400,nop,wscale 5,nop,nop,TS val 513764276 ecr 0,sackOK,eol], length 0
01:01:46.159579 IP 112.198.77.151.39315 > 10.0.98.29.pnbs: Flags [S], seq 1568103837, win 65535, options [mss 1400,nop,wscale 5,nop,nop,TS val 513764276 ecr 0,sackOK,eol], length 0
01:01:48.159112 IP 112.198.77.151.39315 > 10.0.0.236.pnbs: Flags [S], seq 1568103837, win 65535, options [mss 1400,nop,wscale 5,nop,nop,TS val 513766277 ecr 0,sackOK,eol], length 0
01:01:48.159140 IP 112.198.77.151.39315 > 10.0.98.29.pnbs: Flags [S], seq 1568103837, win 65535, options [mss 1400,nop,wscale 5,nop,nop,TS val 513766277 ecr 0,sackOK,eol], length 0
01:01:51.159370 IP 112.198.77.151.39316 > 10.0.0.236.pnbs: Flags [S], seq 597746407, win 65535, options [mss 1400,nop,wscale 5,nop,nop,TS val 513769260 ecr 0,sackOK,eol], length 0
01:01:51.159403 IP 112.198.77.151.39316 > 10.0.98.29.pnbs: Flags [S], seq 597746407, win 65535, options [mss 1400,nop,wscale 5,nop,nop,TS val 513769260 ecr 0,sackOK,eol], length 0
01:01:51.522490 IP 1.224.137.122.55821 > 10.0.0.236.pnbs: Flags [S], seq 1639643263, win 8192, options [mss 1460,nop,wscale 8,nop,nop,sackOK], length 0
01:01:51.522523 IP 1.224.137.122.55821 > 10.0.98.29.pnbs: Flags [S], seq 1639643263, win 8192, options [mss 1400,nop,wscale 8,nop,nop,sackOK], length 0
01:01:52.164359 IP 112.198.77.151.39316 > 10.0.0.236.pnbs: Flags [S], seq 597746407, win 65535, options [mss 1400,nop,wscale 5,nop,nop,TS val 513770276 ecr 0,sackOK,eol], length 0
01:01:52.164388 IP 112.198.77.151.39316 > 10.0.98.29.pnbs: Flags [S], seq 597746407, win 65535, options [mss 1400,nop,wscale 5,nop,nop,TS val 513770276 ecr 0,sackOK,eol], length 0
01:01:53.164441 IP 112.198.77.151.39316 > 10.0.0.236.pnbs: Flags [S], seq 597746407, win 65535, options [mss 1400,nop,wscale 5,nop,nop,TS val 513771276 ecr 0,sackOK,eol], length 0
01:01:53.164467 IP 112.198.77.151.39316 > 10.0.98.29.pnbs: Flags [S], seq 597746407, win 65535, options [mss 1400,nop,wscale 5,nop,nop,TS val 513771276 ecr 0,sackOK,eol], length 0
01:01:54.164265 IP 112.198.77.151.39316 > 10.0.0.236.pnbs: Flags [S], seq 597746407, win 65535, options [mss 1400,nop,wscale 5,nop,nop,TS val 513772276 ecr 0,sackOK,eol], length 0
01:01:54.164278 IP 112.198.77.151.39316 > 10.0.98.29.pnbs: Flags [S], seq 597746407, win 65535, options [mss 1400,nop,wscale 5,nop,nop,TS val 513772276 ecr 0,sackOK,eol], length 0
01:01:54.538571 IP 1.224.137.122.55821 > 10.0.0.236.pnbs: Flags [S], seq 1639643263, win 8192, options [mss 1460,nop,wscale 8,nop,nop,sackOK], length 0
01:01:54.538597 IP 1.224.137.122.55821 > 10.0.98.29.pnbs: Flags [S], seq 1639643263, win 8192, options [mss 1400,nop,wscale 8,nop,nop,sackOK], length 0
01:01:54.665950 IP 24.99.181.117.52844 > 10.0.0.236.27021: Flags [S], seq 3748734139, win 8192, options [mss 1460,nop,wscale 2,nop,nop,sackOK], length 0
01:01:54.665985 IP 24.99.181.117.52844 > 10.0.98.29.27021: Flags [S], seq 3748734139, win 8192, options [mss 1400,nop,wscale 2,nop,nop,sackOK], length 0
